"Speaker","Speech"
"Ms. Bair","I did. We are suggesting that the resolution authority be applicable to any bank holding company, so for resolution purposes, you would not have to differentiate up front. And whether it was used I think would be a determination made by the primary supervisor about whether to avoid systemic ramifications from a normal bankruptcy process by employing the special resolution process, which still has the same claims priority that bankruptcy has with unsecured creditors and shareholders taking losses before the Government. It is a way that we can plan and use additional powers we have to set up bridge banks or to accept or repudiate contracts. The special powers we have really work better for financial intermediaries. But you do not have to make that determination in advance. I think the dollar threshold I mentioned, in the context of whether there would be an assessment to fund a large institution resolution fund, would really determine who is not systemic as opposed to who is. So for maybe anybody below--pick a number--$25 billion, you can safely assume they are not systemic, so they would not be caught in this assessment. But even those caught in the assessment, the amount of the assessment would be risk based. So if you are a plain vanilla regional bank, you take deposits, you make loans, you do not do much else, you are probably not going to have much of an assessment. If you are a complex bank holding company with a lot of proprietary trading, OTC dealmaking, et cetera, you are probably going to have a higher assessment. As Governor Tarullo said, really the only time where you would need to do it in advance is if there was a large systemically important institution that is not already under consolidated Federal supervision. I do think the council should have the flexibility and authority to define those institutions and bring them under prudential supervision if that is the case. I think that is something the council should do. It would be a tremendous power, and I think it would benefit from the multiplicity of views that would be on the council."
"Senator Bennett","The power to define becomes ultimately the power that controls everything."
"Ms. Bair","In terms of institutions, especially if you do away with the thrift charter, there are only a few institutions--I am not going to name any specific institutions--that come to mind that would not already be under Federal prudential supervision. So I am not sure actually if that piece of it in practice would be that profound. As a result of the crisis, pretty much everybody has become a bank holding company or are on their way to doing so. So I am not sure in practical terms that it would be that huge of a change."
"Senator Bennett","Thank you, Mr. Chairman."
"Senator Warner","Well, I want to thank the panel for hanging in, and I think it is down to Senator Martinez and me for the last two on this, and we have actually a second panel. I have a slew of questions, and I will try to ask them very quickly, again, so that Senator Martinez can get his questions in, and we can respect the second panel if we could try to answer fairly quickly. I strongly, as I made clear, believe that the council is the right approach. I guess I would ask for rather quick responses here--if possible, even kind of yes/no. I would love to--should that council have an independently appointed, Presidential appointment with congressional approval chair? Should it have the ability to look across all financial markets? Should it be able to be the aggregator of data from all of the prudential regulators up to with an independent staff that could aggregate and assess this data? Should it have, as I think we have heard you say, the power to issue rules, require enhanced leverage, or capital rules? And should it be able to force the day-to-day prudential regulators to take action and, if not, have backup authority to take action if the prudential regulator does not? I want to try to--I think Senator Bennett asked very appropriate questions about how we define. I am trying now to get into how we structure if we went forward with this council approach, recognizing that Professor Tarullo may not concur on the----"
"Mr. Tarullo","As you know, Senator, the Board at this juncture has a somewhat more contained view of the council, so let me just--you said ``Professor'' before rather than ``Governor,'' and I will slip back into that prior role, which is to say that I think you need to ask yourself at some point whether you are not basically creating a new agency that has brought in all the functions of the other agencies. If you have got a council that basically is able to direct everybody to do what the council thinks you ought to do, it is not that far from the Financial Services Authority mechanism in the U.K. or something like that. Obviously, there are a lot of gradations along the way."
"Senator Warner","Thank you. Chairman Schapiro and Chairman Bair."
"Ms. Schapiro","I think you asked five questions, and I think I have five yeses to all of them. I have not thought very carefully through the structure in terms of Presidential appointee confirmed by the Senate, but I think that makes sense. I do believe it needs to have the ability to aggregate data, to look across financial markets and all financial institutions. That is the whole purpose to my way of thinking. And I believe very strongly it needs the power to set capital requirements, leverage limitations, and other prudential regulatory requirements. And I would have, I guess, one caveat on the ability to force prudential regulators to take action if they do not do that, and my view on that would be to raise standards, yes, not to lower standards."
"Senator Warner","Chairman Bair."
"Ms. Bair","I would say yes."
"Senator Warner","Thank you. One of the things that Senator Corker has brought before you all a number of times, and I agree with him, is this notion of enhanced resolution authority for the FDIC for bank holding companies. I concur with his approach and that our goal ought to be allowing these institutions to actually fail in an orderly process and not be simply propped up ad infinitum. You know, there are a lot of questions beyond that, and we may even have an interim basis here, but one of the concerns I have with the Administration's proposal is there is still a-- how do you fund that resolution? There is still the idea of having to go to the Treasury or the Fed to get the dollars in the interim and go back and do a retroactive funding of the resolution. And clearly you do not want to have prefund so much from existing small banks. How have you thought about a prefunding mechanism? And how do we make sure that the prefunding, if you do agree with the prefunding, is a large enough net that you are going to capture potentially some of these institutions that may not obviously fall into a current FDIC coverage area?"
"Ms. Bair","We support a prefunding mechanism, and it is important to note that this fund would be for working capital. This is not an insurance program, so we would not be guaranteeing liabilities as we do with the Deposit Insurance Fund. This would be for working capital to facilitate resolutions where necessary to make sure there are no disruptions to the system. It would take some time to build that fund up, so initially you might have to establish a line of credit with the Treasury Department. This should all be completely separate from the Deposit Insurance Fund and what goes on with insured depository institutions. To the extent we resolved a bank holding company with both banks, and nonbank functions, we would allocate losses to each fund in a way that would keep them completely separate. Similarly, those with the large deposit bases should not be double-assessed, so whatever they are paying into the Deposit Insurance Fund, will take care of what is in the bank. Any other costs would be allocated outside the bank. I do think prefunding is important from the perspective not only of making sure there is something to call upon so you do not have to immediately borrow from taxpayers to facilitate one of these resolutions. But I also think it is a tool that can complement prudential supervision to disincent high-risk behavior. We use risk-based assessments now for deposit insurance. Congress gave us that authority in early 2006. We like some of the impact it has had on behavior, and I think through this assessment system you could do the same types of things. So, for instance, if you did not want to be so extreme as to tell bank holding companies they could not do proprietary trading anymore, maybe you say they can do that in an affiliate, but we are going to charge you a higher assessment. I think it does have a way to impact behavior, but not in a way that you set hard and fast rules or limits that can be arbitraged or may result in unintended consequences."
"Mr. Tarullo","Senator, I think this is another one of those areas where you have got downsides as well as upsides whichever way you go. The downside of ex post funding, as has already been suggested, is you have to go back and do an assessment ex post. You have to borrow money from the Treasury in the interim--I certainly hope not the Federal Reserve here--for setting up this mechanism. But if you go the prefunding route, there is not really much experience to know what you are prefunding. As Sheila already said, you are probably not going to be at a point any time in the near future where you would have the fund you would need, so you would need a backup line of authority. And I guess the incentive, or signal, question would have to be asked: If you already have a preset pot of money which is reserved for resolution situations, does that make it more likely that it will be used? And I do not think there is a clear answer to that either."
"Senator Warner","I have got another--I am just going to make one quick comment, because I do not want to interfere on Senator Martinez's time. But just as we think about these gradations--and I think, you know, as we think size, I hope there will be some scaling of this as opposed to a simple line that you cross over. The one question I also would want to ask for your answer on, but as we look at bank holding companies taking on a whole series of additional functions that oftentimes look a lot like hedge fund functions, as you mentioned, Chairman Bair, in terms of their internal trading functions, should there be additional capital requirements for these nonbank functions that are taking place inside bank holding companies? And as we look at putting barriers on that ``too-big-to-fail,'' ``too-big-to-fail'' is size and sometimes also a series of additional functions. I will move now to Senator Martinez."
"Senator Martinez","Thank you, Senator Warner. I appreciate it very much. I just believe a lot has been covered, and I do not want to again go over ground that has been covered. But there is one area that we have not talked about, and I would like to know the views of all three of you. It has to do with the GSEs, the Government-sponsored enterprises. They are entities that I think define ``too-big-to-fail.'' I think they also were systemically very risky. However, they had this implied Government guarantee that they continue to enjoy. Obviously, we have done a great deal to do what we should have done much earlier, which is put a regulatory scheme in place that might prevent some of the problems in the past. But thinly capitalized, a huge and ever growing market share which even continues to this day, an implied Government guarantee which provided investors a buffer from reality or from the consequences of investments, and I think the whole ball of wax of our mortgage system became very much troubled as a result of their activities and their actions. And I cannot--I think if we were to look back upon this period and what we have been through, I think it would be impossible to overestimate the impact that they have had and all the problems we have seen. How do they fit into what we are talking about here? What is the appropriate place for them to fit? Is there a future that they even should have as Government-sponsored enterprises? Or should they be simply part of the private sector? As I look at each of your functions, they fall under none of you--maybe perhaps a little bit under Chair Schapiro, but not a lot. Exactly. So we are still in the problem. So if we look at what it is that got us where we are today, I would love for us to focus on what got us here rather than just--and, obviously, AIG is a big part of the problem, and, obviously, there are a lot of other, you know, issues and relationships and interconnectedness and all of that. But would you please address the GSEs for me?"
"Mr. Tarullo","So, Senator, one thing for sure, the guarantee is no longer implicit. It is now----"
"Senator Martinez","Which, by the way, some would say it never was."
"Mr. Tarullo","There is considerable force to that as well. The Board, as you know--long before my arrival there--had expressed concerns about the GSEs, and I do not think anything that has happened in the last 10 months would have reduced those concerns. I guess I would say that there are a number of ways one can go but, going forward, what would be critical is to distinguish private roles from a public role. There is a real public role that can be played by GSEs. That is why they were originally started. But when you have a public role, that is when guarantees, implicit or explicit, are going to be involved. And that is when you are trying to implement a set of policies, so those activities are going to have to be constrained, and you are going to have to make sure that the entity is really functioning as a public entity under a certain obvious set of constraints. My characterization of some of the GSEs over the last 10 years would be that nobody could tell where the public ended and the private began."
"Ms. Bair","I would just add that the Federal Reserve Board was an early sounder of risk. And at Treasury, especially when I was at Treasury, similarly, we tried to sound the alarms. I think, though, one of the advantages of----"
"Senator Martinez","I will speak up for HUD as well. "
"Ms. Bair","Absolutely. A lot of people. I think this council would be able to give voice to those concerns and have real authority to address them. I think that is one of the advantages of the council. I think the Administration proposal would put the FHFA on the council. And if you continue with these GSEs--I do not know what their future is, but if they continue--they clearly still represent tremendous systemic exposure. So I think this would be a prime area where in the past you would have had a mechanism where we could have forced some real action through this council. Going forward, if the GSEs continue to function this way, the regulators should be represented as well."
"Ms. Schapiro","I do not have much to add, although let me stand up for the SEC, long before I arrived, in their push for public reporting by the GSEs. I do think Dan makes an excellent point about distinguishing the public and private roles and attendant consequences of having that public policy mission. It needs to be, I think, very transparent and well-understood by the marketplace."
"Senator Martinez","Well, I think the market, you know, when you put paper in the market and people invest, I do not know how that is ever a public role, really. I am not sure you can have private investors and a board of directors that is then beholden to the investors or to their public role. And that is my trouble with the whole idea of the GSEs the way they are chartered. So I think I for one would wonder how their future should really be and whether, in fact, they still have a role that ought to be as it has been in the past. Or should we very dramatically alter that going forward? Thank you for your input, and thank you for being here this morning."
"Senator Warner","Senator Menendez."
"Senator Menendez","Well, thank you, Mr. Chairman. Thank you all for your testimony. Let me ask, you know, for those of us who are struggling to define what the boundaries of systemic risk are, which is, I think, one of the key questions--and I know you have been asked some of these, and you have given some answers. But to me, it is more complicated than just the size of a firm or what business it is in, but how significant its activities are as well as how extensive its relationships are with other firms and consumers. So we have used very often ``too-big-to-fail.'' Sometimes I wonder whether we should be looking at too interconnected to fail. And in that respect, you know, should, for example, extensive relationships with small business and consumers count in defining systemic risk? By way of example, CIT. CIT is the largest lender to small businesses in America and has been in financial difficulties. It seems to me that unless an entity like that can find its way out of its financial difficulties, we are talking about hundreds of thousands of small businesses across the Nation who will not have the type of financing they need to conduct their activities, which is the greatest creator of jobs in the country at a time in which the country is desperately in need of jobs. So how do we look, for example, at that? Is that an element of systemic risk? If it is, then define it for me a little better. If it is not, tell me why it is not."
"Mr. Tarullo","So I will start, Senator. I do not think any of us probably wants to be speaking with reference to any particular entity, so let me just try to speak in more abstract terms. I think we do need to draw a distinction between entities that are economically significant and entities that pose systemic financial risk. There are many entities in this country whose failure would have very adverse economic consequences on a lot of people who deal with them--a lot of employees, communities, suppliers, and the like--but that do not create systemic financial risk in the sense that their failure leads to a kind of immediate cascading effect, in which leverage that is consecutively held by a lot of institutions that have counterparty relationships with one another suddenly becomes a problem. As asset values deteriorate and margin calls increase, you have to put up more collateral or you have to sell assets because you do not have enough collateral to put up. That is the pattern that we saw with Bear, Lehman, and AIG, and, in fact, you can go back 11 years and say that is the pattern you saw with Long Term Capital Management."
"Senator Menendez","So a cascading of thousands of businesses that would not have access to capital would not be a systemic risk?"
"Mr. Tarullo","It would be a very severe economic problem, but the reason I would say it would not be a systemic financial risk is that it does not unwind essentially overnight or----"
"Senator Menendez","So the automobile industry would fall in the same context as you are describing."
"Mr. Tarullo","I think the judgment on the automobile industry was that, again, there were truly enormous costs, particularly in a situation in which the economy was headed down so quickly anyway, and I gather that is why the Administration and many Members of Congress thought that action should be taken. But it did not pose a systemic financial risk even though it did impose substantial financial hardship. I do not think any of us wants to tell you that an approach to systemic risk will either prevent or mitigate all important economic----"
"Senator Menendez","So let me take a different--I do not know if any of you want to jump in to that question, but let me take a different tack on that. So we are looking at a $3, $4 trillion commercial mortgage problem coming down the pike in a marketplace that at this point in time I am told by entities across the country there is no--largely speaking, in the private sector there is not the wherewithal for that market to take these mortgages that will be rolling over. Now, having looked at our lack of action on the homeownership sign and what happened there, is that something that we think poses systemic risk? Or do you put it under your same category, may create enormous economic consequences but obviously does not have financial risk? Although I would say that if all those people default and cannot find a mortgage in the marketplace, those institutions will be holding a large number--maybe backed up by some degree of security with the properties, but they will have large numbers of defaults and less under a marketplace that has reduced in value and less than their holdings presently require. So what is that?"
"Mr. Tarullo","Well, I think it depends, Senator, again, on where the concentration is to be found and what the impact of the failure of an institution holding any form of exposure would be. Let me just say with respect to commercial real estate, I agree with your assessment that it is a looming problem. It is a looming problem for communities and for economic performance generally. It is a looming problem for many financial institutions in this country. I do not know that one can classify it in and of itself as being a systemic risk or not being a systemic risk. It is surely an issue and a problem, which is why I think all the bank supervisors have been paying attention to the exposures. And now speaking only for the Fed, we extended the TALF program to commercial mortgages precisely because of the absence of credit flows and the absence of secondary markets there."
"Ms. Schapiro","Senator, I would just add briefly that I think there are--your question really points out something very important. We are very focused on systemically important institutions, but there are absolutely systemically risky practices that, if engaged in by a broad range of institutions, no one of which might be a systemically important institution, but those practices taken together across the marketplace as a whole absolutely have the potential to create broad systemic risk for the financial system at large."
"Senator Menendez","My time is up, but I will submit a question to you, Chairman Bair, about your FDIC-OCC dispute on big banks versus community banks, because I just do not quite understand that community banks that were not the cause of the challenges we face get hit at the same rate as entities that did create some of those risks and that have greater risk overall. So I do not quite get it, but I would love to hear the answer."
"Senator Warner","Thank you, Senator Menendez, and I would like to thank the panel. You have hung in for a long time and we will, I know, have additional questions which we will submit to you. Thank you all. If we could go ahead and move to the second panel, and my thanks to the second panel's forbearance. If the second panel could move quickly to their seats so that we could move forward, I think we do have a vote, as I understand, coming up in the next 45 minutes, so we want to make sure folks get a chance to testify. I am going to go ahead and introduce our panel, even though they are in the midst of still being seated. Vincent Reinhart has spent more than two decades working on domestic and international aspects of U.S. monetary policy. He served for the last 6 years of his Federal Reserve career as Secretary and Economist to the Federal Open Market Committee and has served in a variety of senior positions at the Federal Reserve. Mr. Reinhart, thank you for being here. Paul Schott Stevens has served as President and Chief Executive Officer of the Investment Company Institute since June 2004. Outside ICI, Mr. Stevens' career has included varied roles in private law practices, corporate counsel, and in Government service. Mr. Stevens, thank you for being here, as well. Alice Rivlin, as we all know, is the Senior Fellow in Economic Studies Programs at Brookings. She was the Founding Director of the CBO and has served as Director of the White House Office of Management and Budget. Alice, thank you for appearing here, as well. Allan Meltzer is a Professor of Political Economy and Public Policy at the Carnegie Mellon University and is also a visiting scholar at AEI. I don't normally get a chance to sit here in the chair. I don't want to mess it up too much, but recognizing that Senator Bunning said we actually may have a series of votes starting even earlier than 45 minutes from now, I would ask each of the panel, recognizing there are only three of us here still on this side of the dais, if they could make their statements relatively short so that we could make sure we could get a chance to ask questions."
"Mr. Reinhart"," "
"STATEMENT OF VINCENT R. REINHART, RESIDENT SCHOLAR, AMERICAN ENTERPRISE INSTITUTE"," "
