"Speaker","Speech"
"RESPONSES TO WRITTEN QUESTIONS OF SENATOR REED FROM SHEILA C. BAIR","  Q.1. You discussed regulatory arbitrage in your written statements and emphasized the benefits of a Council to minimize such opportunities. Can you elaborate on this? Should standards be set by individual regulators, the Council, or both? Can a Council operate effectively in emergency situations?  A.1. One type of regulatory arbitrage is regulatory capital arbitrage. It is made possible when there are different capital requirements for organizations that have similar risks. For instance, banks must hold 10 percent total risk-based capital and a 5 percent leverage ratio to be considered well- capitalized, while large broker-dealers (investment banks) were allowed to operate with as little as 3 percent risk-based capital. Thus for similar assets, a bank would have to hold $5 for every $100 of assets, a broker dealer would only be required to hold $3 of capital for every $100 of the same assets. Obviously, it would be more advantageous for broker dealers to accumulate these assets, as their capital requirement was 40 percent smaller than for a comparable bank. The creation of a Systemic Risk Council with authority to harmonize capital requirements across all financial firms would mitigate this type of regulatory capital arbitrage. Although the capital rules would vary somewhat according to industry, the authority vested in the Council would prevent the types of disparities in capital requirements we have recently witnessed. Some have suggested that a council approach would be less effective than having this authority vested in a single agency because of the perception that a deliberative council such as this would need additional time to address emergency situations that might arise from time to time. Certainly, some additional thought and effort will be needed to address any dissenting views in council deliberations, but a vote by Council members would achieve a final decision. A Council will provide for an appropriate system of checks and balances to ensure that appropriate decisions are made that reflect the various interests of public and private stakeholders. In this regard, it should be noted that the board structure at the FDIC, with the participation of outside directors, is not very different than the way the council would operate. In the case of the FDIC, quick decisions have been made with respect to systemic issues and emergency bank resolutions on many occasions. Based on our experience with a board structure, we believe that decisions could be made quickly by a deliberative council while still providing the benefit of arriving at consensus decisions.  Q.2. What do you see as the key differences in viewpoints with respect to the role and authority of a Systemic Risk Council? For example, it seems like one key question is whether the Council or the Federal Reserve will set capital, liquidity, and risk management standards. Another key question seems to be who should be the Chair of the Council: the Secretary of the Treasury or a different Senate-appointed Chair. Please share your views on these issues.  A.2. The Systemic Risk Council should have the authority to impose higher capital and other standards on financial firms notwithstanding existing Federal or State law and it should be able to overrule or force actions on behalf of other regulatory entities to raise capital or other requirements. Primary regulators would be charged with enforcing the requirements set by the Council. However, if the primary regulators fail to act, the Council should have the authority to do so. The standards set by the Council would be designed to provide incentives to reduce or eliminate potential systemic risks created by the size or complexity of individual entities, concentrations of risk or market practices, and other interconnections between entities and markets. The Council would be uniquely positioned to provide the critical linkage between the primary Federal regulators and the need to take a macroprudential view and focus on emerging systemic risk across the financial system. The Council would assimilate information on economic conditions and the condition of supervised financial companies to assess potential risk to the entire financial system. The Council could then direct specific regulatory agencies to undertake systemic risk monitoring activities or impose recommended regulatory measures to mitigate systemic risk. The Administration proposal includes eight members on the Council: the Secretary of the Treasury (as Chairman); the Chairman of the Federal Reserve Board; the Director of the National Bank Supervisor; the Director of the Consumer Financial Protection Agency; the Chairman of the Securities and Exchange Commission; the Chairman of the Commodities Futures Trading Commission; the Chairman of the FDIC; and the Director of the Federal Housing Finance Agency. In designing the role of the Council, it will be important to preserve the longstanding principle that bank regulation and supervision are best conducted by independent agencies. For example, while the OCC is an organization within the Treasury Department, there are statutory safeguards to prevent undue involvement of the Treasury in regulation and supervision of National Banks. Given the role of the Treasury in the Council contemplated in the Administration's plan, careful attention should be given to the establishment of appropriate safeguards to preserve the political independence of financial regulation. Moreover, while the FDIC does not have a specific recommendation regarding what agencies should compose the Council, we would suggest that the Council include an odd number of members in order to avoid deadlocks. One way to address this issue that would be consistent with the importance of preserving the political independence of the regulatory process would be for the Treasury Chair to be a nonvoting member, or the Council could be headed by someone appointed by the President and confirmed by the Senate.  Q.3. What are the other unresolved aspects of establishing a framework for systemic risk regulation?  A.3. With an enhanced Council with decision-making powers to raise capital and other key standards for systemically related firms or activities, we are in general agreement with the Treasury plan for systemic risk regulation, or the Council could be headed by a Presidential appointee.  Q.4. How should Tier 1 firms be identified? Which regulator(s) should have this responsibility?  A.4. As discussed in my testimony, the FDIC endorses the creation of a Council to oversee systemic risk issues, develop needed prudential policies and mitigate developing systemic risks. Prior to the current crisis, systemic risk was not routinely part of the ongoing supervisory process. The FDIC believes that the creation of a Council would provide a continuous mechanism for measuring and reacting to systemic risk across the financial system. The powers of such a Council would ultimately have to be developed through a dialogue between the banking agencies and Congress, and empower the Council to oversee unsupervised nonbanks that present systemic risk. Such nonbanks should be required to submit to such oversight, presumably as a financial holding company under the Federal Reserve. The Council could establish what practices, instruments, or characteristics (concentrations of risk or size) that might be considered risky, but would not identify any set of firms as systemic. We have concerns about formally designating certain institutions as a special class. Any recognition of an institution as systemically important, however, risks invoking the moral hazard that accompanies institutions that are considered too-big-to-fail. That is why, most importantly, a robust resolution mechanism, in addition to enhanced supervision, is important for very large financial organizations.  Q.5. One key part of the discussion at the hearing is whether the Federal Reserve, or any agency, can effectively operate with two or more goals or missions. Can the Federal Reserve effectively conduct monetary policy, macroprudential regulation, and consumer protection?  A.5. The Federal Reserve has been the primary Federal regulator for State chartered member institutions since its inception and has been the bank holding company supervisor since 1956. With the creation of the Consumer Financial Protection Agency and the Systemic Risk Council, the Federal Reserve should be able to continue its monetary policy role as well as remain the prudential primary Federal regulator for State chartered member institutions and bank holding companies.  Q.6. Under the Administration's plan, there would be heightened supervision and consolidation of all large, interconnected financial firms, including likely requiring more firms to become financial holding companies. Can you comment on whether this plan adequately addresses the ``too-big-to-fail'' problem? Is it problematic, as some say, to identify specific firms that are systemically significant, even if you provide disincentives to becoming so large, as the Administration's plan does?  A.6. The creation of a systemic risk regulatory framework for bank holding companies and systemically important firms will address some of the problems posed by ``too-big-to-fail'' firms. In addition, we should develop incentives to reduce the size of very large financial firms. However, even if risk-management practices improve dramatically and we introduce effective macroprudential supervision, the odds are that a large systemically significant firm will become troubled or fail at some time in the future. The current crisis has clearly demonstrated the need for a single resolution mechanism for financial firms that will preserve stability while imposing the losses on shareholders and creditors and replacing senior management to encourage market discipline. A timely, orderly resolution process that could be applied to both banks and nonbank financial institutions, and their holding companies, would prevent instability and contagion and promote fairness. It would enable the financial markets to continue to function smoothly, while providing for an orderly transfer or unwinding of the firm's operations. The resolution process would ensure that there is the necessary liquidity to complete transactions that are in process at the time of failure, thus addressing the potential for systemic risk without creating the expectation of a bailout. Under a new resolution regime, Congress should raise the bar higher than existing law and eliminate the possibility of open assistance for individual failing entities. The new resolution powers should result in the shareholders and unsecured creditors taking losses prior to the Government, and consideration also should be given to imposing some haircut on secured creditors to promote market discipline and limit costs potentially borne by the Government.   "
"RESPONSE TO WRITTEN QUESTIONS OF SENATOR MENENDEZ FROM SHEILA C. BAIR","  Q.1. A recent media article (New York Times, June 14th) states there have been strong disagreements between the FDIC and the OCC over whether the proposal to impose new insurance fees on banks is unfair to the largest banks, with the FDIC arguing that the largest banks contributed to the current crisis and should have to pay more. Can you elaborate on your rationale for requiring big banks to pay more than community banks?  A.1. The New York Times article referred to the emergency special assessment, adopted on May 22, 2009, which imposes a 5- basis point special assessment rate on each insured depository institution's assets minus Tier 1 capital as of June 30, 2009. The Federal Deposit Insurance Reform Act of 2005 requires the FDIC to establish and implement a restoration plan if the reserve ratio falls below 1.15 percent of insured deposits. On October 7, 2008, the FDIC established a Restoration Plan for the Deposit Insurance Fund. The Restoration Plan was amended on February 27, 2009, and quarterly base assessment rates were set at a range of 12 to 45 basis points beginning in the second quarter of 2009. However, given the FDIC's estimated losses from projected institution failures, these assessment rates were determined not to be sufficient to return the fund reserve ratio to 1.15 percent. On May 22, 2009, therefore, the FDIC Board of Directors adopted a final rule establishing a 5 basis point special assessment on each insured depository institution's assets minus Tier 1 capital as of June 30, 2009. The special assessment is necessary to strengthen the Deposit Insurance Fund and promote confidence in the deposit insurance system. The adoption of the final rule on the special assessment followed a request for comment that generated over 14,000 responses. The final rule implemented several changes to the FDIC's special assessment interim rule, including a reduction in the rate used to calculate the special assessment and a change in the base used to calculate the special assessment. The assessment formula is the same for all insured institutions--big and small. However, it produces higher assessments for institutions that rely more on nondeposit liabilities. These institutions do tend to be the larger institutions. The FDIC considers this appropriate as in the event of the failure of institutions with significant amounts of secured debt, the FDIC's loss is often increased without any compensation in the form of increased assessment revenue. The amount of the special assessment for any institution, however, will not exceed 10 basis points times the institution's assessment base for the second quarter 2009 risk- based assessment. We believe that the special assessment formula provides incentives for institutions to hold long-term unsecured debt, and for smaller institutions to hold high levels of Tier 1 capital--both good things in the FDIC's view.   "
"RESPONSES TO WRITTEN QUESTIONS OF SENATOR BUNNING FROM SHEILA C. BAIR","  Q.1. Many proposals call for a risk regulator that is separate from the normal safety and soundness regulator of banks and other firms. The idea is that the risk regulator will set rules that the other regulators will enforce. That sounds a lot like the current system we have today, where different regulators read and enforce the same rules different ways. Under such a risk regulator, how would you make sure the rules were being enforced the same across the board?  A.1. The significant size and growth of unsupervised financial activities outside the traditional banking system--in what is termed the shadow financial system--has made it all the more difficult for regulators or market participants to understand the real dynamics of either bank credit markets or public capital markets. The existence of one regulatory framework for insured institutions and a much less effective regulatory scheme for nonbank entities created the conditions for arbitrage that permitted the development of risky and harmful products and services outside regulated entities. We have proposed a Systemic Risk Council composed of the principal prudential regulators for banking, financial markets, consumer protection, and Treasury to look broadly across all of the financial sectors to adopt a ``macroprudential'' approach to regulation. The point of looking more broadly at the financial system is that reasonable business decisions by individual financial firms may, in aggregate, pose a systemic risk. This failure of composition problem cannot be solved by simply making each financial instrument or practice safe. Rules and restrictions promulgated by the proposed Systemic Risk Council would be uniform with respect to institutions, products, practices, services, and markets that create potential systemic risks. Again, a distinction should be drawn between the direct supervision of systemically significant financial firms and the macroprudential oversight and regulation of developing risks that may pose systemic risks to the U.S. financial system. The former appropriately calls for the identification of a prudential supervisor for any potential systemically significant holding companies or similar conglomerates. Entities that are already subject to a prudential supervisor, such as insured depository institutions and financial holding companies, should retain those supervisory relationships. In addition, for systemic entities not already subject to a Federal prudential supervisor, this Council should be empowered to require that they submit to such oversight, presumably as a financial holding company under the Federal Reserve--without subjecting them to the activities restrictions applicable to these companies. We need to combine the current microprudential approach with a macroprudential approach through the Council. The current system focuses only on individual financial instruments or practices. Each agency is responsible for enforcing these regulations only for their institutions. In addition, there are separate regulatory schemes used by the SEC and the CFTC as well as the State level regulation of insurance companies. The macroprudential oversight of systemwide risks requires the integration of insights from a number of different regulatory perspectives--banks, securities firms, holding companies, and perhaps others. Thus, the FDIC supports the creation of a Council to oversee systemic risk issues, develop needed prudential policies, and mitigate developing systemic risks.  Q.2. Before we can regulate systemic risk, we have to know what it is. But no one seems to have a definition. How do you define systemic risk?  A.2. We would anticipate that the Systemic Risk Council, in conjunction with the Federal Reserve would develop definitions for systemic risk. Also, mergers, failures, and changing business models could change what firms would be considered systemically important from year-to-year.  Q.3. Assuming a regulator could spot systemic risk, what exactly is the regulator supposed to do about it? What powers would they need to have?  A.3. The failure of some large banks and nonbanks revealed that the U.S. banking agencies should have been more aggressive in their efforts to mitigate excessive risk concentrations in banks and their affiliates, and that the agencies' powers to oversee systemically important nonbanks require strengthening. As discussed in my testimony, the FDIC endorses the creation of a Council to oversee systemic risk issues, develop needed prudential policies, and mitigate developing systemic risks. For example, the Council could ensure capital standards are strong and consistent across significant classes of financial services firms including nonbanks and GSEs. Prior to the current crisis, systemic risk was not routinely part of the ongoing supervisory process. The FDIC believes that the creation of a Council would provide a continuous mechanism for measuring and reacting to systemic risk across the financial system. The powers of such a Council would ultimately have to be developed through a dialogue between the banking agencies and Congress, and empower the Council to ensure appropriate oversight of unsupervised nonbanks that present systemic risk. Such nonbanks should be required to submit to such oversight, presumably as a financial holding company under the Federal Reserve.  Q.4. How do you propose we identify firms that pose systemic risks?  A.4. The proposed Systemic Risk Council could establish what practices, instruments, or characteristics (concentrations of risk or size) that might be considered risky, but should not identify any set of firms as systemic. We have concerns about formally designating certain institutions as a special class. We recognize that there may be very large interconnected financial entities that are not yet subject to Federal consolidated supervision, although most of them are already subject to such supervision as a result of converting to banks or financial holding companies in response to the crisis. Any recognition of an institution as systemically important, however, risks invoking the moral hazard that accompanies institutions that are considered too-big-to-fail. That is one reason why, most importantly, a robust resolution mechanism, in addition to enhanced supervision, is important for very large financial organizations.  Q.5. Any risk regulator would have access to valuable information about the business of many firms. There would be a lot of people who would pay good money to get that information. How do we protect that information from being used improperly, such as theft or an employee leaving the regulator and using his knowledge to make money?  A.5. The FDIC, as deposit insurer and supervisor of over 5,000 banks, prides itself on maintaining confidentiality with our stakeholders. We have a corporate culture that demands strict confidentiality with regard to bank and personal information. Our staff is trained extensively on the use, protection, and disclosure of nonpublic information as well as expectations for the ethical conduct. Disclosure of nonpublic information is not tolerated and any potential gaps are dealt with swiftly and disclosed to affected parties. The FDIC's Office of Inspector General has a robust process for dealing with improper disclosures of information both during and postemployment with"
"FDIC."," These ethical principles are supported by criminal statutes which provide that Federal officers and employees are prohibited from the disclosure of confidential information generally (18 U.S.C. 1905) and from the disclosure of information from a bank examination report (18 U.S.C. 1906). All former Federal officers and employees are subject to the postemployment restrictions (18 U.S.C. 207), which prohibit former Government officers and employees from knowingly making a communication or appearance on behalf of any other person, with the intent to influence, before any officer or employee of any Federal agency or court in connection with a particular matter in which the employee personally and substantially participated, which involved a specific party at the time of the participation and representation, and in which the U.S. is a party or has a direct and substantial interest. In addition, an officer or employee of the FDIC who serves as a senior examiner of an insured depository institution for at least 2 months during the last 12 months of that individual's employment with the FDIC may not, within 1 year after the termination date of his or her employment with the FDIC, knowingly accept compensation as an employee, officer, director, or consultant from the insured depository institution; or any company (including a bank holding company or savings and loan holding company) that controls such institution (12 U.S.C. 1820(k).   "
