"Speaker","Speech","Type","Comments"
"Mr. Bernanke","OK. So just very briefly, there has been a lot on the regulatory side. We are working with our colleagues in Basel and elsewhere to substantially strengthen and modernize the capital requirements, liquidity requirements, executive compensation requirements, risk management requirements, and a whole raft of things just to give a tougher, stronger regime. So that is an important part. In terms of supervision, we are restructuring our internal organization, and we think a landmark event, a watershed event was the stress tests last spring, which were incredibly successful, which the Federal Reserve led. And I think the Federal Reserve's input to that was to supplement the standard bank examiner going in looking at the credit file with a lot of analytical statistical information which helped improve comparability across banks, which helped to determine the factors underlying possible risks to banks, which integrated the macroscenarios so we could do stress tests and those sorts of things. So in our internal structure, we are, first of all, creating a new group which will bring together not just the bank supervisors but people from other dividends--and I mentioned the economists, the payment system people, the financial people, and so on--to manage the supervisory effort for the system as a whole, and they will be looking at a portfolio of firms, and so it will not be a firm-by-firm operation where this teams looks at Citigroup and this team looks at JP Morgan. Instead, they will be looking collectively at groups of firms doing horizontal comparisons and taking a more systemic type approach. On top of that, we will also have a quantitative evaluation team which increases something we have already done, which is currently for small banks, we do not go in every year or every 6 months. What we tend to do is we look at a bunch of data, a bunch of call report information, for example, and use statistical models to try and evaluate whether there are problems that we should go back and look. Well, expanding that idea in a much more sophisticated way, we can give these quantitative folks the license to look at a range of activities in the firms and look at them across firms and try to use their offsite type analysis to supplement and support the on-side analysis.","Speech"," "
"Senator Warner","Because I want to be absolutely sensitive to my colleagues' times who have been waiting here for a long time, I want to just get one more point out.","Speech"," "
"Mr. Bernanke","Sure.","Speech"," "
"Senator Warner","I have got a lot of other questions, but I will take them at another time. Specifically in terms of, I believe, within safety and soundness you can look at proprietary trading, hedge fund activities, and private equity, whether you have ramped up on that, and one of the issues that one of the panels raised with us a little bit earlier that I thought was quite good was the whole question of interconnectedness, and I will close with that. But I would love to get your quick comments on that, recognizing other folks have been waiting a long time.","Speech"," "
"Mr. Bernanke","So we have not tried to apply the Volcker rules. We have not forbidden some activities. But we have----","Speech"," "
"Senator Warner","Heightened.","Speech"," "
"Mr. Bernanke","Yes, we have heightened our activities, particularly with respect to risk management. We find that was the big Achilles heel in the whole situation, that firms did not really have a sufficient understanding of the broad-based exposure across all their business lines to certain kinds of risks. And we have been working very hard on that part.","Speech"," "
"Senator Warner","Interconnectedness.","Speech"," "
"Mr. Bernanke","On interconnectedness, this is a place, I think, where the Federal Reserve really has a comparative advantage. We have, for example, been working very hard on strengthening the operations of the credit default swap market, the tri-party repo market, et cetera. And in doing that, we are looking at how the--it is critical to us--you know, JP Morgan plays a critical role in the tri-party repo market. DTCC plays a critical role in the securities clearing markets and so on. So we are integrating those with our analysis of the firms, and that is extremely important. We are paying a lot of attention to that.","Speech"," "
"Senator Warner","Thank you, Mr. Chairman.","Speech"," "
"Senator Johnson","Senator Gregg?","Speech"," "
"Senator Gregg","Were you here earlier than I was, Jim?","Speech"," "
"Senator Johnson","Senator DeMint?","Speech"," "
"Senator Gregg","I think Senator DeMint was here. He left. I do believe he is--go ahead.","Speech"," "
"Senator DeMint","Thank you, Mr. Chairman. Thank you, Mr. Bernanke, for enduring us again here. I really appreciate you being here. I apologize for missing some of the questions, but I did hear your testimony. I would just like to get a broad perspective. I know we are talking about a lot of the details of financial monetary systems, but just maybe a larger concern. As I look at what we are doing here in Washington overall and a lot of the debate about specifics, it does seem that the underlying debate is more about are we going to have a free market economy or more of a centrally planned, government-directed economy. And there are very different views on monetary policy depending really on what our paradigm is, I believe. My concern is as I look at where we are even versus 5 years ago, that the Federal Government owns two of our largest auto companies, our largest insurance company, our largest mortgage company. We are heavy in debate about expanding government control of health care. We pretty much control the energy sector, where we drill, all of those kinds of things. We are considering now a new financial reform package that would supercede State control, go all the way down to payday lenders and pawn shops. And in the process of moving in this direction, we have created huge debts, unsustainable, and 10-year projections are more than a trillion dollars a year additional debt. My concern is that in your testimony, that you didn't mention any of this. Not until we questioned the debt was it a concern. I mean, I know it is a concern. I am not suggesting it is not. But I would think that given the fact that the uniqueness of the American economic system has a lot to do with more of the Adam Smith invisible hand, bottom up, that the Chairman of our Federal Reserve would express some concern about the expansion of government ownership and controls of large sections of the private sector economy, knowing that there is a tipping point at some point where we no longer function as a free market economy. I am not sure if we have gone past that or not, but my concern and alarm is that you had not expressed any concern or alarm of the need for Congress to look at ways to devolve and divest of these things, to try to move things back in that direction. Is that not a concern, or is your focus just not-- your focus is what you have to do with what you have got to work with and that is just not your area?","Speech"," "
"Mr. Bernanke","Well, Senator, first, I have, obviously, a lot of things to talk about, so I can't cover everything of concern.","Speech"," "
"Senator DeMint","Sure.","Speech"," "
"Mr. Bernanke","Let me talk about the financial sector, and I think there, that returning to a more market-oriented financial sector is a top priority and we are, in fact, doing that. For example, all the big banks have now paid back their TARP money and we are trying as quickly as we can to get those banks financed by private capital, which they have raised a great deal of private capital and it is very important. AIG, of course, is very problematic, but they are selling off assets in order to pay us back and they are making progress on that, and our objective there, of course, is to put them back in the private sector. We talked earlier about Fannie and Freddie, and I do think that we have to get away from this neither fish nor fowl situation where they are part public, part private. I think one solution would be to privatize those firms, and I think that is an interesting direction to go. If I might, I think perhaps the most important thing, as a number of people have discussed, this Committee is looking at too big to fail, looking at resolution authorities and so on. If you were able to get a strong resolution authority, you would do more to bring back a level competitive playing field, market discipline into the financial sector than anything else that you can do, because with a true resolution authority where creditors know they will lose money, shareholders know they will lose money if the firm fails, then they have the incentive after that to evaluate the firm's credit, quality, and their risk taking and so on, and that would, again, bring back competition, bring back market discipline. So I am very much in favor of bringing back the market in all these areas, recognizing that the financial sector does need appropriate regulation, but market forces and competition ought to play a substantial role, and I am all in favor of doing that and will work with you on that.","Speech"," "
"Senator DeMint","Well, I appreciate that and I suspect we have very much the same philosophies about economies. But I think the country and the world needs to know that and I just would appreciate as you look at where we are that there is a need to back away from where we are. A lot has happened in a short period of time that has expanded the government scope in a lot of areas, and there is a big difference in central planning concepts, as you know more than I do, than free market accountabilities, and I think you are talking about and believe in. So I appreciate that and I thank the Chairman for allowing me to ask a question. I yield back.","Speech"," "
"Senator Johanns","Senator Bayh?","Speech"," "
"Senator Bayh","Thank you, Mr. Chairman. It is good to see you again. First, just a comment. I count myself as one who believes the Fed should retain a robust role in the supervisory area. The reason for that is that any new entity would have to get up to speed. There would be a learning curve there that I think would present some difficulties. Second, my strong impression is that you and your team have learned from the recent past about what can go wrong and that can inform your decisionmaking going forward. And third, my impression is that you gain some important insights by the oversight at the micro level informing your judgment about setting monetary policy and making macro decisions. So that is kind of my take on how we ought to view this going forward. Just a couple of questions. First, as you mentioned, the last quarter GDP figures were pretty good, but a big chunk of that was inventory rebuilding and that sort of thing. So we are all worried about the sustainability of the recovery, the risk of a double-dip, that sort of thing. You mentioned the key to this, to have it become self- sustaining, is final private demand. I don't want you to wade into the political thickets, but there is a debate in Congress about what measures we might take to augment final private demand. Do you have any sense about what steps would be prudent to take at this time to put some wind at the back of the recovery and ensure that it is sustainable?","Speech"," "
"Mr. Bernanke","Well, as you know, Senator, I don't like to inject myself in debates on fiscal policies----","Speech"," "
"Senator Bayh","But as an economist, do you care to offer any?","Speech"," "
"Mr. Bernanke","Well, no. I don't think I can separate my role that easily. My sense is, I mean, just as an observer, it seems that the Congress is debating a number of potential fiscal actions, but none of them are--I think no one is proposing anything of the scale we saw last year, as far as I know----","Speech"," "
"Senator Bayh","Well, let me put it another way. The Senate voted the other day on a $15 billion package. I voted for it. There are some good things in there. Some of my colleagues disagreed, took a different approach. Just in terms of scale, I mean, most people would say, even myself, some good things, I voted for it, but that is unlikely to be of a magnitude that is going to materially add to final private demand, to use your words. Do you have any sense about the scale that would be needed to have a material impact on final private demand?","Speech"," "
"Mr. Bernanke","Well, if these smaller programs are well designed, they can be very beneficial, and so we don't want to denigrate those at all. But----","Speech"," "
"Senator Bayh","I didn't mean to, and I wasn't asking you to----","Speech"," "
"Mr. Bernanke","But my sense is----","Speech"," "
"Senator Bayh","I am just trying to get a sense of, what can we do to try and ensure the economy gets the legs under it that it needs?","Speech"," "
"Mr. Bernanke","You know, this is going to sound like a dodge, but I think that if you are going to do more fiscal policy in the near term, it would be very constructive to combine that with more attention to the exit strategy 5 years down the line, because I think there is a risk that financial markets may begin to become concerned about the sustainability of U.S. Fiscal policy, and the more you can assure them of ultimate----","Speech"," "
"Senator Bayh","It is actually not a dodge. It leads to my second question. You were asked by Senator Dodd about the use of derivatives and the problems they are having in Greece. Senator Vitter touched upon the deficit. I would like to raise the question of Greece again. At what level--you know, our debt-to-GDP ratio is now going to be going up. Some of that is unavoidable because of the recession we are experiencing. But you are asking us to focus on the intermediate term, which I think is exactly right, and that is why I was a strong supporter of the Gregg-Conrad Commission and other steps. Do you have a sense, at what ratio of debt-to-GDP do we begin to approach the tipping point and really run into a risk of currency problems, interest rate spikes, the kinds of things that Greece is now experiencing? Do you have any judgment about that?","Speech"," "
"Mr. Bernanke","It is, of course, very hard to know, and we are very different from Greece in terms of the type of our economy, the size of our economy, the fact that we have our own currency and all those sorts of issues. Just to give you one number, Ken Rogoff and Carmen Reinhart's book about financial crisis has been discussed in many quarters, mentioned a 90 percent debt-to-GDP ratio as a level at which growth becomes impacted after that. Now, saying that, we have got a wide variety of experience among industrial countries, ranging up to very high levels in Japan and in other countries. But our historic levels, we were down to the 30s in terms of debt-to-GDP and I think heading toward a 100 percent debt-to-GDP ratio would be very undesirable, particularly given the aging of our society and those obligations we are facing longer term.","Speech"," "
"Senator Bayh","And we are estimated to get up close to, what, 65, 70 percent here over the next five to 10 years, something like that?","Speech"," "
"Mr. Bernanke","Yes.","Speech"," "
"Senator Bayh","My last question. My time is about to expire. And we also finance our debt. Japan is mostly internal, isn't it? We have a lot of external, which makes it a little bit different. Are you at all concerned about Japan's recent steps to constrain demand there? What impact might--their economy is obviously growing very robustly. Does that present any risks to the global economy, the fact that they are moving in that direction?","Speech"," "
"Mr. Bernanke","Do you mean China?","Speech"," "
"Senator Bayh","I am sorry. I misspoke. China. Yes, I did mean China.","Speech"," "
"Mr. Bernanke","No, I am not concerned about it. I think they have to make appropriate decisions about not overheating their economy. They are obviously growing very quickly. From our perspective, we would like to see more flexibility in their exchange rate as being part of the process for reducing overheating risks. But I think it is important that they achieve an appropriate balance between very rapid growth and the risks of overheating, the risks that their extensive credit extension becomes troubled. So, no, I am not particularly concerned about that right now.","Speech"," "
"Senator Bayh","Thank you for your service, Mr. Chairman. Thank you.","Speech"," "
"Senator Johnson","Senator Gregg.","Speech"," "
"Senator Gregg","Thank you, Mr. Chairman. I want to associate myself with Senator Bayh's comments relative to your regulatory authority and the range of regulatory authority that you should retain. I do think it is important that you be a major player in the regulatory atmosphere, and I do believe that although there are obviously errors that have occurred across the regulatory regimes, that yours are no more grievous than anybody else's, and in fact, I think in many ways, less grievous. To get into this issue, however, which Senator Bayh has touched on, Senator Vitter has touched on, which is when is the tipping point, you have basically alluded to the fact that it may be sooner rather than later if the markets lose confidence in us, the international markets especially. And we have had a budget presented to us which puts us on a path, as you described, of unsustainability because deficits will run at five to 7 percent, debt will triple, and the public debt-to-GDP will hit 80 percent by 2015, 2016, and we will hit 60 percent this year, actually. So the question becomes, what do we need as a government to do to give the markets confidence that we are actually taking some action, real action in trying to control the out-year event, not the immediate issue of getting out of this recession, but the fact that in the out years, we have an unsustainable situation which could lead to a significant financial issue for us as a nation and the reduction in our lifestyle and the quality of life and the standard of living of our children?","Speech"," "
"Mr. Bernanke","Well, the earlier question was about the debt-to-GDP ratio, which was the tipping point. Another way to look at this is what does the trajectory look like? If the trajectory is such that you have an unstable dynamic where interest payments get larger and larger, that in turn increases the deficit, that in turn leads to higher interest payments and it explodes, essentially, then that is a situation where markets will become very concerned. So I think this is as much a political question as an economic question. The question is, can the Congress--and I recognize these are very, very hard problems. I don't want to in any way downplay the difficulty that it is for Congress to address these hard problems. But it would be extraordinarily helpful if there was persuasive evidence that Congress had the political will to achieve over a number of years a stabilization of the debt-to-GDP ratio or of the fiscal trajectory, and that could be done either through whatever mechanisms you choose to undertake or it may be through specific plans, or maybe even through actions that you could take now that would affect expenditures and deficits in the out years.","Speech"," "
"Senator Gregg","But something should be done.","Speech"," "
"Mr. Bernanke","It would be very--again, the point I would like to make is that there really is some--it is not just a question of paying today for a benefit tomorrow. There is benefit today if, in fact, you can increase the confidence of the markets that we will, in fact, address this issue. It gives you more scope and probably lower interest rates today.","Speech"," "
"Senator Gregg","And arguably, the markets aren't going to have that confidence unless there is an event which gives them confidence, which means the Congress has to address the gap between spending and revenues with the fact that that gap is primarily driven by spending, in my view. That is a rhetorical question. So where are we in the perception of the world relative to this country? Does the world have confidence that we can get our house back in order, in your opinion?","Speech"," "
"Mr. Bernanke","Well, the markets seem to have confidence. I mean, we can sell 20- and 30-year debt at relatively low interest rates and I think that is a vote of endorsement for the long-term ability of this country to respond to these challenges. But we have to make good that trust. We have to follow through.","Speech"," "
"Senator Gregg","And if we look at the issue of how you get the money out of the market, you have put $2 trillion, basically, into the economy. Is that about right?","Speech"," "
"Mr. Bernanke","The Federal Reserve?","Speech"," "
"Senator Gregg","Right.","Speech"," "
"Mr. Bernanke","Our balance sheet is $2.3 trillion. It was $900 billion before we started, so we have expanded our balance sheet by about $1.4 trillion.","Speech"," "
"Senator Gregg","So you have got to get that money back out at some point, right?","Speech"," "
"Mr. Bernanke","That is right.","Speech"," "
"Senator Gregg","And I notice you listed a few things here that you have got as mechanisms. There is one, however, that I wasn't that familiar with. I am not familiar with it at all, to be honest with you. You said, the Federal Reserve is currently refining plans for a term deposit facility that can convert a portion of depository institution holdings of reserves balances into deposits that are less liquid. Does that mean you are basically going to require bigger reserves?","Speech"," "
"Mr. Bernanke","No. It means that instead of having reserves held at the Federal Reserve only on an overnight basis, we are going to offer a slightly higher interest rate so that banks will be willing to hold reserves with us for an extended period, and that would take those reserves out of the overnight money markets and give us more control over the Federal funds rate.","Speech"," "
"Senator Gregg","So you are not raising the reserves. You are just going to say----","Speech"," "
"Mr. Bernanke","No----","Speech"," "
"Senator Gregg","----you are going to encourage people to put more money in because you are going to pay them interest on it. That is part of your new authority?","Speech"," "
"Mr. Bernanke","That is part of the authority Congress gave us, to pay interest on reserves.","Speech"," "
"Senator Gregg","OK. Thank you.","Speech"," "
"Senator Johanns","Senator Bennet.","Speech"," "
"Senator Bennet","Thank you, Mr. Chairman. I was going to go in a different direction, but just because the last part of this was so useful, I wanted to say we just heard the Fed Chairman talk about the political will in Congress to be able to address this issue, and I just--it is breathtaking to me as somebody new here that 2 weeks ago, we had the chance, because of Senator Gregg's leadership and Senator Conrad's leadership, to vote for a bipartisan commission--that is all it was--to take a look over a period of time and give us recommendations for an up or down vote, and we didn't have the political will as an institution even to support that. So I want to thank Senator Gregg for his leadership and I hope we will try again, because we need to demonstrate the political will that you are talking about if we are not going to leave our kids a completely diminished set of opportunities. But I will come back to that. I wanted to ask you a question a little bit along the lines of what Senator Brown was asking, but different. In Colorado, if you look at the last period of economic growth in the country before we went into this terrible recession, that period of economic growth resulted in an $800 decrease in median family income in our State. So the economy grew, but middle-class family income fell, as it did across the country. For our middle-class families, I would argue, we have got two recessions that we are trying to recover from, this one and the last period of economic growth that didn't drive their income. And at the same time, in our State, the cost of health insurance over that period went up by 97 percent. The cost of higher education went up by 50 percent. So you have got an economy that is driving costs of things that are important to move families ahead, but income is going down. And my understanding is it is the first time our economy has grown in our history and median family income went down. I just wonder if you have some thoughts about that, because it just feels to me like there are some structural things going on in our economy that we need to be worried about, we need to concern ourselves with.","Speech"," "
"Mr. Bernanke","You are correct that median family income hasn't kept up with average GDP or productivity, and there are a couple of arithmetic----","Speech"," "
"Senator Bennet","Let me just say, because you made that point earlier, as well, and at the same time, because of the increases in productivity you were talking about, it is not apparent where the jobs are going to come from to be able to help ameliorate the issues that I was just talking about. I will stop there. Sorry.","Speech"," "
