"Speaker","Speech","Type","Comments"
"Mr. Bernanke","Thank you, Senator. As you know, I think that stripping the Federal Reserve of its supervisory authorities in the light of the recent crisis would be a grave mistake for several reasons. First, we have learned from the crisis that large, complex financial firms that pose a threat to the stability of the financial system need strong consolidated supervision. That means they need to be seen and overseen as a complete company, reflecting the developments not only in their banks, but also in their securities dealers and all the various aspects of their operations. A bank supervisor which focuses on looking at credit files is not prepared to look at the wide range of activities of a complex international financial firm. The Federal Reserve, in contrast, by virtue of its efforts in monetary policy, has substantial knowledge of financial markets, payment systems, economics, and a wide range of areas other than just bank supervision, and in our stress test, we demonstrated that we can use that whole range of multidisciplinary skills to do a better job of consolidated oversight. By the same token, we need to look at systemic risks. Systemic risks themselves also involve risks that can span across companies and into various markets. There again, you need an institution that has a breadth of skills. It is hard for me to understand why in the face of a crisis that was so complex and covers so many markets and institutions you would want to take out of the regulatory system the one institution that has the full breadth and range of those skills to address those issues. Let me mention your second point, and I think your point is very well taken. As I discussed in my testimony, we have taken very, very seriously both changes in our performance, changes in the way we go about doing supervision, but also changes in the structure of supervision, and we have made very substantial changes in order to increase the quality of our supervision, to increase our ability to look for systemic risks, and to use a multidisciplinary cross-expertise platform to look at these different issues. So we are very committed, and I would be happy to discuss with you through a letter or individually more details. I guess I would also like, if I might just have one more second, the Federal Reserve, of course, made errors and made mistakes in the supervisory function, but we were hardly alone in that respect and there were----","Speech"," "
"Senator Shelby","But what have you learned? I guess that is the question.","Speech"," "
"Mr. Bernanke","Well, my----","Speech"," "
"Senator Shelby","You and the Board of Governors. What have you learned?","Speech"," "
"Mr. Bernanke","We have learned several things. We have learned, first, that regulations need to be tougher, and we have led the effort to strengthen capital requirements, to strengthen liquidity requirements, to put more controls, risk controls into these companies. We have learned that we need to have a more risk and systemic-oriented approach and we have changed our approach to do that. So we have gone at this very extensively.","Speech"," "
"Senator Shelby","Mr. Chairman, I want to briefly get into the Volcker Rule and size limits. The Administration recently proposed, as you well know, that limitations be imposed on banks and bank holding companies with respect to trading activities, including proprietary trading, the so-called Volcker Rule. The Administration also proposed placing limitations on what was referred to as, quote, ``excessive growth'' of the shares of liabilities at the largest financial firms. What are your views on the Volcker Rule proposal, and separately, on the proposal to limit excessive growth in the firms' liabilities? And do the regulators right now have the power, as some people have suggested, to invoke the Volcker Rule, or would you need legislation if the Congress so thought it was necessary?","Speech"," "
"Mr. Bernanke","Senator, first, I think we would all agree that we don't want companies taking excessive risks when they are protected by the government safety net, so that is very important. There are obviously multiple ways to address those risks and they include capital requirements, and we have increased capital requirements, as well as, for example, restrictions on executive compensation, which affect willingness to take risks. If you go about imposing the Volcker Rule, I think it would be difficult to do on a purely legislative basis because of the potential for having unintended consequences. So while on the one hand you may want to restrict purely proprietary trading, you also want to distinguish that from, say, appropriate hedging behavior----","Speech"," "
"Senator Shelby","You have to be careful, don't you?","Speech"," "
"Mr. Bernanke","You have to be careful of unintended consequences. Hedging, market making, customer activities can involve ownership of securities for a period of time. I do think if you want to go in that direction, you should at least allow some role for the supervisors to make determinations about individual activities. I think it would not be inappropriate if a supervisor determines that a company doesn't have the managerial or risk capacity to appropriately manage a particular activity, for the supervisor to be able to restrict that activity. I would argue that we have that authority to some extent now, but if Congress wants to reinforce that, of course, it couldn't hurt.","Speech"," "
"Senator Shelby","Thank you, Mr. Chairman.","Speech"," "
"Senator Johnson","Senator Reed?","Speech"," "
"Senator Reed","Thank you very much, Mr. Chairman, and welcome, Chairman Bernanke. A follow-up on the Volcker Rule. How would you implement it if you were to do it through your regulatory process?","Speech"," "
"Mr. Bernanke","We would do it as part of our overall risk management assessment. We would look at the range of activities that the company engages in. There might be some activities that would be explicitly prohibited by legislation, say perhaps owning a hedge fund, for example. But if there are other activities, such as purchasing of, say, credit default swaps, I think it would be appropriate for the supervisor to, first of all, ascertain that the use of credit default swaps is primarily intended to hedge other positions and therefore is overall a net reduction in risk for the company as opposed to an increase or a speculative increase in risk. Second, even if the purposes of the program are in some sense legitimate, there is still the question of whether the company has adequate managerial risk management resources to properly manage those risks, and what we saw in the previous crisis, and I think this is one of the things we really learned, is that many large, complex companies didn't really understand the full range of risks that they were facing and as a result they found themselves exposed in ways they didn't anticipate. So if a company didn't have strong risk management controls and a strong culture of system--enterprise-wide risk management, I think that would be also grounds for the supervisor requesting either substantial strengthening in those controls or eliminating those activities.","Speech"," "
"Senator Reed","Just an observation. Those controls are much more rigorous today, but they tend to erode over time, particularly as these unpleasant crises fade. And also, the capacity of the regulators, the Federal Reserve and other regulators, to make very nuanced judgments about management, et cetera, there is really a question of regulatory capacity as well as managerial capacity that at least the last several months suggests that it won't be handled by simply sort of letting you do what you inherently can do now.","Speech"," "
"Mr. Bernanke","Well, certainly Congress could provide guidance about what they would like to see shut down or make specific statutory recommendations or statutory laws. But another--I am sorry. I lost my train of thought. Oh, yes, sorry. I just recalled. I think another part of the reform package that is very important is the resolution authority and measures taken to address the too-big-to-fail problem. If you can address the too-big-to-fail problem and get market discipline affecting firms so that investors will have an incentive to try to evaluate the risk taking of those firms, that will be an additional--not a panacea, but it will be an additional factor helping the regulators and the firm itself make good decisions.","Speech"," "
"Senator Reed","Underlying this discussion of the Volcker Rule is a more general principle, I think. That is, what risks should taxpayers support? I think there is a consensus that traditional commercial banking, which everything has a risk, has historically been supported and should be supported. But the ability to access your credit facilities and your authority under 13(3) by large financial institutions whose primary activity is not commercial banking but either proprietary trading, which is inherently riskier, I mean, there is a real question here of whether they should have that access and I think that is at the heart of the Volcker Rule. To your point about too big to fail, I mean, the size has not been indicative of the sort of capacity to fail, so again, I just--there are real questions that we have to wrestle with with respect to, as a policy that you will implement, whether we are going to, with taxpayers' money, support very profitable risk-taking activities when they work and catastrophic activities to taxpayers when they don't work.","Speech"," "
"Mr. Bernanke","Well, Senator, as an example, consider the savings and loans, which basically were killed by interest rate risk. Today, they would either be able to securitize the loans that they made or they would be able to hedge that interest rate risk. So I am not disagreeing with you at all. I think we all agree that we don't want excessive risk taking, particularly on a ``tails, I win, heads, you lose'' basis, certainly. But there are some legitimate purposes for using securities and we just want to make sure not to increase the risk----","Speech"," "
"Senator Reed","No, I recognize the difficulty of sorting out a proprietary trade. You don't have the staff, frankly, to do that, to keep up with every trading platform and every trading floor in the country. So that is why I think there has to be perhaps a simpler approach, since these organizations are so large in terms of their trading versus the commercial banks, they might not qualify for the same type of support. Thank you.","Speech"," "
"Senator Johnson","Senator Bunning?","Speech"," "
"Senator Bunning","Thank you, Mr. Chairman. Thank you for being here. On the discount rate increase, how much lending is currently outstanding at the discount window? I don't want to know the people, I just want to know the amounts.","Speech"," "
"Mr. Bernanke","I believe it is in the order of $17 to $20 billion.","Speech"," "
"Senator Bunning","OK. If that is the case, since there is so little discount window borrowing going on, the increase in the discount rate seems to be more for show than for substance. On top of that, you and the Fed have gone out of your way to downplay the importance of that move. Why should anyone take that move as a sign that you are serious about taking away the punch bowl at this time?","Speech"," "
"Mr. Bernanke","Well, Senator, what we have been trying to do is to eliminate the extraordinary support that we have provided financial markets, and we had a wide range of programs that try to address the dysfunction in the commercial paper market, money market mutual funds, interbank markets, repo markets, and a variety of others. And as I mentioned in my testimony, on February 1, we shut down most of those programs. By June, we will have no more of these 13(3) programs----","Speech"," "
"Senator Bunning","Except--except what Senator Shelby brought up. On Tuesday, the Treasury announced that they were starting up a supplemental financing program again. It is $200 billion- plus. Under that program, Treasury issues debts and deposits the cash with the Fed. That is the effective same thing as the Fed issuing its own debt, which you know is not legal.","Speech"," "
"Mr. Bernanke","What it does----","Speech"," "
"Senator Bunning","There are--well, let me finish with the question and you can answer. What are the legal grounds that the Fed and Treasury used to justify that program? And did anyone in the Fed or Treasury object when the program was created?","Speech"," "
"Mr. Bernanke","Well, legally, we are the fiscal agent of the Treasury and we hold Treasury balances that they--for all kinds of purposes, so there is no----","Speech"," "
"Senator Bunning","But they are not allowed to issue debt, Treasury.","Speech"," "
"Mr. Bernanke","Treasury is allowed to issue debt.","Speech"," "
"Senator Bunning","On its own?","Speech"," "
"Mr. Bernanke","I don't--they issue bills and other kinds of debt all the time.","Speech"," "
"Senator Bunning","Oh, yes, Treasury notes, Treasury bills, Treasury 2-years, 5-years, 10-years. But you are buying--you buying their debt.","Speech"," "
"Mr. Bernanke","We are just paying them interest on their deposits on our balance sheet.","Speech"," "
"Senator Bunning","OK. That isn't the answer that I wanted. Given what you learned during the AIG crisis and the bailout, do you think Congress should be doing something to address insurance regulation or the commercial paper markets?","Speech"," "
"Mr. Bernanke","Well, Senator, I think AIG is the poster child for, first, consolidated supervision. It did not have a strong consolidated supervisor that was paying attention to its derivatives activities, for example. That is very important to do. Second----","Speech"," "
"Senator Bunning","Were those the ones in England?","Speech"," "
"Mr. Bernanke","No, those were the ones, the CDS--the credit default swaps that the Financial Products Division was exposed----","Speech"," "
"Senator Bunning","Weren't they located in London?","Speech"," "
"Mr. Bernanke","Well, they were in any case accessible to U.S. regulators.","Speech"," "
"Senator Bunning","I didn't ask that question. I said, but didn't AIG have an office in London that did those things?","Speech"," "
"Mr. Bernanke","It had some foreign offices, but I believe that the Financial Products Division is headquartered in Connecticut.","Speech"," "
"Senator Bunning","OK. Go right ahead.","Speech"," "
"Mr. Bernanke","So again, to address AIG issues, you need a strong consolidated supervisor that can identify those kinds of risks to the company and you also need some methodology, and I think you would agree that we don't want to have too-big-to- fail firms. We don't want the Fed involved in these bailouts. So you need an alternative legal structure. We have supported a resolution regime. I know this Committee is considering alternatives that would allow the government, excluding the Fed, to wind down a firm like this in a crisis in a way that would not bring down the overall financial system. I think that is a very important direction.","Speech"," "
"Senator Bunning","Does any other Fed Governor have their own staff?","Speech"," "
"Mr. Bernanke","The staff of the Federal Reserve works for all the Governors. There is no----","Speech"," "
"Senator Bunning","That is not my question.","Speech"," "
"Mr. Bernanke","The staff--no, not dedicated, except for clerical----","Speech"," "
"Senator Bunning","OK. Do you think they should?","Speech"," "
"Mr. Bernanke","No. I think we all work collectively and we all get the support from the entire staff.","Speech"," "
"Senator Bunning","Do Fed Governors have access to the Board's staff recommendations or do they only get to see the recommendations you approve of?","Speech"," "
"Mr. Bernanke","They see the staff recommendations.","Speech"," "
"Senator Bunning","They do?","Speech"," "
"Mr. Bernanke","Yes.","Speech"," "
"Senator Bunning","Have you ever tried to change or influence staff recommendations before they were presented to the Board?","Speech"," "
"Mr. Bernanke","Not final recommendations, no.","Speech"," "
"Senator Bunning","Your e-mails tell us differently.","Speech"," "
"Mr. Bernanke","You are referring to an e-mail where a preliminary draft by a couple of economists----","Speech"," "
"Senator Bunning","It was the Fed staff. That is what the----","Speech"," "
"Mr. Bernanke","It was Fed staff, but it wasn't the Fed staff's recommendation because it was a draft done by several people in the division, not by the leadership of the staff. And it was, in any case, a recommendation that was outdated because of changes in circumstances.","Speech"," "
"Senator Bunning","That was in your opinion.","Speech"," "
"Mr. Bernanke","Yes, sir.","Speech"," "
"Senator Bunning","I have more, but I am past my time.","Speech"," "
"Senator Johnson","Senator Akaka?","Speech"," "
"Senator Akaka","Thank you very much, Mr. Chairman. I want to welcome Chairman Bernanke back to the Committee and also to congratulate and welcome him and wish him well in his continued tenure as Chairman of the Board of Governors of the Federal Reserve System. We both share a commitment to improving the lives of working families by better educating, protecting, and empowering consumers. Chairman Bernanke, Chairman Dodd and other Members of this Committee helped develop and enact meaningful card reform legislation. I am proud that the law includes provisions from my Credit Card Minimum Payment Warning Act which will provide consumers with detailed personalized information on their billing statements and access to reputable credit counseling services. Consumers will learn the true costs of making the minimum payments and how long it will take for them to pay off their balance if they only make minimum payments. Consumers are also provided with the amount that they need to pay to eliminate their outstanding balance within 36 months, which is the typical length of a debt management plan. This useful information recently started appearing on statements, and I looked at it and was happy to see it. My question to you is, how will the personalized credit card minimum payment information influence the behavior of consumers, and also what additional personalized disclosures pertaining to other financial service products would enable consumers to make better informed choices?","Speech"," "
"Mr. Bernanke","Well, Senator, I congratulate you on those contributions. As you know, the Federal Reserve developed extensive disclosures for credit cards as well as some rules which were very extensively incorporated in the Congressional bill that passed and was signed by the President. Obviously, as you point out, the more information you can provide consumers, the better decisions they can make and the kinds of information about minimum balances, time to pay off, the cost of the card, the penalties they might face, those are the kinds of things people need to shop. If they can shop, the market becomes more competitive and you get a market that better serves consumers. We have been very focused on good disclosures, good information. We have in our disclosure reform that we did earlier, we--I don't see Senator Schumer here yet today, but there is the so-called Schumer Box, which has----","Speech"," "
"Senator Bunning","He is at the White House.","Speech"," "
"Mr. Bernanke","----has a list of key features of the account. We have done a lot of work on that to make it easier to read and more understandable to consumers. One of the innovations pioneered by the Federal Reserve has been to use consumer testing. We have gone out and instead of having some lawyers just sort of figure out what should be in the disclosure, we have actually gone out to shopping malls and had people look at the disclosures and then we have tested them to see how much they understand and retain. And by doing that, we think we are improving considerably the ability of folks to understand what they are buying and encouraging them to shop around to get a better deal. So again, I congratulate you on your contributions to this and on your longstanding support for financial literacy and for clear disclosures.","Speech"," "
"Senator Akaka","Mr. Chairman, unfortunately, investment banks, credit card issuers, and predatory lenders through their excessive bonuses and unfair treatment of consumers are giving the term ``bank'' an even greater negative connotation. I am afraid that abused or angry consumers may continue to underutilize mainstream financial institutions. After having grown up in an unbanked home, I personally know the challenges that confront the unbanked. Many community banks and credit unions provide vital financial services to working families by providing opportunities for savings, borrowing, and low-cost remittances. The question is, why is it essential that we attempt to encourage the unbanked and the underbanked to utilize mainstream financial institutions more?","Speech"," "
"Mr. Bernanke","Well, Senator, as you well know, for various reasons, lack of information, cultural reasons, and so on, many minority or immigrant communities don't make much use of the regular banking system. The cost of that is they may find themselves paying much more for check cashing or for short-term borrowing or for other services that they need. In most cases, they would be better off in a mainstream financial institution. We have encouraged banks, credit unions, and other financial institutions to reach out to minority neighborhoods by, for example, having people on staff who speak the language, through advertising and through other activities, through the CRA, the Reinvestment Act. By doing that, you attract people from these communities and give them access to the broader financial network. It helps them not only to get better deals on their financial services, to pay less for check cashing, for example, but it also helps them begin to learn how to save or learn how to borrow for a home and do other things that you need to have access to the broad mainstream financial system in order to achieve. So I think it is very important that mainstream financial institutions continue to reach out to people in their communities, including minorities and immigrants, to attract them to use of mainstream financial services.","Speech"," "
"Senator Akaka","Thank you. Thank you very much, Mr. Chairman.","Speech"," "
"Senator Johnson","Senator Johanns?","Speech"," "
"Senator Johanns","Thank you, Mr. Chairman. Mr. Chairman, good to see you again. Mr. Chairman, let me start out and say that I think we have done some good work as we have tried to move through regulatory reform. I think everybody, quite honestly, has learned from the mistakes of the last years, no doubt about that. But I must admit, I have a concern about something that I think is shared by probably everybody here. It may be a little sensitive, but I want to ask about it, and that is Fannie and Freddie. We have spent a lot of time talking about too big to fail and looking at private companies and how gigantic they had gotten and how that really put us in a box. In the end, the taxpayers got put on the hook for that. Isn't Fannie and Freddie the government version of that too big to fail? And how do you get out of that box?","Speech"," "
"Mr. Bernanke","Well, Senator, first, as I am sure you know, the Federal Reserve has a long record of warning about the dangers of the structure of Fannie and Freddie. There are numerous dangerous, including conflicts of private and public interest, and most notably, insufficient capital to support the very large portfolios that they held. And, in fact, it turned out they didn't have enough capital and now the U.S. Government, the taxpayer, is subject to substantial cost. Right now, we are kind of in no man's land. Fannie and Freddie are in conservatorship. They are part of the government's efforts to maintain the housing market because there really is no other source of mortgages at this point, or mortgage securitization. But certainly, this is not a sustainable situation and I think it is very important that we move toward clarifying the longer-term status. There are numerous ways to go. I have talked about some in a speech. But to give two examples, one would be a privatization approach, which might allow the privatized firms that securitize mortgages to purchase insurance from the government for the mortgages that they package and sell. Another possibility would be just to acknowledge that these are government utilities and incorporate them with Ginnie and FHA and other government agencies. So those are two very different approaches, but both of them have the advantage of eliminating this platypus kind of, you know, neither fish nor fowl status that those firms have now.","Speech"," "
"Senator Johanns","Neither approach will eliminate the exposure that the taxpayer faces. Would you agree with me there?","Speech"," "
"Mr. Bernanke","Well, for example, if you had a situation where privatized firms were not allowed to hold large portfolios, which is a major source of the risk, first; and, second, that they paid actuarially fair premiums to the Government as opposed to the implicit support they had before, there would still be risks to the taxpayer, but at least there would be some compensation, some premium is being collected.","Speech"," "
"Senator Johanns","In effect, it sounds to me like a Government liquidation, and I do not know that I would want to personally buy into that. But I guess as a taxpayer we would all end up buying into that. But it is a huge number, isn't it? It is probably $1 trillion plus of exposure.","Speech"," "
"Mr. Bernanke","Well, it depends how you count exposure. Of course, the mortgage-backed securities outstanding are in the trillions.","Speech"," "
"Senator Johanns","Yes.","Speech"," "
