"Speaker","Speech","Type","Comments"
"Mr. Bernanke","The Government's commitment at this point is a couple hundred billion to those institutions.","Speech"," "
"Senator Johanns","Let me also draw your attention to something, and I am running out of time here, but I was just catching up on some things, and I noticed today that first-time unemployment filings have increased. That was not expected. Durable goods orders have fallen the most since August. That is not a good sign. And that excludes, I think, transportation. The market has responded by dropping at least at this point by 160, and I appreciate the market can have up days and down days. I am starting to read more and more articles about the national debt interfering with economic recovery. And yet I do not see an effort to slow that down here. In fact, if we were just to stand down and say, OK, we will adopt the President's plan, there are trillion dollar deficits over the next decade. I cannot imagine how that turns out for-- you know, I will be 70 years old the next decade. I am not going to live long enough to pay that off. That means my children and grandchildren are going to have to deal with that. I am beginning to wonder, Mr. Chairman--and I do not want this to sound overly pessimistic, but I am beginning to wonder whether low interest rates really have any possibility of spurring this economy. And I will tell you what I am thinking about, and you may not even have enough time to respond. Unless there is demand, unless we can get consumers back into it, it just seems very unlikely to me that you are going to see much growth. I talked to people who handle the freight--the railroads, the trucking companies. They are not seeing much improvement. All these signs point to a situation where, quite honestly, this economy is still enormously flat. And I am not sure that offering somebody an interest rate at 2 percent versus 4 percent is going to get us on the other side of this, and I would just like your thought on that.","Speech"," "
"Mr. Bernanke","Well, first, I agree that the economy is still very weak and very disappointing in that respect. I think low interest rates do tend to help, and I will give you a couple of examples. One, you mentioned the durable goods. Notwithstanding--I have not had a chance to get into those numbers in detail this morning, but investment, actually equipment investment, equipment and software investment has been something of a bright spot and has been growing. And part of the reason for that is that larger firms at least have pretty good access to credit at reasonable rates in the corporate bond market, for example, and that has supported the investment rebound, which is a big part of what we are seeing in the recovery. Another example is that the Fed's actions, interest rate actions and our purchases of mortgage-backed securities, have helped bring down mortgage rates. That has helped to some extent to stabilize demand for housing and helped--as you may know, house prices seem to have flattened out and begun to rise a bit, which is very important for consumers in terms of their wealth, in terms of the risk of foreclosure, and in terms of, you know, restarting activity in the residential construction sector. So those are two examples where we see growth. We did have 4-percent growth in the second half of 2009. I think the issue we face is will the growth be fast enough to materially reduce the unemployment rate at a pace that we would like to see, and that is a big uncertainty right now. But we are getting some output growth at this point.","Speech"," "
"Senator Johanns","Mr. Chairman, thank you.","Speech"," "
"Senator Johnson","Senator Brown.","Speech"," "
"Senator Brown","Thank you, Mr. Chairman. Mr. Chairman, nice to see you. We all know for most of our Nation's history--I am going to go in a bit different direction. For most of our Nation's history, manufacturing and agriculture and transportation drove our economy, whether it is steel in Youngstown or agriculture around places like Lexington, Ohio, or the Port of Cleveland shipping raw materials and finished goods all over the Midwest. As an expert on--as an economic historian, as you are, and an expert on the Great Depression, you are aware, obviously, of the role of manufacturing, especially a historic role, in pulling our Nation out of recession. As many Ohioans can tell you, can painfully tell you, manufacturing steadily declined over the last three decades. At the same time, we know that the financial industry has rapidly expanded. As recently as the 1980s, manufacturing made up 25 percent of GDP; financial services made up less than half of that, in the vicinity of 11 or 12 percent. Those numbers crossed in the 1990s. Now it is almost a direct flip. Manufacturing, 12 percent; financial services, 20 or 21 percent. Wall Street's output, put another way, was equal to all the Farm Belt States and the Industrial Belt States combined. In 2004, 44 percent of all corporate profits in the United States came from the financial sector compared with 10 percent from manufacturing. And I say that as a preface to my question for this reason: Kevin Phillips, the writer, has noted sort of the history of great nations in the last 400 years. Habsburg Spain, the United Provinces of Netherlands, and Imperial England, all three saw their economies go from manufacturing, shipping, agriculture--depending on which of each of the three--and energy into more and more emphasis on financial services. And the financialization in that sense is what probably cost those empires their empire. They were countries that never really recovered in the wealth creation. It really is the fact that banking is not an independent source of wealth. It does not cause our prosperity. The success of banking is created by our success and our ability to create wealth. Then I hear people, when I talk about manufacturing policy, I hear your predecessors say this, I hear advisers in the White House, regardless of party, say we cannot have a manufacturing policy, we cannot pick winners and losers. Well, it is pretty clear in the 1980s that this country, this Government, your predecessors, and the Treasury Department picked winners and losers. They decided that financialization, the financial services sector should be the winner as we got rid of usury laws, as we changed rules and deregulated and all those things. So we put ourselves in a position where, as Kevin Phillips said, finance is the chosen sector of the U.S. economy. So my question is this: As your role, your statutory role, a mandated target of 4-percent unemployment, it is at least twice, maybe three times that right now. When I look at a building on the Oberlin College campus 20 miles from my house, fully powered by solar energy, the largest solar-powered building on any college campus in America, about 8 years it was built. All the panels were built in Germany, a country that had an industrial policy that stimulated demand and supply and have built clean energy jobs way better than we have. You read the articles in the paper about what China is about to way outcompete us on alternative energy, solar and wind turbines. We know all that. We still sit with no manufacturing policy. So my question is this: As the economic historian that you are, are you troubled by the fact that the financial sector is now twice the size of the manufacturing sector? And I put parentheses around the next part of that, that no country that I can see in economic history has done well when that happened. Are you troubled by that? And if you are troubled by that fact that the financial industry is twice the size of manufacturing, flipping what it was, what should we do about it and what are you doing about it?","Speech"," "
"Mr. Bernanke","Well, financial services obviously has a place to play in a modern economy, and it is a productive industry in the sense that it helps allocate capital more effectively and share risk and do important things like that. I think we would all agree that over the past decade or so, financial services, residential construction, and some other sectors may have become too big relative to other sectors, and we are now seeing the painful unwinding of that process. I think the right way to address the size of financial services is to make sure that it is being productive and constructive, and that means having a good regulatory regime that directs--that provides a context in which financial services will do productive, constructive things for the economy. So good financial regulatory reform should lead the financial services industry to adjust to an appropriate size that is right for the economy. On manufacturing, it is really a mixed picture in the United States. We still are probably the biggest or one of the biggest manufacturers in the world. We are the most productive. We have had extraordinary increases in productivity, in manufacturing recently. That, in fact, is part of the reason why the employment share of manufacturing keeps going down, is that we need fewer workers to produce a car or an airplane than we used to.","Speech"," "
"Senator Brown","That is true, Mr. Chairman, but look at the profits of the financial services--the chasm between financial services and manufacturing is--the chasm is big in terms of the percentage of GDP. It is even larger in terms of profits in the last 5 years. Keep that in mind.","Speech"," "
"Mr. Bernanke","So in terms of the financial industry, you know, I think markets should be allowed to work, but they should be allowed to work in an environment where regulation is appropriate and where there is an appropriate level playing field. So you would, I suppose, agree that financial services were not appropriately regulated or appropriately supervised. If we strengthen that regulation and allow appropriate changes to take place, that ought to bring down the size of the financial services industry to a size which is more appropriate for our economy. Manufacturing is another issue. I think there are lots of things that mostly Congress--I do not think the Federal Reserve has a lot of direct influence on any particular sector. But there are a lot of things that Congress can do. There is tax policy, there is immigration policy, trade policy. There is the issue of picking winners and losers. I think that is difficult to do. But you gave the example of solar panels. Solar panels are a viable industry with Government support if the Congress determines that, for example, for global warming purposes that carbon-reducing technologies or capital is socially desirable and, therefore, supports that activity, then that will--the private sector will, therefore, come out and produce that. So that is a determination of Congress whether it needs a public subsidy. I do not think that many of those alternative energy sources would survive by themselves in a marketplace because whatever value they have in reducing carbon, for example, is not captured in their price in the market. So I guess what I am saying is that we need, first of all, better regulation in finance to bring finance down to an appropriate size and an appropriate set of functions. And there are a set of things that Congress can do to try to improve our trade balance, for example, to improve the tax policy. I think, frankly--and this is a topic that I never could get much traction on. I think that our immigration policy which restricts severely the number of highly trained, skilled immigrants is a problem because bringing those sorts of folks in helps our high-tech industries develop more competitive-- become more competitive. So there are things I think you can do to strengthen manufacturing. I would also just note that while it has been a very severe recession in the manufacturing sector, manufacturing is, in fact, leading this recovery, as you pointed out. Industrial production has been very strong, and we are seeing, in fact, growth in manufacturing employment. So it has been important in that respect.","Speech"," "
"Senator Brown","One real quick closing statement. If manufacturing were even close to the same percentage of GDP as it was, think how much stronger--how much quicker we would come out of this recession in terms of recovery, just as a point of reference perhaps. Thank you, Mr. Chairman.","Speech"," "
"Senator Johnson","Senator Vitter.","Speech"," "
"Senator Vitter","Thank you, Mr. Chairman. Thank you, Mr. Chairman, for being here and for your work. Thank you for your monetary report. Mr. Chairman, when I go around my State and have town hall meetings and other things, obviously folks are real concerned about jobs and the recession. But I get just as many questions and expressions of concern about what they consider the next looming crisis caused by spending and debt. Now, obviously, you gave us a monetary report focused on things you can control. Federal spending and debt is not something you can directly control. What is your general projection and outlook, once we are out of this current recession, for the impact on the current levels of what are, in my view, unsustainable Federal spending and debt and the impact on the economy?","Speech"," "
"Mr. Bernanke","Well, Senator as you point out, at the moment we are in a deep recession. Revenues are down to 15 percent of GDP. We have a lot of costs arising from the recession, and so deficits are extremely high. The really interesting question is: What is the structural medium-term deficit? If you look at the range of estimates provided by the OMB and the CBO over different scenarios and so on, most of them suggest that the deficit after we come out of recession, say 2013 or so and the rest of that decade, should be somewhere between--will be somewhere between 4 and 7 percent of GDP. That is not a sustainable number. A rule of thumb is that in order to keep the ratio of outstanding Government debt to our GDP more or less constant--I mean, it would be better even to reduce it, but just to keep it constant, you need to have deficits more in the area of 2 \1/2\ to 3 percent. So I think it is important--so 4 to 7 percent is not sustainable. If it were actually to happen, what we would see is increasing interest costs, and eventually the markets would just entirely lose confidence in our fiscal policy, and interest rates would spike. So it is very important for Congress--even though we are now still in a very deep recession or in a very weak economy, it is important for Congress to try to clarify how we are going to exit from our fiscal position and try to provide a credible blueprint for how our Federal deficit will be controlled over the next 10 years and 20 years.","Speech"," "
"Senator Vitter","And just to follow up on that, let us say in the future we reach a point that we are truly out of this recession in a meaningful way and those deficits are where they are projected, 4 to 7 percent, versus 2 \1/2\. How quickly would that become a major problem in terms of the economy?","Speech"," "
"Mr. Bernanke","Well, it could become a problem tomorrow if bond markets are not persuaded that Congress is serious about bringing down the deficit over time. But in any case, certainly if you look at the CBO numbers, you know, by 2025, 2030, under existing policies we are going to be seeing the curve very sharply rising and----","Speech"," "
"Senator Vitter","But surely way before that it would be an issue and a problem in terms of interest rates, et cetera.","Speech"," "
"Mr. Bernanke","Absolutely. Absolutely. And you would be seeing debt-to-GDP ratios rising; you would be seeing crowding out of investments and other problems. Yes, absolutely.","Speech"," "
"Senator Vitter","So is it fair to say, you know, we are perhaps not seeing those immediate threats because we are in a serious recession? Once we come out of that, those immediate threats, the chances of their having a real negative impact elevate enormously.","Speech"," "
"Mr. Bernanke","That is right. And we are not completely sure we will not have negative effects even sooner than that.","Speech"," "
"Senator Vitter","Before that.","Speech"," "
"Mr. Bernanke","Depending on how interest rates respond.","Speech"," "
"Senator Vitter","Right. Mr. Chairman, I want to Fannie Mae and Freddie Mac. On June 18, the Treasury Secretary said before us, ``Fannie and Freddie were a core part of what went wrong in our system.'' I assume you agree with that.","Speech"," "
"Mr. Bernanke","Yes, sir.","Speech"," "
"Senator Vitter","We are discussing regulatory reform. In terms of the draft bills we are discussing, there is no title on Fannie and Freddie. When should we be addressing that? Sooner rather than later, or when?","Speech"," "
"Mr. Bernanke","Well, I think for no other reason than just trying to reduce uncertainty in the markets, the sooner that you can come to some clarity on the future of Fannie and Freddie, the better. Of course, I understand that you are dealing with a lot of complex issues in financial reform and health care and in other areas right now. But it would be, obviously, helpful to try to get some clarity on that. That does not mean necessarily that you can get to that new situation quickly. It is going to take some time to move from the current situation to a more stable long-run situation. But certainly I hope Congress is looking at this issue now and thinking about where you want to go.","Speech"," "
"Senator Vitter","OK. We are really not looking at the issue now, at least in a meaningful way. And the schedule, as I understand it, particularly from Treasury, is not until 2011. Is there any good reason, in your opinion, to essentially put that off to 2011?","Speech"," "
"Mr. Bernanke","Well, I think their concern is just that the agenda is so full and is there time, you know, for everyone to focus on that. And that is not my judgment to make, but I think that is their concern. I think they would agree that an earlier resolution would be better, certainly.","Speech"," "
"Senator Vitter","OK. Mr. Chairman, I want to go to resolution authority and 13(3) type authority, and we have talked about this before, but it is really important so I want to have the discussion quickly again. If in our regulatory reform package we come up with a reasonable, workable wind-down mechanism to resolve large failed institutions in an orderly way, to take them down, to break them up in an orderly way, if we do that, would you support our also ending, taking away 13(3) and other similar authority from the Fed and others to put taxpayer dollars in large quantities into individual firms?","Speech"," "
"Mr. Bernanke","In short, yes, I would support that--13(3) has been used two ways. It has been used in what you would call bailouts, and it has been used in developing these broad-based lending facilities to help individual markets, like the ones we just closed down on February 1st. I think the latter is a valuable thing to have in case of a future crisis, but we would be happy to give up any involvement in the wind-down of failing, systemically critical firms.","Speech"," "
"Senator Vitter","And just to make clear, I am talking about the former not the latter, so I think we are on the same page.","Speech"," "
"Mr. Bernanke","We are on the same page.","Speech"," "
"Senator Vitter","As I understand the Treasury's position, they say they support a resolution authority, but they essentially also want to keep that other authority as ``foam on the runway,'' as sort of a backup plan, however you want to term it. Do you think that is necessary or a good idea?","Speech"," "
"Mr. Bernanke","It depends on exactly how the resolution authority is structured. It might be that you want the Fed to be available to provide liquidity as part of the resolution process, for example. But, generally speaking, I prefer that you develop a process that leaves the Fed to do only its standard discount window lending against collateral as it always has done, without use of the emergency authority.","Speech"," "
"Senator Vitter","So if we get the resolution authority right, you do not see any need for that other authority with regard to individual firms continuing to exist?","Speech"," "
"Mr. Bernanke","We would be very happy if you could find a solution that allows us to give up that authority.","Speech"," "
"Senator Vitter","OK.","Speech"," "
"Senator Johnson","Could you gentlemen wrap it up?","Speech"," "
"Senator Vitter","OK. I have one more question, which is about audits and transparency of the Fed. I welcomed your recent written comments about that as certainly movement in the right direction from my point of view. One thing you underscored was some delay in terms of disclosing certain action so as not to disrupt the markets in terms of an immediate disclosure of certain activity. What is your reaction to the idea of having the same disclosure with a lag for all loans and collateral used to secure loans made by the Fed--in other words, the normal discount window activity?","Speech"," "
"Mr. Bernanke","Including the names of the borrowers?","Speech"," "
"Senator Vitter","Correct.","Speech"," "
"Mr. Bernanke","That is a concern that we have, and the problem is that if banks think they are going to be--that their names are going to be publicized, then they will not come even if they are under attack by the market, even if there is a panic or a run on the firm. So it is a very delicate issue. I think we will have further discussions, I am sure, but we are quite nervous about essentially shutting down the viability of this critical tool, which proved to be very valuable during the crisis. So that is something that we are concerned about, even, you know, with a delay.","Speech"," "
"Senator Vitter","So even with a delay.","Speech"," "
"Mr. Bernanke","You know, I am sure we will have further discussions about this, but, you know, again, if a company is under attack by people who do not believe that it is stable and they know that if they go to the window, their name is going to be published even with some delay, they may feel that they have no option, that they will just have to fail, because if they go to the window and that is revealed, then the market will then believe that they, in fact, are not stable, and the whole purpose of the discount window loan will not be served. So that is a particularly sensitive one for us, even though that is a relatively small part of our lending.","Speech"," "
"Senator Vitter","OK. Thank you.","Speech"," "
"Senator Johnson","Senator Warner.","Speech"," "
"Senator Warner","Thank you, Mr. Chairman. I appreciate getting my time. Thank you, Chairman Bernanke, for being here. I do share one concern that Senator Vitter mentioned about the deficit, and, gosh, I wish we would have supported Senator Gregg's proposal when we had a chance. I think it was still the best, perhaps last best proposal to actually force this Congress to take an up-or-down vote on a plan that would put us back into fiscal sanity. I want to come back on the question of financial regulation. Mr. Chairman, you make, I think, a strong case about the need to have sophisticated, strong supervision for bank holding companies and that this supervision has to take a look at not just individual supervision but systemic risk in a macro level. I still think we are weighing where that role should be, and I am not sure, at least from my standpoint, while you make a strong case that you have fully made the case that it absolutely has to be deposited within the Federal Reserve, that it could perhaps be deposited elsewhere. You know, one of the comments you have made--and we are now 18 months after the crisis, and you have said that you have looked at the Fed within supervision of the bank holding companies, stronger capital, stronger risk supervision. You know, we have had a lot of discussion over the last 18 months about size. We have talked a little bit earlier--Senator Reed raised questions about the Volcker Rule, and I share some of your concerns about how you draw those lines. Chairman Dodd raised the question about use of some of the instruments out there in terms of derivatives. Could you tell us a little bit in this last 18 months, with this increased focus on the large sophisticated bank holding companies that you currently supervise, you know, what steps that has taken to strengthen that supervision in a little more specific way than you did in your----","Speech"," "
"Mr. Bernanke","Well, it would take me quite a long time.","Speech"," "
"Senator Warner","Perhaps you could give that for the record. I would like to see----","Speech"," "
