"Speaker","Speech"
"The Chairman","The Committee will come to order. We have Members coming in. We don't have votes until 6:30, so I appreciate the Members making an effort to come back. I think we will have more Members joining us. Good afternoon to everybody, and welcome to today's hearing on derivatives legislation. For those on the Committee who were here in the 110th Congress, today's hearing will cover many of the issues and topics considered during the nine hearings held last year on this subject. The effort to strengthen oversight and improve transparency in derivatives markets, whether regulated or unregulated, whether they are physically based commodities or financial commodities has been a top priority of this Committee. For those of you who are new to the Committee, welcome to the fire. Members and staff have been working hard on this issue since the last Congress adjourned, and it is my intent to move expeditiously this month; because every day we delay is another day where markets operate without the oversight or transparency they desperately need. Last year, we began our journey with extensive public hearings on the issue of speculation, lack of convergence, lack of effective oversight, and increased transparency of derivative markets. The result of those hearings was a strong bipartisan bill that had more than \2/3\ majority when it passed the House last September. We will continue this effort in the 111th Congress, but this time with new provisions resulting from the hearings we held late last year on the role of credit derivatives in the economy after the collapse of large financial institutions that were heavily engaged in the over-the-counter derivatives transactions and market. The language that I circulated last week, and that this Committee will be discussing, contains provisions similar to last year's bipartisan bill. It will strengthen confidence and trader position limits on all futures markets as a way to prevent potential price distortions caused by extensive speculative trading. It would close the so-called London loophole by requiring foreign boards of trade to share trading data and adopt position limits on contracts that trade U.S. commodities linked to U.S.-regulated exchanges. It would direct the CFTC to get a clearer picture of the over-the-counter markets, and it calls for a new full-time CFTC staff to improve enforcement, prevent manipulation, and prosecute fraud. This proposal would bring a sense of order to the over-the- counter market by requiring transparent central clearing for all OTC derivatives. The legislation contemplates multiple entities, whether regulated by the CFTC, the SEC, or the Federal Reserve, offering clearing services for the market. In that sense, it is modeled after the current law. However, the bill requires these clearing entities to follow the same set of core principles in their operations as a means of avoiding regulatory arbitrage. The failures of AIG, Lehman, Bear Stearns, and other institutions have shown us that it is time for some transparency in the market for credit derivatives. The way for us to identify and reduce the risk out there is to facilitate clearing it. The draft bill provides the CFTC with authority to exempt some derivatives from clearing in recognition of the fact that not every OTC trade is suitable for clearing. However, those seeking to remain in the derivatives business without clearing will have to report their actions and demonstrate their financial soundness. In the debate over credit derivatives, there has been much discussion about choosing the proper regulator, whether it is the CFTC, the SEC, or the Fed. I have made it clear that I believe the CFTC is the agency that has the knowledge and the expertise in these markets. I am flat-out opposed to the Fed having a role in clearing or overseeing these products. If I could have my way, the Fed would not be involved. However, that is probably not a political reality of today, and the draft legislation reflects that. The Federal Reserve is an independent banking system, not a police officer of derivatives transactions. I share the concerns of those who think the Fed controls too much already. They are an unelected body that sets monetary policy, oversees its state member banks, oversees holding companies, and now they are printing money for the bailout. I am not surprised that the large banks are clamoring for the Fed to regulate derivative activity, given their cozy relationship with Fed members. Plus, they probably think it is a good idea to have a regulator with resources to bail them out if things go wrong. I am also strongly opposed to allowing the SEC to have primary authority over these contracts. The SEC uses a rules- based system that is behind the curve of today's modern, complex financial products and in my opinion is just not workable. They are not just trying to solve yesterday's problems or last week's problems; they are still trying to solve the last decade's problems. As a result, they have done a poor job. How much confidence can we have in an agency that repeatedly ignored calls even from within its own agency to examine the investment advisory business of Bernard Madoff, which turned out to be the biggest Ponzi scheme in history? They gave them a road map as to what was going on; and they missed it. They even missed the red flags in their oversight of Bear Stearns, as was detailed in a report by the SEC Inspector General. Other people are trying to use the problems of credit default swaps as an argument to create a super financial regulator. However, in my opinion, taking something that is working, like the CFTC oversight of the futures market, and moving it to another place where things are not working is, frankly, crazy. To name a financial czar or a single super- regulator over the whole thing is an even worse idea and has the potential to create financial markets' version of the Department of Homeland Security, which a lot of us don't want to see happen. So I don't want to even imagine the problems that we would create if we would go down that avenue. So as this Committee moves forward on this matter, we will continue to work on a bipartisan basis on this bill. We will do our work out in the open, and we will listen to any and all who want to comment. That is what we did with the farm bill, with the reauthorization of the Commodity Exchange Act and with our examination of speculation. The result of that approach was passage of strong bipartisan legislation last Congress that had the support of the Ranking Member at the time, Mr. Goodlatte, and it received \2/3\ of the vote in the House. This is must-pass legislation, in my view, which is why we need to move quickly; and that is why I have circulated this language, and why we are holding these hearings today and over the next couple of weeks. So I welcome all of today's witnesses and the Members to the hearing. I look forward to their testimony. Prepared Statement of Hon. Collin C. Peterson, a Representative in Congress From Minnesota Good afternoon and welcome to today's hearing on derivatives legislation. For those on the Committee who were here in the 110th Congress, today's hearing will cover many of the issues and topics considered during the nine hearings held last year on this subject. The effort to strengthen oversight and improve transparency in derivative markets, whether regulated or unregulated; whether they are physically based commodities or financial commodities has been a top priority of this Committee. For those of you who are new to the Committee, welcome to the fire. Members and staff have been working hard on this issue since the last Congress adjourned and it is my intent to move expeditiously this month because every day we delay is another day where markets operate without the oversight or transparency they desperately need. Last year, we began our journey with extensive public hearings on the issue of speculation, lack of convergence, lack of effective oversight, and increased transparency of derivatives markets. The result of those hearings was a strong, bipartisan bill that had more than a \2/3\ majority when it passed the House last September. We will continue this effort in the 111th Congress, but this time with new provisions resulting from the hearings we held late last year on the role of credit derivatives in the economy after the collapse of large financial institutions that were heavily engaged in OTC derivative transactions. The language that I circulated last week and that this Committee will be discussing contains provisions similar to last year's bipartisan bill. It would strengthen confidence in trader position limits on all futures markets as a way to prevent potential price distortions caused by excessive speculative trading. It would close the so-called London Loophole by requiring foreign boards of trade to share trading data and adopt position limits on contracts that trade U.S. commodities linked to U.S.-regulated exchanges. It would direct the CFTC to get a clearer picture of the over-the-counter markets, and it calls for new full-time CFTC staff to improve enforcement, prevent manipulation, and prosecute fraud. This proposal would bring a sense of order to the over-the-counter market by requiring transparent, central clearing for all OTC derivatives. The legislation contemplates multiple entities, whether regulated by the CFTC, the SEC, or the Federal Reserve, offering clearing services for market. In that sense, it is modeled after current law. However, the bill requires these clearing entities to follow the same set of core principles in their operations, as a means to avoid regulatory arbitrage. The failures of AIG, Lehman, Bear Stearns, and other institutions have shown us that it is time for some transparency in the market for credit derivatives. The way for us to identify and reduce the risk out there is to facilitate clearing it. The draft bill provides the CFTC with authority to exempt some derivatives from clearing, in recognition of the fact that not every OTC trade is suitable for clearing. However, those seeking to remain in the derivatives business without clearing will have to report their actions and demonstrate their financial soundness. In the debate over credit derivatives, there has been much discussion about choosing the proper regulator; whether it is the CFTC, the SEC, or the Fed. I have made it clear that the CFTC is the agency that has the knowledge and expertise in these markets. I am flat opposed to the Fed having a role in clearing or overseeing these products. If I could have my way, the Fed would not be involved; however that is not the political reality of today, and the draft legislation reflects that. The Federal Reserve is an independent banking system, not a police officer of derivatives transactions. I share the concerns of those who think the Fed controls too much already. They are an unelected body that sets monetary policy, oversees its state member banks, oversees holding companies, and now they are printing money for the bailout. I am not surprised that the large banks are clamoring for the Fed to regulate derivative activity, given their cozy relationship with Fed members. Plus, they probably think it is a good idea to have a regulator with the resources to bail them out when things go south. I am also strongly opposed to allowing the SEC to have primary authority over these contracts. The SEC uses a rules-based system that is behind the curve of today's modern, complex financial products and is just not workable. They are not just trying to solve yesterday's problem or last week's problem; they are still trying to solve last decade's problem. As a result, they have done a poor job. How much confidence can we have in an agency that repeatedly ignored calls, even from within its own agency, to examine the investment advisory business of Bernard Madoff, which turned out to be the biggest Ponzi scheme in history, having cheated an untold number of investors, charities, and foundations out of billions; or that missed the red flags in its oversight of Bear Stearns, as was detailed by a report from the SEC Inspector General? Other people are trying to use the problems with credit default swaps as an argument for creating a super financial regulator. However, in my opinion, taking something that is working, like CFTC oversight of the futures markets, and moving it to another place where things are not working is just crazy. To name a financial czar or single super regulator over the whole thing is an even worse idea that has the potential to create a financial markets version of the Department of Homeland Security. I don't want to even imagine the kind of mess that would create. As this Committee moves forward on this matter, we will continue to work on a bipartisan basis on this bill, and we will do our work out in the open and listen to any and all who want to comment. That is what we did with the farm bill, with reauthorization of the Commodity Exchange Act, and with our examination of speculation. The result of that approach was passage of strong bipartisan legislation last Congress that had the support of the Ranking Member at the time, Mr. Goodlatte, and achieved \2/3\ votes in the House. This is must-pass legislation, in my view, which is why we need to move quickly. That is why I have circulated this language and why we will be holding hearings over the next 2 weeks. I welcome today's witnesses and I look forward to their testimony. At this time I would like to yield to Ranking Member Lucas for an opening statement."
"The Chairman","At this time, I would yield to Ranking Member Lucas for an opening statement."
"OPENING STATEMENT OF HON. FRANK D. LUCAS, A REPRESENTATIVE IN CONGRESS FROM OKLAHOMA",""
"Mr. Lucas","Thank you, Chairman Peterson, for calling today's hearing. We appreciate the opportunity to examine your draft legislation that addresses concerns with the derivatives industry and its impact on the U.S. economy. During the past several months, the Committee has spent a great deal of time monitoring the issue of trading activity in the futures market, as well as exploring the role credit default swaps have played in our current financial crisis. The draft legislation we are considering would impact a wide array of financial instruments, and what the ultimate effect will be in the marketplace is unknown. My main concern is how the legislation will impact risk management for agricultural producers. How far will this legislation go beyond credit default swaps and derivatives in general? I support greater transparency and accountability in respect to the over-the-counter transactions. However, I also believe any legislation to regulate financial markets has to strike a delicate balance between protecting the economic workings of this country and creating opportunities for economic growth, business expansion, risk management for our agricultural producers. To that end, I believe this Committee must work to ensure that the Commodity Futures Trading Commission, the CFTC, plays a leading role in appropriately regulating the derivative and commodity markets once the Committee decides what level of additional regulations are needed. We should also work to ensure that the CFTC has the tools it needs, human resources, technical resources, economic resources to effectively carry out its statutory mandate. It must be noted that the CFTC has a proven track record in clearing futures contracts, and to date has not lost a single dollar of a single customer's money due to failure of a clearinghouse. Finally, I would like to thank the participants of our two panels today. We appreciate your time and your commitment to the public policy process, and we look forward to your testimony and answers to our questions. Thank you, Mr. Chairman."
"The Chairman","I thank the gentleman and his staff for working with us through this process. We have been working on a bipartisan basis, and we will continue to do that. The chair would request that other Members submit their opening statements for the record so that witnesses may begin their testimony and we ensure that we will have ample time for questions. Prepared Statement of Hon. Sam Graves, a Representative in Congress From Missouri Thank you, Chairman Peterson and Ranking Member Lucas for holding this hearing to review the Chairman's draft bill on derivatives legislation. Investor Warren Buffet has described the multi-trillion dollar market in financial derivatives as the equivalent of a financial pearl harbor. The unregulated and often shadowy market in financial derivatives trading has contributed greatly to the uncertainty and volatility that is paralyzing financial markets and hindering our economic recovery. Sunshine is often the best policy. Last Congress I sponsored legislation to bring greater regulatory oversight and transparency to the over-the-counter trade in natural gas contracts. As many Members of this Committee know, natural gas is an important component of many agriculture products, including fertilizer. While my bill was focused on combating market manipulation, I believe its transparency components are applicable here, to financial derivatives. Like anything, the devil is in the details and I look forward to learning more about the Chairman's proposal and hearing the opinions of today's panel. Again I would like to thank the Committee for holding this hearing. Thank you."
"The Chairman","So, with that, without objection we would like to welcome our first panel of witnesses to the table. First, we have Mr. Tom Buis, the President of the National Farmers Union. Welcome. Mr. John Damgard, the President of the Futures Industry Association; Mr. Michael Greenberger, Law School Professor at the University of Maryland School of Law; Mr. Michael Gooch, the Chairman and Chief Executive Officer of GFI Group, Incorporated, of New York; Mr. Sean Cota, President of Cota & Cota, Incorporated, on behalf of the Petroleum Marketers Association of America and the New England Fuel Institute of Bellow Falls, Vermont; and Mr. Terrence Duffy, the Executive Chairman of the Chicago Mercantile Exchange Group, Incorporated, of Chicago, Illinois. So, gentlemen, welcome to the Committee, welcome to the panel. We look forward your testimony. Mr. Buis, you can begin, if you are ready."
"STATEMENT OF TOM BUIS, PRESIDENT, NATIONAL FARMERS UNION, WASHINGTON, D.C.",""
