"Speaker","Speech"
"Mr. Buis","Well, thank you, Congressman. I was enthralled by the debate that was going on here, and certainly trying to follow along on those credit default swaps. Things on the farm are not good, and this deregulatory approach, or the lack of oversight by CFTC, has led to it. Farmers thought they were going to get good prices. They were precluded from the market, and Mr. Damgard is right, they ran up against their credit limits. But what they don't tell you is that those markets were going up, not because of market fundamentals, but because of the tremendous amount of Wall Street money that came into those markets. And everyone saw this as a great opportunity to make money. As a result, you gave false hopes to the grain farmers that they were going to get these prices. They were precluded. You gave false hopes or big scares to the livestock industry because they thought the prices were going to continue to go higher and higher, so they locked in feed costs. You gave false hope to the ethanol industry, the biodiesel industry, all the processors that, to hedge themselves, they paid higher prices because the big fear was that it was going to continue. And when the bubble burst, and when commodity prices collapsed, it has virtually impacted every aspect of agriculture."
"Mr. Kagen","So now your input costs are higher than the price that the farmer----"
"Mr. Buis","Absolutely."
"Mr. Kagen","--is going to receive, so they are in a losing position."
"Mr. Buis","In a very losing position, and they are locked into these higher costs, whether it is livestock producers or grain producers. Buy fertilizer based on record inputs, and fertilizer prices followed oil, and we all know that was a false bubble as well."
"Mr. Kagen","When do you expect the consumers to feel the impact of that?"
"Mr. Buis","Well, the irony is consumers aren't feeling the impact. You know, wheat prices were $23 a bushel on the Minneapolis Exchange last winter. They are now down around $6, and the price of a loaf of bread has gone up over $1 this year. So that would be another subject for another hearing, Mr. Chairman, Members of the Committee."
"Mr. Kagen","Mr. Greenberger, Mr. Gooch has suggested that the credit derivatives market is transparent. Do you agree with that?"
"Mr. Greenberger","I don't, I don't, and I want to make a point about the worry about credit. We know today there is no credit in the markets. Why is there no credit in the markets? Because everybody is worried that somebody else holds these private, bilateral contracts that have nothing to do with helping people get mortgages. They are simply bets that people won't pay the mortgages, but they are trillions of dollars of debts. If Lehman Brothers fails, if Bear Stearns fails, if Fannie and Freddie fail, if Citigroup has spent $300 billion of their troubled assets thing, everybody is saying to themselves, we can't loan to anybody because anybody may fail."
"Mr. Kagen","And isn't it true that the notional value of those potential assets are far greater than the real estate holdings, the real market value?"
"Mr. Greenberger","Absolutely, because people are betting. It is just like when you say in the Super Bowl, how much money is at risk----"
"Mr. Kagen","Please, let me follow up on a statement by Mr. Gooch, that the banks are illiquid primarily because of the unknown market value of the paper, bad paper, toxic assets that they are holding, because those things haven't been marked-to- market, those things are unsellable at a market price that they can come out with any profit on; isn't that true?"
"Mr. Greenberger","That is exactly right. If you have the legislation that this Committee has proposed would give those credit default swaps that are traded--and, by the way, if you have risk, in other words you have loaned money, and you want to make a risk against it, you can go on Mr. Kelly's exchange and buy a credit default swap. If you don't have risk, that is the question, should you be able to bet that people won't pay their mortgages or that GM will fail? Mr. Peterson, in his draft bill, is saying betting is for Las Vegas, not for the exchanges. By the way, Las Vegas, if they regulated the stuff, would have never gotten into the trouble that AIG had. Or, for that matter, if the Mafia had done this, they would have balanced their book."
"Mr. Kagen","Well, I am going to assume they are not in the room, but they might be watching."
"Mr. Greenberger","Okay."
"Mr. Kagen","But coming back to the point that was made by Mr. Gooch, and that was that the mortgages have failed and not the CDSs, it is just the opposite, because the notional value that is a result of the CDS activity is far, far greater, perhaps to the tune of $50 trillion greater, than the underlying assets of the mortgages in the paper. I see my time has expired, and I apologize for going over if I have. But, Mr. Gooch, if you would like to make a comment, do you stand by your statement that it was the mortgages that have failed that have helped to create this illiquid condition throughout the global marketplace and not the derivatives markets?"
"Mr. Gooch","Yes, I do. The CDS is a specific type of credit derivative that I am concerned about the elimination of the naked risk. If you went to that extent, then I guess you could disallow disinterested parties from buying and selling stock options or shorting stocks. And you could just do the same thing in the foreign exchange markets and the bond markets, and have the same thing in the agricultural markets and have no liquid markets. My concern with the elimination of the naked-risk trading, the elimination of it in the CDS market, is once you do that, you take the risk-taker and capital provider out of the equation, right now I take the contrary view to Mr. Greenberger that the credit derivatives are not the reason the banks aren't lending. The banks aren't lending because they are concerned about their capital requirements. You have mark-to-market, which I said in normal markets makes sense, and they are reluctant to put money out on the street because they can't get it back in a moment's notice; and they don't want to go to you guys for very expensive preferred equity, so they are sitting there not lending. Finally enough, the only lenders in the market are the providers of credit default swap protection that are still very willing to provide that protection, and that is making it possible for some of the most secure credits to be provided with capital. It is also allowing for these very banks to protect some of their risk they have with certain lending relationships they have now, which, otherwise, they might curtail to an even greater extent. So, as you know, I only have 18 percent of my business in credit derivatives. If it disappeared tomorrow, we would find something else to intermediate, probably carbon credits. So I am not speaking from my own personal best interest, I am actually talking about the U.S. economy and the global economy. My concern, as an independent, neutral marketplace for credit derivatives, is that if you take it away, you are going to really significantly damage the very fragile credit market we have now."
"Mr. Kagen","Thank you for your comments, and I would finally say that once we restore confidence to the marketplace by providing transparency, we might be able to unfreeze some of that credit. Thank you."
"The Chairman","Thank you. The gentleman from Texas, Mr. Conaway."
"Mr. Conaway","Thank you, Mr. Chairman. At the risk of beating a dead horse, section 16 does give me some pause if for no other reason than a ban on any other kind of otherwise legal activity is always troublesome. I would like some comments as to if, in fact, we do institute this ban, what instruments take these CDSs' places in the market? We have some very bright people out there who will find something else that you and I aren't thinking of right now, perhaps, to do that. Most of the comments seem to be as a result of the scale and the size of this thing. My view--and I would like your comments--if we had the normal reserve and capital requirements that insurance companies have to abide by when they sell an insurance product--and the CDS is an insurance product--and you had those capital requirements in place, and then you had on top of that the margin requirements on exchanges that further add a protection, that would drop the scale of these things back. You would still allow them to do it, still allow the activity to go on. I had a conversation yesterday with a friend from Fort Worth, Texas, who is one of those dreaded hedge funds guys. He and two of his buddies scraped together some capital about 10 years ago, and they have been able to parlay that into a lot of money for themselves and their clients, and nothing wrong with that. They are long in the stock market, in this instance mining stocks. They use credit default swaps as a hedge, in their mind, a legitimate hedge, to offset the perceived risk in that, and it worked on their behalf. So, comments on capital requirements or reserve requirements for folks who write the original contract, CDS, and then as well as the impact the margin requirements would have on stabilizing these things so that if there is a loss, someone other than the American taxpayer pays that loss off."
"Mr. Duffy",""
"Mr. Duffy","Thank you, sir. Maybe the answer to your first question is what new products would they come up with to trade if there was a ban on credit default swaps or others. I don't think they would. I think they would just trade them someplace else, such as in London. So they would continue to trade the product of credit default swaps. Second, I think capital requirements are essential and reserves are essential for this product. We still believe this is a very viable product for participants to use to manage risk in credit default swaps. But, again, when Mr. Greenberger says that Chairman Volcker, Mr. Greenspan, Mr. Geithner, and others have said that these things should be banned, that is not true. What they have said is they need to be regulated, not banned. And, that is going to what you are saying, Congressman. We need to come up with ways to make sure there is transparency and people can use risk management for these products so we don't have systemic risk so it is coming back for the taxpayer to be bailed out. So we completely concur with that, we agree with that. No one likes going back to the government to be bailed out. We believe that a cleared model for credit default swaps makes complete sense, recognizing that there are certain ones that are just not potentially clearable, and we may have to trade off-exchange."
"Mr. Conaway","Mr. Damgard."
"Mr. Damgard","I would agree. I would say there are a lot of legitimate businesses out there that used the futures market and used credit default swaps for their own protection, as you just evidenced. The credit default swaps are not going away. There are very, very fine markets outside of the United States, both in the listed derivatives business and the unlisted derivatives. It seems to me anything we do to encourage people to use markets outside of the United States diminishes the CFTC's and the SEC's ability to see what is going on. This would be a perfect example of taking business that is creating jobs in the United States, it is providing liquidity, and moving it offshore."
"Mr. Conaway","Mr. Greenberger, 30 seconds max."
"Mr. Greenberger","I would just say I agree with you completely about capital requirements. Your state insurance commissioners are doubtless right now thinking that the CDS is insurance of a risk or unlawful insurance of no risk. If there were capital requirements, that would be very helpful. If there were collateral requirements, that would be very helpful. Mr. Marshall is looking for a compromise here. If you require people who entered into these transactions to have the capital to pay them off and collateralize their things, yes, that would be an adequate substitute to an absolute ban."
"Mr. Conaway","Thank you, Mr. Greenberger. Sections 4 and 5 talk about detail reporting, transparency and that kind of thing. I am a CPA by background, and one of the ways to whack somebody is to regulate them to death, and I am not experienced enough in this kind of reporting to understand that--are we overreaching, Mr. Duffy, Mr Gooch or Mr. Damgard? Talk to us about sections 4 and 5 real quickly. Is that too far, is that okay, is it a subject you can comply with?"
"Mr. Gooch","I am not entirely sure what sections 4 and 5 say because I was focusing on 14 and 16."
"Mr. Conaway","Okay."
"Mr. Gooch","But I would just like to add that I do support, and my firm is in favor of, what the Committee is trying to achieve in trying to find transparency and regulation in the marketplace. My concern is simply not banning something in some kind of knee-jerk reaction that could actually do more damage than good."
"Mr. Conaway","Mr. Duffy, 4 and 5, you guys, can you confer with that?"
"Mr. Duffy","You know, I had to just confer with counsel, but right now, sections 4 and 5, it just is a lot of daily reporting activities. We don't have issue with what you are doing on these two sections, sir."
"Mr. Conaway","We would like, if there is anybody else out there that has any comments about how they would actually comply with that, and if that is such a stifling burden, we may adjust it. Thank you, Mr. Chairman, I yield back."
"The Chairman","I thank the gentleman. Mr. Schrader, the gentleman from Oregon."
"Mr. Schrader","Thank you, Mr. Chairman. I appreciate that. I guess I am concerned about some of the credibility of what we have heard today. I mean, I am a new Member. I won't pretend to understand some of the arcane notions of derivatives and futures trading, but I do know that for most of this country's history, we didn't have any credit default swaps, and we seemed to get along okay. I also find it interesting that most of the people affected by naked default swaps are in favor of this legislation, namely the agricultural community and the petroleum marketers. That speaks volumes in itself to whether this is, as such, a bad piece of legislation, and it is so incomplete in its scope. I am curious why the people that are most affected seem to be totally in favor of most of this piece of legislation. To me, I guess I need to hear from Mr. Damgard, Mr. Gooch and Mr. Duffy. Do they or do they not believe that speculation, rampant speculation, speculation holocaust is indeed part of this problem that we are enduring right now in this economy. When I hear people, Mr. Duffy, say CDS is a very important tool in the economy we live in, well, I would suggest that the economy we are living in is not too good right now. I do not subscribe to that philosophy of the CDSs, or certainly naked CDSs. My folks back home would ban them. They would get rid of hedge funds, they would get rid of CDSs altogether. I understand that there is somewhat of a lack of understanding in some of the way the market works right now. But I certainly think that this modest proposal is certainly acceptable, and I guess we need to hear from you gentleman if you don't think that speculation, rampant speculation, has anything to do with the problems on our farms and our petroleum marketers, gas stations back home."
"Mr. Damgard","Well, I would say speculation has been demonized to the point where people think speculation is the same thing as manipulation. We speculate all the time by buying stocks, selling stocks. The people that are using futures markets historically, Mr. Congressman, have been institutional users that know precisely what the risks are, and they use those markets for price protection. We have seen those markets expand every year for the last 20 years with one exception, and it is really a credit to this Committee and the education that has gone on that has gotten more and more people involved in these markets that are used primarily by people that are managing risk. Now, without speculators, they wouldn't be able to do that, and the spreads would widen. So speculation is----"
"Mr. Schrader","I am talking about rampant speculation versus investment; it is a big difference."
"Mr. Damgard","I think you have to trust the CFTC. There are spec limits on speculative traders that are not there for the hedgers. The CFTC has a pretty admirable history in making sure that these markets have worked as well as they have. Random speculation, or outrageous speculation, is something that, in my judgment, is left to the decision of the people in the Surveillance Department of the CFTC, and to legislate hard and fast rules, particularly as these markets expand, is pretty dangerous. We want speculators in these markets. We want hedge funds in the markets. We want pension funds in the markets. Clearly, an awful lot of the money that was made in the rise in the price of oil was pension funds and endowment funds that had deserted the equity markets. The people that manage those endowments recognized that there was more opportunity in the commodity area. There have been a lot of adjustments in our market since the advent of electronic trading. It used to be that certain markets, particularly when it was floor-based, were kind of a club. With electronic trading, everybody that has access and money to an account with a clearing member has the opportunity to invest in whatever they want to invest in."
"Mr. Schrader","I appreciate the testimony. I would like to hear from Mr. Gooch and Mr. Duffy. I understand rampant speculation is okay with you."
"Mr. Gooch","No, certainly not; that is subjective. I would not be in favor of rampant speculation. I mean, there are situations where the Hunt brothers cornered the silver market way back in the past. Clearly there has to be some regulation in that respect. I don't think you can just have--when you use the words ``rampant'' and ``holocaust,'' obviously, that would be bad. But to then take all speculation----"
"Mr. Schrader","I think it is pretty bad right now."
"Mr. Gooch","Well, you say that, but at the same time the United States, even in this significant downturn, still has the highest standard of living in the world."
"Mr. Schrader","Well, we are going the other way as hard as we can."
"Mr. Gooch","The entire world was over-leveraged and went through a credit bubble that may have significant causes other than the various instruments that we used to transact the risk. Yes, I completely support the concept of centralized clearing, but I agree with Mr. Duffy, not all products could be put into centralized clearing. Regulation, transparency and limits, limits on positions relative to capital and things like that, those things all make sense. Certainly, AIG should not have been selling credit default swaps and pocketing the premiums and treating it as if it was income. They should have been far more conservative. But there is always, throughout history, the case of either individuals or corporations or governments that overspeculate, and they should be held to some kind of limits."
"The Chairman","I thank the gentleman. The gentleman from Ohio, Mr. Latta, has he left?"
"Mr. Duffy","Mr. Chairman, may I make a comment, sir?"
"The Chairman","Yes."
"Mr. Duffy","I didn't have a chance to answer the Congressman. I think it is important for the record that I do so, right, because he talked about not having credit default swaps around or anywhere else as of 10 or 11 years ago, and that is absolutely true. But you also have to remember that product innovation in financial services is as critical as it is to research and development of any other business. So in order for economies to grow, we need to have new products that people can manage their risk properly with that to help us continue to grow and bring us into new centuries. So, that is really important for product innovation to move forward. And as far as rampant speculation, when you look at regulated exchanges with limits proposed on their trading, spending a big part of a portion of their own budgets--we are public companies--to make certain that we don't have rampant speculation that could turn into manipulation, it is critically important to the success of any publicly traded company such as CME Group. So, no, we don't condone excessive speculation or rampant speculation, as you put it, sir, but we do believe that there is a buyer for every seller, a seller for every buyer. The more liquidity there is, the better price the person that is trying to hedge their risk will get for the product. Thank you, Mr. Chairman."
"The Chairman","Thank you. The gentleman from Nebraska, Mr. Fortenberry."
"Mr. Fortenberry","Thank you, Mr. Chairman, for holding this very important hearing and for delving very deeply into this complex issue, and I thank the panel as well for the lively and informative exchange. It has been very productive. When gasoline went over $4 in Nebraska last year, I stopped in to see Bill Sapp. He does something similar to you, Mr. Cota. Any of you who have gone down Interstate 80 right outside of Omaha might see a big coffee pot sitting 100 feet in the air. That is Bill's business. I said, Bill, what is going on, and he said, speculation. I want to follow up with your comments, Mr. Cota, talking last year when we hit $140 or so on oil futures, and now we are back down to $40. Your suggestion that this is being driven by greed and fear, being untethered from any supply or demand conditions, simply being accelerated because of artificial factors, outside, again, of the underlying fundamentals, led to such disruption not only in terms of gasoline prices, but all of the other commodities. And you, sir, had mentioned consequences for the other agricultural markets. If we presume that is true, and last year we held numerous hearings on this with the CFTC to figure out what systemically was potentially failing, where has regulation gone wrong. Their conclusion was we can't find a smoking gun, but we need more time and more help to potentially find a smoking gun. Let us unpack the reasons for, again, that rapid spike in speculation that everyone agrees has been terribly disruptive and not normal. Mr. Gooch, you alluded to it, to a portion of the reason, maybe the significant portion, in terms of credit and credit bubbles and investing in commodities as an inflationary hedge or for other reasons, because people were just getting on this accelerating train. If we can get to that underlying question, and then we know a lot more as to how to potentially prevent this type of systemic failure, disruption into the future, which has been, again, underlying a big portion in this economic malaise that we are in."
"Mr. Cota","Congressman, first with regard to your comments on the CFTC in that they didn't have enough information in order to determine whether or not there was speculation having an impact, that is because they don't have jurisdiction over large chunks of the market through various--closing the Enron bill does take part of that, but those administrative rules are not in place yet, and it still exempts the lending loophole in all of those. So until you start counting the whole pie, it doesn't make any sense. The case of Amaranth, which was a hedge fund that went bad, they only got caught because they did some of their trades upon a regulated exchange, a subsidiary of the Chicago Merc, the New York Mercantile Exchange, where they were cornering--it was perceived that their positions were too large for the February contract. In retrospect, after an investigation, it turned out that they had 80 percent of the U.S. total natural gas production for the February contract, just for their position. So until you see what these aggregate position limits are of these large entities, and you keep track of it, that is the only time you can bring it to the light of day. I like to have exchanges do most of this, because you put all of the players together in the same room, and they know what is going on. When they see somebody is going to put them at risk, they are going to be much more diligent and make sure that person doesn't. As to what started the whole process, we started when the subprime market went bad, so people needed to put their money as they sold out of that. The banks that lost money on that initially lost because they had loaned money to people to buy these subprimes, and then they decided it went as high as possible, so I had better short it. So they shorted it. People they loaned money to went bad. People needed to move money out quickly. Any pyramid collapses faster than it went up, and then they went into their remaining items. The remaining investments were equities at that point, so in 2007 you saw a bump in equities. As that started to come apart, it moved into currencies and commodities. It was the only thing that was cash. As people became afraid of everything else, a stock may go to zero, Lehman may go to zero, a commodity will never go to zero. It may go to 2 cents on the dollar, but it won't go to zero. So the investing world was so afraid of any sort of investment. The banks didn't trust one another so that they went into the few things that they thought were left. That, to me, underscores the issue that you need to have sensible regulation. The world looks to the United States to have the most coherent regulation of financial markets in an open and free market--so that you can trust your money is going to be worth something. The other markets around the world don't have that. I am a kind of a contrarian to some of the conversations here-- if you do have a well-regulated market in the United States, the money will flood back in because they can trust this market. They may not be able to trust the others. That is my analysis of what occurred."
"Mr. Fortenberry","Thank you."
