"Speaker","Speech"
"Mr. Friedman","Thank you, Madam Chairwoman, and thank you, members of the committee. I truly appreciate the opportunity to testify before you today. I am a research director and senior engineer with the Union of Concerned Scientists. And as an engineer, I hope to bring a different perspective to this hearing. But first, I would like to point to the perspective of the American taxpayers whose money would be on the line. As I am sure you are all well aware, Americans have, by and large, lost confidence in the Detroit automakers. Recent polling indicates over 60 percent of Americans oppose government financial assistance to them. This is despite the fact that about half the cars and trucks sold last year are from the Detroit 3. Now, there are a lot of reasons for this lack of confidence. But if this committee, the House, the Senate, and the American people are going to support giving money to the automakers we need to find a way to ensure that this is not a bailout. Instead, the package should be structured as an investment where taxpayers are given a very clear return through money saved at the pump. To help rebuild confidence in the auto industry, and to build confidence in a package, I suggest four steps: First, we need to acknowledge what we already know. The survival of the Detroit auto industry depends on their ability to deliver the products consumers need in a world of volatile oil prices and a changing climate. No matter how they restructure themselves, if automakers fail to produce millions, millions of highly fuel efficient cars and trucks every year they will not be able to compete and they will not become profitable. Second, we need to require a return on taxpayer investment. This will help ensure that this package is in our Nation's interest. Automakers should be required to comply with fuel economy standards 3 years early as GM has effectively said it is going to do in the plans they just submitted. If Detroit automakers were required to follow this path, consumers would see net savings of more than $30 billion through 2025. And that is with gas at just $2 a gallon. Third, require that automakers not bite the hand that feeds them. In return for taxpayer monies, automakers should be obligated to drop lawsuits seeking to block States that are requiring cleaner cars. These States represent over 35 percent of taxpayers and they are demanding cleaner cars through a single global warming pollution standard. Frankly, it would be a slap in the face to ask their residents to put up money to help an auto industry that is undermining their efforts. Further, based on submissions from GM and Ford it looks like they could be in a position to comply with the State standards. If the auto industry wants one single standard, a great way to deal with this is to simply adopt the State standards nationwide. Fourth, we should preserve the 2007 energy bill's 136 advanced technology loan package and do not even temporarily bypass its modest requirement of a 25 percent increase in fuel economy for qualifying investments. In their plans, the automakers said they are already depending on this and they said that they can deliver on that 25 percent. There is no reason to sidestep that. If there are other barriers to getting that money to car companies as soon as possible those are the things that should be addressed. Now, Madam Chairwoman, the reason why I am so focused on building confidence in car companies by ensuring a return on investment is because I had very mixed emotions in studying their plans. There are a lot of reasons for hope in some of the plans the automakers submitted. From a promise to essentially meet 2015 fuel economy requirements 3 years early, to the planned introduction of a hybrid family car that beats the competition by at least 6 miles per gallon, the automakers appear to be laying out a more positive direction than they have followed in the past. But these promises also sound a little too familiar. They sound too much like the unfulfilled promise to deliver an 80 mile per gallon family car or a commercially available hydrogen car in return for billions in R&D money under the partnership for new generation of vehicles or the freedom car program. I honestly think that automakers that made these promises can carry them out. That has never been the question. Detroit's automakers already have the technology to do this and they are working hard at the more advanced technologies. And they have an extremely talented work force. So I am genuinely excited about the products they can produce. The question is not whether they can deliver; it is whether they will. And it is up to this committee and the Congress to make sure they deliver on these in return for financial help. Now, I have been a critic of the auto industry so it probably doesn't surprise you to see me pointing out the risk and accepting them at their word. But I also strongly believe that we need a viable domestic auto industry to tackle America's oil addiction while avoiding the worst impacts of climate change. If we avoid something that looks like an auto industry bailout and instead invest in them and require cleaner cars and trucks we can save money, save gas, reduce global warming pollution, and create new jobs along the way. Thank you. [The prepared statement of Mr. Friedman can be found on page 150 of the appendix.]"
"Ms. Waters","Thank you very much. Mr. Damon Lester. "
"STATEMENT OF DAMON LESTER, PRESIDENT, NATIONAL ASSOCIATION OF MINORITY AUTOMOBILE DEALERS (NAMAD)"," "
"Mr. Lester","Thank you, Madam Chairwoman, and members of the committee. I want to thank you for inviting me here to speak to you on behalf of all the small new automobile dealers in the United States. My name is Damon Lester, and I am the president of the National Association of Minority Automobile Dealers (NAMAD). NAMAD represents over 2,000 ethnic minority automobile dealers, who represent less than 5 percent of the overall automobile dealer network in the United States. However, I am here today not simply to talk about ethnic minority automobile dealers, but the owners of all small dealerships in the country as this automobile industry and this economy is facing a complete global economic meltdown. Today, small dealerships throughout the United States are suffering at an alarming rate and are running out of cash and will close their doors if access to capital is not provided to them immediately. While NAMAD supports the bridge loan requests made by the Big Three, we also believe that fair consideration should also be given to those small dealerships who sell the products that the manufacturer produces. There is a direct correlation between the success of a healthy manufacturer and a healthy and profitable dealership. We support the requests made by Congress for the Detroit 3 to come up with a plan depicting how they are going to spend the requested funds. We support the need for more fuel efficient vehicles and we also support the concessions made by the UAW as well. As all of these efforts provide a blueprint on how the manufacturer will and has revamped its operations. However, we are concerned about the small dealer. Without the dealership operating effectively, without the manufacturer having a strong consumer confidence in the brands and in the corporation, consumers will not purchase a vehicle and we need to change that. As I have reviewed the plans submitted by the Big Three, which focus on both short- and long-term viability of their respective companies, I am extremely concerned with some of the language that was alluded to in their proposals of having an excess number of dealerships. We believe that this deserves some review. As all small dealerships in rural and suburban America on average employ 53 employees and generate over $33 million in gross annual sales, a small dealership is Main Street. These dealerships provide so much to the communities they serve that if a dealership closes today, the local churches will suffer, the local school and summer athletic teams will suffer, the local 4-H Clubs and Lion's Clubs will suffer, the local Boy Scouts and Girl Scouts Club will suffer, and the local print and television stations will suffer as well. This is what Main Street is all about; grass roots, roll up your sleeves and becoming active in the communities in which they serve. As this Congress is considering the requests for immediate capital and liquidity by the Detroit 3, fair consideration and attention must also be given to the small dealerships. One very simple way to provide access to capital for these small dealerships is by the Small Business Administration Loan Guarantee Program. It has come to our attention that in the past 10 years, the SBA Loan Guarantee Program has been shortchanged and attempts to fund it have been shortchanged as well. In fact, just modifying the definition of who is eligible for the Loan Guarantee Program would help small dealerships. Currently the size standard, which is the definition used by the SBA to determine whether or not a business is deemed small, is stated as either employee based or in gross annual receipts based. As it relates to automobile dealers, the size standard currently is $29 million in average gross receipts, which is well below what the average gross annual sales are today. We believe if the size standard was modified to reflect an 100- employee based model, it will provide greater assistance for these small dealerships to survive. It is our hope that the loan guarantee will provide more assurance for financial institutions to begin lending to automobile dealers as it has come to almost a complete halt right now. We understand with any financial assistance program not all will be saved, but we truly believe that those dealers who have been historically profitable but are now going out of business for the lack of access to capital, can survive. I believe if there were an increase in the SBA Loan Guarantee Program of $1 billion from the TARP, which should be dedicated to provide assistance to small dealerships will potentially cover over 80 percent of those dealerships running out of cash now and being forced to close their doors. This loan guarantee will provide assistance to those rural and suburban dealers as well. In addition, I will recommend that $1 billion of TARP dollars from the manufacturer requested funds be directed to support small dealerships with the stipulation that these funds be used to purchase real estate, equipment and provide job training. And on behalf of the National Association of Minority Automobile Dealers, I want to thank the Detroit 3 for opening the doors for the diversity we now see among the small auto dealer network through its dealer development programs. Thank you. [The prepared statement of Mr. Lester can be found on page 165 of the appendix.]"
"Ms. Waters","Thank you very much."
"Mrs. Biggert","Madam Chairwoman, I have a Parliamentary inquiry. I notice that this witness is not on the memo to us, nor do we have his testimony. And I don't know whether the chairman and the ranking member discussed this, but I would hope that this would not set a precedent, and I am not sure that the testimony should be entered into the record."
"Ms. Waters","Certainly the chairman is not here, but it is my understanding that a decision was made. I don't know what conversation took place between the chairman and the ranking member, but I would certainly hope that there would be no opposition to this testimony being a part of the official record. And I would suggest that there may be follow-up conversation with the chairman about it."
"Mrs. Biggert","I certainly don't want to dismiss the testimony, and it is very relevant to this. But with the caveat that I would not want to see this set a precedent that this happens when none of our staff is aware of this."
"Ms. Waters","I can appreciate that. And I do not think that there are many situations where the chairman would add someone at the last moment without that kind of conversation. I certainly think we should note that. I shall talk with him based on this conversation that we are having and hope that would not happen again."
"Mrs. Biggert","Thank you."
"Ms. Waters","You are certainly welcome."
"The Chairman","I made the decision to add Mr. Lester, as I made the decision to extend the time to accommodate Mr. McCotter. Sometimes we don't always have things as we anticipated. It struck me that the dealers should be represented. We did have a dealer representative on the last panel. And frankly, also the aspect of the impact on the minority community seemed important. So it did not seem to me that anybody would object to any witnesses. As I said, from time to time, I think it is important to make decisions that will I think accommodate important interests reasonably in ways that don't cause any problem. Does the gentlewoman have any further questions about it?"
"Mrs. Biggert","If the gentleman would yield. No, I just wanted, since you were not here, and the question was that there is no testimony that we have or anything. I just wanted to know, just to make sure this isn't a precedent that will be when this is not discussed--"
"The Chairman","No."
"Mrs. Biggert","And I can understand."
"The Chairman","It is a response at the last minute to someone calling to my attention a mistake, and I realized that there wasn't testimony. So it will not be the regular order, but I couldn't rule out doing it again. And I will say, from time to time, I have accommodated requests that have come from Members on either side to change things. We were up to Professor Sachs, I believe. "
"STATEMENT OF JEFFREY D. SACHS, DIRECTOR, THE EARTH INSTITUTE, AND QUETELET PROFESSOR OF SUSTAINABLE DEVELOPMENT AND PROFESSOR OF HEALTH POLICY AND MANAGEMENT, COLUMBIA UNIVERSITY"," "
"Mr. Sachs","Mr. Chairman, thank you very much. Let me start by commending this committee for keeping at this, because this is of extraordinary importance for the American economy. Nobody likes this crisis, nobody likes these bailouts. History will record that this committee made a great service to the country in passing the TARP legislation. We have a crisis that is unprecedented in its speed and ferocity. It is hard to get everything right. You are doing the right thing. I would plead with you to stay in session to get this one done as well, otherwise we will have a meltdown in this economy that is of absolutely extraordinary proportions. This industry has enormous value worth preserving. These are some of the largest companies in the entire world. This is absolutely the worst financial crisis since the Great Depression. We all agree, aside from specific tactics on the need for a large government loan and a government involvement, so we are down to the details. In my view, Chapter 11 is not the best option right now. It is extraordinarily unpredictable. The last time we did a Chapter 11 was Lehman Brothers. That turned out to be the single biggest financial shock in modern history. And I think that we want to avoid going to that route as a first resort. In my view, it is the last resort. There are tremendous unpredictabilities on the consumer side, the finance side and the supplier side, possibilities of cascading disasters that I think we would do best to avoid right now. Now, we all agree that we need a significant restructuring. What GM put forward in detail, for example, is a very significant balance sheet restructuring. I believe that it can be done outside of Chapter 11, and I think that is what should be attempted right now. And I think it is enormously impressive what they put forward and enormously important for us to support that process. They call for an oversight board that can help that process. I agree with that. And I think that this is the basic structure in which this should proceed. Who should pay for this? This is the hot potato that everybody is worrying about, understandably. There are three sources of funds it seems to me, not just two. One is a direct loan by the Fed. I think Chairman Bernanke is the missing personality at these negotiations, quite frankly. I do not understand the reticence of the Fed right now. The Fed lent against Bear Stearns assets. The Fed lent against Citibank assets. The Fed can lend against GM collateral. This is a big mistake that is being made right now. This is a systemic financial risk in this country and a substantial one. And we need the Fed here as well. So in my opinion, this is the first place where we should be looking for financing. Second is TARP. It fits perfectly with the intentions of the TARP that this be used for this purpose. And I am so happy with the testimony of Mr. Dodaro yesterday and again today. This is absolutely appropriate that the TARP should be used for this purpose. The third is section 136. I also support that. Let's be pragmatic. Get this job done so that we don't have a meltdown. Have a new Administration come in. It is going to have to take a longer term look at this in early 2009 to help this process go forward. This is not the end of the story; this is the beginning. That does not mean endless amounts of new money. That is not what I am implying. What I am implying is government support for a basic restructuring of this industry to achieve financial restructuring, balance sheet change, and model change along the lines of the environmental goals that we all share. So we need to get there because otherwise we will have a meltdown. I think at this point the double standard with Wall Street is so painful and so palpable it is hard actually to understand, how one throws a $306 billion guarantee over Citigroup without a single hearing or a single plan or a single datum, but we can't get even a loan effectively senior and collateralized for millions of workers is a shock to me. I don't even understand what they are thinking right now. Because this is absolutely as systemic as Citigroup or absolutely as systemic as the other financial matters. This is our largest industry. Are we going to watch it melt down by Christmas? That is what we are talking about, with all of the disintegration of value that would go along with this. So I think we have to frankly, in my opinion, have Chairman Bernanke and Treasury Secretary Paulson here at the table. We have three sources of funds. It needs to be worked out. This is not an endless open-ended process. There are plans on the table which your committee has successfully elicited, a great contribution of these hearings I might add. And it is going to be a process now to get to the next Administration for a longer term considered strategy. Let me finally add that all around the world, governments are supporting their automobile industries. Just yesterday, President Sarkozy made announcements about France. This is going to be a worldwide phenomenon given that we are in the sharpest downturn in modern history. And so please do not leave this weekend. I don't want to open up to see what the markets look like on Monday morning because Congress has gone home and hasn't been able to figure out how to do $25 billion when we have trillions of dollars at stake. Thank you very much."
"The Chairman","You are pretty free with our weekends, Mr. Sachs."
"Mr. Sachs","With all due respect."
"The Chairman","You may have to give notes to our responsive spouses, significant others, and children. First of all, I appreciate--let me ask this. Do you have an opinion on the response that was made by the Treasury and the Fed in various combination to Citigroup and AIG? Take them one at a time. What did you think about the response to AIG?"
"Mr. Altman","I think the AIG bailout was necessary. I think the deal that the U.S. Government got was very poor. AIG is a global organization with an incredible amount of--"
"The Chairman","They didn't declare bankruptcy, did they?"
"Mr. Altman","No."
"The Chairman","Do you think they should have? I mean, why the requirement for bankruptcy here and not for AIG? I am picking up--or similarly with Citigroup. Both of those got large amounts of money without bankruptcy. Why is bankruptcy a necessity for the autoworkers or--"
"Mr. Altman","In this case, what I am advocating is that the government does not turn its back on General Motors when they go bankrupt. In fact--"
"The Chairman","I understand that."
"Mr. Altman","--I am advocating a much greater amount of assistance than what General Motors and the rest are asking for."
"The Chairman","I understand that, but I still--it does seem to me there is a difference in the treatment legally in terms of bankruptcy that was provided with regard to AIG and Citigroup on the one hand and what you are advocating here."
"Mr. Altman","There is a difference."
"The Chairman","What is the justification for being harsher on the auto companies than on the financial companies?"
"Mr. Altman","Well, first of all, I don't think we are being harsher on the auto companies. The auto companies--"
"The Chairman","You don't think if AIG was told if they had to do some form of bankruptcy, they wouldn't have thought that was being harsher?"
"Mr. Altman","I am sorry. I didn't hear the question."
"The Chairman","Well, if AIG had been told that they had to declare some form of bankruptcy, etc., you don't think they would have considered that to be harsher than what in fact happened?"
"Mr. Altman","Sure. Absolutely."
"The Chairman","Then why isn't it harsher for the auto companies than it was for AIG?"
"Mr. Altman","No, no. What I am saying is that I think the only hope for General Motors and the rest is to go bankrupt, to restructure, to perhaps even change the management of their companies."
"The Chairman","We changed the management of AIG without bankruptcy, and we restructured. I just don't understand why you have to take the extra step of bankruptcy here and didn't do it there. And there is this concern of a disparity that--and the ranking member made the point with regard to even the treatment of requests for approval of various forms of banking. I appreciate it. I think that is both a perception problem and a real problem; and I have to say I think there is to some extent in the culture and at the decision-making level what I have said before, a blue collar/white collar bias. I have heard a lot of requests from Mr. Gettelfinger to have the blue collar workers that he aptly represents reduce their compensation because it is greater than some other autoworkers. But my guess is the average autoworker gets significantly less in annual compensation than the average worker at Citigroup or AIG. And no one asked that they reduce their wages. We did talk about cutting out their bonuses, but I am sure the autoworkers would be perfectly willing to give up their bonuses, which they don't have. So that is what is troubling to me. Let me ask the panelists, Mr. Sachs, and Mr. Rohatyn, who have some experience here, what is the likelihood in your judgment of our taking some action and it leading ultimately to success, to the survival of the companies? Mr. Rohatyn."
"Mr. Rohatyn","I would think, Mr. Chairman--and depending on how quickly it is done, because every day that goes by creates another problem--I would think you have a 50/50 chance of being successful. The case is difficult to make from a popular point of view, but I think it is vital from a substantive point of view."
"The Chairman","You do substantive and we will do popular or unpopular."
"Mr. Sachs?",""
"Mr. Sachs","I think the chances of GM and Ford remaining self-standing, successful companies is over 90 percent. Very, very high probability. Chrysler, obviously, the chance that it gets merged with some other company is more likely. But these are major global enterprises. Unless in the middle of this crisis they are driven to disaster, they will survive and they will recover."
"The Chairman","Thank you. Mr. Friedman, one last question because--and I began and Mrs. Maloney ably carried out on the issue you raised about the lawsuit. One of the arguments we got was, though, that the three American companies are only some of the plaintiffs. If they withdrew as plaintiffs, would that end the lawsuit? Would it be more than a symbolic victory to get them out if other plaintiffs were able to go forward on the same legal issues?"
"Mr. Friedman","There are definitely other plaintiffs. But let us be honest, the leaders of these lawsuits have been the Big Three."
"The Chairman","I understand that. But, as a practical matter, what would the effect be if they got out? Would their lawsuit still go forward?"
"Mr. Friedman","You would have to ask the members of the other foreign companies and some of the dealers what they would do. But I would think it would be incredibly difficult for them to maintain those lawsuits if the Big Three stepped away."
"The Chairman","The gentlewoman from Illinois."
"Mrs. Biggert","Thank you, Mr. Chairman. Mr. Friedman, I serve on the Science Committee as well as this committee, so I am really extremely interested in the alternative vehicles and all that goes into that. And I worry about the fact that we have to continue this, particularly with the price of gasoline going down as in the 1970's when everybody suddenly thought, well, let us bring back the big cars. But I do see a difference here with people really looking forward to having the fuel-efficient cars. Do you think that that is one of the factors that--why people are not buying a car right now, that they know this is coming soon and there are already the hybrids and they don't want to buy a car that is going to lose value, that doesn't last as long as some cars have in the past?"
