"Speaker","Speech"
"Mr. King","Thank you, Mr. Chairman. Again, I want to thank the witnesses for their testimony. And as I stated in my opening statement, the concern I have is that, if we do provide the loans, the bridge loans, that we don't know exactly how much is really needed. For instance, last week it was $25 billion, now it is $34 billion. There was testimony yesterday that over $100 billion could be what is actually required. And to follow up on what Mr. Castle said, I am looking for some reasonable assurances that as we go forward, this will work. Now, Mr. Gettelfinger is here today, and I am not trying to pinpoint the UAW at all. But in the testimony, Mr. Nardelli, for instance, you spoke of continuing to negotiate cost savings. Now, that is in the future. If the money is given, for instance, what assurances do we have that those negotiations will continue between the UAW--and I know there are others besides UAW as far as the parties that have to be negotiated with--what assurances do we have that once the money is there, the negotiations will continue, and we won't be back here 6 or 8 months from now saying, we got the money up front, and therefore we sort of put this on hold, sort of the way the American people were doing with gas prices, when they were $4 a gallon, $4.50 a gallon, they were in a panic. Now that it is back under $2, and they are forgetting the potential crisis, I am wondering, can we be assured that you will not forget how important and how vital this crisis is and that the temporary money you get will not put off those negotiations?"
"Mr. Gettelfinger?",""
"Mr. Gettelfinger","Thank you very much for the question. I would like to first of all say that, compare this to a ballpark right now. In 2005 we went on first base, 2007 we went on second base. Just recently, this week, we are on third base. Other participants have not even entered the ballpark yet. We are prepared, as I have stated in my testimony, to go back to the bargaining table. In fact, we took action this week, but we think everybody should be at that bargaining table. We think the board of directors, we think the management, suppliers, dealers, equity holders, and especially creditors should be at the table. And we believe that there should be equal sacrifice. But we also believe that the men and women of the UAW who have stepped up should be given recognition for the three negotiations in which we have already made major concessions. But yes, sir, we are willing to go back to the bargaining table, providing everybody else comes to the table as well."
"Mr. King","Now, if I could ask the auto executives. You heard Mr. Gettelfinger say it sounds like almost ongoing negotiations. Do you feel the other parties will be at the table? Do you feel that you can make the type of progress that has to be made, that Mr. Gettelfinger believes has been made with his people, that you will make with the others?"
"Mr. Nardelli","Congressman, if I could very quickly, and then allow the others to comment. In our plan we are asking for $7 billion. We have also identified $4 billion of concessions across all constituents, just as Mr. Gettelfinger had identified. We are willing to put in a benchmark date that if not by March 31st we don't have those concessions in line, because that is when we start to realize the benefit of those, then we should be back here and pull the loan."
"Mr. King","Mr. Mulally."
"Mr. Mulally","Yes."
"Mr. Wagoner","Our plan comprehends the same approach, to use the short-term advance of funding and the oversight board as forcing mechanisms to ensure that we deliver all parts of the plan."
"Mr. King","Thank you, Mr. Chairman. I yield back."
"The Chairman","The gentleman from Florida, Mr. Klein."
"Mr. Klein","Thank you, gentlemen, for being here today. Mr. Chairman, I also want to just voice my support for use of the TARP funds for the auto financing issue. We have heard from a number of our dealers and many others about the lack of availability of financing for customers, and that certainly is one of the factors right now that is dealing with the lack of sales that is going on. So I think that is already out there, but Congress doesn't have to do anything further. It is more of the Treasury's move here to make that available, and certainly I would support that. Gentlemen, what is going on here in this discussion is a balancing act of what is palatable, what is feasible, what is politically supportable, and what makes economic sense. None of us are experts here, we are all trying to combine together with you and others to come up with a good solution. I want to throw an idea out that was sort of brought to me by some local people who are economists, people who are business entrepreneurs. And maybe it is just too common sense, but I want to put it out there and see what you think. We all know about the idea of collaboration and research. We know that you are on different tracks and different points on hybrid and electric vehicles. We know that your competitors overseas are at different stages as well. We all know that in order for you to be not only short term, but long term, and have a sustainable plan, you have to have the most advanced, the most cutting-edge technology on these automobiles that will be attractive for us, as consumers, to buy them here in the United States and everywhere in the world. We want you to be on top of that and at the forefront. What about the idea of taking whatever level of technology and research you have going on right now and creating some type of joint enterprise, whether it is public, not for profit, maybe some different way of doing it or maybe some private collaboration, taking some of the money that you are asking for here right off the top so the American taxpayer can understand there is something tangible that they are going to see come out of this in terms of long-term sustainability, if they are listening to the discussion today and your explanations, some of it may be supportable in the way they view it, and some may just think we are pouring money back into a problem, but taking part of this and say, let's take whatever technology you have and collaborating together and making that effort to say we are going to do something together, our Manhattan Project, if you will, for the moment, to say in some timeframe we are going to put together the most far-reaching, the most supportable, the best concepts that we can put together, take all that and put it together, and then make it available back to each of the companies for future development and commercialization. What do you think about that?"
"Mr. Nardelli","Congressman, let me say, first of all, I couldn't agree with you more. Two is, we ought to use the $25 billion that has been approved for fuel efficiency and environmental compliance. We should take a portion of that money and we should create exactly the format you have suggested. Therefore, rather than each of us trying to spend a portion of the money in developing the same technology, we do it collectively, it works back, and we gain our brand identity and differentiation through the vehicles we put it in. I fully would support that because I think without that we might be trading and trying to gain oil--removing our dependency on oil to dependency on foreign technology. So I would totally subscribe to the concept."
"Mr. Wagoner","For my side, in fact in our submission we specifically raised the concept. I would have to put a footnote on that though as far as if the funding is taken out of the request that we have put forward. We would have to tell you how much we actually have in for our own R&D spending just to make sure we balance it out right. But other countries do a lot of their research this way. It is not a coincidence that the leadership in battery technology in the world today is in Korea and Japan. They do things just like you are saying. So I think if we want to move this country to leadership in the next generation technology, this kind of collaboration, plus a heavy amount of government support and basic R&D, is going to be an essential aspect and we would welcome it."
"Mr. Mulally","Sir, I agree. And in a big way we are doing that through our suppliers because, as you well know, about 75 percent of the dollar value of all our automobiles are with the suppliers and they supply to all of us. So we work very closely to make sure that we are targeting the most effective enabling technology so we would bring that on. But that is a great idea also, to take it a step further."
"Mr. Klein","And I would like not just to talk about through the supplier chain; I understand some of that technology is advanced through manufacturers and research that way. I am literally talking about physically taking this research and these very bright people, I am convinced the brightest people in the world, the scientists and the entrepreneurs, are right here in the United States. And if we took this idea and took each of you in your present form and bring this together under one roof, physically under one roof, and put this out and say this is going to be it, this is how we are going to focus all of our attention on this, obviously you have to stay alive, but I think that is something to consider, Mr. Chairman."
"The Chairman","The gentleman from Alabama."
"Mr. Bachus","As you all know, back in 1980, the government got warrants from Chrysler, and then 3 years after that Chrysler became profitable and Chrysler tried to get out of that obligation. President Reagan went ahead and enforced it and insisted that the warrants not be called back. If warrants were given to you or there were some other agreement as to interest rate at a later date, would you attempt to come back to Congress or to Pennsylvania Avenue and try to get out of those agreements?"
"Mr. Wagoner","No, sir."
"Mr. Nardelli","No, sir."
"Mr. Mulally","No."
"Mr. Bachus","The one reason I mention that is of course AIG did just that, they borrowed $85 billion, had an agreement at a certain interest rate, and then 6 months later--or 6 weeks later, actually, they complained that was much too high and it was an onerous agreement. And actually over one weekend they came in, didn't have to come to Congress, didn't have to testify, and they got a lower interest rate and $65 billion more, which sort of brings me to my second question. And either Union representative, Mr. Gettelfinger, or you, Chrysler has filed for a TARP application. You haven't had any word on that, right?"
"Mr. Nardelli","No, sir."
"Mr. Bachus","You know, Citibank and AIG got relief over a weekend without ever coming to Congress; Congress found out about it after the fact. I am sure you all feel a little singled out, and I think Mr. Ackerman mentioned that. And it is a good point, it is just amazing that there seems to be a glaring double standard. Chrysler Financial has had an ILC application for 3\1/2\ years. And during the last year there has been no moratorium. You still haven't heard about that, have you?"
"Mr. Nardelli","No, sir."
"Mr. Bachus","That would help, wouldn't it?"
"Mr. Nardelli","It would help tremendously because it would give us access."
"Mr. Bachus","Toyota, and some of you are calling it Volkswagon, they have had that advantage over you. Ford has had a request since last February. Have you heard?"
"Mr. Mulally","I have not. It is very important. It could really free up the credit for the consumer."
"Mr. Bachus","Yes, it is amazing to me. And let me conclude by saying GMAC has had an application for a bank holding company for some period of time. You have not heard anything, have you?"
"Mr. Wagoner","Our application is under consideration."
"Mr. Bachus","Under consideration. You know, Morgan Stanley and Goldman Sachs, they got expedited status because there was a financial problem or because of the financial issues. I can't imagine why you are not being given expedited consideration. But it does appear that our Federal regulators certainly have two tracks, one for Citi, one for AIG, one for Morgan Stanley and one for Goldman, and a much slower track, almost a dirt road track, that you take. And we have urged them, and I know the chairman--"
"The Chairman","If the gentleman would yield, you mentioned the moratorium. But even during the period of that moratorium, in our new charter for industrial loan corporations, we had made it clear that the auto companies should not be covered by that. So even during the period of the moratorium, we made that clear with regard to GMAC's application, and others. So I am in total agreement with the gentleman."
"Mr. Bachus","This committee and the chairman and I moved legislation with the support of people on both sides saying if Toyota and Volkswagen had that tremendous advantage, then Ford and Chrysler certainly ought to have it. And it is quite discouraging to see $7.7 trillion worth of different credit facilities, TARP funds and all of this, and yet when our motor companies appear before these regulators all they do--they certainly don't do anything. Thank you."
"The Chairman","The gentleman from New Hampshire."
"Mr. Hodes","Thank you, Mr. Chairman. I want to thank the witnesses for appearing today, and thank you for the work you did in putting together your business plans. I think they have gone some way to showing that you are connecting the dots because a couple of weeks ago, at least what I heard from my constituents, was that you folks simply were in another universe and you weren't connecting the dots and that you didn't have the answers that people expected before exposing taxpayer money, again, given what we have just done with the financial system bailout, to loss of taxpayer money. I am not opposed to helping your industries. I think that they are crucial to our economy, the jobs that are connected are upper most in my mind. I have met with representatives of the UAW in New Hampshire, I have met with the auto dealers who, despite the fact that a third of them are going to disappear under the best of circumstances, are supporting helping the auto industries. But I think that, even assuming your business plans worked and we spent $34 billion, what I am hearing here today from my colleagues, and what I have heard from others, including the auto dealers, is that is only one-third of the problem. You can hold yourselves open for business with the money we give you, the $34 billion, and I think that is a short-term fix, it will get you on the road, but not get you down all the way to a long-term transformation. But the issue with the credit availability is a serious, serious issue. That is the second component to the true cost to the taxpayers. And so you have heard from the ranking member and the chairman that there is support for the idea, perhaps, of the transformation of bank holding companies and ILC, and also from other members about accessing the TARP funds. What amount of money do you put on the need of the credit companies, whether it is spent in an asset purchase program or direct injection, or whatever Secretary Paulson comes up with as plan A, B, C or D, what amount of money for the credit companies do you see as necessary? And would they accept conditions that say the money they get has to go for auto loans as opposed to what we did with the bailouts where the banks are sitting on the money? That is question number one. And number two, don't you think we also are going to realistically need incentives for consumers who are worried about losing their jobs, losing their houses, and are frankly concerned about spending $30,000 or $40,000 on a car purchase? And if that is going to be required, what is the dollar amount, what is the plan for that, how do you think it ought to happen, and aren't we really talking about a really much bigger number than $34 billion when those are factored in?"
"Mr. Nardelli","Well, let me, first of all, sir, answer the first part of your question. Chrysler Financial, that is what they do. It is the easiest and the cleanest allocation of funds that you will see. They basically provide about 70 percent of consumer loans and close to a similar amount of floor planning. Our dealers have been tremendously disadvantaged relative to the rates, as we went out and got a new conduit and what they have to pay there. So termination of the lease program took 20 percent of our volume away, and the fact that dealers now cannot floor plan beyond 1 year has imposed additional hardship on them. So the support for our financial institution, the financial arm of our company is important. The short-term request for Chrysler was about $1.6 billion for wholesale, that request is in, and another couple of billion to support retail, so that when consumers come in, they can get competitive rates and they have access to loans. Today, at a 700 to 750 FICA score, at least our consumers, the hardworking men and women of America who buy our products, just aren't qualifying."
"Mr. Hodes","So is Chrysler's answer $4 to $5 billion on the credit side?"
"Mr. Nardelli","That is the current request that is in today."
"Mr. Hodes","And do you think that is sufficient under the current circumstances?"
"Mr. Nardelli","Along with getting ILC that will allow us then to sell paper, to increase the capacity, and we will be able to get that flow going back through Chrysler Financial, supporting our dealers, supporting the consumers."
"Mr. Hodes","GM, Ford."
"Mr. Wagoner","Our situation is a little different. Our finance company, which we only own 49 percent of, is applying for a bank holding company status. And if they achieve that, they would then be eligible over time to access funds that have already been appropriated under the TARP. I can't give you that exact amount now, I can check and try to get back to you. But it is critical."
"The Chairman","Mr. Mulally, if you can go very quickly."
"Mr. Mulally","As you know, we are in a very different situation because we have our own finance company. And the relationship that you are talking about is very important. We support 77 percent of all the wholesale financing. And so what we have in for the short-term, asset-backed commercial paper with the Federal Reserve is $16 billion, and we have accessed $4 billion of that to support the customers."
"The Chairman","The gentleman from California, Mr. Royce."
"Mr. Royce","Thank you, Mr. Chairman. I would like to ask a question of Mr. Wagoner and also Mr. Mulally. And it goes more to the long-term question of Ford and GM because over the last few years, Ford and GM internationally have performed very, very well. And one of the questions I have is what is it about the business environment or the tax structure or the operating costs, as you go down the reasons for the success for Ford and GM in past years and looking forward over the long haul, why they are projected to do well overseas and international competition and why it is a greater burden here. I would like a discussion from each of you in terms of what some of those determinants are."
"Mr. Wagoner","I will be glad to start. When we go into new or newer markets, frankly we don't take some of the burdens of the past that we might have for being in business in the United States for 100 years, so we get to use, you know, all of our accumulated knowledge of the industry. But then as we go into new markets, we go in on an unencumbered basis. Frankly, not so different than some of the transplants who have come to the United States later, they come using the latest knowledge, the latest thinking about dealership structures and things of that sort. So sometimes, ironically, coming a little bit later can be an advantage. So the reason that we have been successful in growth markets is we really use our global capabilities and we build up with the latest best practices, whether it is lean manufacturing or when it is the right product technologies, whether it is the right distribution strategy. So I think that is a plus. And by the way, those overseas businesses, over the last several years, almost uniformly have been quite profitable. And they have, in almost every case, been able to send dividends back to help us address funding issues in the United States. I think the other thing that we have struggled mightily with here in the United States is the fact that we have had huge pension and post-retiree health care obligations. Our report indicates that we have spent about $103 billion over the last 15 years to fund pensions and post-retiree health care obligations. Those were responsibilities that we had from our past, and so we felt it was appropriate to try to fund those. But in all candor, that is a use of cash that in a newer market we wouldn't have to allocate funding for. And obviously if we had the $103 billion and could use it for other things, it would enable us to be even farther ahead on technology or new equipment in our plants, or whatever. So I think that is maybe two of the points that I would cite there. But I do want to highlight that a lot of that is behind us now, thanks to the funding we have put in and the work we have done with Mr. Gettelfinger and his Union. So we do think we have a lot of those issues behind us now in the United States, and so we are looking forward to our next 100 years here with a cleaner slate, if you will."
"Mr. Royce","Let me ask Mr. Mulally the same question."
"Mr. Mulally","You bet. As you all know, Ford has grown up as a global company, very regionally operated though, but because of that we had just an absolute laser focus on the Ford brand. And in the United States over time, especially with our cost structure in the United States and fuel prices being relatively low and low interest rates, we were focusing on the larger vehicles, the SUVs and the trucks. Well, around the world, the majority of our vehicles are much smaller. And we all know how neat they are because the fuel prices are relatively higher. So going forward, especially because of the work we have done with the UAW where we can now make smaller vehicles in the United States profitably, we are leveraging all of those fabulous vehicles from around the world in the United States, so we will have a balanced portfolio now of small, medium and large cars, utilities, and trucks. I think we are going to be able to profitably grow now in the United States using those lessons learned from around the world."
"Mr. Royce","Let me also ask you, the spread here that we have seen on auto loans, and asset-backed securities in general, getting back to the ranking member's question, just how much of a benefit would it be since your competitors, for example--well, Toyota operates under an ILC. If it were possible to achieve the bank holding company position, or the ILC status, how much of a difference would that make in that very large spread right now? Would that diminish those costs in financing significantly if you were on par with your competition?"
"Mr. Wagoner","It would have a huge impact for us because right now we either can't get credit, or the spreads have moved up dramatically. And if we had a bank holding company status and then you would have deposit taking capability, the cost of funds would go down. I can't give you an exact basis point on that, I could look it up and get back to you, but it would be a tremendous advantage."
"The Chairman","The gentlewoman from Wisconsin. Ms. Moore of Wisconsin. Mr. Wagoner, you mentioned in your last response, you talked about the legacy cost, which, as you said, in the last 15 years they have cost you $103 billion and it has constrained investment in more advanced manufacturing product technologies. And you have a very elaborate plan. Wouldn't this have been a great time for GM to say, we need a national health care program in order to stay viable? You correctly identify the problem that other markets--China, Latin America and Russia--where GM doesn't have the burden of those costs. Why did you stop short of saying that this kind of initiative would help our industry?"
"Mr. Wagoner","Well, it undoubtedly would help to level the playing field for the industry. I remember back to when President Clinton first brought forth proposals on health care back in the early to mid-1990's, our chairman and my predecessor, Jack Smith, was a very proactive proponent of it, and we have tried to be very active in the health care debate since here in Washington, but our endorsement per se wouldn't necessarily have resulted in the enactment of a policy. But our competitors do, in most other countries, operate with a significantly greater government role in health care. Ms. Moore of Wisconsin. But it is very much not a part of your plan here. Let me move on to ask a question about the warrants and about the first position of taxpayers. How can taxpayers manage to retain a first position, GM and Chrysler, if, in fact, you plan to honor all of the trade debtors in other countries? Can you just walk through for the committee how you would be able to do that?"
"Mr. Wagoner","We at GM have a fairly significant collateral pool that has not been pledged yet of assets, for example, our ownership position, overseas subsidiaries, and trademarks. And so, as one thing, we could offer that as collateral against any borrowing that we do, and that would be a first lien for the government."
