"Speaker","Speech"
"Senator Bayh","I would like to call the Subcommittee to order and thank our witnesses for being with us today. I am well aware of how busy you are, and so in the midst of all the other things you have to deal with, I am very grateful for your insights. I apologize for being a little bit late. I was waylaid by some well-intended members of the fourth estate who, for some reason, wanted to talk about health care. But the matter that we are here today to discuss is very important. We will be turning to that very shortly, and so I am grateful for your presence. I am pleased to call the Subcommittee to order for our hearing entitled ``The International Cooperation to Modernize Financial Regulation.'' I want to begin by thanking Chairman Dodd of the Banking Committee as a whole and his hard-working staff for their cooperation and assistance in arranging this hearing and for the Chairman's support in looking into these important matters. I would also like to welcome my friend and colleague, Ranking Member Corker--I am grateful for his leadership on these and other matters--and my other colleagues on the Committee who are with us. Some will be with us later in person. Others will be reading the testimony. I want to thank them for their interest in this matter. To our three witnesses, I want to welcome you and thank you for appearing before the Subcommittee to give an outline on the efforts underway to harmonize our collective financial regulations. I understand these few weeks have been very busy for all three of you, with the G-20 summit and upcoming meetings abroad. I appreciate your rearranging your schedules and your overseas travel to be with us here today. Once again, thank you for your consideration. Our panel today consists of our country's leading representatives and experts on international economic and financial affairs, so I look forward to our upcoming dialog. But first I would like to go over why we are here today and why the international element of our financial regulatory overhaul is critical to our global economic recovery. One year ago, our country experienced a financial crisis fueled by home foreclosures and institutional failure. The markets dropped drastically and credit began to freeze as banks refused to lend to families, businesses, and even to one another. It soon became apparent that no one was immune. Our financial crisis quickly became a full-blown economic crisis, complete with a housing decline and our Nation shedding, on average, 700,000 jobs each month. My home State of Indiana was hit particularly hard. It was clear Congress needed to intervene with massive Government assistance to help stabilize our financial markets and prevent complete economic collapse. As I said at the time, it was a ``distasteful but necessary step to protect millions of innocent people.'' Now, 1 year later we are on the path to recovery. It will take some time for our financial system to completely heal, but in the meantime, it is our responsibility and the duty of lawmakers to be willing to take the steps necessary toward long-term reform to make sure this situation does not happen again. The Senate Banking Committee has already held approximately 30 hearings since this January on the issue of financial regulatory modernization. It would be challenging enough to reform our regulatory scheme here in the United States and ignore the efforts internationally. But that would neglect our economic reality. We live in an interconnected global economy, and as we have seen, that means interconnected global problems. Vulnerabilities and gaps in financial markets abroad can impact us here substantially at home. Any reform or rules we enact here at some level should be matched or harmonized abroad to ensure capital does not gravitate to the lowest common denominator. We sometimes refer to that as regulatory arbitrage. Two weeks ago, in a speech before Wall Street, President Obama reaffirmed his commitment to financial regulatory modernization and the need to close the gaps and harmonize our collective rules. He stressed that the United States needs to play a leadership role in lifting our global regulatory standards to ensure there is a global race to the top. This is necessary to, number one, prevent the regulatory arbitrage I just mentioned that puts our entire financial system at risk; and, number two, make sure we remain competitive with other nations. In light of that commitment, we are moving forward with today's hearing to show our support for this critical component of regulatory reform. Today we will hear from our three witnesses on the work that is underway to coordinate our regulatory structures. We have already laid the foundation to begin this process. In an effort to coordinate financial regulatory reforms, world leaders began working together at a series of international meetings to address changes in policy, regulations, oversight, and enforcement. The first was in November of 2008 here in Washington, D.C. At that meeting, the leaders approved an action plan that included instructing their Finance Ministers to make specific recommendations in a number of areas. Some of the most important included: avoiding regulatory policies that exacerbate ups and downs of the business cycle, reviewing incentives for risk taking and innovation reflected in executive compensation practices, and strengthening the regulatory scheme for credit derivatives and reducing their systemic risk. The G-20's next meeting was in April 2009 in London. There the leaders focused on the issues of coordination and oversight of an international financial system with the creation of the Financial Stability Board. The Financial Stability Board is an extension of a previous international organization, the Financial Stability Forum, with an expanded membership to include all G-20 countries, Spain, and the European Commission. Our three witnesses today are the United States' representatives to the Financial Stability Board, and I look forward to hearing their thoughts on this reinvented organization and how effective it will be in enacting change. Leaders of the London Summit also agreed to work on cross- border cooperation, closer regulation of banks, hedge funds, and credit rating agencies, and a crackdown on tax havens--all important issues. Last, the United States asserted our leadership in these international economic issues by hosting the Pittsburgh Summit just last week. I am particularly interested in hearing from our witnesses on what was accomplished at the G-20 Summit in Pittsburgh on the international harmonization aspects of regulatory reform. Specifically, we would like to know the U.S. goals of the summit, if the objectives were accomplished, the roles played by the respective governmental witnesses, and the status of any proposals presented by the Financial Stability Board. The conventional wisdom on international coordination is that at summits countries talk globally but afterwards act only locally. This hearing and the oversight our Subcommittee will conduct on this issue throughout this lengthy process is one way to ensure that the momentum is not lost. However, the work is not completely laid at the feet of the administration and our international standard-setting entities. Congress has some responsibility in this debate as well. The biggest question for Congress is how much our regulatory modernization should be harmonized with international norms and standards and what we should do when there are conflicts on proposals that may not be consistent with U.S. interests or what Congress prefers. These are difficult questions. But I trust that my colleagues here in the Senate and the witnesses sitting before us today are willing to put in the work to make sure that we make the right decisions and get something done. Let me close by reiterating how critical these efforts are to our global economic recovery and future success. Last year, as Congress passed the Emergency Economic Stabilization Act, popularly known as TARP, I said: I am not a cynic, but I am a skeptic about the way Washington can work in times like these. Congress will act in a moment of crisis, but once it is abated, the sense of urgency will dissipate. The forces of reform will not have the energy that they have today. All the interests will circle this place like hungry birds looking for carrion in order to prevent us from taking the steps that are necessary. We must not let that happen. Here we are a year later, and we must remain committed to seeing through long-term reform. We need to bring the same sense of urgency that was so palpable during the crisis. And now before we hear from our witnesses, I would like to turn to my distinguished colleagues, and I would like to acknowledge the presence of our Ranking Member of the entire Banking Committee, my friend Senator Shelby. Senator, thank you for your presence."
"Senator Shelby","Thank you."
"Senator Bayh","And I am not sure what the appropriate protocol is here, gentlemen. Robert, I had intended to turn to you, and it looks as if the Ranking Member agrees with that, so I will turn to my colleague Senator Corker for any opening remarks that he might like to make, although, Bob, I have been informed of something we call the Corker rule, which has to do with your unusual habit for a Senator of being very brief. So I do not know if you intend to invoke the Corker rule today or not, but you are not obligated to."
"OPENING STATEMENT OF SENATOR BOB CORKER",""
"Senator Corker","Listen, Mr. Chairman, I am looking forward to serving with you on this Committee, and I like working with you on numbers of issues. I am not fond of opening statements and not known for them, and I do not plan on changing that today. So thank you for coming as witnesses. We look forward to your testimony, and I do think our distinguished Ranking Member has someone in particular he wants to embellish, but certainly wisdom he wants to share with all of us. So, Mr. Ranking Member."
"OPENING STATEMENT OF SENATOR RICHARD C. SHELBY",""
"Senator Shelby","I believe I will stay with the Corker rule. By osmosis, you know, we are picking it up day by day. But, Mr. Chairman, this is, I think, a very timely hearing and a very needed hearing dealing with international cooperation, dealing with our financial regulation, our accounting system, and everything that goes with it. So I look forward to today's witnesses. Thank you very much."
"Senator Bayh","Thank you, Senator Shelby, very much. It is now my privilege to introduce our witnesses. Why don't I start moving from the panel's right to the panel's left, and I have very lengthy and detailed synopses of your very distinguished careers. I am going to dispense with that and just give your titles, and I will have the entire introductions entered into the record for those who are interested in the entire resume."
"Senator Bayh","First, Mark Sobel. Mark is the Deputy Assistant Secretary for International Monetary and Financial policy in the United States Treasury Department. Mark, thank you for your presence, and we are well aware of how busy things are in the Department these days. And please thank the Secretary for his cooperation in making your presence possible here today. Second, Commissioner Kathleen Casey. Ms. Casey is an SEC Commissioner and the SEC representative to the Financial Stability Board. Kathleen, thank you for your good work at the Commission, and I am grateful for your time here today. Finally, we have the Honorable Daniel Tarullo who has been kind enough to appear before our Subcommittee before. Daniel, it is good to see you once again. He took office as a member of the Board of Governors of the Federal Reserve on January 28, 2009. You have had no lack of things to do since that time as well, Dan, so I am grateful for your insights and your testimony here today. Thank you and, Mark, let us begin with you, Mr. Sobel. You might want to push the microphone--there you go."
"STATEMENT OF MARK SOBEL, ACTING ASSISTANT SECRETARY FOR INTERNATIONAL AFFAIRS, DEPARTMENT OF THE TREASURY",""
"Mr. Sobel","It has been pushed for me. OK. Thank you. Thank you for this opportunity to testify on international efforts to promote regulatory reform, especially following the Pittsburgh Summit. Immediately after the start of the crisis, policymakers and regulators worldwide redoubled efforts to repair financial systems and put in place a stronger regulatory and supervisory framework so that a crisis of the magnitude we have witnessed does not occur again. Good progress is being made, and much was achieved already through the Washington and London G-20 Summits. We strengthened prudential oversight, reached agreement to extend the scope of regulation, strengthened international cooperation, and have taken action to deal with jurisdictions that failed to commit to high-quality standards. A fundamental objective of the Pittsburgh Summit was to build on these accomplishments. Leaders agreed on four priorities: Capital. They agreed to develop rules to improve the quantity and quality of capital and to discourage excessive leverage by end 2010. This agreement tracks closely with Secretary Geithner's principles issued earlier this month. On compensation, leaders endorsed the implementation of standards to help financial institutions and regulators better align compensation with long-term value and risk management. National supervisors will impose corrective measures on firms with unsound practices. On OTC derivatives, they agreed that all standardized OTC derivative contracts should be traded on exchanges or electronic trading platforms and cleared through central counterparties by end 2012. Non-centrally cleared contracts will be subject to higher capital requirements. On cross-border resolution, they agreed to strengthen domestic resolution frameworks and that prudential standards for the largest, most interconnected firms should be commensurate with the costs of their failure. Leaders also called on international accounting bodies to redouble efforts to achieve a single set of high-quality, global accounting standards. Firms are now global in scope, as you noted, Mr. Chairman, and we derive benefits from open, interconnected markets. But the crisis highlighted that financial duress can spread quickly across national boundaries. And while the responsibility for sound regulation begins at home, different national standards open the possibility for regulatory arbitrage, gaps in oversight, and a race to the bottom. International cooperation is essential to avoid these pitfalls. Throughout the crisis, standard setters and other bodies, in addition to the G-20, have helped in this effort. But one body, the Financial Stability Board, has played a critical role in promoting international financial stability. Founded as the Financial Stability Forum in the aftermath of the Asia crisis with strong U.S. support, it brought G-7 officials together with key standard-setting bodies. At the outset of the crisis, the G-7 asked the forum to analyze the causes of the crisis and provide recommendations to increase the resilience of markets and institutions. Those recommendations have been at the center of the international consensus on how to overhaul the world's financial regulatory system. In April, with strong U.S. backing, the Financial Stability Forum was reconstituted as the Financial Stability Board, with an enhanced mandate and membership now encompassing all G-20 countries. The FSB has been a key venue to prepare for G-20 leaders summits. I have provided greater detail in my written testimony on the FSB's purposes and functioning. In the United States, we have set out a proposal for comprehensive regulatory reform, but to promote a global race to the top, we need our G-20 partners to be equally ambitious. The three institutions we represent have worked closely together in preparing for FSB meetings. In addition, U.S. regulatory officials are heavily involved in setting the agenda for international standard setters. This strong cooperation between U.S. and international officials is reflected in the closely aligned agendas pursued by the FSB in the United States and has allowed us to forge more consistent global standards in line with the U.S. agenda. As part of our work to help ensure a cohesive national vision at the international level, U.S. officials also coordinate through the President's Working Group on Financial Markets and at a working level conference calls hosted by Treasury with U.S. regulators to discuss implementation of the G-20 leaders and FSB work. Looking forward, consistent national implementation throughout the G-20 will increasingly be our focus. The FSB will be an important forum to assess progress. Despite our achievements, much more remains to be done. Some of the flaws in the U.S. financial system and regulatory framework that allowed this crisis to occur are still in place. In conclusion, the United States has led the effort to create the FSB, shape its agenda, expand its membership, and involve it closely in the G-20's work. In turn, the Financial Stability Board has been a key instrument for policy development. We can be confident knowing that the machinery to strengthen the international financial system is in place and has set forth principles for reform that are consistent with the administration's own plan. Again, thank you for having me here today."
"Senator Bayh","Thank you, Mr. Sobel."
"STATEMENT OF KATHLEEN L. CASEY, COMMISSIONER, SECURITIES AND EXCHANGE COMMISSION",""
"Ms. Casey","Chairman Bayh, Ranking Member Corker, and members of the Committee, thank you for inviting me to testify about the international cooperation to modernize financial regulation. I am very pleased to have the opportunity to testify on behalf of the Securities and Exchange Commission on this very important topic. International cooperation is critical to the effectiveness of financial regulatory reform efforts. In reaffirming their commitment to strengthening the global financial system, the G-20 Finance Ministers and Bank Governors recently set forth a number of actions to ``maintain momentum make the system more resilient.'' The G-20 banking statement correctly recognizes that, due to the mobility of capital in today's world of interconnected financial markets, activity can easily shift from one market to another. Only collective regulatory action can be effective in fully addressing cross-border activity in our global financial system. As an SEC Commissioner and Chairman of the Technical Committee of the International Organization of Securities Commissions, I bring the perspective of both a national securities market regulator and a member of the international organization charged with developing a global response to the challenges posed to securities markets by the financial crisis. I also represent the SEC and IOSCO in the Financial Stability Board, where the U.S. representation is led by the Department of Treasury, with the Securities and Exchange Commission and the Federal Reserve Board both serving as members. The financial crisis has made it clear that there are regulatory gaps that we must address. The Commission has recently proposed action to this end in a number of different areas, recognizing, however, that some regulatory gaps and market issues cannot be fully addressed without legislative action. The SEC already is working to achieve consistency on the domestic and international levels, including through IOSCO and the FSB, with banking, insurance, futures, and other financial market regulators. The Commission also is working to ensure respect for the integrity of independent accounting and auditing standard-setting processes in the global regulatory environment. This is essential for the benefit and protection of investors. The Commission has worked actively to achieve consistency in regulatory policy and implementation on an international basis through multilateral, regional, and bilateral mechanisms for many years. The SEC was a founding member of IOSCO and has maintained a leading role in the organization. The Commission's commitment to international cooperation has become increasingly important to its mission in recent years in response to the increasingly global nature of financial markets. In addition to my chairmanship of IOSCO's Technical Committee, Commission staff leads or is very active in IOSCO's standing committees and task forces, as well as many other multilateral organizations. While IOSCO represents the primary vehicle for development of common international approaches to securities market regulation, the Financial Stability Board is another key mechanism for the Commission to engage internationally on broader financial market issues. The Financial Stability Board has a broader scope, with membership comprised of national regulatory and supervisory authorities, standard-setting bodies, and international financial institutions, central bankers, and Finance Ministers. Its mission is to address vulnerabilities and to encourage the development of strong regulatory, supervisory, and other policies in the interest of financial stability. In addition to multilateral global engagement, the Commission participates in regional and bilateral mechanisms for discussion and promotion of common approaches to regulation, such as our engagement in a number of Treasury-led regulatory dialogues, including with the European Commission, Japan, China, and India, as well as with Australia and our North American partners, Canada and Mexico. Securities-regulatory-focused dialogues between the Commission and our counterpart securities regulators in these and other jurisdictions also complement these broader financial sector dialogues. Recently, the Commission and a number of other securities regulators have also entered into bilateral ``supervisory'' memoranda of understanding that go well beyond sharing information on enforcement investigations. These supervisory MOUs represent ground-breaking efforts by national securities regulators to work together to cooperate in the oversight of financial firms that increasingly operate across borders. As these efforts suggest, the infrastructure for international cooperation on securities regulatory policy is well developed, and the Commission plays a key role in promoting rising levels of cooperation and building on our successes in raising standards of cross-border enforcement cooperation. Today the SEC has broad authority to share supervisory information as well as to assist foreign securities authorities in their investigations through various tools, including exercising the SEC's compulsory powers to obtain documents and testimony. In order to facilitate international cooperation, the SEC supports legislation providing authority to the Public Company Accounting Oversight Board, which the SEC oversees, to share confidential supervisory information with foreign counterparts. The Commission believes that granting this authority to the PCAOB would enhance auditor oversight, audit quality, and, ultimately, investor protection. In closing, the Commission looks forward to continuing the ongoing constructive dialogue with our colleagues at the Fed, Treasury, and other agencies, in developing common U.S. position on international cooperation in the future. While the Commission's particular focus--and that of IOSCO on investor protection and efficient and fair markets has remained constant and somewhat distinct from that of banking supervisors and regulators of other market segments, our recent collaborative work, both at home and internationally, continues to enhance our ability to identify and address systemic risks across the world's financial markets and will be central to efforts to strengthen the global financial regulatory system. Thank you again for the opportunity to testify, and I look forward to taking your questions."
"Senator Bayh","Thank you, Ms. Casey."
"STATEMENT OF DANIEL K. TARULLO, MEMBER, BOARD OF GOVERNORS OF THE FEDERAL RESERVE SYSTEM",""
