Speaker,Speech,Type,Comments
"Mr. Volcker","That is a legitimate question. Do you want to take the emergency authority away from the Federal Reserve and give it to nobody? I am not quite that radical at this point, given what we have been through. But it is a reasonable question. You are quite right, what I am trying to do is diminish the sense that it is there and available for nonbanks. Now on the international side, if what you say is true, I deal a little bit with it in my long statement I have issued to the committee. And there are some issues where international cooperation will be clearly necessary and, in fact, it has a pretty good history so far and that is in the area of capital requirements. There already is a high degree of uniformity in capital requirements. They are going to have to be reviewed, they are being reviewed nationally, they are being reviewed here and they are being reviewed in the U.K., but there is a body at the BIS, separate from the BIS, but a joint body of regulatory authorities to consider that issue. And they also have now extended their authority, encouraged by heads of state, to consider other matters of banking supervision and regulation where international consistency is important. And there are quite a few of those areas, and they have done quite a lot in trying to regularize practice. It is a big challenge, but it is important. On some of these other things, it is equally important. I think you already have a framework where practically all big banks or big countries with relevant banking systems already have a safety net. That is different in detail but it is a common factor. Now we have to deal with how all of these countries deal with their nonbanks. And I think some consistency there is important. The other really big financial center, as you well know, is London. And these matters are under intense consideration by the regulatory authorities in London. And at the end of the day, I think it is important that there be some consistency between what we do here and what they do in the U.K., just as a start. And I think that is quite possible. It won't be perfect, but that is the way we started actually with capital requirements. We got an agreement between the U.K. and the United States, and then it got extended around the world. So maybe we can duplicate that.",Speech, 
"The Chairman","Now I am going to try again. The gentleman from Delaware.",Speech, 
"Mr. Castle","Thank you, Mr. Chairman. Mr. Volcker, like probably everybody else on this committee, I have a tremendous amount of respect for your comments on the economy and this particular problem of banking in general. I want to thank you for being here. I have some questions concerning the Federal Reserve itself. Let me throw a couple of things out and you can respond to them. As we all know, the Federal Reserve has great responsibilities in the economy today--you know that better than any of us--all the way from monetary policy to interest rates, the emergency powers that you have discussed here today, and consumer protection. The consumer protection may, in accord with whatever we do here in Congress, change and go over to be handled otherwise. But other than that, the remaining powers would be there. You have suggested strongly that it is the best agency. You have suggested in your writing--I am not sure if you spoke it or not--appointing someone else who would have this responsibility confirmed by the Senate, etc., with respect to the systemic risk, etc., and I understand that. But my question is, is the Federal Reserve taking on too much responsibility with respect to the monetary circumstances of this country and its policy, one, and then the second question is should there be or have you recommended someplace-- I haven't seen it--some sort of a council that would meet with whomever the appointment of the Federal Reserve person would be to help guide this? And I am thinking about the other banking regulators who seem to have a great deal of knowledge and input. Would they serve on some sort of group that would advise or would all that be informal, or would they be formally members? I would be interested in your comments about the Federal Reserve's ability to manage this kind of emergency at this point.",Speech, 
"Mr. Volcker","Well, obviously, a very relevant question, is the Federal Reserve proposing or are other people proposing as things exist? Does the Federal Reserve take on too much? I don't think so. These are big responsibilities. But as I see it, there is a close relationship between banking and financial supervision and monetary policy. I don't think monetary policy should be a matter of domain of a few economists sitting in a room deciding on the basis of various theories which are probably controversial, and what interest rates should be precisely where, and so forth. That is part of it. But I think that process ought to be leavened by knowledge and close contact with what is going on in financial markets. Now, we have an example of that recently. The Federal Reserve was counting on monetary policy, but that got thrown off course and the economy got thrown off course completely by what was happening in the financial system outside the realm of monetary policy. Now, I think the regulators should have been on top of that a little better, although they are never going to be perfect. But we want to--I think we need a cross kind of fertilization between monetary policy and supervisory policy, myself. It is an old concern--go back and you read the history of the Federal Reserve. Marriner Eccles in the 1930's, who was then the Chairman, complained bitterly about the fact that the Federal Reserve didn't have enough control over supervisory policy because in the middle of the Depression, he thought those other banking supervisors were being way too tough on banks and inhibiting bank lending. And he thought they were too easy earlier, when the economy was doing well. Now, is the Federal Reserve going to do a better job? I don't know. I don't think they should be the only regulator. But I do think they are the logical ones to have this oversight responsibility. And I also think, as you mentioned, if the Federal Reserve is going to remain in the regulatory supervisory business, I think the Congress should reinforce their responsibility by doing such things as having a particular Vice Chairman of the Board who is responsible for supervisory policy, and he knows that is his statutory function. There is nobody in that position now. The staff is going to have to be strengthened and enlarged and various other measures made. Now, should there be a council? I have no problem with a council, and I think it would be useful, so long as there is somebody who is driving the process and is, in the end, responsible. And the Treasury, as I read it, they don't quite say it this way, but I think what it amounts to, at the end of the day, the way the Treasury would do it is have the Treasury in that position. And I guess the way I would do it is I would have the Federal Reserve in that position, because I think it is a part of a natural central banking function. It is interesting, this is in controversy all over the world, frankly, but in the U.K., which has gotten a lot of attention, supervisory authority was taken away from the Bank of England 10 years ago, more or less. And then when the crisis arose, they were kind of at sixes and sevens as to who was responsible and how the crisis arose; how did the regulatory agency--how was that too insensitive and why didn't the Bank of England know what was going on? And they had trouble coordinating the effort. And the Treasury got involved, too, as it naturally would, but at one point that was considered best practice: Take the regulation out of the Federal Reserve. I don't think that is a strong opinion internationally anymore, after seeing the primary exponent, the U.K.--I can't say it fell on its face, but it didn't do very well when push came to shove, because the locus of responsibility was not clear.",Speech, 
"The Chairman","Mr. Volcker, thank you. There is a lot of interest, so we are going to have to move on. The gentleman from New York, Mr. Meeks.",Speech, 
"Mr. Meeks","Thank you, Mr. Chairman. Good to see you Mr. Volcker. We have been debating something within my office. I am going to make a quick statement and then just ask you if, in fact, you can give me your opinion on it; that we when we consider the issue of ``too-big-to-fail'' and moral hazard, we are basically trying to get firms and their investors to internalize the cost of negative externalities that they may present to the system as a whole. In other words, we want the capital costs and the capital structure and the appetite for the risk to reflect all the costs of the institution, both internally and externally. And I think Larry Summers, when he was speaking before this committee earlier, said that if a firm is too big to resolve in an orderly manner, it is undoubtedly too big to run in a professional manner. In other words, if the senior management of a financial institution cannot present a plan that will convince the public and its regulators that it can disentangle and wind down its operations in an orderly manner, there is no reason to believe that this same management team can run the institution on a daily basis, because they themselves don't fully understand their own company. And for this reason, I believe that a properly structured, comprehensive resolution authority is, in fact, the most critical pillar to managing the moral hazard of the ``too-big- to-fail'' and systemic risk going forward. And the reason for that is different than what has been commonly discussed. It seems to me that the strength of the resolution authority is that it makes debt capital markets work in concert with regulators, and debt presents multiples of equity on financial institutions' balance sheet and debt holders have the power of covenants to manage what they perceive as risk or threats to their privileges as debt holders. With effective, credible resolution authority, bondholders will know that they can no longer rely on the government as an informal insurance policy on their debt. It is this expectation in the past that has allowed firms to become ``too-big-to- fail'' as debt markets and every incentive to provide nearly unlimited financing to the largest institutions, knowing that the larger it got, the more likely it was that the investment would be backed by the government in case of institution failure. So I think that is the crucial area we are looking at, and I would like just to get an idea of what you think in that regard, because I think that is absolutely key as we move forward with reform, with regulation reform in this particular instance. I would love to get your opinion on that.",Speech, 
"Mr. Volcker","I agree with the thrust of what you are saying. That is the burden of my testimony here this morning is that we do need such a resolution authority, for the reasons you described. Some of the approaches that the Administration has surrounded that with, I don't agree with. But the basic idea that you need that kind of authority is, I think, central.",Speech, 
"Mr. Meeks","Do you believe that, as a consequence of capital more accurately reflecting the full risk of investing in an institution, that it will increase with that the institution size and the level of global risk?",Speech, 
"Mr. Volcker","Well, I hope we can get a realization of that; that the institution will be more careful and less risk-prone and less--and the financial system and the economy will be less subject to their failure.",Speech, 
"Mr. Meeks","Thank you. I yield back.",Speech, 
"The Chairman","The gentleman from New York, Mr. Lee, I believe, would be next.",Speech, 
"Mr. Lee","Thank you, Mr. Volcker. It is a pleasure to have been listening to you this morning. I appreciate many of your thoughts. You touched on a lot of areas and I, like you in many cases, feel that you have to be very careful in how much farther we go along with expanding the Federal regulation. I think we need to have the right type of regulation in place with the right type of authority to those--in this case, the Federal Reserve. In many cases, I agreed with what you said. You touched briefly on the issue when you have banking institutions getting in more riskier-type trades. And in your mind, how do you--is there a way to decouple that and ensure we provide solvency to this industry?",Speech, 
"Mr. Volcker","Couple that with--",Speech, 
"Mr. Lee","With the banking institutions right now. How do we decouple where they are getting into riskier trading type activities--do you have a solution on how we would be able to separate these in a logical manner?",Speech, 
"Mr. Volcker","Well, I think some of the activities that I am concerned about are clearly enough defined so you can just, in effect, either put it in law or have clear that the supervisory authority will prohibit it. The tricky area is I think trading, which we discussed a little bit earlier, because there is a kind of legitimate area of trading that a large bank anyway is going to engage in that is, in fact, considerably in the area of customer service. If a customer comes in and wants to sell some securities, they ought to be able to sell through a bank. And if a bank is going to handle that, it is going to have to have some kind of a trading operation, a foreign exchange operation. But I think there is a--the borderline is fuzzy, but there is a clear distinction between customer-related trading activity and pure proprietary trading, which some of the big institutions label it that way. They have a proprietary trading desk, separately operated, sitting someplace else, as in the case of--",Speech, 
"The Chairman","Mr. Volcker, could you speak into the microphone? You have to sacrifice politeness for audibility. So we need you to speak directly into the microphone. It is less important to be polite than to be audible, so don't look at who you are talking to.",Speech, 
"Mr. Volcker","AIG is a good example of what I am worried about. It is not a bank, but it should be regulated, I think, naturally. But they had this trading operation, a little trading operation that made a lot of money for a while, and it got out of hand, mostly credit default swaps. Nobody was much looking at it. No regulator was looking at it. It is an activity that if, better informed now, if a supervisor was looking at it and AIG was supervised--and they should be supervised--somebody should have raised a question. That is an activity that had nothing to do with your insurance business directly, or out there on a trading operation to make a lot of money, and similarly to profit-making but not to the insurance business. Stop it. I mean, that was a clear enough case that you--",Speech, 
"Mr. Lee","I am just bringing up AIG. With the knowledge that you have now, in retrospect, going back a year ago, how would you have handled this situation with AIG?",Speech, 
"Mr. Volcker","It is a complicated situation. They had to make a very quick decision about an area that nobody could understand the full implications of. The regulators I am sure were not on top of this operation in London or Connecticut, or wherever it was being operated. And everybody got in over their heads, and they did what was necessary in a very disturbed situation to provide money. And it has become now, as you know, $150 billion, $180 billion, whatever it is; it is, you know, outrageous. But I understand how they got there. That is what we want to avoid. And I might say, while it is not on the agenda today, and the Treasury didn't put it on the agenda, I would hope this committee would look at the question of national charters for insurance companies and bring them under--at least the big ones--under a framework so that something like AIG with similar problems can't arise in the future. I think a lot of the big insurance companies would welcome a national charter and the consistency that would provide, because--I don't want to commit them into the safety net, but I do think that they ought to be regulated in a consistent way.",Speech, 
"Mr. Lee","Thank you.",Speech, 
"The Chairman","Thank you, Mr. Volcker. Let me just say, for your information, the question of an optional Federal charter for the insurance, particularly life insurance, is on the committee's agenda for probably next year. It just would be more weight than I think this issue could carry. There will be a proposal made by some for a national insurance office to do some monitoring. But the question of an optional charter is a very important one. It is a request we get from the international community. There is a lot of resistance to it at the State Insurance Commission level here. But I did want to assure you--",Speech, 
"Mr. Volcker","I know there is something short of a charter. I hope you would go further than what has been proposed.",Speech, 
"The Chairman","Well, right now--that, right now, is much short of a charter. For next year, on this committee's agenda next year, will be the question of a charter, of an optional charter. The gentlewoman from Illinois, for instance, has been very much interested in that, along with the gentleman from California, Mr. Royce. And I have assured them they will get a full hearing. But it just, with the agenda this year, complicated by needing to deal with the issues from last year--but it is on the agenda.",Speech, 
"Mr. Volcker","I am unaware of any other AIGs out there, so maybe you are all right at the moment.",Speech, 
"The Chairman","Well, of course, AIG's regulator was the fearsome Office of Thrift Supervision, and we will be addressing that issue. The gentleman from Kansas. Mr. Moore of Kansas. Thank you, Mr. Chairman. And, Chairman Frank, I ask unanimous consent that the resolution authority proposal by Tom Hoenig, president of the Federal Reserve Bank of Kansas City, and his colleagues, as well as two of his recent speeches, be entered into the record.",Speech, 
"The Chairman","Without objection, it is so ordered. And, without objection, there will be general leave for any of the members or the witnesses to introduce into the record any material they would wish to insert. Mr. Moore of Kansas. Thank you, Mr. Chairman. Chairman Volcker, how do we end ``too-big-to-fail?'' I don't know if you have seen the recent proposal offered by Kansas City Fed President Hoenig and his colleagues. Their proposal on resolution authority lays out more explicit rules than the Administration's proposal of how a large financial institution Like Lehman Brothers or AIG could be resolved so the debt holders, shareholders, and management would be held accountable before taxpayers are asked to step in. If you haven't seen the Kansas City Fed proposal, I would like to provide to you a copy and I would appreciate your written comments, if you would please. Others suggest that we require the largest financial firms to undergo a regular stress test that would have aggregate information publicly released, even in good times. I know some have argued the list of these firms should remain confidential. But doesn't the market already know who these firms are, based on the last round of stress tests? How do you propose we create the right incentives for firms to maintain reasonable leverage ratios and strongly discourage ``too-big-to-fail?''",Speech, 
"Mr. Volcker","Well, I might say I become aware yesterday that a Kansas City bank had made such a proposal, but I haven't read it so I can't comment on it in detail. Mr. Moore of Kansas. I will forward this to you, sir.",Speech, 
"Mr. Volcker","I am sure these are all directed toward the same problem that we have been discussing; in fact, all these questions this morning. How do you reduce the moral hazard problem? How do you-- Mr. Moore of Kansas. Sir, excuse me. Could you pull the microphone just a little closer? I am having a little difficulty hearing you.",Speech, 
"Mr. Volcker","I said, we have discussed in a number of these questions, and my opening statement, how we deal with this moral hazard problem. And in all these cases, I think, I believe in the Kansas City proposal, this idea of a resolution authority looms very large. Just how you do that, you are going to find not the easiest drafting problem in the world, because it raises a lot of technical issues and legal issues, even constitutional issues, which have to be carefully thought through. But I do think it is possible. There is clear precedent or clear analogous arrangements for the banking world. And so what needs to be done is extending that to the nonbanking world, without the implicit promise--and of course this is key--without the implicit assumption that Federal money will be provided in the case of the failing institution. Mr. Moore of Kansas. Chairman Volcker, as we consider monitoring for systemic risks, it seems to me that it would be helpful to ensure our inspectors general, the various financial agencies be also asked to help identify weaknesses in the regulatory structure and propose solutions. Would you support formally connecting these IGs to create a financial watchdog council, where they would meet on a quarterly basis and be required to provide Congress an annual high-risk assessment report on the greatest risks and gaps in our financial regulatory system that need to be addressed? Would you support a proposal like that, sir?",Speech, 
"Mr. Volcker","I think I would have to look at that before I have any comment. When I respond on the Kansas City thing, I will respond on that point. Mr. Moore of Kansas. Thank you, sir, very, very much. I yield back, Mr. Chairman.",Speech, 
"The Chairman","The gentlewoman from West Virginia, Mrs. Capito.",Speech, 
"Mrs. Capito","Thank you, Mr. Chairman. I think I am out of sync here. Sorry.",Speech, 
"The Chairman","Yes. Well, I take--",Speech, 
"Mrs. Capito","Well, I am in sync.",Speech, 
"The Chairman","Well, on this issue I take instructions from the Minority, so Mr. Lance is next.",Speech, 
"Mrs. Capito","Thank you, sir.",Speech, 
"Mr. Lance","Thank you very much, Mr. Chairman. Good morning to you, Mr. Volcker. Regarding the whole issue of ``too-big-to-fail''--and this is obviously of great concern to all of us--and regarding the issue of moral hazard, yesterday the Secretary of the Treasury indicated that in identifying tier one candidates, there would not be a list but the market would know who they were, based upon the criteria. Is there any real way to resolve this situation? It seems to me that Wall Street will know who they are and that there will inevitably be moral risk, more hazard, as a result of the identification of tier one entities.",Speech, 
"Mr. Volcker","I don't think--Put it positive. I think it is extremely difficult to designate in advance who is systemically important and who isn't, because you may even find some fairly small institutions, not mega-institutions anyway, that are playing a particular role in the market at a particular time and have had a lot of interconnections with other institutions that create a big problem. They create a clog in the resolution of credit default swaps or something. Arranging all this in advance, I don't know whether the Treasury would intend to announce it or not announce it or set out criteria or what.",Speech, 
"Mr. Lance","Not as I understand it, sir. There would not be an announcement as to which entities actually are on the list, and the list would not be public; but that based upon the criteria, that Wall Street could figure out who they are.",Speech, 
"Mr. Volcker","Yes, well, I would think that is true. Wall Street would figure it out, so you would have to probably announce it in the end. And then you have the problem, is a particular institution in, or is a particular institution out? And I think we will find in calm circumstances, the institutions that are in would hate it, because they would have particularly tough capital requirements and feel uncompetitive. But as soon as a problem arose, the institutions who were out would complain that we are vulnerable and they are not.",Speech, 
"Mr. Lance","Yes. I perceive a situation where, at one stage in the economic cycle, people would lobby not to be in it, and then later they would lobby to be in it.",Speech, 
"Mr. Volcker","I think it is not the happiest thing in the world, but I think you properly have to leave some ambiguity in this situation.",Speech, 
"Mr. Lance","Thank you, sir. This is a continuing issue on this committee, on both sides of the aisle, and it is not easily resolved. And I appreciate your thoughts on that. I yield back the balance of my time. Thank you.",Speech, 
