Speaker,Speech,Type,Comments
"Mr. Miron","Thank you, Mr. Chairman, Ranking Member Neugebauer, and committee members. Let me begin by expressing my thanks for the opportunity to present my views on this matter. The question I will address is whether Congress should adopt Title XII of the proposed Resolution Authority for Large Interconnected Financial Companies Act of 2009. This Act would grant the FDIC powers for resolving insolvent financial institutions similar to those that it currently possesses for revolving banks. My answer to this question is an emphatic, unequivocal ``no.'' Let me explain. The problem that resolution systems attempts to address is that when our financial system fails, the value of the claims on that institution's assets exceed the value of the assets themselves. Thus, someone must decide who gets what, and it is impossible, by virtue of the assumption that we are dealing with a failed institution, to make everyone whole. The size of the pie owned by the failing institution has shrunk so those who are expecting a slice of that pie collectively face the necessity of going somewhat or substantially hungry. The resolution authority decides who gets what, but the reality is that someone has to go wanting. It is in society's broad interest to have clear, simple, and enforceable procedures for resolving failed institutions, principally to ensure that investors are willing to commit their funds in the first place. If the rules about resolution were arbitrary and ever-changing, investors would be loathe to invest and economic investment productivity and growth would suffer. A well-functioning resolution process is part of a system for defining and enforcing property rights, which economists agree is essential to a smoothly functioning capital system. The crucial thing to remember here is that someone has to lose. Just as importantly, it is valuable to society as a whole, although not to the directly-harmed parties, that those invested in the failed institutions suffer economic losses. This releases resources to better uses, provides signals about good and bad investments and rewards those who have made smart decisions. The flip side of the fact that standard resolution systems, like bankruptcy, impose an institution's losses on that institution's stakeholders, is the fact that a standard of resolution authority, such as the courts, puts none of its own resources into that institution. The resolution authority is resolving claims and dividing the pie but is not adding any more pie. Under the bill being considered, however, the FDIC would have the power to make loans to the financial institutions to purchase its debt obligations and other assets, to assume or guarantee obligations and so on. This means the FDIC would be putting its own, that is, taxpayers' skin in the game, a radical departure from standard bankruptcy and an approach that mimics closely the actions that Treasury took under TARP. Thus, this bill institutionalizes TARP for bank holding companies. A crucial implication of this departure from standard bankruptcy is the taxpayer funds foot the bill for the loans, asset purchases, guarantees, and other support that FDIC would provide to prevent failing institutions from going under. These infusions of taxpayer funds come with little meaningful accountability, and it would be hard to know when they have been paid back and often that will not occur. The proposed new authority for the FDIC also generates the impression that society can avoid the losses that failure implies, but that is false. The proposed FDIC actions would merely shift those losses to taxpayers. The new approach is institutionalized bailouts, plain and simple. Thus, under the expansion of FDIC authority to cover nonbank financial institutions, bank holding companies will forever more regard themselves as explicitly, not just implicitly, backstopped by the full faith and credit of the U.S. Treasury. That is moral hazard in the extreme and it will be disastrous for keeping the lid on inappropriate risk taking. The right alternative to expanding FDIC authority is good old-fashioned bankruptcy. It has become accepted wisdom that bankruptcies by financial institutions cause great harm, and it is asserted in particular that letting Lehman Brothers fail was the crucial misstep last fall. In fact, nothing could be further from the truth. As I explain in more detail in my written testimony, the ultimate causes of the financial crisis were two misguided Federal policies; namely, the enormous subsidies and pressure provided for mortgage lending to non-creditworthy borrowers and the implicit guarantees provided by both Federal Reserve actions and the U.S. history of protecting financial institution creditors. These forces generated an enormous misallocation of investment capital, away from plant and equipment towards housing, created the bubble, and established a setting where numerous financial institutions had to fail because their assets were grossly overvalued relative to fundamentals. Lehman's failure was one part of this adjustment, and it was a necessary part. If anything, too few financial institutions failed since the massive interventions in credit housing markets that have occurred in the past year have artificially propped up housing prices, delaying the adjustments. Thus, the better way to resolve nonbank financial institutions is bankruptcy, not bailout. That is not to say existing bankruptcy law is perfect. One can imagine ways it might be faster and more transparent, which would be beneficial, nor should one assume that had bankruptcy been allowed to operate fully in the fall of 2008, the economy would have escaped without any pain. A significant economic downturn, in particular, was both inevitable and necessary given the fundamental misallocation of capital that occurred in the years before the panic, but nothing in the data, historical data or recent experience, suggests these bankruptcies would have caused anything worse than what we experienced and broader bankruptcies would have helped eliminate more hazards going forward. In light of these assessments, I urge the members of this committee to vote against this bill since it codifies an approach to the resolution that is fundamentally misguided. We need to learn from our mistakes and trust bankruptcies, not bailouts, going forward as we should have done in the recent past.",Statement,STATEMENT OF JEFFREY A. MIRON, SENIOR LECTURER AND DIRECTOR OF UNDERGRADUATE STUDIES, DEPARTMENT OF ECONOMICS, HARVARD UNIVERSITY 
"Mr. Cleaver","Our next witness is Mr. Mark Zandi, the chief economist and co-founder of Moody's Economy.com.",Speech, 
"Mr. Zandi","Thank you to the members of the committee for the opportunity to testify today. My remarks are my personal views and not those of the Moody's Corporation, my employer. The Obama Administration's proposed financial regulatory reforms will, if largely enacted, result in a more stable and well-functioning financial system. I will list five of the most important elements of the reform, and I will make a few suggestions on how to make them more effective. First, reform must establish a more orderly resolution process for large, systemically important financial firms. Regulators' uncertainty and delay in addressing the problems at Lehman Brothers and AIG, in my view, contributed significantly to the panic that hit the financial system last September. Financial institutions need a single, well-articulated, and transparent resolution mechanism outside the bankruptcy process. The new resolution mechanism should preserve the system of stability while encouraging market discipline by imposing losses on shareholders and other creditors and replacing senior management. Charging the FDIC with this responsibility is appropriate given the efficient job it does handling failed depository institutions. I think it would also be important to require that financial firms maintain an acceptable resolution plan to guide regulators in the event of their failure. As part of this plan, institutions should be required to conduct annual stress tests based on different economic scenarios similar to the tests that large banks engaged in this last spring. Such an exercise, I think, would be very therapeutic and would reveal how well institutions have prepared themselves for a badly-performing economy. Second, reform must address the ``too-big-to-fail'' problem, which has become even bigger in the financial crisis. The desire to break up large institutions is understandable, but I don't think there is any going back to the era of Glass- Steagall. Taxpayers are providing a substantial benefit to the shareholders and creditors of institutions considered ``too- big-to-fail,'' and these institutions should meet higher standards for safety and soundness. As financial firms grow larger, they should be subject to greater disclosure requirements, required to hold more capital, satisfy stiffer liquidity standards, and pay deposit and other insurance premiums commensurate with their size and the risks they pose. Capital buffers and insurance premiums should increase in the good times and decline in the bad times. Third, reform should make financial markets more transparent. Opaque structured-finance markets facilitated the origination of trillions of dollars in badly underwritten loans which ignited the panic when those loans and the securities they supported started to go bad. The key to better functioning financial markets is increased transparency. Requiring over-the-counter derivative trading takes place on central clearing platforms make sense; so does requiring that issuers of structured financed securities provide markets with the information necessary to evaluate the creditworthiness of the loans underlying the securities. Issuers of corporate equity and debt must provide extensive information to investors, but this is not the case for mortgage and asset-backed securities. Having an independent party also vet the data to ensure its accuracy and timeliness would also go a long way to ensure better lending and reestablishing confidence in these markets. Fourth, reform should establish the Federal Reserve as a systemic risk regulator. The Fed is uniquely suited for this task given its position in the global financial system, its significant financial and intellectual resources, and its history of political independence. The principal worry in making the Fed the systemic risk regulator is that its conduct of monetary policy may come under onerous oversight. Arguably one of the most important strengths of the financial system is the Fed's independence in setting monetary policy. It would be very counterproductive if regulatory reform were to diminish even the appearance of that independence. To this end it would be helpful if oversight of the Fed's regulatory functions were separated from the oversight of its monetary policy responsibilities. One suggestion would be to establish semi-annual reporting to the Congress on its regulatory activities much like its current reporting to Congress on monetary policy. Fifth, and finally, reform should establish a new Consumer Financial Protection Agency to protect consumers of financial products. The CFPA should have rulemaking, supervision, and enforcement authority. As is clear from the recent financial crisis, households have limited understanding of their obligations as borrowers or the risks they take as investors. It is also clear that the current fractured regulatory framework overseeing consumer financial protection is wholly inadequate. Much of the most egregious mortgage lending during the housing bubble earlier in the decade was done by financial firms whose corporate structures were designed specifically to fall between the regulatory cracks. There is no way to end the regulatory arbitrage in the regulatory framework. The framework itself must be fundamentally changed. The idea of a new agency has come under substantial criticism from financial institutions that fear it will stifle their ability to create new products and raise the cost of existing ones. This is not an unreasonable concern but it can be adequately addressed. The suggestion that the CFPA should require institutions to offer so-called plain vanilla financial products to households should be dropped. Such a requirement would create substantial disincentives for institutions to add useful features in existing products. Finally, let me just say I think the Administration's proposed regulatory reform is much-needed and reasonably well- designed. Reform will provide a framework that would not have prevented the last crisis, but it would have made it measurably less severe and it certainly will reduce the odds and severity of future calamities.",Statement,MARK ZANDI, CHIEF ECONOMIST AND CO-FOUNDER, MOODY'S ECONOMY.COM 
"Mr. Cleaver","Our final witness is John H. Cochrane, AQR capital management professor of finance at the University of Chicago Booth School of business.",Speech, 
"Mr. Cochrane","Thank you for giving me the opportunity to talk to you today. This wasn't an isolated event. We are in a cycle of ever- larger risk taking punctuated by ever-larger failures and ever- larger bailouts, and this cycle can't go on. We can't afford it. This crisis strained our government's borrowing ability, there remains the worry of flight from the dollar and government default through inflation. The next and larger crisis will lead to that calamity. Moreover, the bailout cycle is making the financial system much more fragile. Financial market participants expect what they have seen and what they have been told, that no large institution will be allowed to fail. They are reacting predictably. Banks are becoming bigger, more global, more integrated, more systemic, and more opaque. They want regulators to fear bankruptcy as much as possible. We need the exact opposite. We and Wall Street need to reconstruct the financial system so as much of it as possible can fail without government help, with pain to the interested parties but not to the system. There are two competing visions of policy to get to this goal. In the first, large integrated instructions will be allowed to continue and to grow with the implicit or explicit guarantee of government help in the event of trouble, But with the hope that more aggressive supervision will contain the obvious incentive to take more risks. In the second, we think carefully about the minimal set of activities that can't be allowed to fail and must be guaranteed. Then we commit not to bail out the rest. Private parties have to prepare for their failure. We name, we diagnose, and we fix whatever problems with bankruptcy law caused systemic fears. Clearly, I think the second approach is much more likely to work. The financial and legal engineering used to avoid regulation and capital controls last time were child's play. ``Too-big-to-fail'' must become ``too-big-to-exist.'' A resolution authority offers some advantages in this effort. It allows the government to impose some of the economic effects of failure, shareholders and debt holders lose money, without legal bankruptcy. But alas, nothing comes without a price. Regulators fear--their main systemic fear is often exactly the counterparties will lose money, so it is not obvious they will use this most important provision and instead bail out the counterparties. I think the FDIC, as often mentioned, is a useful model. It is useful for its limitations as well as for its rights. These constrain moral hazard and keep it from becoming a huge piggybank for Wall Street losses. The FDIC applies only to banks. Resolution authority must come with a similar statement of who is and who is not subject to its authority. Deposit insurance and FDIC resolution come with a serious restriction of activities. An FDIC-insured bank can't run a hedge fund. Protection, resolution, and government resources must similarly be limited to systemic activities and the minimum that has to accompany them. Deposit insurance in FDIC resolution address a clearly defined systemic problem, bank runs. A resolution authority must also be aimed at a specific defined and understood systemic problem, and the FDIC can only interfere with clear triggers. The Administration's proposal needs improvement, especially in the last two items. It only requires that the Secretary and the President announce their fear of serious adverse effects. That is an invitation to panic, frantic lobbying, and gamesmanship to make one's failure as costly as possible. It is useful to step back and ask, what problem is it we are trying to fix anyway? Regulators say they fear the systemic effects of bankruptcy. But what are these? If you ask exactly what is wrong with bankruptcy, you find fixable, technical problems. The runs on Lehman and Bear Stearns brokerages, collateral stuck in foreign bankruptcy courts, even the run on money market funds, these can all be fixed with changes to legal and accounting rules. And resolution doesn't avoid these questions. Somebody has to decide who gets what. If Citi is too complex for us to figure that out now, how is the poor Secretary of the Treasury going to figure it out at 2 o'clock in the morning on a Sunday night? The most pervasive argument for systemic effective bankruptcy, I think, is not technical; it is psychological. Markets expected the government to bail everybody out. Lehman's failure made them reconsider whether the government was going to bail out Citigroup. But the right answer to that problem is to limit and clearly define the presumption that everyone will be bailed out--not to expand it and leave it vague. Here I have to disagree with Mr. Volcker's testimony. He said we should always leave people guessing, but that means people will always be guessing what the government is going to do, leading to panic when it does something else. And let me applaud Chairman Frank's statement earlier that no one will believe us until we let one happen. I look forward to, not necessarily to that day, but to the clearer statement--clearer understanding by markets and the government of what the rules are going to be the day afterwards.",Statement,STATEMENT OF JOHN H. COCHRANE, AQR CAPITAL MANAGEMENT PROFESSOR OF FINANCE, THE UNIVERSITY OF CHICAGO BOOTH SCHOOL OF BUSINESS 
"Mr. Cleaver","We are going to begin the conversation with the gentleman from Texas, Mr. Neugebauer, who has an appointment that he needs to keep and so we will begin with him, and then we will move to the other side.",Speech, 
"Mr. Neugebauer","",Speech, 
"Mr. Neugebauer","I thank the gentleman for accommodating me. One of the things that I hope that we all agree on, and I think I hear, is that there are no more bailouts. That is bad for market discipline, that companies that make bad decisions have to suffer the consequences of that. And one of the elements of the Republican alternative is that we believe there are ways to do that. One is making sure that entities are adequately capitalized. But secondly, not having someone choose which companies are systemically risky to the marketplace and thereby giving them a free pass on their market activities. But I want to go to the resolution issue because I think it is probably as equally important in restoring market discipline. One of the things that I am very concerned about in the current bill is that it is a wheel of fortune, as I call it, when you get to the bankruptcy or to the dissolution of that entity. Because if someone is arbitrarily going to just choose which people get made whole and which aren't and which people get a certain percentage and not follow some orderly discharge of those obligations, how am I going to estimate what my risk is when I am either buying equity or I am buying security or buying debt or I am buying subordinated debt or taking an unsecured position or secured position if somebody else is going to determine what my position is? So the Republican plan quite honestly has designed about, as I think Mr. Cochrane was talking about, is that if there are--we actually set up a special chapter in the Bankruptcy Code, and if there are special powers or additional expertise that are needed to make that discharge, but that way everybody that is making an investment in an organization knows that if this investment does go south, they understand what their position is and not relying on the wheel of fortune in some cases where if the wheel turns in my direction, I went from an unsecured to a more preferential position. Your comments, Mr. Cochrane? I will start with you and kind of just go down the line there.",Speech, 
"Mr. Cochrane","Yes. I would agree with you. One thing that worries me about great power and no rules is precisely that means not only is it a wheel of fortune, it is a wheel of fortune that answers your phone calls. So there will be a lot of lobbying. It also means that the game of buying debt becomes not one of guessing what is the value of the assets, it is one of guessing what am I going to get out of the new resolution authority. And finally, we are acting as if it is simple. The whole reason we are worried about this is that the web of counterparties which are systemic, which aren't systemic, who should get money, who not, too complicated to think about. Well, goodness gracious, it is going to be even more complicated to think about it at 2 o'clock on a Sunday morning.",Speech, 
"Mr. Zandi","I agree with many of the things that you said. The one thing I worry about and am concerned about is putting these institutions into bankruptcy. That has its own set of uncertainties as any firm going into bankruptcy and creditors know. And the problem is that the uncertainty can drag on for quite some time, because of the nature of these financial institutions. We don't have the time. So I think we need a resolution mechanism that is independent of the bankruptcy system. I don't think the system can be fixed to a sufficient degree to address those issues, and to take our chances in using bankruptcy, of course, for this process would in fact create greater uncertainty and cost taxpayers more in the long run.",Speech, 
"Mr. Neugebauer","As a follow-up to what you are saying, I think what we envision is a separate actually--possibly judicially, have special courts to do that, to have the expertise to make those decisions relatively quickly so that if there is a continuation possibility in that entity that there is the ability for someone to make those decisions at that particular point in time. It is not much different than the resolution concept except that we are going to have an orderly disposition in the event of a liquidation and settling that everybody understands. Mr. Miron?",Speech, 
"Mr. Miron","I would emphasize two aspects of your comments. One is I personally think there should be no more bailouts. Whatever the resolution system is, whether it is a bankruptcy court, a new kind of bankruptcy that no taxpayer money goes into it. Then the second point is, can we design a bankruptcy system, even for nonfinancial firms, that is smoother and faster than the current one. The answer is probably, but certainly it might be appealing to try to design something which is very fast and very smooth, say a default off the shelf and last will and testament that you have to create when you are incorporated. But I also think finally that the risks of the financial firm bankruptcies have been exaggerated. I don't say they were zero by any means, but I think there was a lot of claiming that the sky was going to fall in, which was not based on evidence in the historical records. Particularly before 1914, we had many, many financial panics. The vast majority were not associated with major changes in the economy. They were short. They were limited to a few firms and a few cities and the economy recovered very quickly.",Speech, 
"Mr. Levitt","You know, it is so hard to be formulaic about these issues and to try to define what is in the public mind and what isn't. When you are going through a panic, and we went through a panic, it is scary, very, very frightening. And I wouldn't take the position that there will be no more bailouts. We don't know what there is going to be or how great the threat is going to be. But if the resolution authority is so established where the onus is put on both creditors and shareholders they will be, in my judgment, in a much better position to evaluate the condition of given institutions than any regulator might be. I think holding their feet to the fire in that fashion will go a long way toward avoiding the kind of calamity that you speak of. As to the need for a systemic risk overseer in terms of a council that would serve as an early warning system, I think that makes a good deal of sense. It would be a hands-on group that would be led by a presidential employee. As an alternative, if the Fed were to get rid of its conflicts--and I think they have very profound conflicts which make them a less than ideal systemic risk regulator--I think the combination of these two could do a great deal to restore public confidence. If the public loses total confidence in the system, all of our pronouncements about ``too-big-to-fail'' and we can't afford the bailout, or what have you, go up in smoke. It is a power that should not be underestimated.",Speech, 
"Mr. Cleaver","Thank you. We are going to have votes in maybe 15 or 20 minutes. I do think we can get all members in if the members will use the Reader's Digest version of your questions and if you will give the Cliff Notes version of the answer, I think we can get through all of these. We will begin with the gentlelady from Illinois, Ms. Bean.",Speech, 
