"Speaker","Speech"
"Chairman Spratt","The committee will come to order. We meet today to hear the distinguished Chairman of the Federal Reserve, Benjamin Bernanke, testify on the recession that is plaguing our economy and on the prospects of recovery. Chairman Bernanke testified before our committee on October 20 of last year as we searched for ways to mitigate, if not avoid, a long recession. The Chairman acknowledged then that monetary policy has its limits. Without being specific, he welcomed a fiscal complement. Congress had just passed a bipartisan bill authorizing $700 billion to dispose of troubled assets, so-called TARP. Backed by these funds, the Treasury, the Fed, and the FDIC have made extraordinary advances to banks and other financial institutions, recognizing what Chairman Bernanke told the Joint Economic Committee last month, that, quote, ``A sustained recovery in economic activity depends critically on restoring stability to the financial system.'' This is one question we hope you will address today, Mr. Chairman: Just how strong and how stable are our financial institutions? By February of this year, it was clear that TARP relief was a necessary but not sufficient solution. So Congress passed, on a partisan basis, an even bigger boost, the American Recovery and Reinvestment Act, which packed $787 billion of fiscal stimuli in the form of spending increases and tax decreases. We would like to know, Mr. Chairman, whether from the Fed's viewpoint this huge countercyclical thrust is working. Bold action was necessary to head off a collapse of the financial system, but the steps taken also swell the Nation's deficit and the national debt. It is all but impossible to balance the budget when the economy is bucking a headwind like this recession, because what we do to make the economy better is likely to make the deficit worse. Yet, at the same time, we cannot add infinitely to the national debt without facing consequences in global credit markets or on our future capacity to borrow. One purpose of this hearing is to explore both the advantages, and the potential downside risk of our bold and unprecedented response to financial turmoil. Should we be concerned that some of our swelling debt must be financed with foreign credit? We hope that most of our outlays are for nonrecurring needs and that much of what has been advanced in recent months will in time be recovered, repaid, and used to pay down the debt that we are incurring. We would like to have your assessment, Mr. Chairman, of that possibility. Despite bold, unprecedented action, the Director of the Congressional Budget Office told this committee on May 21st that our economy is still running at 7 percent or more below its capacity, or a trillion dollars per year below its potential. Recently there have been signs, however, of a turnaround. Business inventories are down; the stock market is up a bit; and so, too, to some extent, is the housing market. Our question to you, Mr. Chairman, is whether these are glimmers of hope or flashes in the pan. To keep this recession from growing worse, the Fed has pumped enormous liquidity into the money markets, so much so that some critics even worry of inflation, lurking, to be sure, just over the horizon, but a threat nevertheless. The spread between short- and long-term Treasuries has widened to more than 2.5 percentage points. We would like to know, Mr. Chairman, if these are salutary signs of a recovery or ominous signs of inflation. A month ago, Chairman Bernanke told the JEC that, quote, ``We expect economic activity to bottom out and turn up later this year.'' But he went on to warn, ``Even after the recovery gets under way, the rate of real economic growth is likely to remain below potential for a while, only gradually gaining momentum.'' The old locomotives that pulled the economy out of the rut in the past--real estate, consumer durables--are unavailing now. This causes us to ask, Mr. Chairman, what will empower a turnaround in this dismal economy, and when can we expect to return to normality? Mr. Chairman, as you can see, we have a lot of grist for our mill today. We thank you for being here, but, most of all, we thank you for your service to our Nation at this very crucial time. Before proceeding to your statement, let me turn to Mr. Ryan for his opening remarks."
"Mr. Ryan?",""
"Mr. Ryan","Thank you, Chairman Spratt, for arranging this important hearing. Chairman Bernanke, you come before this committee with the financial markets in a better position than in your previous appearance last fall. The economy is finally showing some signs of stabilizing, and that is encouraging. But despite these short-term glimmers of hope, I have become more concerned about the longer-term implications of our economic policies. On the fiscal side, the Treasury is issuing record amounts of debt, over $2 trillion this year alone, to support record government spending and record deficits. Meanwhile, the Federal Reserve has injected an enormous amount of monetary stimulus into the economy and has even started purchasing longer-term Treasury bonds in an attempt to lower borrowing costs and further ease financial conditions. This can be a dangerous policy mix. The Treasury is issuing debt, and the Central Bank is buying it. It gives the alarming impression that the U.S. one day might begin to meet its financial obligations by simply printing money. And we all know what happens to a country that chooses to monetize its debt. It gets runaway inflation and a gradual erosion of workers' paychecks and family savings. There is an increased discussion in the financial press about the potential negative consequences of our economic policies. Just this week, the yield on the 10-year Treasury bond rose to a 6-month high, over 3 percent--3.7 percent--a sign that global investors are becoming concerned about debt levels and the possibility of future inflation. This is the bond market telling us that there is no free lunch. When you issue record amounts of debt in your central bank, as the monetary policy levers at full throttle, red flags begin to get raised and our borrowing costs go up. There are some faint warning bells going off. The value of the dollar has slipped recently. The price of gold is back up to nearly $1,000 a troy ounce. And inflation compensation spreads in the Treasury bond market have risen to a 9-month high. Now, I realize that some of these signs in the financial markets are likely reassuring to the Fed, since the predominant risk over the short term has been deflation, and that this could be signs of a recovery. But I am generally concerned that the Fed will be unable to unwind its considerable monetary policy stimulus in a timely manner to prevent a sharp rise in inflation over the medium term. There are a number of technical challenges associated with shrinking your balance sheet and returning to a more normal monetary policy stance. But I am more concerned about the political challenges the Fed will face when you finally have to make this call. I imagine there will be substantial political pressure on the Fed to delay tightening its monetary policy while the unemployment rate is still rising, for instance. But the Fed's political independence is critical--it is critical and essential for safeguarding its commitment to price stability, which is the chief policy concern of every central bank. This clear commitment is all the more important at a time when the fine line between monetary policy and fiscal policy seems a bit blurry. Despite the recent signs of stabilization in the economy, we policymakers should recognize that our most challenging period is going to be ahead of us as we try to right the ship and get back on the path of sustainable growth and job creation. That will clearly take a renewed sense of fiscal discipline to rein in spending and budget deficits, but it will also take a clear exit strategy on the part of the Fed and a firm commitment to price stability. We, in Congress, are committed to working with the administration to accomplish the former, and we trust the Fed will work diligently to ensure the latter. Thank you, Chairman."
"Chairman Spratt","Thank you, Mr. Ryan. Now, before proceeding with Chairman Bernanke, let me, as a housekeeping detail, ask for unanimous consent that all members be allowed to submit an opening statement for the record at this point. So ordered.   Prepared Statement of Hon. Gerald E. Connolly, a Representative in Congress From the State of Virginia  Mr. Chairman, thank you for holding this hearing and thank you, Chairman Bernanke, for your testimony on the state of our economy. I understand the complexity of issues affecting our economy and I respect the Federal Reserve's various efforts to stabilize the current crisis. There is, however, one critical area in which I believe the Fed has failed to act--the municipal bond market. Municipal bonds are the primary funding mechanism for state and local capital projects, including the repair or construction of our schools, fire and police stations, libraries, water treatment plants and critically needed transportation infrastructure. Traditionally, state and local governments have sold an average of $280 billion in bonds each year. The capital programs of our state and local governments, primarily funded by municipal bonds, have been one of the most effective engines for job creation throughout the country. Yet, despite the historically solid performance and low default rate of municipal bonds, investors fled from the muni market to U.S. Treasury notes following the economic meltdown last fall. As a result, the nation's 55,000 state and local governments are experiencing limited access to the capital markets. Further complicating the issue is the fact that the private insurance market virtually disappeared overnight, eliminating a viable means of credit enhancement for many issuers. If we do not address this serious problem, we could wind up in a situation where this squeezing of the municipal bond market has a counteractive effect on the benefits of our hard-fought economic recovery package. Municipal bonds are and have always been a tremendous source of economic stimulus that we cannot ignore. Chairman Bernanke, you stated in your March 31st letter to Members of Congress that although fixed-rate municipal debt is available to the larger municipalities, the costs to those localities are elevated, and thousands of smaller entities remain unable to access credit. You further noted the additional stress on the floating rate debt. According to Section 2a of the Federal Reserve Act, the Fed is required ``to promote effectively the goals of maximum employment, stable prices, and moderate long-term interest rates.'' To that effect, during the current recession, the Fed extended more than $2.1 trillion in credit through additional lending facilities to help spur the credit market. Earlier this year I introduced H.R. 1669, the Federal Municipal Bond Marketing Support and Securitization Act, as a way to begin to address the problem. At its core, my proposal directed the Secretary of the Treasury and Federal Reserve Board to work together to strategically intervene in the municipal bond market to restore liquidity and spark local job creation. The Congress now is considering several options, including authorizing a federal reinsurance program and a liquidity enhancement proposal to give the Federal Reserve the authority to fund a new liquidity facility for the purchase of variable rate demand notes. The Federal Reserve is empowered to conduct Open Market Operations. I understand the Fed's traditional reluctance to purchase municipal securities; however, the current recession is truly an extraordinary and historic situation, requiring new and innovative tools to address. Chairman Bernanke, you stated in your October 28, 2008 letter to Congressman Paul Kanjorski, ``the Federal Reserve Act provides the Federal Reserve with only limited ability to purchase directly the obligations of states and municipalities.'' If we are serious about promoting economic stimulus and recovery, then we must address the credit crisis that is paralyzing our state and local governments' capital programs--programs which represent one of the most significant job creation engines in the nation. "
"Chairman Spratt","Let me further say that the Chairman's testimony has been received and will be, without objection, entered in the record, so that you may summarize as you see fit. I think it is an important statement, full in detail, and we would encourage you to plow all the way through it, Mr. Chairman. One other very important detail. The Chairman has to leave at 12:30 today, so we will be riding the clock very closely on questions that members ask. Mr. Chairman, the floor is yours. And thank you, sir, again for coming. "
"STATEMENT OF BEN S. BERNANKE, CHAIRMAN, BOARD OF GOVERNORS, FEDERAL RESERVE SYSTEM"," "
