"Speaker","Speech"
"Chairman Spratt","Thank you, Mr. Chairman. Can we conclude from what you have just said and from what you are seeing that the favorable factors in our economy today may be glimmers of hope, may be harbingers of an economy that is recovering? You have used the words, ``an incipient recovery.'' Do you see a recovery unfolding at this point in time?"
"Mr. Bernanke","Yes, sir, our expectation is that we will begin to see growth in the economy, so the end of the technical recession, later this year. Underlying that prediction is some stabilization in final demand, including consumer spending, as well as the importance of unwinding the inventory dynamic. Firms have been cutting back their production and, therefore, have lowered their stocks of unwanted inventories. As that process goes forward, they will be able to increase production as they no longer have to get rid of those extra inventories. So we expect to see some growth, not robust growth but some positive growth, later this year. Unfortunately, since the growth rate, in the beginning of the process will be lower than potential, we expect unemployment to continue to rise into next year and to come down only slowly. So we will have a weak labor market for some time."
"Chairman Spratt","Without the extraordinary steps that we have taken, Fed has taken, the FDIC and the Treasury, without TARP and TALF and the Recovery Act, do you think we would be where we are, on the doorsteps of an incipient recovery?"
"Mr. Bernanke","No, sir, I am quite sure we would not be. I recognize that many people have raised concerns about various aspects of policies, financial risks that have been incurred, for example. And those are real and serious concerns. But I do think we need to keep in front of us the fact that without the concerted effort of the Federal Reserve, the Treasury, and other agencies like the FDIC, supported by the Congress and the administration, that last fall we very likely would have had a serious and perhaps global financial meltdown, with extraordinarily adverse implications for the U.S. and global economies. I think having averted that and that we now seem to be on a process of slow and gradual repair, both of the financial system and of the economy, is a major accomplishment. And though, again, there are many issues that remain, we must keep in front us the fact that we averted, I think, a very, very serious calamity."
"Chairman Spratt","In undertaking these countercyclical steps, we have advanced large sums of money and taken back, in many cases, assets like preferred stock in the major banks which were recipients of TARP funds. In addition, the Fed has a TALF lending facility for asset-backed securities. Can you give us some idea of what you expect in the way of recovery or repayment on these assets so that we can, in turn, look towards the recovery of some of these moneys to be used to pay off the debt that was incurred in advancing these loans in the first place?"
"Mr. Bernanke","I think that, with respect to the TARP, I think our recovery will be excellent. In particular, a number of banks are looking to repay TARP, the Federal Reserve will announce a list of banks next week that we believe are sufficiently sound and are able to lend, that they are eligible to repay the TARP, with, of course, interest. And if the Treasury accepts that recommendation, then we will see some repayment of the initial TARP outlay. With respect to the TALF, the Federal Reserve's program for asset-backed securities, we have extensive protections, which I would be happy to detail if you would give me a few minutes. But we are very comfortable that this program is, on the one hand, very effective in opening up the markets for consumer credit, including auto loans, student loans, small business loans, at the same time, I think, that the credit risks, especially to the Fed itself, are quite minimal."
"Chairman Spratt","Has the Fed done any work to determine what the likely pool of savings available for borrowing may be--foreign markets, world markets, global credit markets--and to what extent we will have to borrow substantially from those savings pools, capital pools, in order to meet our debt requirements in the foreseeable future?"
"Mr. Bernanke","Yes, we have certainly looked at that. I think it is an interesting point. Even though as the Federal Government's borrowing has skyrocketed, that the U.S. current account deficit, which is essentially a measure of the amount of borrowing we do from abroad, is actually lower today than it has been in some years, which suggests that the increase in Federal borrowing has been substantially offset by a decline in private borrowing, as banks and households deleverage. So, in a sense of there being an availability, there is an availability of credit to meet the needs of the U.S. Government and other governments. That being said, as I mentioned in my testimony, in order to make lenders willing to continue to finance us at reasonable interest rates, we do have to persuade them that we are serious about returning to a more balanced fiscal situation going forward."
"Chairman Spratt","Mr. Chairman, thank you very much for your testimony."
"Mr. Ryan?",""
"Mr. Ryan","Thank you, Chairman. Good to see you again, Mr. Chairman. Let's talk about our deficit and debt. The CBO, their re- estimate of the President's budget shows record deficits of 5.4 percent of GDP in 2019 and debt rising to 82.4 percent of GDP. Meanwhile, Medicare and Social Security will have already begun their pathway of permanent deficits. Are you concerned about these levels of deficits and debt? And is this a sustainable and prudent fiscal policy course?"
"Mr. Bernanke","Mr. Ryan, I certainly am concerned about that. I think we face a double challenge. One is that we have to restore ourselves to a more balanced fiscal path after addressing the financial and economic crises that we currently are facing. But, in addition, that is complicated by the fact that with the retirement of the baby boom and the increase in medical costs that we are facing rising entitlement costs, which--this is no longer a long-term consideration. This is something that has got to happen in the next 5 or 10 years. So that is extraordinarily challenging. My rough rule of thumb to the Congress would be, given that we have seen this increase in the debt-to-GDP ratio, that we should hope to try to at least stabilize it at the higher level and over time to try to reduce it. But certainly we cannot allow ourselves to be in a situation where the debt continues to rise, that means more and more interest payments, which then swell the deficit, which leads to an unsustainable situation. So it is very, very important that we----"
"Mr. Ryan","So what matters is the trajectory. The path of the trajectory is really what kind of matters here in the long term; is that right?"
"Mr. Bernanke","That is right. The CBO shows alternative simulations that involve the debt essentially exploding, which it would if it got so high that interest payments became unmanageable."
"Mr. Ryan","Let's turn to inflation. Your colleague at the Philadelphia Fed, Charles Plosser--and I have spoken to some other Fed bank presidents who seem to concur--he recently gave a speech in which he said that the economic forecasters rely too heavily on measures of the so-called ``output gap'' as a predictor of inflation. These forecasters argue that inflation will remain low for some time, given the large current output gap. He notes that other indicators, more forward-looking economic models, suggest a much higher risk of inflation over the medium term. Are we looking at the right indicators to gauge the risk of future inflation? Gold and inflation compensation spreads and the Treasury bonds markets are rising. So what indicators are you using to measure inflation, and why are they the right indicators?"
"Mr. Bernanke","Well, Congressman, we look at a whole range of indicators, absolutely. I do think that when output gaps reach the level that we are currently seeing that it is no longer the case that we can really debate that the output gap exists. I think there is clearly an output gap. And the experience is that, in previous recessions, that inflation has tended to fall after the recession. That, I think, is a reliable empirical regularity. And the size of the current output gap will be a drag on inflation."
"Mr. Ryan","So you fall into the output gap camp."
"Mr. Bernanke","Mr. Plosser does, as well. He is simply saying we shouldn't put too much weight because it is very difficult to measure them. But what I am saying is that, currently, there is not much doubt that there is an output gap, and that, therefore, there would be a downward effect on inflation. That being said, there are other factors as well, including the currency, including commodity prices and so on, and we watch those very carefully. I think I would note that, if you look around for evidence of inflation, inflation expectations, you are not going to find very much. If you look, for example, at surveys of consumers, if you look at the forecast of professional forecasters, if you look at the spreads between indexed and nonindexed bonds, all of those things are quite consistent with inflation remaining stable and well within the bounds that the Federal Reserve believes is consistent with price stability."
"Mr. Ryan","Are you concerned that today's models, which reflect yesterday's models, are not fast enough to pick up on changing expectations? What I mean when I say that is, in the 21st-century economy, information spreads much faster. Opinions are formed much more quickly because data is more available than it was, say, in the 20th century. Are you concerned that the models we use today do not fully reflect the fact that expectations can change a whole lot faster than they could in the past, and then we will be too late to catch it when it occurs?"
"Mr. Bernanke","Well, of course, we always have to keep modifying our models and addressing new situations. But we have a lot of ways of checking on expectations, including monthly surveys of both businesses and households, the daily behavior of the TIPS market, the daily behavior of commodity prices, and other factors. And, in particular, you know, inflation expectations can only result in inflation if they actually affect wage and price setting. And what we are seeing in the markets is that prices of manufactured goods, for example, and wages in nominal terms are not showing any signs of a wage-price spiral. To the contrary, they are showing quite a slow rate of growth. So, first of all, I want to say that in the medium to longer term we are very focused on the price stability issue, and I understand your concerns about that. But, as best we as can tell within the uncertainties of the forecasting, we don't see any inflation risk in the near term."
"Mr. Ryan","So when the time comes where you do see that concern--my last question is basically this: one about your exit strategy and one about the independence of the Federal Reserve. You have four big policy tools that are being deployed at full tilt: targeting zero interest rates; a program of quantitative easing; you have a balance sheet around $2 trillion, $2.1 trillion, some of which has longer-term paper on the balance sheet now than before; and you are buying Treasury bonds. That is a lot of policy that is out there that you would have to unwind very quickly in order to turn the corner. What is the exit strategy of the Fed? And what kind of confidence do you have that you will be able to wind all this down when the moment comes, question number one? Question number two is it was inevitable, I would argue, that your dealings with the Treasury were unprecedented. You had to do a lot in the last year to fight deflation, and I think everybody recognizes that. However, that has in some ways blurred the distinction of the independence between the administration, the executive branch, and the Federal Reserve and its unique independent role. What do you think of that concern? And what are you doing to reassert the independence of the Federal Reserve, not just in structure but in the impression of the marketplace?"
"Mr. Bernanke","That is a very long question, but I would like to address it, if I might. First of all, on the technical aspects of unwinding, we are confident that we can unwind this process. What we need to be able to do is raise short-term interest rates to tighten policy in the normal way. In order to do that, we have a sequence of things that can happen. First, short-term lending, short-term programs can either decline because of lack of demand, which we are seeing-- we have seen a very substantial decline in the usage of our short-term programs over the last couple of months. Secondly, of course, as conditions return to normal we can simply shut down those short-term programs. That is step number one. Step number two and very important is the interest on Reserve's authority that the Congress gave us last year. By setting an interest rate on reserves close to our target for the short-term interest rate, we make it very unlikely that banks would want to lend out in the overnight Federal funds market at a rate below that interest rate."
"Mr. Ryan","Is that your biggest tool? Is that the most powerful tool you have?"
"Mr. Bernanke","That is a very important tool, and many central banks around the world effectively use that tool. We have additional ones, though, including reverse repurchase agreements and, if necessary, sales. But there are a number of ways that we can address this problem. So I think, from a tactical point of view, we are able to address the current level of our balance sheet. Politically, there are several points here. First, as you point out, I think the American people would want the Federal Reserve and other agencies like the FDIC to work closely with the Treasury in trying to address these critical financial problems, which is what we have done. But we have done so on an equal basis, from a perspective of an independent agency. In particular, our supervisory decisions have been independent and have been made on our own information and our own decisions. So we have maintained our independence, even as we have collaborated closely with the Treasury, in trying to address the financial crisis. In that respect, that is consistent with previous financial crises when different agents of the government have worked together. On monetary policy, independence is, of course, crucial. We have not experienced any threats to our independence from Congress, the administration, or elsewhere. We have made all our decisions of monetary policy on a strictly independent basis, and we feel quite confident that we can continue to do that going forward. We face, as always, the same difficult decision about what is the right moment to begin to remove accommodation. You don't want to remove accommodation so soon as to prevent the recovery from taking hold. On the other hand, you don't want to wait so long as to lead to an inflation in the medium term. But that decision is the same difficult decision we always face when we come to a point to remove a monetary accommodation. And we are fully confident that, although that is a difficult decision in terms of balancing the risks on both sides, we are fully confident from a political independence point of view that we are able to make that decision as we need to make it."
"Mr. Ryan","It will clearly occur in an atmosphere of more pressure than I think you have seen in the past, given where we are right now. Thank you."
"Chairman Spratt","Mr. Doggett?"
"Mr. Doggett","Thank you, Mr. Chairman. And thank you, Mr. Chairman. While the $700 billion bailout, which you urged Congress to adopt last September, has received continued scrutiny and debate, the Federal Reserve is apparently committing about three times that amount in public money, much of it through the emergency lending powers. Certainly, independence and secrecy may be important in the Fed's normal operations, but this use of expansive emergency powers relying on a vague statutory provision that has not been used in about seven decades is certainly not normal. The Fed, indeed, seems to have sprung into action through the backdoor as a way for some to avoid another request of the Congress for public funds through the front door. One of the few safeguards that we have in the taxpayer- financed portion of the bailout is the congressional oversight panel. Yet the Fed has not responded to that panel's April request for specific information about your continued assistance to AIG, even though our oversight panel told you that the lack of information, quote, ``has substantially hampered oversight.'' Meanwhile, we have learned that the AIG bailout was also a bailout of Goldman Sachs and some of the world's largest foreign banks, all of whom were not asked to accept a penny of losses. I have four questions or question areas for you that are all closely related. I will try to state them and then just ask you to respond at the end. The first one is just directly, when will you have a thorough and complete response to every query that the oversight panel asked you in April? The second is that that same congressional oversight panel concluded that a third of the taxpayer moneys that the Treasury gave away under TARP was wasted. You have not disclosed sufficient details to permit a similar independent analysis of what the Fed has been doing to determine what value the Fed is getting for its investment of our public money. What meaningful assurances can you provide the American people that we are not being fleeced again? Have you done a full review of what kind of deal the taxpayers are getting? And, if so, will you provide the complete documentation for the basis of that assessment? Third, while the Fed's secrecy regarding which banks are borrowing from its discount window is understandable, the situation is far different with your newly discovered emergency powers. There is little difference between those you are aiding in secret and those the Treasury is aiding in public. How can there be effective oversight, any protection, really, for the public, when you are not disclosing who the Fed is helping, how much they are getting, and on what terms? And I am not talking about just adding a table to your Web site or a summary report on a monthly basis. My question is, when will you be able to provide the identity of participants, transactions implemented, profits or losses posted from specific transactions to the oversight panel, the Fed inspector general, the GAO and this Congress? And, finally, relying upon the Federal Reserve instead of the Treasury for bailouts can also mask the true cost to the public in terms of our soaring national debt. Any losses on assets on loans through these riskier, abnormal emergency power activities could result in the Fed, of course, remitting less money to the Treasury. Have you undertaken a comprehensive analysis of the risk to the taxpayer from the assets that you are requiring in the loans that you are making? I am not referring to a conclusive statement that everything is fine, but if you have done such an analysis, can you provide it to us this month?"
"Mr. Bernanke","Congressman, on the oversight panel request, I am sure we will respond to that. I am not aware of the status of that request. I would just note that the Senate--I think the Congress passed a rule recently that would allow the GAO to directly audit AIG and other individual banks or other interventions, and we are perfectly comfortable with that. We have provided extensive information to the Congress on AIG in those other rescues, including monthly reports required by Congress on all 13(3) lending. So we have been quite open about it. If there are specific issues, I would be----"
"Mr. Doggett","Well, how about the specific issues on the specifics? Who gets the money? What are the terms? What are the----"
"Mr. Bernanke","On what program?"
"Mr. Doggett","On any programs under your emergency powers, where you rely on emergency powers. Certainly on the approximately trillion dollars that you say you will be doing in mortgage-backed securities."
"Mr. Bernanke","Well, mortgage-backed securities, so if you look at our balance sheet, the bulk of it is in two things: short-term lending to financial institutions, which goes up to a trillion, is now down to about $600 billion, $700 billion because of payback, basically--the naming of those institutions relates to the concern that you mentioned earlier, which is that if you name the institutions they will not be willing to take the liquidity backstop, which is necessary for stabilizing financial markets. But I would like to point out that your concern was about credit risk. These are extremely safe, short-term loans, well- collateralized, with recourse, and with supervisory oversight. To my knowledge, we have never lost a penny. We have actually made money on those loans. So that is a big part of it. The other big part of our balance sheet is securities, which are Treasuries, GSE, the debt and mortgage-backed securities. Those are standard securities that are guaranteed by the U.S. Government. There is no loss to the Fed from that. And there is nothing to be disclosed about that, other than the fact that they are just conventional securities. So those are the two biggest components of our balance sheet. Then, of course, there is about $100 billion, about 5 percent of our balance sheet is dedicated to the Bear Stearns and AIG rescues. As I said, those things are now open to audit by the GAO, and we will cooperate in every way and provide whatever information is needed on that. So I would urge you to look at our new monthly report that we will issue very shortly. And we will respond to the congressional oversight panel, and I hope we can meet your----"
"Mr. Doggett","But you have declined to provide any of the specific details?"
"Mr. Bernanke","You will have to be more specific about what you need. I think, in the case of the short-term financial liquidity provision, I think there are good policy reasons not to provide that. But we have provided extensive information about the programs, about the collateral we accept, about the number of borrowers. And in cases where TARP money is concerned, we will provide all the information that SIGTARP would want or anyone else that needs to have an enforcement authority."
"Chairman Spratt","Mr. Hensarling?"
"Mr. Hensarling","Thank you, Mr. Chairman. Welcome, Chairman Bernanke. If the staff could put up chart 10, please. Mr. Chairman, as you well know, we are looking at an explosion of debt over the next 10 years. Now, presently, our Federal debt is at 41 percent of GDP. I know this is well-known to you. CBO says that it will increase to 82 percent of GDP in 10 years. In your testimony, you speak of the need to have prompt attention to questions of fiscal sustainability in order to maintain the confidence in our financial markets. So, certainly, the case has been made for short-term Federal intervention in our marketplace. I believe that in testimony by the head of CBO their estimate is that we will reach positive GDP growth in the third quarter of this year and that unemployment will level off, I believe, I think, the second quarter of next year. OMB had a rosier scenario. And today, in your testimony, you speak of an incipient recovery, and I believe you said economic activity should turn up later this year. So my question is, if OMB, CBO, and the Federal Reserve are predicting positive GDP growth, an upturn in economic activity somewhere in the next 6 to 18 months, we have concerns about the fiscal sustainability of these levels of debt. Having our debt go from 41 percent of GDP to 82 percent of GDP in 10 years, tripling the national debt in 10 years, does this meet your definition of prompt attention to questions of fiscal sustainability?"
"Mr. Bernanke","Well, Congressman, I am not sure whose CBO projection, I guess, that is. I would say that that picture is concerning not only because of the level but because of the fact that it continues to rise. Sustainability means--there are countries that have 80 percent or 100 percent debt-to-GDP ratios. I am not recommending that. But, clearly, you can't have a debt-to-GDP ratio which continues to rise indefinitely. So it is very important that we have now or very soon a plan to stabilize, at least, the debt-to-GDP ratio so that it doesn't go into a continued increase, which, because of interest payments, would make sort of a vicious circle going forward."
"Mr. Hensarling","I have seen one analysis that, clearly, to keep the debt at today's level, 41 percent of GDP, that either, number one, you are going to have to monetize the debt and essentially inflate the money supply 100 percent, or that tax increases across the board in the neighborhood of 60 percent would be necessary to balance the budget in 10 years. Has the Federal Reserve done its own calculations? Does this seem to be an accurate analysis?"
"Mr. Bernanke","We haven't done that particular analysis. I don't think it is realistic to get back to 41 percent that quickly."
"Mr. Hensarling","Which means perhaps some level of tax increase, spending decrease, or inflating the money supply is going to be necessary?"
"Mr. Bernanke","Relative to that CBO baseline, I mean, it is evident that either cuts in spending or increases in taxes will be necessary to stabilize the fiscal position."
"Mr. Hensarling","Will the Federal Reserve monetize this debt?"
