"Speaker","Speech"
"Mrs. Lummis","Dr. Bernanke, thank you for being here today. I want to visit a bit about that balance between taxes and spending in the medium term. If Congress just increases taxes to eliminate the deficit in 10 years, let's say, without cutting spending, could that have an effect on our economic recovery, a negative effect?"
"Mr. Bernanke","So as I was trying to make the distinction earlier that in an economy in recession, tax cuts or tax increases have two effects. One is the incentive effects, which are more long-term effects, but also withdrawing purchasing power, taking away income from consumers. And in a short-term recessionary situation, I think that latter effect is more important. So if you raise taxes during a recession, you probably want to offset it with a tax cut elsewhere, for example. Over a longer period of time, you have to weigh the implications of higher taxes on incentives and on potential growth against the benefits of what you are using the revenue for. So there is a cost-benefit tradeoff to be made there. So in particular, I believe the Congress will want to look at both sides, both the tax and the spending side, and try to find a reasonable balance between those two."
"Mrs. Lummis","Mr. Chairman, you mentioned just a few minutes ago that many of the programs at the Fed are temporary and could be wound down. Well, such is the case with the Congress also, and this stimulus bill comes to mind. If Congress were to freeze spending at 2009 fiscal year levels and freeze release of the TARP funds at the end of the this fiscal year, do you believe the economy will have recovered adequately that we could then begin to address the debt and deficit problem and focus on it? Because you mentioned that as a very important looming issue. So I am looking at the point at which we can actually, as a Congress, also enact an exit strategy from trying to stimulate economic growth because the economy is finally leveling out, and then begin to address that great looming issue that you mentioned as a concern--that I agree is a huge concern--that being both the deficit and the debt."
"Mr. Bernanke","I think it is very important, as I mentioned in my testimony, to begin the planning process as soon as possible so it will have a persuasive exit strategy that will not only give us a plan but will also help to reassure lenders in the bond markets that in fact the U.S. Government is going to find a fiscally sustainable path going forward. You asked about 2009. No one knows the future of course, but based on our best projections we think that the economy will be pretty weak albeit starting to grow at the end of 2009 and the unemployment rate will probably still be rising. So would unlikely be a period of robust growth at that point."
"Mrs. Lummis","Mr. Chairman, suppose if we froze spending of the Federal Government's budgets at 2009 level and then let the stimulus package continue to work, would that be a way to begin to address the deficit and the debt as well as allow the stimulus monies to continue to flow into the economy?"
"Mr. Bernanke","Congresswoman, I think that there are lots of ways that you could structure this, and I don't think I want to try to pick one, particularly on the fly here. So you really need to think about maybe not just the total amount of spending but the various programs and the various needs we have from health, and defense, and benefits payments, everything else, and think about those programs and try to think about how we are going to structure them in a way that over the next few years we are going to return to a more balanced situation. So I think a longer term perspective is probably necessary."
"Mrs. Lummis","Thank you, Mr. Chairman. A quick question about government intervention in our economy, given the degree and depth of the government intervention in the economy, which is the highest since World War II, can you estimate how long it might take for the government to unwind its immersion in the markets?"
"Mr. Bernanke","It is going to depend on the market. For example, in some of the short-term markets, like the commercial paper market, we are already seeing an unwinding going on now as those markets stabilize. For other parts of the economy, like the TARP investment in banks or some of the longer term holdings of the Fed, it may take a few more years. But I would say that 4 or 5 years from now I hope that as a government we will be pretty much out of those financial markets and that things will be operating on a more normal basis."
"Mrs. Lummis","Thank you, Mr. Chairman."
"Chairman Spratt","Ms. Tsongas."
"Ms. Tsongas","Thank you, Mr. Chairman, and thank you, Chairman Bernanke, for being here with us. When we spoke last year, as we were considering our response to the downturn in the economy and we were trying to consider the parameters of a recovery package, I asked, and you stated, that helping the States prevent cutbacks in services could have a stimulative effect and indicated support for addressing weaknesses in the municipal bond market. The Recovery Act we passed did include money for state stabilization and created several flexible bond options to help our State and local governments. And this past week when I was in Massachusetts as part of the break and happened to meet with our Governor as well as our State senator who chairs the Ways and Means Committee, I can tell you how grateful they were for the fact that we included significant funds to help the States deal with the downturns in their revenues and the impacts on their budget. I think it is one of the most difficult places to be today, in State and local government. So I want to thank you for that, and also for your reiterating your support today for what we have done with the recovery package and the necessity for it. In your testimony you just stated that about one-quarter of the funds will come out either through tax cuts or direct benefits and direct spending this year, one-half next year, and possibly the last quarter in 2011. Are you concerned that we are meeting that timetable, and how important is the timetable as we go forward beyond the tax cuts that have showed up in people's paychecks today?"
"Mr. Bernanke","Well, it is the very early days. At this point I think something on the order of 5 percent of the monies appropriated have entered the economic bloodstream, so to speak. It is important that there not be extensive delays in that process because it would possibly give you a fiscal stimulus exactly at the wrong time when the economy was already in a substantial recovery mode. But I don't have any information to the effect that the stimulus is not being disbursed at a reasonable pace. I think it is just too early to know how quickly the monies will get out."
"Ms. Tsongas","So you are confident that the administration is moving in a timely fashion, especially within the various departments where they have to put in place a regulatory framework, the process of people applying for the funds, that that is going along in a manner that should be helpful?"
"Mr. Bernanke","As far as I know. But we all recognize that this is, from a bureaucratic point of view, a very challenging task. But so far, of course I think payments are underway and the planning process is underway."
"Ms. Tsongas","So the impact we see today, given the fact that only 5 percent is moved out, what do you attribute that to?"
"Mr. Bernanke","The recent improvement in the economy?"
"Ms. Tsongas","Yes."
"Mr. Bernanke","It is partly the fact that we had this very sharp decline in the latter part of last year related to the financial crisis that caused a big buildup of inventories. Very importantly, as I discussed earlier, we seem to have achieved a good deal of progress in stabilizing the financial system. That has helped restore confidence. Finally, demand is beginning to stabilize. We still had a very bad first quarter and we may yet have a negative second quarter because of the need to work down those inventories, but because the financial markets are doing better, because there is more confidence in the economy, in the financial system, as those inventories work down, we should begin to see a modest increase in growth. So I would put the internal dynamics of the economy in terms of inventories, and so on, as being part of it, but I also would like to give credit to actions taken by the Treasury, the Fed, the FDIC, and the Congress to help stabilize the financial system."
"Ms. Tsongas","Thank you, and I yield back."
"Chairman Spratt","Ms. Moore."
"Ms. Moore","Thank you very much, Mr. Chairman, and thank you, Mr. Chairman, for being patient. I have three questions, but I want to start out with your certainty that we won't be facing inflation and your certainty that we have gotten a handle on deflation. Just your last answer to Mrs. Tsongas about the buildup of inventory, and certainly there has been a loss of value in the housing market, given the unemployment rate that is going to continue to rise-- even recently from the GM and Chrysler restructuring--given the high unemployment and the buildup of inventory and the loss of value in housing, how can you say that deflation is not a risk and we are not having these fire sales to get rid of inventory or losses being taken in the housing market? I guess I don't understand how we have we are going to avoid deflation."
"Mr. Bernanke","Well, you correctly point out that we have a balancing act between on the one hand deflation risk and on the other hand potential medium-term inflation risk. We have to look at both sides of that equation. Recently, since the outlook seems to have improved some, since confidence is up somewhat, because inflation expectation is measured by a lot of different means seem to be pretty stable, I put a lower probability now on a deflation than I would have a few months ago. That is not to say it is completely----"
"Ms. Moore","If people don't have jobs, how are they going to buy the built up inventory? What is going to happen when people just have to sell their houses and they have lost 30 percent value?"
"Mr. Bernanke","Well, that has a very negative effect on the economy and we expect the employment to keep rising. I agree with you that the economy remains quite weak, but consumer spending, though at a lower level, it seems to be stabilizing, not growing great guns but it seems to be stabilizing, and those kinds of considerations, we think the deflation risk has receded. But we are certainly going to continue to follow that carefully."
"Ms. Moore","Let me go on before my time expires. There has been a lot of talk about the Fed being named as a super regulator or alternatively a systemic risk regulator. Mr. Ryan earlier asked about the independence of the Federal Reserve, and I just want your comment about whether or not you think you are the appropriate agency to be either a super regulator or a systemic risk regulator and whether or not that would be a little bit incestuous."
"Mr. Bernanke","Well, first of all let me say that I do think there is a benefit to going toward a more system-wide regulatory approach because so many things that caused problems in the recent crisis sort of slipped under the radar because there was nobody looking at it. So we do need to have a system whereby the large systemically critical firms are being appropriately overseen, where we have a way to address the potential failure of large financial firms, where we make sure that risks that build up in the system are----"
"Ms. Moore","Should that be you? Before my time expires?"
"Mr. Bernanke","The Federal Reserve needs to be part of that process. But given our expertise, given our historical role in financial crisis management, given the fact that we are the lender of last resort, we should have a substantial role in that. The exact structure of the arrangements I think remains to be discussed. The administration hasn't even come out with their proposal yet."
"Ms. Moore","I want to ask a question about what monetary policy should we be pursuing, given that the Chinese seem to be putting up a challenge to the dollar as the reserve currency. This would be a great loss to us were we seriously challenged. What should we be doing to maintain the dollar as our reserve currency?"
"Mr. Bernanke","Well, first, I don't see any risk in the foreseeable future to the dollar status as reserve currency."
"Ms. Moore","You don't see the Chinese and the Brazilians that are now using their own currency for reserve currency, the Chinese concern about the strength of the dollar as being a challenge?"
"Mr. Bernanke","Well, a share of reserves held by all countries in dollars, that share has actually gone up a bit recently. With that being said, we do have a responsibility to make sure our economy is appropriately run, and my view is that the best way to get a strong dollar is to get a strong economy and to get the economy back on a growth path with high productivity, good amount of savings. That is the best way to get the dollar strong, and that is why I think it is important to get us turned around, get the financial crisis fixed, and get the economy growing again, and that is what the Federal Reserve's policy is trying to achieve."
"Ms. Moore","Thank you, I yield back."
"Chairman Spratt","Ms. Kaptur."
"Ms. Kaptur","Thank you, Mr. Chairman. And Chairman Bernanke, thank you for your patience. Most of my questions will be yes and no, and but I want to begin by saying that very privileged and powerful bankers in our country have hurt our Nation deeply, yet it seems that they get special treatment by the Federal Reserve and other financial regulatory agencies that should be protecting the public interest. And these bankers have earned huge profits for themselves, but when their imprudent behavior causes vast economic dislocation, they throw the cost of that on the backs of the taxpayers, raising our national debt. Taxpayers who are hurt, homeowners lose their homes, people lose jobs, people lose their companies, bankruptcies go up, but they don't get the same treatment. So I am interested in the favoritism exhibited towards these bankers as well as the non-transparency of financial rescues being arranged by the Fed and other Federal regulatory agencies. The presidents of the regional reserve banks of the Fed extraordinarily have been expressing concern about what is going on and the power of the New York Fed, Kansas City Fed, Saint Louis Fed, the Richmond Fed, shockingly, signed an agreement with you, an unprecedented agreement where you agreed to absorb any losses that would be incurred by the Fed. The Treasury actually signed that agreement. And so my first question is, yes or no, do you support the concept of having the presidents of each of the Federal Reserve banks join the ranks of your Board of Governors and be nominated by the President and confirmed by the Senate to have a more representative Fed?"
"Mr. Bernanke","No."
"Ms. Kaptur","Thank you. For the record, before this month is out, how much TARP money will AIG, can you provide for the record, before this month is out, how much TARP money AIG has disbursed since January 1 of this year and who were the recipients. Can you provide that for the record?"
"Mr. Bernanke","I think so, but I can't do that here."
"Ms. Kaptur","Can you do it within the month?"
"Mr. Bernanke","They have already produced the information on their counterparties. I think that information is in the public domain."
"Ms. Kaptur","How many of these disbursements and which derivative contracts were paid out at 100 percent on the dollar and which were not?"
"Mr. Bernanke","All contracts, of which there was a legal contract binding, were paid out 100 percent because there was no bankruptcy allowed. We need a system where we can renegotiate those things, but we don't have a system like that."
"Ms. Kaptur","Well, we are going to want as much detail as you can provide for the record, because the Fed is really heavily involved in that, am I correct?"
"Mr. Bernanke","The Fed is involved very unwillingly because there is no good system for addressing the failure of a major financial institution."
"Ms. Kaptur","How much more of our rising debt is being provided by foreign creditors now as our debt rises? Can you provide that for the record?"
"Mr. Bernanke","Actually less, less than it has been, because we know the current account deficit has been declining. And that current account deficit measures the flow of new lending from foreign creditors to the United States. As the Federal deficit has gone up, the private borrowing has gone down."
"Ms. Kaptur","Thank you. We would like that for the record. How many no-bid contracts has the Fed now signed with the private money management firm BlackRock and any of its subsidiaries."
"Mr. Bernanke","We have signed several. Because of exigencies of time, all that information is going to be provided in this monthly report, which we are now releasing to the Congress."
"Ms. Kaptur","Will the contracts be released to the Congress?"
"Mr. Bernanke","I believe so, yes."
"Ms. Kaptur","What is the value of assets being managed by BlackRock and any of these contracts in total?"
"Mr. Bernanke","I don't have information."
"Ms. Kaptur","Will that be provided for the record?"
"Mr. Bernanke","Oh, yes."
"Ms. Kaptur","What is the Fed providing for BlackRock in services. Will that be provided for the record?"
"Mr. Bernanke","We have a committee, which has gone through and made a whole set of recommendations based on carefully considered analysis and consultation, and that will be providing a great deal of information. I don't remember every single decision that they made, but I would like to defer to their decisions."
"Ms. Kaptur","Do you know, Mr. Chairman, which foreign countries and companies are a part of BlackRock's transactions?"
"Mr. Bernanke","I don't understand the question."
"Ms. Kaptur","What other business does BlackRock do besides service the Fed?"
"Mr. Bernanke","They have a very large asset management business."
"Ms. Kaptur","But you wouldn't necessarily be aware of what those relationships are. Yes or no?"
"Mr. Bernanke","Not necessarily."
"Ms. Kaptur","Are you aware that one of the contracts BlackRock manages for the Fed may be compromised, and that is the one, probably more than one is compromised, dealing with Freddie Mac and Fannie Mae? And I just wish to state this for the record. Laurence Fink, who is the head of BlackRock, which now is 47 percent owned by Bank of America, in which the--Mr. Summers, who heads the National Economic Council, is a major investor, just got several no-bid contracts from the Fed, including one to manage Freddie Mac and Fannie Mae's troubled portfolios. I think that is one of the contracts you signed with BlackRock. Did the Fed know that Mr. Fink is the person who first created the collateralized mortgage obligation when he headed First Boston, and then he brought that instrument to Freddie Mac and initially sold it to them for over $1 billion of such obligations, making huge profits for himself and his firm. He is now the Fed's go-to man through his firm on Freddie Mac workouts. I have a question about the revolving door, and how do you protect the public, again, against his potential and that company's potential conflict of interest or possible self- dealing that relate to his own and his firm's historic involvements with those mortgage portfolios?"
"Mr. Bernanke","The Federal Reserve is a separate institution from Freddie Mac. We have nothing to do with Freddie Mac. I don't understand your question."
"Ms. Kaptur","You have signed a contract with BlackRock to manage the Freddie and Fannie portfolios, have you not, the troubled mortgages within those portfolios?"
"Chairman Bernanke","Not to my knowledge."
"Ms. Kaptur","I understood it was one of the four or five contracts that you had signed with BlackRock."
"Mr. Bernanke","I will have to go back and check on that."
