"Speaker","Speech"
"Mr. Bernanke","Sir, in dealing with a situation like this, there is the immediate emergency response and then there is the longer-term actions you want to take. On the emergency response, the two lessons I learned from studying the Great Depression are, first, that monetary policy has to respond aggressively. The Fed did not respond in the early thirties, and we, of course, have done that. The second is that maintaining financial stability is absolutely critical. And as you know, we have taken a number of measures--some of them quite extraordinary--working with the Treasury to prevent a meltdown in the financial system. And I believe that we have averted a much worse outcome by taking those steps. Going forward, we certainly want to avoid this kind of crisis happening in the future. We have learned a lot of lessons from the recent experience. I think we will have to have stronger oversight of the large firms, maybe higher capital. We need to have resolution regimes, as I mentioned earlier, to help resolve failing firms. And I believe we need to strengthen the financial infrastructure. But I would also say that I think we do need to take a more system-wide approach to regulation. Instead of looking only at individual firms where agency A is responsible for firm one and agency B is responsible for firm two, that there needs to be a more collaborative approach that looks at the whole system and make sure they aren't building risks in one area that are being ignored because they don't bear on a particular firm. So I think a more macro-prudential or system-wide approach would be helpful."
"Mr. Etheridge","Thank you, sir. Thank you, Mr. Chairman. I yield back."
"Chairman Spratt","Mr. Garrett."
"Mr. Garrett","Thank you, Mr. Chairman. Chairman Bernanke, the other hat I wear is in Financial Services. And when you come over there, the issue that is often discussed is the term ``the system risk,'' the systemic risk regulator. And as you know, of all the hearings that we have had, no one has really yet defined exactly what it is, what authority they will have, what they will regulate, so on and so forth. But one thing out of both of these committees that I serve on seems to be pretty emphatic--and I will be taking a page out of Paul Ryan's comments here--and that is that one thing that is a systemic risk is the unfunded debt that is out there, as Paul was alluding to before. For this country, it is up to $56.4 trillion, and the numbers vary on that. Interestingly enough, we have had expert after expert for the last 6 years come before the committee. They all say the same thing, and we hear it from both sides of the aisle. But in the budget that we got this year, unfortunately it really isn't addressed. Obviously, we spend more. The numbers you already said before. We are looking at the national debt would double in just 10 years, pushing the debt north of 100 percent of GDP. And interestingly, on those numbers--maybe somebody else referenced this--is what has happened over in the United Kingdom with S&P's downgrading them, going from stable to negative. And their situation, in some perspective, one economist is saying not quite as bad as where we are, and where our trajectory is, that we are going to be worse than them. So your comment already is, I think, that this is probably the looming largest issue that we need to address?"
"Mr. Bernanke","I would say that is right."
"Mr. Garrett","And I wonder, everything else we do besides that is almost that, besides the point; is that a correct----"
"Mr. Bernanke","I wouldn't go that far, but there are many other issues we face. And I want to say that you have had a lot of experts. And it is easy for us to sit at this table and tell you that you have to solve this problem, and it is a very hard problem to solve. But it is critical that we address that."
"Mr. Garrett","All right. So I over-strayed by saying it is besides the point, but the other aspect is trying to get our overall budget in order and trying to get those numbers down. Now, Secretary Geithner was over in China just this past week and he made a statement to their concerns about where we are on our spending. He said, well, don't worry, we are going to try to rein things in. And the reports I read was the response from the Chinese was just laughter to that. I guess they just don't believe it. About a month ago, I think it was, our President said that he was going to start tackling it. And the way he said he is going to start tackling it is he is going to save $100 million. Where would you put that $100 million savings in the whole scheme of things; significant, large, major, or just totally irrelevant to the entire picture that we are dealing with as far as our unfunded liabilities and our budget as well?"
"Mr. Bernanke","Well, $100 million obviously by itself is not a very big amount of money relative to these problems. I think the important issue is the commitment that the administration and Congress have both talked about and need to put into play."
"Mr. Garrett","But do you see any commitment from the administration based upon the $100 million so far or from the budget that has been presented so far?"
"Mr. Bernanke","A lot of the budget that was presented was placeholders and broad plans and themes. I think the proof will be in the pudding, as they say, how Congress and the administration actually begin to implement health care reform or climate change policy. Those details about how the spending and revenues will be matched will be the critical issue."
"Mr. Garrett","Well, regardless of how we spend them, let's assume for the moment that we spend them on all the best things in the world, the deficit numbers don't change and the debt numbers don't change. We are still going to spend that $634 billion, whether it is on health care or something else, we are still going to spend this money on something, so the bottom- line numbers don't change."
"Mr. Bernanke","Well, my understanding was that $634 billion placeholder came with some prospective revenue offsets from the carbon permits and from upper-class tax increases. Mr. Ryan says no."
"Mr. Garrett","I will yield to him."
"Mr. Ryan","Half from Medicare cuts and half from the upper tax increase."
"Mr. Bernanke","Well, prospectively, there was a match there. But as I say, this is all about execution, and that is the key issue."
"Mr. Garrett","When the CBO was here I guess about 2 weeks ago, one of the questions that I referenced to you as well, being a historian on this, was during the Great Depression--and I am not saying this is a depression--is that you actually say two depressions, one before Roosevelt and then one afterwards. With regard to the recession that we are in, is there the possibility that we will see what we are in right now, and that if the stimulus--and their description of the stimulus, my words, not theirs, was it started out small and will peter out altogether next year--if it doesn't have the impact that they suggest, that we will see that second bottom of a W then in next year's economy?"
"Mr. Bernanke","It is very difficult to forecast that far in advance. If the fiscal program is not effective, then of course that would be a negative going forward."
"Mr. Garrett","They said that next year is going to have minimal impact, that basically you saw the impact now on the tax side of the question and basically it was of minimal impact as of next year. So if the stimulus is not having the impact, then what would?"
"Mr. Bernanke","My understanding again is that about half of the effect will be in 2010, is my understanding of the timing of the stimulus package. But there are other factors at work as well. I mean, as confidence returns, private sector activity ought to increase, low-interest rates will stimulate demand. The rest of the world is strengthening. There are a lot of other factors that would provide support for growth outside the fiscal package. That being said, again, there are a lot of issues to be resolved, such as excessive leverage, for example, that are likely to be headwinds as the economy tries to get back to a sustainable growth path."
"Chairman Spratt","Ms. Schwartz."
"Ms. Schwartz","Thank you, Mr. Chairman. And Mr. Chairman, thank you for your testimony and for your comments, both about the reality of the situation fiscally and economically, but also going forward. I wanted to ask two questions, if I may, that really relate more to households and some of the things that we hear about in our districts. And I think Mr. Latta alluded to it on the issue of unemployment as one that is very significant more so in his district than maybe even mine in the Philadelphia area. Fortunately, while not great, it is still in the 10 percent, 9 percent. It is not what we want it to be, but it is not as hard hit as other regions of the country. With that said, when I hear and when my constituents hear that we are seeing maybe some stabilization, maybe some signs of growth that are positive, we still do keep hearing that the unemployment rates are going to continue to be high and not recover--you said so yourself in the testimony. Could you elaborate in any way, both on the expectations about unemployment, but maybe more so what more we can do about it? Some of these are projections based on previous recessions, previous actions. We don't know that there won't be some changes because we are taking different actions and you are as well. Could you speak briefly just about whether there are additional actions or whether we can actually have more hope that we will see an increase in employment so that families in our district, businesses in our district are really starting to see that personal recovery?"
"Mr. Bernanke","Well, the historical experience is that the labor market tends to lag the business cycle. So even as the economy begins to recover, unemployment can still remain high. In particular, if growth is relatively slow, it won't be fast enough to absorb workers coming into the labor force."
"Ms. Schwartz","So one of the last decisions businesses make is new employees and a commitment to new employees."
"Mr. Bernanke","That is right. So this is a very serious problem. Because besides the very important fact that people without jobs have difficulty meeting their house payments and other bills, people who are out of the labor force for a few years tend to lose their skills, tend to lose their connection to the labor force, and maybe when the economy recovers they may not even be employable. It is possible. So there are a lot of costs involved in this. And if I had an easy answer, I would give it to you. All I can say is that, as you know, the Federal Reserve has been very aggressive in trying to support the economy, and the Congress has been as well. We might look at trying to help people retain their skills through educational programs or other kinds of training programs."
"Ms. Schwartz","So maybe while people are on unemployment, we might want to actually get them into other kinds of job training or education?"
"Mr. Bernanke","At least it is an opportunity, if you are unemployed, to fine-tune your skills and perhaps be prepared when jobs begin to open up."
"Ms. Schwartz","And maybe look at future jobs; jobs that might be opening up, what kind of industries are growing, looking at what is next."
"Mr. Bernanke","It is the strength of our country and our economy that we have, in our technical schools and junior colleges and all kinds of other formats, we have a lot of ability for people to retool even in mid-life."
"Ms. Schwartz","Maybe something we should do, I know we did under TAA, Trade Adjustment Assistance, I added some provision that said that you would be eligible for job training and education benefits if your industry was certified as one of those industries affected by international trade, even if your own company and your own facility hadn't closed yet, with the notion that why not get people new skills and the ability to move on. Maybe that is something we ought to look at as we are dealing with a great many people who are unemployed who are going to need some additional skills. It is a good point. Maybe that is something we can work on. Just very briefly, because I only have a minute, we have talked before about an interest of mine in helping to make sure that Americans learn to save. One of the interesting aspects of this recession is that people's fear about stagnant wages and unemployment is to actually hold the money and to actually begin to pay down debt and save. Could you speak very briefly about how, while we want people to be spending in the sense of encouraging use of consumer products and stimulating the economy that way, we don't want people to lose this notion that actually saving and preparing for a rainy day, being able to have some cushion personally is important. We have forgotten to do that in the last 10 years, at least, maybe 20 years. Could you speak briefly to what else we might want to do to hang on to this concept that Americans ought to be saving some part of their income if they could?"
"Mr. Bernanke","You are absolutely right. Over the last couple of decades, in part because of rising house prices and stock prices, people have sort of felt not necessary to save. Now they are saving more for the reasons you have mentioned. And it is interesting to note that people who grew up during the thirties, even in prosperity 30 years later, are still saving much more than their children. So this experience is of course a very negative one, but one benefit might be it is going to have some impact on people's savings behavior. There are other things that can be done to try to increase saving, such as using only opt-outs from 401(k) participation, things of that sort. There is no magic bullet. And, indeed, attitudes and psychology seem to be important, and this certainly is having an influence on that."
"Ms. Schwartz","Well, maybe it is something we can do together in the sense of really encouraging Americans to think about continuing to save."
"Mr. Bernanke","Yes."
"Ms. Schwartz","Thank you. Mr. Chairman, I yield back."
"Chairman Spratt","Mr. Nunes."
"Mr. Nunes","Welcome, Mr. Bernanke. I am going to switch over to the Fed's involvement in mortgage-backed securities. There has been a report out recently that says--I think Wall Street Journal ran a report that said you are about 10 percent underwater on these mortgage-backed securities. There is currently $480 billion worth, I think is the number that they use. As we look forward, I have a couple different questions related to this. Are you concerned that the risk of the Fed purchases will outweigh the benefits? That is the first question. The second question would be this; the Fed has said that they will buy up to a maximum of $1.25 trillion of mortgage-backed securities. Do you plan to go up to that limit? And if so, by when?"
"Mr. Bernanke","On the first issue, I am not sure about the correctness of that calculation because we have a mix of securities, not just ones we purchased recently, but it is not our anticipation to be selling those off in the market in the near term. Right now we are financing those MBS, which pay coupons of 4 percent or so, using funds which cost us one- fourth of 1 percent. And so there is a substantial flow of revenue that comes in that will offset losses that might occur down the road. So we are pretty comfortable. Obviously there are some issues there, but we are pretty comfortable that this will be providing revenue to the Treasury. That being said, I think the first question is trying to get this economy moving again. And since we took very aggressive actions in the March FOMC meeting to expand our mortgage-backed security purchases and initiate some Treasury purchases, I am not saying this was the only reason, but since then we have seen some significant improvement in financial markets and in the economic outlook. And of course that is the first order, that is the most important thing. What was your other question?"
"Mr. Nunes","The $1.25 trillion; are you going to go up to that limit?"
"Mr. Bernanke","Well, this is a decision of the Federal Open Market Committee. It is like a monetary policy decision. So we will meet and we will evaluate the state of the economy, the state of that market, the state of credit markets in general, and we will have to make a decision. But I can't preview that, we have to make that decision as a committee."
"Mr. Nunes","There is some concern out there and there are some numbers that float out there that basically the Federal Government, in some form or fashion, is involved in 75 percent of all mortgage-backed securities, of all mortgages out there. And I think there is a concern out there that this could create another bubble, a different type of bubble long term where essentially you have the Federal Government owning everyone's home or their mortgage. Do you see this trend continuing? Do you agree with the 75 percent number? Is it lower than that?"
"Mr. Bernanke","Well, it is true that currently almost all mortgages--not all, but a very large proportion of mortgages being originated are passing through Fannie or Freddie or the FHA, which means that they are getting a government guarantee. Those are the only mortgages right now that can be sold into the private markets. So the Fed has nothing to do with that. We are buying Fannie and Freddie's mortgages, but they have already been guaranteed by those agencies, which are now, of course, in conservatorship in the government."
"Mr. Nunes","But we are on the hook for it long term."
"Mr. Bernanke","You are on the hook for it. And I believe that one of the things that this body will want to look at is reform of Fannie and Freddie and figure out how the government's intervention in the housing market ought to be conducted. I think many people are convinced that the way Fannie and Freddie were set up before was not entirely satisfactory, and we need to have some rethinking about what role the government should play in the housing market."
"Mr. Nunes","I want to switch topics just real quick here. I want to go to cap-and-trade and the global warming legislation that is supposedly going to move through this body. And I will be very up front with you, I am strongly opposed, I am strongly against this policy of adding any type of energy tax at all to the American public, especially at this time. I have a real concern about how we are going to compete with China and India and Brazil, who are putting billions of dollars into making energy and making energy cheaper and more available to their people, to their population. And you are an independent guy, you are supposed to operate outside of the Congress. And if someone of your stature would come out and say this is the wrong time to do an energy tax, I think it would send a message to this Congress to stop this energy tax. And so I would request that if you believe this is the wrong time to do an energy tax, that you would come out and say that. I think it would be a powerful statement."
"Mr. Bernanke","I think just from a short-term cyclical consideration, to the extent that there is an energy tax, it would make sense to rebate it somehow so that the net purchasing power is not diminished too much by such an action. But that would be the short-term consideration I would mention."
"Mr. Nunes","So you are not willing to go all the way and say we should not do an energy tax at all?"
"Mr. Bernanke","In the long run, this clearly depends on the assessment of the Congress on the importance of reducing carbon greenhouse gas emissions. I am not a scientist, I can't judge that. If those costs are perceived to be large enough, then some intervention is justified. In addition, though, and I think a point that one should make, is that our doing this alone would probably not help the greenhouse gas situation that much. And so part of our strategy, if in fact we go this way, ought to be to negotiate or work with China and other countries to get them to do the same."
"Mr. Nunes","Well, thank you, Mr. Chairman. I think what we need to do, just to finish up, Mr. Chairman, is that nuclear power is where we should be putting our efforts to have clean energy in this country, not into an energy tax. Thank you, Mr. Bernanke."
"Chairman Spratt","Mr. Larsen."
"Mr. Larsen","Chairman Bernanke, there are some escape hoods right here in front if you need one to try and get away from that question."
"Mr. Bernanke","That is okay."
"Mr. Larsen","But I wanted to chat a little bit and ask a question, but I do want to clear something up. I was just in China as well this last week visiting with a lot of their leaders on the economy, asking some questions and trying to get some perspective. And the characterization that my colleague from New Jersey made about Mr. Geithner's reception was inaccurate. It may have been a little bit accurate when he spoke at Peking University, but I have never talked to a group of college students that didn't take me on either. So there is, perhaps, a disconnect there. But in our discussions with folks from the Central Bank and from the Ministry of Commerce, as well as Vice Premier Wang and some others, there is a real desire for cooperating on the economy with the Chinese. I want to give you a few assessments and ask a few questions, if I might, based on those meetings. The first headline is ``Concerned, Yet Confident.'' There was a general concern shared to us regarding the potential of inflation in the U.S., but not over the next 12 or 18 months, but kind of beyond that time frame. Even then, that concern was tempered by an expressed confidence in the dynamism of the U.S. economy and understanding that the steps we took were necessary and are necessary for our own economic health. ``A signal on the deficit'' would be another headline. The Chinese seem to be looking for a signal on the fiscal deficit, not that it disappears, but that it decreases over time. That is certainly consistent with what you said. The third, ``The Scare Is Gone''--to paraphrase B.B. King. There is an agreement on the assessment ``the worst has passed,'' but there is still not enough signs of improvement. And finally, exit strategy. And this gets to Mr. Ryan's question. I am hoping you can be a little bit more particular about it. Though there is this expectation of some inflation, the Chinese are looking for an exit strategy that gradually withdraws an appropriate amount of liquidity from the market and decreases the chance that you have to purchase our own debt issuance over time. And so the question I have is, what can you tell us about inflation expectations and the Fed's exit strategy with regards to this concern expressed by the Chinese?"
"Mr. Bernanke","Certainly. And I think, not just for the benefit of the Chinese, but for the benefit of the United States and for our own people, we need to explain how we are going to restore fiscal sustainability and avoid inflation. On that latter issue, let me just begin by saying that the Federal Open Market Committee of the Federal Reserve is strongly committed to price stability. We will ensure price stability. Price stability means neither deflation nor inflation. And in the near term, our concern for a time at least was that the recession would be so severe that we would see deflation, and we have taken strong actions to try and avoid that. And I think the fear of deflation has receded somewhat, and that is a positive development. Now, for the time being, we still need to maintain a strong, supportive position in order to help this economy begin its recovery. But as that begins, at some point we are going to need to begin to withdraw the policy of accommodation so that we can avoid any inflation down the road. Basically, the exit strategy is that when the time comes, we need to begin to raise interest rates. That is the usual way that the Federal Reserve tightens policy as the economy begins to recover. And the question is, will we be able to raise interest rates given the size of our balance sheet? My answer is yes. First of all, as I mentioned earlier, many of our programs are short term and can be wound down. That will reduce the size of our balance sheet. Secondly, and very importantly, our ability to pay interest on reserves means that we can raise interest rates by raising the interest rate we pay on the reserves because banks will not be willing to lend in the Federal funds market at rates below what they can earn by just holding their cash at the Fed. We can raise interest rates and then we can tighten policy. Beyond that, we have additional tools. For example, we can do reverse repurchase agreements which will allow us to fund our balance sheet outside the banking system and therefore doesn't have the same effects on the money supply or interest rates. And if worse came to worse, we could sell some of our assets, but that is not a big part of the plan certainly in the near term. There are still other possibilities that we are looking at and that perhaps we can discuss with Congress at some point. But we are certainly, as we look forward and decide what further actions we want to take, we want to be sure that we will be able to remove accommodation at an appropriate time and an appropriate speed to be sure that we don't have an inflation risk down the road. It is not going to be an easy call, but we will have to balance the risk on both sides, not going too soon and stunting the recession, not going too late and having a bit of inflation, but we will get price stability after we get out of this recession."
"Chairman Spratt","Mrs. Lummis."
