"Speaker","Speech"
"Mr. Carnell","Yes. A couple of things, Senator Merkley, if I could. First, the Federal Reserve argument that it needs to be a primary Federal bank regulator to do its monetary policy responsibilities are just not credible, based on facts at several levels. First, right now, the Federal Reserve only has supervisory responsibility for 13 percent of FDIC-insured assets and 10 percent of FDIC-insured institutions, so it is not a significant proportion at all. And then on top of that, our whole commercial banking system only accounts for 18 percent of credit market assets. Gone are the days when banks held 50 percent of those assets, as would have been true when I was born. There is just a big change in the growth of other financial markets and it is just out of touch with reality for someone to suggest that that Fed connection to being a primary Federal bank regulator is essential."
"Senator Merkley","I want to get into some other questions before I run out of time here, but Mr. Carnell, to follow up, you made a comment in regard to bank holding companies, that they exist to allow banks to get into businesses that are, and I am not sure if I caught this quite right, but incompatible with banking or very distinct from banking. Should we be eliminating bank holding companies? I mean, do they serve a-- what purpose do they serve----"
"Mr. Carnell","Well, just so----"
"Senator Merkley","----more risk than value?"
"Mr. Carnell","I don't think we need to eliminate them, but I do think our system has put much too much emphasis on them. I think our focus in banking policy should be on what can banks do and how should they go about doing it. I wouldn't want to leave the impression that bank holding companies had this role as letting do something nefarious. I mean, we are talking about things like opening an office in the next county, opening a bank in the next State. These were things that restrictive laws of 50 years ago didn't allow. And then getting into nonbanking activities, many of which are not allowed in the bank or Congress has passed a law saying they could be in the same corporate family. So it is not that the activities were inherently problematic, but it is that we have this enormous growth of holding company regulation that is really unrelated to any real need other than the fact that we sort of built it up in these loophole-based ways."
"Mr. Ludwig","If I might, Senator, go a little farther, I would say that the comment--I forget whether it was Senator Corker or someone made, that, in fact, what happens when you have to make a decision at the corporate level, you ultimately decide what box to put it in for capital reasons or tax reasons, et cetera, and what happens then at the supervisory level--so I find something wrong in the bank. I can't go to that other entity. That other entity is not being supervised, and in fact, if you look at this current debacle, a great deal of the problem in the larger financial institutions was not in the technical bank. The bank was infected by it. It was actually in the nonbank affiliates that were hard to get to and it was hard to look at the animal as a whole. And if you are really going to be an effective supervisor--after all, everybody has the same interest, a healthier institution--you have got to do the whole piece."
"Senator Merkley","Thank you all. I am over my time. I will just close by echoing concerns about the community banks and also about our credit union system, where they have rules that have constrained their risk, not using prepayment penalties, having interest rate caps, and so forth. They are a little nervous about being rolled into a system with an unfamiliar regulator and perhaps paying fees disproportionate to the risk they impose on the system, and so our community banks and our credit unions may--are a little disturbed that they might not have been so much of the problem but may get rolled into a disadvantageous set of rules, and so of great interest. Thank you."
"Chairman Dodd","One of these things that is going to be important for us, this is not being punitive. I think that is one of the things we are getting into, this notion that because some have been good actors and bad actors, I think we have some history of that. So I think it is really important as we look at all of this, this is not to punish some or discipline some, but rather to try to think in 21st century architectural terms. How do we create an architecture and a structure that makes sense in all of this? And the only thing I was getting at on the assessment issue, because I think putting aside the question of who was responsible for what, just given the magnitude and size and complexity of institutions, I mean, the idea that you would level sort of the same assessments across the board because you have one regulator, to me would be offensive. I mean, you have got to clearly make some distinguishing features. But I hope we can stay away from the punitive quality here as we look at all of this. We can go back and examine, how did we get here and what we are trying to do, and I think all of us agree that, in part, it was this patchwork out there that contributed, certainly, among other things. It is not the only thing. I think somebody made that point, that there are a lot of issues we need to look at. This is one of one. And it isn't going to solve everything, either. I think Bob Corker made the point, and I agree with him on this, is the assumption that if you solve this, you would solve the problem, I think would be false. But clearly I want to get away--because I think you can see that developing, that argument that somehow we are laying--we are blaming institutions by putting them in this. That is not the argument at all. The question is whether or not this makes sense. Let me raise one other question I have for you, and then I will see if anyone has interest in a second round. I wonder if you agree with the Administration's proposal regarding the systemically important financial companies that have a parent or significant affiliate engaged in commercial activities, whether they should be regulated as a bank holding company and forced to divest commercial activities. This is a big issue that is going to be before us. It sort of follows on with Jeff's question, I think, that he raised. Does anyone want to jump into this one? Professor, you sound like you have got some strong views on this, so----"
"Mr. Carnell","I do. I think this is a very troublesome aspect of the Administration's proposal. I should emphasize that I am troubled mainly on its use of political capital. I don't know that--I don't think the substantive stakes are very large here. I will make that more clear in a moment. Go back to the point I made earlier about how bank holding company regulation as a really big deal is unique to the United States. It is a historical quirk of our system. It is something the Federal Reserve got hold of in a context where the Congressional objectives were completely different from what we have now and the Fed was able to expand its authority and make it into a very big deal. Let me actually just make that a bit more clear. The bank holding--there is something in my written statement about this, but the Bank Holding Company Act was passed in 1956 in a populist effort to limit bigness and also to split up some affiliations, like Bank of America and TransAmerica were affiliated at the time. But basically we had--Chairman Wright Patman of the House Banking Committee believed that everything was too big, including $100 million banks, and so he responded with the Bank Holding Company Act. He got trade association support for people who were concerned about banks getting into their business. We are not talking about something that was a safety and soundness statute in its origin. It was a kind of populist antimonopoly statute in its origin. We see safety and soundness come in as a criterion in 1970 as a basis for exceptions on some things. But this was not originally a safety and soundness statute. It was not a statute relating to bank policy. And yet it becomes what my old boss, Jerry Hawk, Under Secretary of the Treasury, said, a matter of theology, where there are people invested in a certain kind of outcome here. And so what they are wanting to do, then, is to conform the existing nonfinancial owners of financial institutions to sort of a very pure version of how they would like things to come out. Now, in fact, nonfinancial institution ownership has saved the taxpayers money. Ford Motor Company put about $1 billion, as I recall, into a thrift institution that had acquired trouble. So there has been positive results. I don't think there have been significant negative results. And this ownership, like General Electric and so forth, was not a source of the current crisis. So the idea of making a big deal out of this is sort of like, as we have seen from some quarters, is sort of like trying to protect us from the Mexican mafia by building a wall on the Canadian border. It is just not related to the major problems."
"Chairman Dodd","Well, thank you for that observation. I want to make the point, I just mentioned to Senator Merkley as he was walking out, I heard him say credit unions. Credit unions are not part of this consideration at all. We are talking about banks. And before we start getting inundated with e-mails and messages from across the country, credit unions, you are OK on this. "
"Chairman Dodd","Let the word go forth from all of this. Senator Corker, any----"
"Senator Corker","No. I think you have just given evidence as to where the real political clout is. "
"Senator Corker","I referred earlier to sot of a super-OCC, and I realize it is sort of that, what you are proposing. As we have looked at the resolution mechanisms that need to be in place so that we don't have the same kind of problem, I think we all understand part of the reason we had the problems we had was there was no resolution mechanism for highly complex bank holding entities and one of the only solutions was to prop them up artificially. So the OCC has argued strongly to keep in place the ability to use taxpayer monies to prop up institutions that fail. The FDIC, on the other hand, has argued strongly against that. I happen to have fallen on their side of the equation and think that having any institution that is too big to fail creates tremendous problems, and I really appreciate what Paul Volcker has said about that recently. But hand-in-hand with this is the notion of how we resolve--in other words, we have the regulator--how we resolve that. You all have already made a great case for this type of arrangement that you want to have. I don't think there is any point in going down that path anymore. I understand what it is you would like to see happen. But what should we do as a it relates to a resolution mechanism and how should that be set up?"
"Mr. Ludwig","Well, Senator Corker, I couldn't agree with you more that resolving the largest institutions is a critical issue and I am not in favor of propping them up. That is, if we don't resolve them, we basically create two problems. One is we have public utilities if we don't have an ability to resolve them. And we also disadvantage the community and regional institutions. Rather, this whole structure ought to be one that creates sufficient stability and focuses in a professional way on proper supervision so as to minimize burden and increase the ability of all these institutions to support the economy of the United States. And where one of these institutions is not doing its job correctly and it gets into problems, we have to have a private sector component here--this is really a private sector activity--where it fails, and we have to have the ability to fail it without creating a systemic crisis. If we don't have that, I think we also have the danger that these largest institutions end up controlling the economy and the Governmental mechanism, not vice-versa."
"Mr. Baily","Can I throw in a comment? I think Gene is absolutely right and you are right. We don't want to have institutions that are too big to fail. We want to be able to have a mechanism by which they can go bankrupt when they make bad decisions. Otherwise, this is not a good system at all. But realistically, I mean, if an airline goes into bankruptcy, you can still have the planes fly, or if a railroad goes into bankruptcy, you can still have the trains go on the tracks. The trouble with a financial institution is that it may get to a certain point where it really can't function without some kind of funding or some kind of support to keep it going. Now, to some extent, that was the justification for giving money to General Motors. You needed money for the suppliers, and I don't want to get into that case which I don't know the ins and outs of. But clearly, we need a mechanism, whether it is a bankruptcy or a resolution mechanism, that has a certain amount of money available to make sure that you don't just close the doors and people can't get at their money. Now, what is in the Treasury proposal is a sort of open-ended checkbook that somebody can write a check for any amount to prop up an institution. So I think that is--I don't agree with that. I think that Treasury proposal is too open-ended, and I think the House and the Senate need to make sure taxpayers are protected and that they have a control over the purse. But I don't think we can, at the same time, just say, no, we are never going to put taxpayer money in again, because the fact of the matter is we will come into another financial crisis and we will end up putting in a lot of money, and it is better to have a resolution mechanism or a special bankruptcy court that has the resources to let this thing down gently, although letting it down."
"Mr. Carnell","Senator, be wary of anyone who puts a lot of stress on the notion that we need a new resolution mechanism. By and large, we had the resolution mechanisms that we needed. I could be a little more specific about that, but just to put it in the perspective. There certainly are some things that could be helpful here, but basically, we had the mechanisms. There were two problems. First, the system had been allowed to go in the direction of internal weakness to such a degree that problems piled up and happened quickly. But mainly----"
"Senator Corker","And how did that happen, by the way?"
"Mr. Carnell","Well, I mean, we are talking about a decade in which--or more specifically, from about 2002 to 2007 in which market participants became increasingly complacent about credit risk and where regulators were not taking the opportunity to strengthen things like capital standards while the sky was blue and the sun was shining, take advantage of that time to build bank capital up. Those would be some examples of things that could have been done in the context. But the key thing is that most of the laws we needed were already in place, and in the case of something that is a bank or thrift, the Federal Deposit Insurance Act is the model for the world in terms of doing resolution, and----"
"Senator Corker","And we used it, but what about in the other examples of how they kind of--I won't name the entities, but our largest entities in the country, what about in those cases?"
"Mr. Carnell","Well, if you----"
"Senator Corker","What type of mechanisms existed that we didn't use?"
"Mr. Carnell","Well, I should emphasize that many of the largest entities in the country are bank holding companies where the biggest part of the firm is the bank. So the law was there available for that. Now, with a bank holding company----"
"Senator Corker","Or the FDIC to come into the bank component itself."
"Mr. Carnell","That is correct, and let me just emphasize that this does not require--it certainly doesn't require a pot of taxpayer money and it doesn't necessarily--FDIC money is not the only thing that is available, because you can--the FDIC needs to satisfy insured deposits. But other creditors can have a haircut applied to their claims and you close the bank one day and it opens the next business day with a new charter, but the same tellers and so forth there. Now, as for the nonbank part of organizations, we do have the bankruptcy courts. There are some changes that would make sense for bankruptcy courts dealing with nonbank financial institutions, for example, to make sure that you can't shop for the court that you think is best, say shop between New York and Delaware or something like that, to make sure that these cases go to judges who have some expertise and some other things to expedite that. But basically, the law is there."
"Senator Corker","I would like for you, if you would, to schedule some time to come in and talk about some of the tweaks on the bankruptcy side. And again, I just want to point out that in many ways on this regulatory piece, we are looking at sort of rearranging the deck chairs, and I think the suggestions that each of you have made have been very helpful, but even after you make those changes, it is that lack of--it is that procyclical thinking that drove us to where we were. The sun was shining and so we were continuing to do more and more instead of reserving up more. And I still haven't heard of a way--it seems like to me that what we are going to do is create sort of a super-regulatory entity, but we still haven't yet figured out a way to cause them to actually not be procyclical. So again----"
"Mr. Carnell","If I could come back to you on that one, Senator, it is a very difficult challenge, and I do not mean to suggest that there is any simple solution to the problem that you--the challenge you pose there. I do emphasize in my testimony the importance of looking at the incentives that regulators have, because the fact is: bank regulators had the tools that they needed, but they did not take action that they could have here. Part of it is a foresight problem, but part of it is also an incentive problem. That is, if you look at it from the standpoint of the particular people making the decisions, what makes sense from their standpoint? Now, in a four-regulator system where there is squabbling over turf, where there is competition for regulatory clientele, it is tougher to look ahead--if you are the person who is looking ahead and said--to take the example--let us go for higher capital standards now, let us raise the standard in terms of your exposure to systemic risk from other institutions. If you look ahead and you are doing the thing that is not considered obvious at the time, you are more open to criticism. And in a multiregulator system, the friction among regulators provides something of a disincentive there. On top of that, where you need to do joint rulemaking with regulators--and that is a requirement under various laws--you know, you run into other ones who say, ``If it ain't broke, don't fix it.''"
"Mr. Baily","Since you want people to be wary of folks like me that think----"
"Mr. Carnell","I do not mean you."
"Mr. Baily","Well, you should, because I think you need to have a certain amount of money available. However good a system you set up, a big financial institution is going to get into trouble at some point in the future. That has always been true, and I suspect it is going to be true again. We can improve regulation as much as we like, but somewhere somebody is going to get into trouble again. And I think we need to make sure that we have a mechanism, whether it is--I think it should be a special bankruptcy court. I do not think you can just pick any judge. I mean, this has to be a judge with special expertise. Or you have a resolution mechanism, and there has to be a way-- you know, this is not just FDIC, because this is not just banks. It is financial institutions more generally. And we have to have a way in which we can keep them operating and that they do not bring the rest of the system down while we are doing it. And if we do not set up that now, then you are going to end up--taxpayers are going to cost a lot of money down the road."
"Mr. Ludwig","Two points, Senator. One is that these systemic problems are really, by and large, governmental problems. They are not institutional problems. So when you say who is going to be looking out, one of the reasons you want to have somebody with a systemic responsibility for looking for systemic problems--i.e., bubbles--that is independent is because if you look historically, it has really been governmental problems into which institutions are dragged, by and large. The second thing is the point you made and the point that Rick made about a single consolidated regulator being less given to arbitrage and, therefore, more likely to be conservative. To some degree, the proof of the pudding is in Canada and Australia. In both those systems, they are both English-speaking countries with consolidated prudential supervisors, and that is all they did. And in both systems, they were quite conservative as regulators in terms of their institutions. Now, I just came back from Canada. I was up a couple weeks ago and spent some time with their finance minister and their head of the central bank and their bankers. And they will all say that their supervisor was a restraining force on them getting into a lot of the problems that our institutions got into."
"Senator Reed","Senator Warner."
"Senator Warner","Mr. Chairman, I will not ask a question. I would just like to make a request to the panel, because it is clear that the panel has got a lot of ideas here. As I think I said earlier, I would love to see more specificity about how we can ensure community banks, smaller banks, are inside a single end-to-end regulator, from assessments to less regulatory, less paperwork. What are the protections we could give beyond division, number one? Number two, Senator Corker and I believe that there needs to be expanded resolution authority at least to bank holding companies, with the FDIC, and the FDIC has raised--and I know you have addressed today, but has raised the concern that if they were--if we took away their prudential supervision, would back-up supervision be enough to have them have their pulse on the status of all of the institutions that they might cover in this expanded jurisdiction. So I would love to have some specific suggestions on how we could address that concern. And then, third, obviously, you know, the Federal Reserve will make the point that, as lender of last resort, they still need to keep their hands in this pie in terms of at least with these larger institutions on the bank holding companies. And I think you have made some very--the whole panel has made a number of valid points about the bank holding companies, but I would love--and, again, Martin, you made the comment about the fact that FDIC and the Fed would be on the board. But what are other ways that we could ensure that the Fed, as lender of last resort, would not lose the expertise that they have? Thank you, Mr. Chairman."
"Senator Reed","Thank you very much, gentlemen. I just have one or two quick questions since I have got the opportunity with this panel, which is rare. Going back to the landscape after we adopt a single regulator, at least hypothetically, should the Federal Reserve continue to have any regulatory authority with respect to State member banks if that is all they are doing in the regulatory sphere? Mr. Ludwig."
"Mr. Ludwig","I would not think so, Senator. I think there is huge advantage to having, just like companies, entities that do things that they do well and focus on them. I think it is better for oversight for the Congress. I think it is better for the agencies themselves. And I think to Martin Baily's excellent point, monetary policy is so essential in central banking functions. Do we really want our Chairman of the Federal Reserve sitting around thinking about either consumer rules or bank supervision rules? Which are not unimportant, but how much can you do in a day? I think one of the problems we have with CEOs generally is how much can you actually accomplish in a day, and I think that is an enterprise that they should give up."
"Senator Reed","Another general question is that this is an opportunity, obviously, and a necessity to look across the board in terms of the Federal regulatory structure, and I think not just in concept of how you regulate banks, but the structure itself of the Federal Reserve. As we cut back, presumably, some of their responsibilities, does their present structure still need to remain the same with regional banks located sort of because the way America was in 1930, not 2010? Does anyone have any comments?"
"Mr. Carnell","I would not try to defend the location of Federal Reserve banks, including, you know, the old thing about why are there two in Missouri. But I do think the Federal Reserve banks play a valuable role in Federal Reserve policymaking. That is, they are not just regional offices that receive top-down directives from Washington. And I think in monetary policy and in a great many other things, they provide a diversity of perspective that is desirable. I would note, by the way, that where a significant proportion of supervisory personnel are currently located in Reserve banks, that same space could be used, if desired, by employees of the new agency, and you would still have, you know, interaction of proximity there. So I would keep the Reserve banks. I would encourage cross-fertilization like that. I do not think----"
