Speaker,Speech,Type,Comments
"The Chairman","And would you go beyond that to put actual limits on it? I mean, we have, for instance, the 10 percent deposit limit. That doesn't seem to me to do a great deal, but would you give the Systemic Risk Council the ability to, in establishing and enforcing a level of bank growth, could they do an absolute limit, so you can't get any bigger? Or would it only be through the capital requirements in other ways?",Speech, 
"Mr. Wallison","First of all, Mr. Chairman, I want to be sure we're talking--the term, ``bank'' is used very loosely. I am talking here about a commercial bank.",Speech, 
"The Chairman","Yes.",Speech, 
"Mr. Wallison","Okay.",Speech, 
"The Chairman","The way you're using it--depository--",Speech, 
"Mr. Wallison","Okay. Yes. And in that case, I don't believe that there should be any limits placed on the size of the institutions. But as capital rises, I think the institutions will be required themselves to limit their growth--",Speech, 
"The Chairman","But you say here, ``The Systemic Risk Council could be authorized to establish an acceptable limit of bank growth and impose appropriate limits on growth that are not consistent with the limits.'' By that, do you mean capital requirements? There's no actual limit?",Speech, 
"Mr. Wallison","No, there's no actual limit on the size of the institution. But as the capital increases the institution will decide to put some sort of cap--",Speech, 
"The Chairman","But--",Speech, 
"Mr. Wallison","I'm not for caps in general.",Speech, 
"The Chairman","All right. The language frankly could have supported that. So you're not quoted in opposition to something--you are talking about strict capital-- What else would the Systemic Risk Council do--because you say here--and obviously I think this is an important possible area of some common ground--you say, ``The Systemic Risk Council would be authorized then to monitor the worldwide financial system, report to Congress and the public on the possible growth of systemic risk, or the factors that might produce a serious common shock.'' Would they have any more power than just to report it to us? Do they just drop it in our laps? Or would you give them any power to do anything other than limiting the capital limits on banks?",Speech, 
"Mr. Wallison","Well, I outlined in my prepared testimony some things in addition that they might do.",Speech, 
"The Chairman","I didn't find any formal things. Help me with it, because I couldn't find any, other than there was a metrics of risk-taking. But the Systemic Risk Council identifies, as you say, the growth of systemic risk factors that might produce a serious common shock--would they be empowered to do anything about that?",Speech, 
"Mr. Wallison","The most important thing that the Systemic Risk Council would do, Mr. Chairman, is to identify areas that were not identified before the current crisis--",Speech, 
"The Chairman","And would they be empowered to act on that, once they had identified it?",Speech, 
"Mr. Wallison","I think the way it would work is that they would instruct the supervisors of the particular institutions. The members of the Council would be the Federal Reserve, of course, the OCC, the FDIC, and so forth. And when the Council saw that there was developing the kind of systemic risks that we have had up to now, which is all--",Speech, 
"The Chairman","Let's talk about what they would do. They give instructions to the regulators. Would they be binding on the regulators?",Speech, 
"Mr. Wallison","I would expect that the regulators would take those actions--",Speech, 
"The Chairman","Well, then we have to write laws. We can't do attitudes. I don't mean to be, you know, pressuring you too much. But I have to write a law here. Would the Systemic Risk Council have the power to order the regulators to act, once they have discovered something? Or would they not?",Speech, 
"Mr. Wallison","Well, I don't think it's possible to order regulators to do anything--",Speech, 
"The Chairman","By statue--",Speech, 
"Mr. Wallison","But if they have agreed to the Council's policies--",Speech, 
"The Chairman","I'm going to stop you here. You could statutorily say that the Systemic Risk Council had the statutory authority to require action. Of course you could. It's a question of whether you want to or not.",Speech, 
"Mr. Wallison","Well, the regulators are part of the Council,",Speech, 
"Mr. Chairman","I don't understand how--",Speech, 
"The Chairman","Does the Council have to vote by unanimous--",Speech, 
"Mr. Wallison","What the Council decides to do--",Speech, 
"The Chairman","Does the vote have to be unanimous on the Council? No.",Speech, 
"Mr. Wallison","I think that's the sort of thing a Council can decide on its own. I haven't run into those kinds of questions--",Speech, 
"The Chairman","Well, I'm going to say I'm disappointed, because you're leaving ambiguities here that are not--I'm sorry, Mr. Wallison, I'm going to finish--that are not appropriate to a statute. So can the fact that one member, one entity as a member of the Council doesn't mean that it might not be in disagreement. And I think you'll leave yourself hanging here when you say we have this Systemic Risk Council and they can report, monitor the growth of systemic risk or the factors that might produce common shock. And then you leave me hanging as to what they do about it. The gentleman from Texas?",Speech, 
"Mr. Hensarling","Thank you, Mr. Chairman. My first question for anybody on the panel who would care to take it is as you analyze the root causes of the economic turmoil we find ourselves in today, I am curious what aspects of the turmoil you can cite as resulting from a lack of regulatory authority as opposed to perhaps mistakes, malfeasance on the part of regulators. Clearly, we have a very large capital markets reform bill in front of us. Some have opined that we had a lack of regulatory authority. I am not sure with the exception of Fannie and Freddie, we have covered that history and battle before, but with that possible exception, I know for example we had testimony from the head of OTS that he had the resources, the financial expertise, the regulatory authority to regulate the credit default swaps of AIG, they just missed it. As we analyze the legislation before us, is it more regulatory authority that we need? Do we need to make sense of the regulatory regime we have before us, or do we just need to figure out a way to get regulators to act smarter and perhaps focus on systemic events that previously they have not focused on? Whomever might want to take that first. Mr. Johnson?",Speech, 
"Mr. Johnson","Mr. Hensarling, I think I completely agree with you on the safety and soundness point, which is that the regulators did have the ability, did have the statutory authority to reign in many of the excesses, including to prevent the abuses of consumers that we have seen, and they did not exercise those powers. That is part of the reason, I think, we should actually reinforce the protection of consumers through a new safety agency, focused just on consumers. I think with regard to banking safety and soundness, on derivatives, perhaps the regulators could have found the authority, but I think they were correctly interpreting the legislators' intent with regard to not regulating many derivatives' transactions, and I think that was a very conscious decision made at the end of the 1990's, which should be re-visited. I think putting that in the legislation makes sense.",Speech, 
"Mr. Zandi","Can I take a crack at it?",Speech, 
"Mr. Hensarling","Sure, Mr. Zandi.",Speech, 
"Mr. Zandi","I think that the reason why this financial crisis evolved into a financial panic last September--I think it was a manageable, albeit greater than garden variety crisis prior to September, it turned into a panic in September because policy makers, including the regulators, the Federal Reserve, the Administration, did not have a clear understanding of what their authority was and how they should use it. That begins with Fannie Mae and Freddie Mac in early September. That extends to Lehman Brothers. That extends to AIG. That extends to Citigroup. I think that goes to a key failing of the current regulatory structure.",Speech, 
"Mr. Hensarling","I have limited time. Let me move onto another line of questioning here. To me, a very fundamental question that we have to examine here is if we either implicitly or explicitly designate firms as being systemically significant, do we not have a self fulfilling prophecy? I am trying to figure out how does one avoid that. If you set up criteria for bank holding companies, there is so much public information there, if you attempt to keep these firms confidential, their names, sooner or later, the market is going to figure out which firms have the implicit guarantee and which do not. We know with Fannie and Freddie how implicit becomes explicit at the snap of a finger and hundreds of billions of dollars of taxpayer exposure/liability later. I just do not understand any mechanism that one steps up, and I appreciate the argument that regulators need to look at individual firms and that through capital and liquidity requirements, maybe there is much they can do to reduce the systemic risk, but once you set up a criteria, I do not know how you do not have a self-fulfilling prophecy and everybody is waiting in line wanting to be the next systemically significant firm. I just do not see how you avoid it. Mr. Wallison?",Speech, 
"Mr. Wallison","It seems to me if we focus solely on the banking industry, we do not have that problem because all banks are regulated. Right now, the largest banks are regulated much more fully than the smaller institutions. One can assume that a large bank is too big to fail, but it does not have to be true. There is a certain amount of ambiguity when you come to a line between the very largest and the less large institutions. We have no idea what systemic risk is. That is one of the major faults in this legislation. What we ought to do is simply make sure that the banking industry is safe and sound and then we do not have to worry about any of the others. The main fault with what the Administration is doing is attempting to extend regulation which did not work for the banking industry across a broader range of our financial system. There is no need to do that. If we focus solely on banks, we can solve almost all of the problems that we encountered in 2007 and 2008.",Speech, 
"Mr. Hensarling","Thank you. It is up to the chairman. I see I am out of time, Ms. Rivlin.",Speech, 
"The Chairman","The gentleman from Pennsylvania.",Speech, 
"Mr. Kanjorski","Thank you, Mr. Chairman. Ms. Rivlin, in your testimony, I am not sure I understood whether or not you were indicating that the Federal Reserve should not be designated as the systemic risk regulator or that it was in fact well qualified to be the gatherer of information and data for the systemic risk regulator.",Speech, 
"Ms. Rivlin","I was trying to distinguish two concepts of systemic risk agencies. One is monitor and gatherer of information for which I think the Fed is very well qualified and should be doing it anyway and it is coordinate with its responsibilities on the economy. I would put that responsibility there. I do not think that it should be the systemic risk regulator in the sense of regulator of systemically important institutions, regulator supervisor of systemically important institutions, because (a) I do not think there should be such a designated responsibility for the reasons we have been talking about. I do not think you should have a list. Second, if you did do that, I sure would not put it at the Fed. I think it would dilute their monetary policy responsibilities and they would not be very good at it.",Speech, 
"Mr. Kanjorski","I agree with you, but I wanted to perhaps attack part of your premise there. I recall very clearly in 2005, the Chairman of the Federal Reserve was testifying before this committee. I specifically asked him a question, whether or not there was a real estate bubble in his opinion, and he said he thought there was, and that the price of real estate was ever increasing, but it was perfectly manageable and it did not constitute a risk to the system. If he in fact were the gatherer of that information and the analyzer of that information, we would have missed the opportunity to have found systemic risk. What is your answer to Mr. Greenspan's lack of perceiving that difficulty?",Speech, 
"Ms. Rivlin","I think he was just wrong. He said that himself. He did not see this one. I think we have learned a lot about bubbles. One thing we have learned is that interest rates is not a perfect tool for controlling them, which is why I would give them more leverage control as well.",Speech, 
"Mr. Kanjorski","I understand that. Let me move to Mr. Wallison because you seem to be talking about that our only problem here in regard to systemic risk exists in financial institutions.",Speech, 
"Mr. Wallison","No. I think the only real problem exists with banks, commercial banks.",Speech, 
"Mr. Kanjorski","Just banks, nothing else?",Speech, 
"Mr. Wallison","Just banks.",Speech, 
"Mr. Kanjorski","Mr. Wallison, testimony before this committee not too many months ago was heard from General Motors, Ford and Chrysler. They appeared together, their CEOs, and I think the CFOs of those three corporations. Their testimony was quite clear that it was their opinion that the failure of any one of them, and particularly Chrysler, who only entertained 7 percent of the car market in the United States, would cause systemic risk if they were allowed to fail, and that was their opinion as to why the Congress should marshal the assets necessary to ``bail'' the three companies out if they needed it, but most particularly Chrysler and General Motors, who at the time did recognize the fact that they needed it. Their total argument was that they both feed off the same dealer base and supplier base. Just the loss of Chrysler Corporation's 7 percent penetration of the market and the use of the dealers and suppliers would bring down all of the suppliers and all of the dealers, and therefore bring down the entire industry. Just recently, on Friday, you probably have read the paper, the question that I would pose to you, I want your idea on the General Motors' problem, but then CIT, most of our regulators concluded that did not constitute systemic risk, I think that is the conclusion. Luckily, they did not need help from the Government ultimately. As I understand the problem, as it was explained to me on Friday, if it had been allowed to fail, that is the factory business that CIT was involved in, that it would have brought down 70 percent of the apparel suppliers in the country, to the extent that the department stores and specialty stores in the retail business in the United States would not have had the inventory to continue their practices. Hundreds of thousands if not several million jobs would be lost in the supplier trade manufacturing and in the retail businesses throughout the country. That came to my attention through a department store owner who called those facts to my attention. Would you not feel that perhaps is a systemic risk and it is not a financial institution--",Speech, 
"Mr. Wallison","In my testimony, Congressman, I looked very carefully at this question of the difference between a systemic risk and mere disruption. We really do not understand what systemic risk is or how it would be created or what kinds of institutions would create it. This is one of the fundamental problems with what the Administration is talking about. In the case of General Motors or Chrysler or Ford, for that matter, or CIT, yes, there would certainly be disruption if a large firm fell. I think the same thing is going to be true of financial institutions other than very large banks. That is why it is such a bad idea to provide to the government the authority to bail out or take control of any kind of institution, because the institutions will always come in and argue that their failure will cause some sort of huge loss in our economy, whereas in fact companies fail all the time. But they don't create a systemic event, just disruption. They get worked out in bankruptcy. Sometimes, they return to full activity. Other times, they are completely unwound. We have to make sure that we know the difference between a mere disruption, which they will claim, and a systemic risk. We do not know how to make that distinction.",Speech, 
"The Chairman","The gentleman from Alabama.",Speech, 
"Mr. Bachus","Thank you. I read something here for the first time. I agree with it. I have thought it. It is from Mr. Johnson, who actually was called by the Democratic Majority to testify. What he says are short-term measures taken by the U.S. Government since the Fall of 2008, particularly under the Obama Administration, have helped stabilize financial markets, primarily by providing unprecedented levels of direct and indirect support to the large banks. But these same measures have not removed the long run causes of systemic instability. In fact, as a result of supporting these leading institutions on generous terms, systemic risk has widely been exacerbated. In other words, the bailouts have actually increased the danger. Mr. Wallison, that is similar--you have said that in a different way, have you not? That we actually are creating a more dangerous environment?",Speech, 
"Mr. Wallison","Yes, of course. Every time we bail out one institution, we create the belief on the part of people in the markets that other institutions that have a similar size or maybe even smaller will also be bailed out, and as a result, great moral hazard is created, as Professor Mahoney made so clear in his testimony.",Speech, 
"Mr. Bachus","Mr. Kanjorski and I were at a meeting with one of the leading hedge fund managers. I will not name his name. The Financial Times said he was the smartest billionaire in the world. He said the same thing you said about Lehman in your testimony. The problem was the markets were shocked. They thought they were going to bail them out because they had bailed out Lehman, which is exactly what you said. I am not sure if you were aware. This gentleman is a very private individual. You all came to the same conclusion. Mr. Johnson goes on to say, and I believe this is absolutely true, some of our largest financial firms have actually become bigger relative to the system and stronger politically as a result of the crisis. The competition has been eliminated. Do you agree with that, Mr. Johnson?",Speech, 
"Mr. Johnson","Yes, sir.",Speech, 
"Mr. Bachus","Executives of the surviving large firms have every reason to believe they are too big to fail. They have no incentive to help bring system risk down to an acceptable level. That is exactly the problem we have today. Mr. Johnson goes on to say that when you have a situation like this, it is either bailout or collapse, but as it begins to affect other institutions, responsible official thinking shifts to bailout at any cost. We certainly have seen that over the past 6 months. Mr. Zandi says, and here is where I think we maybe can all come to a consensus, he said the Treasury and the Fed were seemingly confused as to whether they had the authority or ability to intervene to forestall a Lehman bankruptcy and ensure an orderly resolution of the broker-dealer's failure. The procedure was not in place. Mr. Mahoney today has said give them that procedure, as I understand it. Give them a procedure, but in bankruptcy. Is that right, Mr. Mahoney?",Speech, 
"Mr. Mahoney","That is right. I think the idea of adding another chapter to the Bankruptcy Code makes perfect sense. It is probably the case that the amount of agenda control that debtors have in the standard Chapter 11 bankruptcy proceeding could be disruptive in the case of a large financial institution where you are dealing with some short-term creditors who need to know what is the value of this obligation that I am holding sooner rather than later. I think you could create a quicker, more streamlined procedure. I would draw a sharp distinction between the procedure through which this happens and the substantive rules that will govern it. I think it is important that the substantive rules be the same as they would be for anyone else, which is to say the creditors take their losses in the order of their contractual priority so it is predictable. There is a set of rules that is known in advance, and everyone will understand where they are in the pecking order.",Speech, 
"Mr. Bachus","Mr. Zandi, you said the confusion is the big problem, but if we had the substantive rules that we used in dreadful WorldCom and Lehman, ultimately, you would clear up the confusion. You would have certainty, and the certainty would be that they would go into--you would have an expedited procedure, and you can call that expedited bankruptcy, but it really needs to be there, in my opinion.",Speech, 
"Mr. Zandi","I think the Bankruptcy Code probably would be inadequate for purposes of these kinds of failures.",Speech, 
"Mr. Bachus","If we made the procedure, if we changed the procedure--",Speech, 
"Mr. Zandi","I do not think the courts would be viable for the kind of decision-making that needs to be done as quickly as needs to be done.",Speech, 
"Mr. Bachus","We had a small bank in Washington fail and the FDIC put 400 people on it. Obviously, they would need help from the regulators. I would agree with that.",Speech, 
"Mr. Zandi","To me, too big to fail is more than the interconnectedness of the institutions, it also goes to the confidence we have in our system. You would get bank runs, and if you go into a bankruptcy proceeding, you may be able to solve the interconnectedness problems, but confidence would still be an issue.",Speech, 
"Mr. Bachus","Of course, you said about the regulators that we all know they had a complete lack of understanding.",Speech, 
"Mr. Zandi","And that needs to be changed, but I do not think the Bankruptcy Code is the way.",Speech, 
"Mr. Bachus","I do not know how you give understanding. That is worse than the bankruptcy courts to me. If you gave them the procedure, you gave them a right to do things, and you establish a procedure, maybe we can work together on some things, how we could amend that Code and use the basics.",Speech, 
"The Chairman","The gentlewoman from New York. May I ask the gentlewoman to yield me 1 minute? I did want to respond. Reading Mr. Johnson's point here that short-term measures, particularly under the Obama Administration, I am not sure entirely what he means. I do want to be very clear. Every single activity now characterized as a bailout that is going on in the United States was initiated by the Bush Administration, by Mr. Bernanke and Mr. Paulsen. That is AIG, Bear Stearns, Merrill Lynch, and Bank of America, which was kind of a bailout. That was General Motors, Chrysler. Every single one of them. The first proposal for a bailout that came to the Obama Administration was CIT, and they said no. Literally, every single bailout now going on was initiated in the Bush Administration for the Obama Administration to carry out. Yes, it is true, I agree, I think we all agree that where we are today is a result of the need for the bailouts and then the bailouts have made us more vulnerable. That is why our agenda is to try to do something about it. That is no great point. Sure, we need to do something, but again, there is not a bailout underway today that was not initiated by the Bush Administration. I thank the gentlewoman. The gentlewoman from New York.",Speech, 
"Mr. Bachus","Mr. Chairman--",Speech, 
"The Chairman","It is the gentlewoman from New York's time.",Speech, 
"Mr. Bachus","You took the extra time.",Speech, 
"The Chairman","I asked the gentlewoman to yield. This is the second time the gentleman has done that. I have asked other members to yield. It is disruptive. I have asked members to yield. I would ask the gentleman to pay attention.",Speech, 
"Mr. Bachus","I will be less disruptive in the future.",Speech, 
"The Chairman","The gentlewoman from New York.",Speech, 
