"Speaker","Speech","Type","Comments"
"Mr. Bernanke","Yes, we did cancel that survey for budgetary reasons. But we did so also in the understanding that we could get almost all the necessary information through other means. And we in fact discussed this with Congress. We discussed this with various groups of interest in this area. The most important alternative is the Survey of Consumer Finances, which is a Fed-managed product which surveys families periodically on all aspects of their balance sheets and income. That is an excellent survey instrument for asking small business owners what their situation is, do they have access to credit, what is their net worth, and so on. So what we have tried to do--and I believe this will be successful--is to integrate the key elements of that small business survey into the Survey of Consumer Finances that will allow us to recover most of the information. And then we have a variety of other sources of information that I think will make it possible for us to get a good picture of small business.","Speech"," "
"Ms. Velazquez","Thank you. Thank you, Mr. Chairman.","Speech"," "
"The Chairman","The gentleman from Nevada.","Speech"," "
"Mr. Heller","Thank you, Mr. Chairman. I appreciate the opportunity to spend some time here with Chairman Bernanke. I will try to stay on some of the macro issues as you led us earlier in the hearing. I don't think there is a newspaper out there today that is not talking about the bad economic news that is out there--the Washington Post, the New York Times, the Wall Street Journal. You read them and it is talking about yesterday's hearings. I have a copy of USA Today in front of me that talks about the signs of growing crisis, the Dow being down, inflation being up, the U.S. dollar down, foreclosures being up. All of this, I think, was reflected in your testimony as you spoke with us earlier in this hearing. The only good news I am hearing out there is that by December 31st, the year should be over. I guess what I want to do is touch on a concept or a statement that I hear too often, and that is too big to fail and the systemic economic impact of these financial institutions and their ability to survive or not. And we have obviously recent examples--Bear Stearns, the Fed steps in; IndyMac, the Fed steps in; GSEs, the Fed steps in. I receive a lot of calls from constituents who are concerned about their deposits in other banks including Wachovia, Bank of America, and Wells Fargo. I guess the question I have--and I have heard you say in the past, correct me if I am wrong, that some of these financial institutions should be allowed to fail. I guess my question is, what is the threshold between a financial institution that the Fed should step in versus one that should be allowed to fail?","Speech"," "
"Mr. Bernanke","Well, first of all, IndyMac did fail, and the Fed did not do anything about that. I would add to your constituents, as I mentioned earlier, that all insured deposits were available immediately and no insured depositor is going to take any loss from that. We have in this episode just been confronted with weaknesses and problems in the financial system that we didn't fully--we collectively, the regulators, the Congress, the economists did not fully anticipate. And in the interest of the broader financial system and particularly as always, always the ultimate objective is the strength of the economy and the conditions for--economic conditions for all Americans. We found weaknesses and we had to respond in crisis situations. I think that--while I certainly would defend the actions we have taken, I would much prefer in the future not to have to take such ad hoc actions and, as I described, I think to Ranking Member Bachus, the best solution is to have a set of rules that govern when a bank can be or other institution can be, you know, put through a special process. In particular, we already have such a process for depository institutions, which is a fiduciary process where the requirement is that the government resolve that bank at the least cost to the taxpayer unless a determination by a broad range of financial officials that a systemic risk exists, in which case other measures could be taken. So I think it wouldn't be appropriate for me to try to give you any guidelines right now. I think what we are doing right now is trying to do the best we can to make sure the financial markets continue to improve, and that they begin to function at a level which would be supportive of the economy. I think what is critical is as we go forward, we take stock from the lessons we have learned from this experience and try to set up a system that will be less prone to these kinds of difficult decisions that we have had to make.","Speech"," "
"Mr. Heller","I appreciate your feedback. When we are talking about 1.5 million foreclosures last year, we are talking about 2.5 million foreclosures in this calendar year. And one of the concerns that I get back--keep in mind that I am from Nevada and the impact that foreclosures are having on all of Nevada, especially southern Nevada, and their concern is that as the Fed is stepping in in the Bear Stearns issues, the IndyMacs, the GSEs and they don't feel like the Fed is stepping in enough for the 2.5 million people who are finding themselves without homes. Any comments or reflections on that?","Speech"," "
"Mr. Bernanke","Well, on two dimensions, one is that, as I said, the actions we have taken--obviously it is not always crystal clear to the public. But we have always taken our actions with an eye to helping all Americans. And in particular, if--when we do take actions to try to promote stability in the financial system, we are thinking about the availability of credit, the safety of investments, mortgage credit, all those things which do affect people's lives. So for example, in these discussions of Fannie Mae and Freddie Mac, I have no particular concern about the companies per se but they are very critical right now to the U.S. mortgage markets and there are people out there who would want to get a mortgage, people out there who would hope the housing market can come back, and that can only happen if there is renewed interest and availability to buy homes. So these actions are intended to make our system work for the benefit of all Americans. Now with respect to foreclosures specifically, within our powers we have done what we can to try to address that. We have, for example, given guidance to banks that we encourage them to do workouts. I have talked about the need for loan modifications. When other more temporary measures do not succeed in avoiding foreclosure, the Federal Reserve has also been extraordinarily active at the local level. All of our 12 reserve banks and collectively the entire system have been working closely with NeighborWorks and other institutions to try to assist locally in terms of training, in terms of helping communities deal with foreclosure clusters and the like. So wherever we can, given our national footprint, we have been involved in trying to help. So you know, I would argue that we are addressing this on two fronts. I am first of all trying to help the economy get stronger but also addressing this issue directly.","Speech"," "
"Mr. Heller","Thank you very much.","Speech"," "
"The Chairman","The gentleman from California, Mr. Baca. Then we will go to Mr. Sherman and Mr. Scott on our side. Mr. Baca.","Speech"," "
"Mr. Baca","Thank you very much, Mr. Chairman. Mr. Chairman, a combination of declining wealth, a weak job market probably because of all of the outsourcing and its impact that it has had on working families, rising gas, food prices, and foreclosures have created a downward turn on the economy. To put it into perspective: 94,000 jobs have been lost each month this year; 8,500 families are in foreclosure each day; 2.5 million foreclosures are expected in the year 2008; home prices have fallen, stripping away household wealth and equity; the value of the dollar has dropped between 20 to 30 percent; inflation is raising quickly; unemployment has risen to 5.5 percent; and the real wages have fallen to the level of 2001 value. More importantly is the real impact these numbers have on families. I go back home and my constituents are asking me, what are you doing to bring down the gas prices and what are you doing to help stop the foreclosures? Families are struggling to make ends meet. They are forced to pick and choose between basic necessities that they can afford each month, food, house payments, child care or gas. You stated that the growth in the second half of this year would be well below the trend due to continued weakening in the house markets, elevated energy prices, and tight credit conditions. But you stopped short at predicting a recession. Question number one: Is the worst yet to come? And how would you explain to the average American and to the working families who are feeling the impact every day that we are not in a recession?","Speech"," "
"Mr. Bernanke","Well, Congressman, first I would like to respond quickly to something about your initial statement. You talked about outsourcing and the like. Probably the key source of the job loss we have had is the decline in the housing market, which has laid off construction workers and has had spillover effects through the financial system and so on. At this moment, our trade sector is actually one of the bright spots in our economy that is creating new opportunities for exports and job growth. With respect to whether this is a recession or not, that is a technical determination that a group of economists will make at some point in the future. It has to do with the various criteria. I think I agree with the premise of your question, which whether it is a technical recession or not is not all that relevant. It is clearly the case that for a variety of reasons, families are facing hardships in terms of higher energy costs, declining wealth, and all of the things that you mentioned. So this is clearly a rough time. Whether it is a recession or not, as you point out, is not--","Speech"," "
"Mr. Baca","Do you believe that we are in a recession?","Speech"," "
"Mr. Bernanke","I don't know. And I don't know if the--in fact, I am quite confident that the people who officially will determine that don't know either. In the past--","Speech"," "
"Mr. Baca","Do you feel like the people who are impacted feel like we are in a recession?","Speech"," "
"Mr. Bernanke","Again, I think I would not put much weight on this technical terminology. I mean, I think it is clear that growth has been slow, and that the labor market is weak. And so conditions are tough on families. I have no doubt whether it is technically a recession or not, and I don't see how that makes a great deal of difference. As far as the projection is concerned, we see continued growth, positive growth but weak for the rest of the year. Looking at the housing market, it is beginning to stabilize, at some point around the end of the year, early next year. And with the hope that we can continue to strengthen the financial system, we would hope to see recovery back to more normal levels of growth in 2009. But like all economic forecasting, there are uncertainties in both directions. But with respect to the current situation, again, whether it is a recession or not doesn't really play in our policy decisions.","Speech"," "
"Mr. Baca","Well, let me ask you the other question before my time runs out. You mentioned the housing sector together with the oil is the heart of the current economic uncertainty. How would we eliminate the uncertainty and cause people to have a greater degree of confidence? And should we do something to address the market speculation in oil to help drive down the gas prices?","Speech"," "
"Mr. Bernanke","Well, let me address the oil price situation. I discussed this a bit in my testimony. There are multiple causes, no doubt, for energy price increases. But the most important cause is the global supply and demand balance. The fact that oil, for whatever reason and there are a number of reasons, has not kept up with--oil production has not kept up with the growth in demand for oil particularly in emerging countries which are growing quickly and industrializing. So that suggests that probably the best thing we as a country can do about this is to--perhaps working with other countries, is to promote conservation, alternatives, new energy exploration, all the measures that will help bring us to a more sustainable situation as far as energy is concerned. On speculation, I also discussed this in my testimony. The Federal Reserve is working as part of a task force with the CFTC to look at these issues empirically. But my sense, based on the information I have at this point, is that speculation or, more properly defined, manipulation is not a major cause of oil price increases at this juncture.","Speech"," "
"Mr. Baca","Thank you very much, Mr. Chairman.","Speech"," "
"The Chairman","The gentlewoman from Ohio.","Speech"," "
"Ms. Pryce","Thank you, Mr. Chairman. And I want to thank you, Chairman Bernanke, for being with us today. Thank you for your activity over the last several months. It has certainly been a tumultuous few months. My concern is that we as a Nation, you as the Fed, the Administration, and the Congress seems to be working in a reactionary mode, in crisis mode, that everything that has happened as a result of events. Now I know that you have no crystal ball any more than we have a crystal ball. But we as a committee have responsibility for oversight of the safety and soundness of our financial system. And I just want to ask a very simple question because I just haven't found an answer for it yet. And that is, why did such sophisticated market participants misjudge so badly the risk in the U.S. housing market? Is there an answer that you can impart to the committee to help us understand why we blinked and missed this one?","Speech"," "
"Mr. Bernanke","Well, as we look back on it, we see that there were just some serious failures in the management of risks. There were many firms that had exposure to the housing market in a variety of ways across the firm, including holding mortgages and other ways. And they didn't fully appreciate that in the contingency that the housing boom would turn around, that house prices would begin to drop; they didn't fully appreciate their exposure to that situation. The regulators bear some responsibility on that. It is our job to make sure that they measure and manage their risks appropriately. We have been working on that for a number of years related to bank supervision initiatives like the Basel Initiative, for example, and so on. But it is clear that we need to redouble our efforts to make sure that the risk management is sound, that the underwriting is sound, and that we don't get ourselves into this kind of situation again.","Speech"," "
"Ms. Pryce","Well, you mentioned Basel. Are there further risks ahead to our system and therefore the overall economy that might arise, and the new capital adequacy standards in Basel? You know, if we are trying to have this happen simultaneously, could that create new risk to the system? Effects of a crisis in any overseas market, could that affect our system in a negative way? Further decline in the dollar. There is a list of many things that could potentially happen. One of the things I would like your comment on is the commercial real estate market. You know, many banks astutely avoided the subprime lending, and they instead expanded their commercial real estate lending. So everywhere we turn we see increased vacancy signs and downward pressure on rents. And do we expect another wave of pressure from that market? And are we planning ahead as a country to address these things as opposed to, you know, being reactionary as it seems that we have had to be of late?","Speech"," "
"Mr. Bernanke","Well, on commercial real estate, this was an area where the Federal Reserve and other Federal bank regulators issued guidance several years ago requiring banks that held very high concentrations of commercial real estate to make sure that they were underwriting properly, that they had good risk management. And I believe that guidance, which some people complained about at the time, I think that is going to help us in the near term as we face the situation. Certainly as the economy weakens there is going to be a somewhat weaker performance of commercial real estate. But to this point, we are not seeing anything remotely like, you know, what we have seen in the mortgage market. But it is obviously something we are going to have to keep our eye on.","Speech"," "
"Ms. Pryce","Can you comment on anything that is happening at the Fed in terms of future planning out for other contingencies? You know what I mean. So that we have less of, you know, a reactionary mode in the future?","Speech"," "
"Mr. Bernanke","Well, we are working with our international counterparts in trying to strengthen the regulatory system. You mentioned my mention of Basel. Clearly we learned some of these in this last year and the Basel Committee is looking at places where they should strengthen capital requirements, strengthen liquidity management requirements, and so on. So as that becomes rolled in over time, it will reflect what we have learned from the past year. So even as we are trying to manage the current difficulties, we are also working with other regulators and with Congress to try to make sure that our system would be stronger and that we will emerge from this with a system that is a lot more resilient than we saw in the last year.","Speech"," "
"The Chairman","The gentleman from California.","Speech"," "
"Mr. Sherman","Thank you. First, a few comments. I would like to join the chairman with regard to his comments on your consumer protection efforts. Your statements say that the new rules will apply to all types of mortgage lenders. So for the record I will ask you to refine that a little bit. I can't imagine that those rules will apply to individuals who make loans in order to sell their homes or whatever. I would also note that in your statement you say that despite a sharp increase in prices, production of oil has risen only slightly. And then you go on a couple pages to go on to explain why oil production has only risen slightly. I would add to that--and I am surprised that you didn't mention the fact that OPEC exists for the exact purpose of preventing increases in supply and that the Saudis have oil fields ready to go. They could turn on the spigot and they have refused to do so. Talking about oil prices, there is a lot of talk here in Congress about, well, what can we do to decrease demand by 10,000 barrels a day? Or how can we go drill and get 500,000 barrels a day? There is a worldwide price for oil. And what level of production, or in the case of the SPRO not acquiring for reserves, how many barrels a day would the United States have to deal with in order to really affect the world price of oil? And in contrast, there is a North American price for natural gas. What percentage increase or decrease in supply or demand of natural gas would it take to have a perceptible effect on the prices consumers pay?","Speech"," "
"Mr. Bernanke","Well, first on the lending rules, the Federal Reserve normally issues guidance and rules for the banks that it supervises. But of course as the mortgage market has evolved, more and more mortgage lending took place in nonbank companies, various kinds of mortgage companies, brokers and the like. And our rules will apply to all of those types of companies. In some cases, when they are outside of our enforcement authority, we have to rely on State and other regulators to enforce the rules. And therefore, as part of this effort, we are working closely with them, doing some joint examination exercises, and so on, to try to help them ensure that they will enforce these rules. You made a good point, that the global oil market, about 84 million barrels a day, is large. And so it takes--you know, that very small change in oil supply and demand would not necessarily have a big effect. But I would make a couple of comments on that. One is that the fact that we have to import most of our oil hurts our trade balance, forces us to send money overseas, so to speak. It would be better for the dollar and better for our economic prosperity here at home if we had more sources of energy domestically. So that is one consideration. The other consideration is that--and we can see this in the tremendous movements in oil prices up and down, over a short-term period even though there is a large market, the elasticity of supply and demand, the ability of suppliers or demanders to change their behavior in the short run is quite limited. So sometimes relatively small events like a strike or political unrest in a given country can have a big effect on the price because there is so little spare capacity. So to the extent that that spare capacity could be enlarged and have more flexibility, that could have--","Speech"," "
"Mr. Sherman","Is there any way to give a numerical answer? Would half a million barrels a day affect the price, a quarter million?","Speech"," "
"Mr. Bernanke","Well, any--","Speech"," "
"Mr. Sherman","Can you give me figures on natural gas?","Speech"," "
"Mr. Bernanke","But the short-term elasticity is sort of that a 1 percent increase in supply could lower prices as much as 10 percent.","Speech"," "
"Mr. Sherman","Is that your natural gas answer or does that answer apply to oil as well?","Speech"," "
"Mr. Bernanke","I assume natural gas is similar. Natural gas has more flexibility to use it in electricity generation and so on. So I am not sure it is quite the same.","Speech"," "
"Mr. Sherman","Okay. Now a question for the record relating to Bear Stearns. The rules of capitalism which are applied with a vengeance on Main Street would have said that in a situation like that, the shareholders and the subordinated debt holders should take the losses long before anybody else. But in the deal that was worked out, not only did the shareholders get $10 a share, which I realize is far less than they had hoped for, but the subordinated debt holders are going to get every penny with interest. And I wonder whether giving you the right to demand the conservatorship immediately would put us in a position where we could impose the risks and costs not on the taxpayer but on those who are supposed to bear them.","Speech"," "
"Mr. Bernanke","I agree. We need some kind of resolution regime that will help us do this in a more orderly and predictable way.","Speech"," "
"The Chairman","The gentleman from Delaware.","Speech"," "
"Mr. Castle","Thank you, Mr. Chairman. And Chairman Bernanke, I am going to talk about something else that you mentioned that concerns me in terms of our economic future. At the very end of your testimony, you mentioned that the Board worked with the Office of Thrift Supervision and the National Credit Union Administration to issue proposed rules under the Federal Trade Commission Act to address unfair deceptive practices for credit card accounts and overdraft protection plans. You suggested credit card issuers should alter their current practices. You also note that the Fed has received over 20,000 comments on the proposed UDAP rules. I hope the Fed will be deliberate and take time to closely scrutinize these comments. I presume you share my concern that while we want to protect consumers, we likewise want to maintain a competitive credit card market, and not further damage the standing of the financial services industry. Any comments you have beyond that I would appreciate.","Speech"," "
"Mr. Bernanke","Only to agree with you that both in our mortgage rules and in the credit card rules we want to strike an appropriate balance between increasing clarity and eliminating bad practices on the one hand versus making sure the credit is still available on the other. And that has always been our balance and has always been our concern. With respect to credit cards, we have been using consumer testing quite a bit to see what people could understand, what they do understand about their statements and about the provisions of their contract. And we find that there are some elements that it is just very difficult to explain, like double cycle billing for example. And you know markets work best when people understand what they are buying. And so there may be some circumstances where the market will actually work better and produce more credit in situations where there is not so much distrust and confusion about what it is exactly that is in the contract. And that is the kind of thing we have been trying to tackle.","Speech"," "
"Mr. Castle","Thank you. On another subject, Mr. Ackerman and I have introduced legislation which was numbered H.R. 6482 to determine what kind of structured finance investments are eligible to receive ratings from National Recognized Statistical Rating Organizations. We feel measures like these would contribute to restoring confidence in financial markets. Would you agree that small steps like this one could contribute to the overall stability of our market or any other comments you may have concerning the credit rating agencies and their role, particularly in the housing circumstance?","Speech"," "
