"Speaker","Speech","Type","Comments"
"Mr. Bachus","We talk about Bear Stearns and about the GSEs, about systemic risk because of large financial institutions. Is there a downside to the belief that I think is taking hold in the marketplace that the Federal Reserve and the Treasury will be lenders of last resort for the entire financial system? Don't we run the risk of a moral hazard? And when we do that, what do we do about where private investors participate in the profits? It seems that we are socializing the losses, or the public is assuming those losses. Could you comment on those two things?","Speech"," "
"Mr. Bernanke","Certainly. The recent financial crisis, which has been quite severe, as you know, has revealed a number of weak points in our economy, in our financial system, and they have required attention because we need to have a stable, well-working financial system in order for the economy to recover. In the longer term, I agree that market discipline is the best source of strength in the financial system. We need to take action to make sure that moral hazard doesn't induce excessive risk- taking. I spoke on this subject last week in a speech, and I indicated three directions forward that we could take to make sure that moral hazard is constrained in the future. The first is, now that the investment banks have received some support, in particular they have received access to, at least temporarily, to the discount window, I believe that we need to have legislated consolidated supervisory oversight over those firms that would ensure that they have adequate capital, adequate liquidity, and adequate risk management so they would not be taking advantage of any presumed backstop that they might otherwise see. Secondly, I talked about the need to strengthen our financial infrastructure. Part of the reason that it was a big concern to us when Bear Stearns came to the brink of failure was that we were concerned that there were various markets where the failure of a major counterparty would have created enormous strains on the financial system. One way to address the problem, and I discussed that at some length in my speech and I would be happy to talk more about it, is to make sure that the financial infrastructure, the systems through which lending and borrowing takes place, as well as the risk management of the lenders is strengthened to the point that the system could better withstand a failure, and therefore there would be less expectation of support in that situation. Finally, I think the issues we have approached like the investment banks, these circumstances were not contemplated in other areas like deposit-insured banks. There is a procedure, a set of rules, prompt corrective action, systemic risk, those sorts of things which tell the regulators how Congress wants them to proceed and create clarity in the market about under what circumstances assistance would be forthcoming. As Secretary Paulson has also indicated, I think we ought to be looking at clarifying the congressional expectations for how we would resolve--were the situation to arrive again, how to resolve such a problem.","Speech"," "
"The Chairman","The gentleman from Massachusetts.","Speech"," "
"Mr. Capuano","Chairman Bernanke, I have been listening to the GSE issue, and some people think this is nothing more than a crisis of confidence; maybe we should not do anything and let it wait. It amazes to me to hear this when I have an oil crisis, a food crisis, a Consumer Price Index going up through the roof, job losses all over the place, a trade deficit, a budget deficit going through the roof, corporate losses all across-the-board, and the stock market shaky every single day. I would argue very clearly that this is a little more than a crisis of confidence; I think we have a crisis of leadership. When I say that, I want to except you from that position. I say that because of the actions you have taken. They have been dramatic, bold, and courageous. That doesn't mean I agree with every little detail; I don't want to pretend that. But as far as I am concerned, you have been the leader in this Congress in proving that taking bold action, sometimes action that is a little bit on the edge, helps the economy. It is something that is necessary. I think you are following in the footsteps of some people who really saved this country from disaster in the 1930's. People tend to forget this. In the 1930's, there was no one action, no one silver bullet that pulled us out of the Depression. It was a series of actions, over a decade. Many of those actions were to correct prior actions that maybe they made a mistake on, maybe they acted too quickly and had to adjust it. I don't see that there is anything we can do, unless anyone has a single action that this Congress and this country should take. I think we need more action, and that includes Congress as well. I think we are going to try to do something in the next week or so. We need it from the regulators. I personally think we need more action from the SEC. I think we need faster action by everybody. I think we need more dramatic action by everybody. And I think we need more coordinated action by everybody. Right now, I think we have too many people running around on their own. All that being said, again, I want to thank you for what you have done thus far and to thank you for your bold and courageous moves, as I see it, most recently in the predatory lending area. I would just like to hear your opinion in general, not about the specific proposals we have. I guess I can't escape them right now when the GSE proposal is floating around in all its different iterations. In general, in the crisis that we are in, do you believe that government--that includes Congress, regulators, and everybody across-the-board--but that government should be acting relatively quickly, or do you think that we should simply sit back and say it is a confidence problem and people just need to get over it? Because, honestly, especially in the last day or so, I have been shocked at the number of people who have pretty much said that. I understand people differ as to what we should do. That is fair. That is what this is all about. But to imply or to state that no action is necessary, to me, is completely wrong, and I would just like to hear your opinion on that issue.","Speech"," "
"Mr. Bernanke","Well, you want to take the right actions. Let me say a word about GSEs. The GSEs are adequately capitalized. They are in no danger of failing. However, the weakness in market confidence is having real effects as their stock prices fall. It is difficult for them to raise capital. If their debt spreads widen, it will increase the borrowing costs. As I said yesterday, I think the housing market is really the central element of this crisis, and anything we can do to strengthen the housing market or to strengthen mortgage finance would be beneficial. Therefore, I do think this is one area where Congress needs to think hard about how to restore confidence in the GSEs to make sure that they can carry out the function of supporting the mortgage market, which, right now, except for the FHA-Ginny Mae combination, they are the entire securitization market for mortgages. I think that is an area particularly where action is needed and justified.","Speech"," "
"Mr. Capuano","With that, I yield back the rest of my time because that was the answer I wanted.","Speech"," "
"The Chairman","The gentleman from Texas, who may not be quite so lucky in getting the answer that he wants.","Speech"," "
"Dr. Paul","Thank you, Mr. Chairman. I want to address the subject of the inflation being actually a tax. Today, most of us who go home and talk to our constituents hear a major complaint, and that is the rising cost of living, especially the cost of gasoline, medical care, food, and education. Most economists from all fields, whether they are monetarists or Keynesians, they generally recognize that inflation is a monetary phenomenon. But it is interesting that once we get rising prices, very few people talk about the real source and the cause of the inflation, and they go to saying, well, it's the oil companies. They charge too much. That is inflation. Labor makes too much money, and it is a labor problem. Others just say, well, it's just pure speculation, if we didn't have the speculators, we wouldn't have the inflation. Yet, most people conclude not that we have too much money, but that we don't have enough. If we only had more money, we could pay all these bills, which I think is absolutely the wrong conclusion. What we need is more value in the money. In terms of gold and other commodities, prices aren't really going up. Sometimes they actually even go down. In terms of paper money worldwide, whether the euro or the dollar, the prices are going up. But I maintain really that inflation is a tax. If the Federal Reserve and you as Chairman have this authority to increase the money supply arbitrarily, you are probably the biggest taxer in the country. You are a bigger taxer than the Congress, because they are talking now about a bailout package of $300 billion, and we will have to raise the national debt to accommodate to take care of the housing crisis. But you as the Federal Reserve Chairman and the Federal Reserve Board and the system create hundreds of billions of dollars without even the appropriations process. Then this money gets circulated, and some people benefit--the people who get to use it first benefit, and the people who get to use it last suffer the consequence of the higher prices. So every time people go and complain about these higher prices, they should say to themselves, I am paying a tax. Because whether you are monetizing debt or whatever or catching up for buying up securities, we have had a free ride for all these years. We have been able to export our inflation. We have the Chinese buying up our securities. We haven't had to monetize it. But now it is coming home, and you have to buy these things to prop them up. So I maintain that inflation, as the increase in the supply of money for various reasons is a tax, it is an unfair tax, it is a regressive tax, it hurts the poor, it hurts the retired people more because labor never goes up and keeps up with inflation. We never keep up with the need for retired individuals to keep up with the cost of living. So I would like you to comment on this. Is this completely off base, or is there something really to this? Every time we see the cost of living going up, we indirectly are paying a tax.","Speech"," "
"Mr. Bernanke","Congressman, I couldn't agree with you more that inflation is a tax and that inflation is currently too high, and it is a top priority of the Federal Reserve to run a policy that is going to bring inflation to an acceptable level consistent with price stability as we go forward. I would make one distinction, which is that what the Federal Reserve can control is the increase in prices on the average, over the overall basket of consumer goods and services. The enormous jumps in oil prices and other commodity prices are to some extent at least due to real factors out of the control of the Federal Reserve. The Federal Reserve cannot create another barrel of oil. It is the global supply and demand conditions which are affecting those particulars things to the most significant extent, but to the extent that the Fed does have influence on the overall inflation rate, you are absolutely right that it is very important to maintain price stability, and I take that very seriously.","Speech"," "
"Dr. Paul","But if the oil prices were going up for another reason other than monetary reasons, other prices would have to come down because there would be a limit in the money supply. I think--and the prices are going up today, like I indicated in my opening statement, not necessarily because of the monetary policy of the last year but maybe for the last 15 or 20 years and the fact that we were able to export, so to speak, our inflation. Now it is coming home. Those people who have been holding these dollars are not wanting to buy them as readily. Fortunately, foreign central banks are still not dumping them but even the other central banks might not be as cooperative. So I still see tremendous pressure. I don't see any signs that you are able to do very much because all we hear about is more inflation. You know, it is not so much that they are too big to fail. It just means that everybody needs to be propped up. Congress participates in it. And all the pressure is put on the dollar. It is a dollar bubble. And I think what we are seeing is the unraveling of a dollar bubble that had been building for more than 35 years.","Speech"," "
"The Chairman","The gentlewoman from New York.","Speech"," "
"Mrs. McCarthy","Thank you. And again, I thank you for the work that you have been doing in the last couple of weeks. I imagine it has been very stressful. I want to just ask a couple of questions and see how prepared we are. When I think about the small community banks, the regional small banks, they are going under the same crunches as our, you know, what we are concerned about as far as the larger banks, Wall Street. And even my retirees or those of us who are thinking of retiring in the next 5 to 10 years who have put money away into our IRA, I don't think a lot of people realize that it is only back to $250,000. Is that going to put a lack of confidence in those who are putting money into the IRA? Because this is a country that does not save, and we have been trying to encourage people to save for their retirement. So those who put money into the IRA are now all of a sudden finding a lot of that money is gone again. Is there anything that Congress should be doing for the future? And what tools do you have to help the small regional banks that don't have the ability to go to the Fed for money to help make loans for those who can actually buy homes to get the housing market to go?","Speech"," "
"Mr. Bernanke","Well, to the extent that your constituents have part of their IRA in the form of deposits, you know, they should understand what the limits are of the FDIC protection. Of course, one strategy if they have any concerns whatsoever would be to break up their money across banks or in different accounts and so on. There are obviously ways to get that protection, if that is what you are concerned about. And you know, I have complete confidence in the FDIC, as we all should, in that the deposits that are insured by the FDIC are completely safe and there is not even any break in time between if there were a problem, when you would be able to access your money. So I think we all need to reassure the public that the FDIC is protecting deposits and that there is no need to be concerned about those deposits. With respect to borrowing, all banks can borrow from the discount window, including small banks. Normally they don't as much. They tend to be well-capitalized and strong and they sometimes come to the window. But if they want to, they certainly are free to do so.","Speech"," "
"Mrs. McCarthy","So the school of banks do have the opportunity to go to the discount window?","Speech"," "
"Mr. Bernanke","Yes, they do.","Speech"," "
"Mrs. McCarthy","Okay. I didn't actually know that. So I thank you for that information. Thank you very much. I yield back.","Speech"," "
"The Chairman","The gentleman from Illinois.","Speech"," "
"Mr. Manzullo","Thank you, Mr. Chairman. Chairman Bernanke, earlier this week you took an action to crack down on a range of shady lending practices that have hurt the Nation's riskiest subprime borrowers and also have caused a tremendous amount of economic distress in this country. Among other things, the Fed issued regulations that would prohibit lenders from lending without considering the borrower's ability to repay and also would require creditors to verify their income and assets at the time of the borrowing. These are pretty basic. Although hindsight is a 20/20 issue, and it is easy to sit here and say the Fed should have done this a long time ago, the evidence of this housing bubble has been going on for some time. And my question is, what took the Fed so long to act? And then the regulation you are coming out with is not going to be effective until October 1st of next year. Those are the issues just involving in the subprime borrowers. As to the regular borrowers, you came up with another landmark regulation that says, whenever a borrower gives a check to the bank that the bank has to credit it that day to the borrower's account. I mean, this shows knowledge of some very basic problems that have been wrong in the housing industry. But what took the Fed so long to act? And why wait 15 months before the regulations go into effect?","Speech"," "
"Mr. Bernanke","Well, the regulatory process itself imposes certain time constraints. We obviously have to make sure the rules are consistent with existing law, including State as well as Federal law, that they take make sense economically, and so on. It does take some time to develop these proposals. They are quite elaborate.","Speech"," "
"Mr. Manzullo","Sir, these are not elaborate proposals. These are very basic statements that say that nobody can take out a loan on a house unless he can afford to pay it. What is so elaborate about that statement?","Speech"," "
"Mr. Bernanke","It raises issues according to what kinds of liabilities might be associated with that. Are there circumstances in which--say we have a long-time relationship between a bank and a customer where you don't go through the paperwork, those kinds of questions are still there. And I was just going to add that under any kind of circumstance, we have to have a comment period to get input from the public. We have to revise our regulations.","Speech"," "
"Mr. Manzullo","But you didn't start until December.","Speech"," "
"Mr. Bernanke","So there are two questions. What is the length of the regulatory process, which is basically what we have to do to follow congressional--","Speech"," "
"Mr. Manzullo","The question is, why did you take so long? You didn't do anything until December of last year.","Speech"," "
"Mr. Bernanke","I described in my testimony here in July that we were going to do a top-to-bottom review of all these issues and we were going to act as quickly and as effectively as possible. We began that process and we have supplemented it, as you know, with considerable work on the credit card side. We have worked also in--","Speech"," "
"Mr. Manzullo","Chairman Bernanke, a lot of people in this country are losing their homes. The Fed has the responsibility and the authority. You could have moved a long time ago and stopped a lot of this. I mean why does it take months, if not years, to have a very simple statement that you can't buy this house unless you can afford to make the mortgage? These regulations are not that revealing. You talk about--you need a top-to-bottom review for something this simple? This is inexcusable on the part of the Fed. Notice that I said on the part of the Fed, not you.","Speech"," "
"Mr. Bernanke","Well, at the current moment, as we all know, the subprime market is pretty moribund, and so these rules are important but they are not having much impact on the market. What we hope to do is have rules in place so that when the market comes back, as it some day will, that the lending will be done in a way that is prudent and also supportive of homeownership among people with a more modest means. That is our intention, and we have followed the regulatory principles in order to do that.","Speech"," "
"Mr. Manzullo","And then with regard to regular loans, you have proof, do you not, that homeowners are making payments to lending institutions and the lending institutions are holding on to the checks while the interest grows on the loan and waiting days before applying that money to the principal balance of the mortgage, isn't that correct?","Speech"," "
"Mr. Bernanke","We have addressed in our regulations some issues about servicers and how quickly they have to apply the money to make sure that it is fair and transparent.","Speech"," "
"Mr. Manzullo","It simply says--","Speech"," "
"The Chairman","The gentleman can't ask questions after the 5-minute rule. We have a full, full rostrum. The gentlewoman from New York, I ask you to give me 15 seconds. Chairman Bernanke, quickly, when did you become Chairman of the Federal Reserve?","Speech"," "
"Mr. Bernanke","In the beginning of 2006.","Speech"," "
"The Chairman","And when did you start working on these regulations that were just being discussed?","Speech"," "
"Mr. Bernanke","In 2007.","Speech"," "
"The Chairman","And when did Congress give the Fed the authority to do it?","Speech"," "
"Mr. Bernanke","1994.","Speech"," "
"The Chairman","1994. I don't think the delay is fairly laid at your doorstep given those numbers. The gentlewoman from New York.","Speech"," "
"Ms. Velazquez","Chairman Bernanke, thank you for being here. Since June of 2006, the Federal Reserve has acted consistently with a series of aggressive cuts to the Federal funds rate. However, with the rate now at 2 percent and with rising indicators of inflationary risk, what can the Fed do to support the U.S. economy and force the further decline in the markets?","Speech"," "
"Mr. Bernanke","Congresswoman, as I indicated in my testimony, we at this point are balancing various risks to the economy. And as we go forward, my colleagues and I are going to have to, you know, see how the data come in and how the outlook is changing and try to find the policy that best balances those risks and best achieves our mandate of sustainable growth and price stability. So I don't know how to answer beyond that, other than to say that we are going to be responsive to conditions as they evolve. I noted today the importance of not letting inflation from commodities enter into a broader and more persistent and more pernicious inflation. That is certainly an important priority. But in general, we are going to have to just keep evaluating the new information and see how it affects the outlook. Monetary policy works with a lag. We can't look out the window and do something that will affect the economy today. So the best we can do is try to make forecasts and try to adjust our policy in a way that brings the forecast towards the desired outcome.","Speech"," "
"Ms. Velazquez","Well, Mr. Chairman, I understand all the steps and actions taken by the Fed. But it seems to me that the lending tools are proving to be ineffective at this point. Doesn't this prove that the current economic conditions have moved beyond a liquidity crisis that can be mitigated through Federal lending and is now proven to be a capital crunch?","Speech"," "
"Mr. Bernanke","Well, as the earlier questioner mentioned, dealing with these kinds of problems is multi-dimensional. Monetary policy is one element. Lending is one element. Regulatory policy, both initiated by the regulators and by Congress, is another element. I think we need to address the Fannie Mae/Freddie Mac situation to try to strengthen the mortgage markets. There are many other steps. We have done the fiscal stimulus package. So I absolutely agree that there is no single solution. If there were, of course we would have used it by now. What we need to do is have a sensible, coordinated, and proactive approach that is going to allow us to get through this difficult period and return to the strong underlying growth of this economy, in which I have great confidence.","Speech"," "
"Ms. Velazquez","Okay. Many believe that the losses from the housing market could spill over into consumer and business credit, indicating that the worst may be yet to come. What is your take on that?","Speech"," "
"Mr. Bernanke","Well, there has been a problem in that many banks that have suffered losses from mortgage credit and therefore have had their capital reduced, they either have to raise more capital or if they don't do that, they have to shrink their balance sheets or at least be reluctant to make new loans. So there is some risk of that, that it would spill over to other kinds of credit. In fact we have seen credit tightening in a number of dimensions. Of course there is another factor as well, which is as the economy slows it is natural for banks to be more cautious in their lending because with a slower economy, credit risks tend to rise. So that is a very important issue. We want to be sure that banks are sound and that they have enough capital so that they cannot just be safe and sound, which of course is critical, but beyond that so that they can expand credit in a safe and sound way to promote the recovery and strength of the economy.","Speech"," "
"Ms. Velazquez","Mr. Chairman, every day we hear stories about small businesses being impacted by the credit crunch. And the Fed used to provide the Survey of Small Business Finances. And you have been critical to many policy decisions both at the Federal Reserve and here in Congress. If the survey is discontinued, what alternative sources of information will your agency use to make its report to Congress on the availability of credit to small businesses?","Speech"," "
