Speaker,Speech,Type,Comments
"Mr. Engle","Well, I was just going to say I think an independent NIF would be very effective, but I think it could also be effective if it is within a systemic regulator, housed within a systemic regulator, because a systemic regulator has exactly the same target, has the same goals that you have both phrased, and it would, therefore, give more of a tool for understanding which data series need to be examined, which institutions can be ignored for the moment and would have to be studied later. Without having that being decided by the NIF itself, who would not--since it is responding to multiple regulatory inputs but no authority, would not actually be able to coordinate those decisions.",Speech, 
"Senator Reed","Thank you. Dr. Horne?",Speech, 
"Mr. Horne","Thank you, Senator.",Speech, 
"Senator Reed","Go ahead.",Speech, 
"Mr. Horne","I appreciate it. Well, I think the words come to my mind, and it is probably words you have been hearing often over the past few months in particular, and those are the words ``moral dilemma.'' And I think this is what it is all about, and, again, my esteemed panelists here have brought up the concept of what I think is a moral dilemma. You know, if you are inside of an agency whose job is both to support the financial markets in terms of being directly involved in assisting them in growing and expanding and at the same time regulate them, there is a moral dilemma. If you are inside of an institution whose goal is to make as much profit as possible and at the same time you want to stick within regulatory bounds, you have a moral dilemma. So the issue that we have--and I can only speak for my company--is our goal is if we do not get the data right, we are dead in the water because people will stop buying our data. So our moral dilemma is getting the facts correct, and there is no dilemma. We either get it right or we get it wrong. And if we get it wrong, we are not in business very long. So part of the issue that I have is that I do believe that there is a need for an independent agency inside of the Government to deal with these issues without having to face the moral dilemma. I believe that there are issues that have to be faced by Congress, and it is going to take a little while for that to gel and come together. In the meanwhile, I do not think you can go and continue moving forward with the state of the economy as it is and the current what I call systemic bubbles that are occurring all across the country to continue to occur without having the information necessary to at least in the short term provide information above where you currently are today. And you are in very many cases at a point of stone chisels and knives, I might say, from a data standpoint, turning it into information in comparison to where the commercial market is and the commercial sector is in terms of managing their own information, although I have to say many of these companies, as was mentioned earlier, that I know of personally--because I worked with them in building some of these systems or trying to build some of these systems--are now all of a sudden spending hundreds of million dollars revamping their own internal risk management and analytic systems, including probably all of the top 20 banking and investment firm organizations, have incredible plans moving forward for building their own infrastructures, which in the long run the Government actions relative to what should be done in terms of capturing this data will probably improve their capabilities and, therefore, improve the trade of information and exchange between the two parties. But, again, I think you have a long-run situation where you need to get away from the moral dilemma. I think you have a short-run situation which is you have got to get the information in the hands of the people who can do something about it sooner rather than later, because there are other bubbles on the horizon that could pop, and unless you know that they are happening, unless you understand them, unless you address them, and unless you spend less money than just throwing it at the whole market, you spend it at the appropriate places, you are going to have greater pushback from the taxpayer in terms of being able to have the tools in your possession to be able to do the things that you want to do.",Speech, 
"Senator Reed","Thank you. Senator Corker.",Speech, 
"Senator Corker","Thank you, Mr. Chairman, and I thank each of you for outstanding testimony. There is something very appealing about the presentation which is--and we thank you for spending so much time in our personal office talking about it. I know Senator Reed feels the same way, I am sure. And then there is a piece of it that is almost kind of an eerie feeling. On the other hand, it is sort of the chaos of the market system and the companies you are talking about, Mr. Horne, investing that money to figure out ways of getting a tenth--just a little tenth of a point off, and they are taking advantage of anomalies that exist to make money, and I mean that in a positive way, OK? And then, on the other hand, we are talking about Professor Liechty creating models, if you will. You talk a little bit about NOAA, and NOAA is an interesting analogy except that NOAA is sort of talking about what is going to happen with the weather, and there is nothing you can do about it. I mean, it is just going to happen. On the other hand, you are talking about setting up models to keep anomalies or huge systemic risk occurrences from happening, and I guess how do you, when you are designing these models, keep yourself from sort of interfering from this chaos that can be positive or actually sort of creating self- fulfilling prophecies in some ways by virtue of the modeling that you set up?",Speech, 
"Mr. Liechty","That is an excellent question. It really is, because it comes to the heart of--this analogy does break down when you start thinking about the financial system because it is not a bunch of pressure systems and equations that you can model. It is just much more complicated than that. It is a game, really, is what you are thinking about, a very large- scale game. And I think if you borrow from the general scientific tradition, the first thing that you try to do in science is understand and explain. The second thing you try to do is predict. And then, finally, you see if you can have any level of control. It is kind of this progressive improvement that happens in your ability to gain scientific knowledge and understanding about a system. I am not sure how far we can go in terms of that path. I really--I am not certain because we haven't gone down that path in the research sense. But I think there are a lot of things you can borrow because it is a game, and if we begin to study it from a number of different perspectives and build a competing set of models. I want to just kind of echo what Governor Tarullo said and what Professor Engle said, is that you really do want--even to have this independent, you do want to have multiple people contributing to it. You can take, for example, kind of the hurricane modeling approach. There is not one model that is used to model hurricanes. When they start looking at hurricanes, they use a collection of competing models that then give them a multiple set of perspectives about how that hurricane is approaching and the impact. Now, would we potentially impact--I mean, would the National Institute of Finance or a systemic regulator potentially impact the path of the economy if they interceded in certain ways? That is a very hard question for me to answer. I am not sure. But I do believe that we can start to find answers to those kind of questions if we set up this kind of analysis. And we can at least, if we do no more than we do with the weather and begin to understand when there are really serious risks, when we learn how to potentially prepare ourselves better for those type of events that are occurring, then I think we will have made important progress in this arena.",Speech, 
"Senator Corker","If you are setting up models, though, to try to ensure that a systemic risk does not occur and information is being made public, do you not automatically in some ways affect the economy or affect at least financial markets? I mean, how can you not do that if that information is being made public? It seems that is self-evident that that is going to occur.",Speech, 
"Mr. Liechty","Well, I think that for the large--when people approach the financial markets, they typically approach from the statistical perspective. Even though it is a whole bunch of individual agents interacting with each other, it is too complicated typically to really model effectively. There are some folks at Los Alamos and there is a really big simulation study over in Tokyo. I know there are IBMs involved with where they are trying to do Asian-based modeling. But typically, you have to sit back and look at aggregate summaries and model it from that perspective. Now, we have a lot of information that is already about the financial markets that is widely disseminated and we would be talking about adding additional information on top of that. I think where you start to begin to have problems or people begin to influence is if you have people all doing the same type of behaviors, so lots of people are making mortgage-backed securities and securitizing them and selling them off to pension fund, and there are lots of similar behaviors happening and then a shock comes through and everybody has to respond in a similar fashion. Then, in some sense, the model collapses down to a much simpler system because everyone is forced into a corner in the way they are going to have to behave. For the most part, I think giving more information and trying to model it is not going to have an impact, because I don't know that anybody is going to really have the ability to nudge the system one way or another. But what you hope you will find is when the system gets to a point where there, in essence, are bubbles that could be collapsing and what might trigger those bubbles, how you respond to that is going to be very carefully thought about, and is going to have to be very carefully thought about by the systemic regulator and the other regulators when they have that information. Do they want to talk to banks quietly? Do they want to make a public announcement? These are things that you are going to have to think very carefully about, and I am not prepared to lay the guidelines out right now.",Speech, 
"Senator Corker","So you are not really thinking about creating a world full of elevator music or anything. We would still have some degree of chaos in the marketplace.",Speech, 
"Mr. Liechty","Yes, sir. It would be very complicated.",Speech, 
"Senator Corker","OK. Professor Engle, it sounds like you want to respond to this, and you are welcome to do that, but you also mentioned about making information available. Just for laymen like myself that obviously are at a whole different level as far as mathematic modeling and all that, what would be--for other Senators who might be tuned in, staffs or whatever--what would be the first three pieces of public information you think that might come out of an institute like this that would be helpful for people to know?",Speech, 
"Mr. Engle","Well, I think what I was going to say before is also related to this. The systemic regulator is going to have to use the incentives in the marketplace to achieve his goals. He is not going to be able to just legislate one thing or another, and our use of capital standards, capital controls, are ways of trying to nudge the institutions to take less risk or change their behavior in one way or another. Systemic taxes are very much designed to encourage institutions who have systemic risk to avoid the taxes by shedding the systemic risk if you can define and devise the systemic tax in exactly that way. The reason I think that making data public is useful is quite easily seen in the OTC derivatives market, where every time you enter a contract, you have a counterparty. And this counterparty has a risk that they will not perform. If the derivative turns out to have the value you want it to, then your counterparty may not perform. So we have to consider there being these extra risks, and it is very hard to assess the risk that your counterparty is going to be there if you don't know very much about what the counterparty is doing. So if we had more information on the health of counterparties, in other words, how much exposure they had to these same kinds of contracts, then the prices of the same deal with two different counterparties might not be the same. There would be a risk premium and you could decide whether you wanted to take the weak counterparty or the strong counterparty and you would get a different price in those contracts. That way, you would understand what risks you were taking and the weak counterparties would not be able to amass big positions. The poster child for this example is AIG, who, of course, wrote lots of credit default swaps but didn't have enough capital behind it, and investment bankers and final users bought a great deal of these contracts and insurance products without recognizing that actually they should have gotten a big discount on getting them because they weren't really so likely to pay off because AIG had such a big position. So if you could make public information on a basis which said, for each counterparty, how exposed is this counterparty-- how many positions does this counterparty have maybe a week ago on these kinds of contracts? This would give the market a way of evaluating the risk that they were taking with each counterparty. I think it would also encourage trades to move toward exchanges or centralized counterparty where you might not have to produce this information. So I think that the transparency has a dual role in this case. It would encourage the migration of products to centralized clearing, which is something that we think would reduce systemic risk, and it would allow investors to understand the risks and price the risks they are taking better and thereby both of these would reduce systemic risk.",Speech, 
"Senator Corker","Professor Liechty, I have two more questions.",Speech, 
"Senator Reed","Go right ahead.",Speech, 
"Senator Corker","Professor Liechty, how long would it take-- you know, we talked a little bit about this in the office, but let us say something like this became law in the summer of 2010. How long would it take before an entity like this was at least providing some of the basic information, not data, but information that would be useful to someone who is looking at systemic risk or other prudential regulators?",Speech, 
"Mr. Liechty","Sure. I am not an expert in this, but I have spoken to a number of folks who built up large institutions and teams of this nature. It does speak to the fact that you really want this institution to be an institution of very high stature. You want very high-quality individuals in this. To the extent you can build a world-class institution, it works in favor, I think, of all of us in the economy. The way you would start out, of course, is you would take existing data that is in the marketplace that you can find, pull together many of the ways that Steve is talking about, and augment that potentially with other types of reports you could require from the banks that would be fairly straightforward. I believe within 18 months to 2 years, you would be able to put together some preliminary, rudimentary maps of the entire system. You would be able to start seeing things like aggregation, some of the really simple low-hanging fruit. Everybody is heading in the same way in a trade, or someone has got outstanding positions that are really too large for that institution, like the AIG example. You would then, I believe, move yourself toward integrating counterparty information that is in the repositories, DTCC and the other clearinghouses, and I would see this being multi- stage, multi-year. So you would have a focus initially as to what can you get from the existing data and what science do we need and models do we need to build from that. You might be able to borrow from existing models and augment those. And then you will have another path, in my view, that would be doing longer-term, more sustained research. I would imagine that it would probably take somewhere, 6 to 8 years, in that timeframe, to see yourself walk all the way up to the full vision that we would see with a National Institute of Finance where you have a very fine-grained view of the entire counterparty network and be able to do large-scale simulations to understand how different types of shocks to the economy might work through that network and where the critical points of that network are and how they might have cascading failures or where you might see liquidity crises occur. But I would envision within 8, potentially 10 years, you would see a fully functioning institute, and certainly along the line you would see some very valuable information come out within shorter timeframes.",Speech, 
"Senator Corker","Thank you very much, and go ahead, Mr. Horne.",Speech, 
"Mr. Horne","Yes, Senator, if I may add, I think the difference between what we are talking about here is mostly the fact that the NIF, I think--and again, this is my opinion, I am not going to speak on their behalf--but they are really talking about building a very structured approach toward managing risk, standing back and building models that can take all different sorts of views and all sorts of different looks at this problem and over periods of time be able to ascertain how to best approach these problems from an academic and regulatory approach. What we are trying to do, which is a little different, in the short-term and hopefully becomes a foundation or platform for what eventually the NIF is trying to do, and I don't know if the two pieces will ultimately fit together, but I do believe that we are extensible where that is a possibility, is that the data that is available right now today is capable of being integrated into a platform where regulators can start looking at the governance rules that are in place today and start figuring out, just as compensation analysts do, just as people who have to deal with the same problems. If you think about a compensation analyst inside of a large corporation, you have a huge sales force that is saying, OK, I am going to try to break every rule I possibly can so I can make the most money I possibly can, and I am not concerned about profit because it is not built into my compensation. Well, some portion of their compensation ends up having profit built into it. Then they say, well, wait a minute. I am not responsible for all the mechanisms that drive my product, so therefore maybe I shouldn't be responsible for profit. So you start getting into all these different types of analogies of how you should compensate people and how you should incent people to move forward. Well, the same issue is true in the financial markets. This moral dilemma that I brought up earlier is the same problem. You brought up the issue to Professor Engle about the fact, well, couldn't you--or to Professor Liechty--couldn't you actually influence what these markets do? And what I am thinking is it would be better to use the nearer-term, the shorter-term data that we are talking about now to try to help with some of the governance and regulatory rules to get people on the same path and same direction, and possibly those are things looking at specific pieces of law today that, you know, may be in conflict with systemic risk. The uptick law, for example, and I don't know how familiar you all are, but with shorting issues out there, you know, that could be a major driver of systemic risk. As a weighted value in a model, if you were to take that out and put that in, you may find that right off the bat, there is a factor there that maybe should be reconsidered relative to law. And what I am saying is from a governance perspective, if you have the information in the short-term to be able to do some of these things, then these models become incredibly valuable over time because they start really showing the dynamics and the interconnections and all the points of potential failure that can exist within the market. But in the near term, you have got to use some of the information that can be converted out of the data to figure out how to manage. And I am not talking about big government. I am not a big believer in big government. I am a believer in better government and better governance. And what I believe we have got right now is a lot of broad-stroke rules that don't allow for the surgical precision of attacking the problems where they exist. And with this information, you would have the ability to do so, and that is the difference between what we have today and what we could have. And by going through this process of cutting out certain things that make no sense whatsoever and maybe putting some governance back into the process, we could be on the same page so that the institutions and the government and the taxpayer are not facing the moral dilemma with each other.",Speech, 
"Senator Corker","I noticed Professor Mendelowitz.",Speech, 
"Mr. Mendelowitz","Thank you. I really would like to go back to one of the issues you raised a few minutes back about interfering in the market. We rely on markets, in this case financial markets, to allocate capital because they do it efficiently, and we know from history when other societies have tried to rely on command and control systems to do those kind of functions, they failed miserably. But for financial markets or any other kind of market to do its job, which is to allocate scarce resources efficiently, there have to be a number of conditions met that make it possible for the markets to do that, and as you well know, if they are not present, the markets can't. The challenge in financial markets is that it is clear, and this recent crisis is the most glaring example of it, financial markets are prone to the financial equivalent of sudden cardiac arrest, and I would like to take credit for that, but it wasn't my analogy. It was a professor at MIT who came up with it. And that government intervention was needed to deal with this equivalent of sudden cardiac arrest. Now, maybe extending the analogy is a bit much, but there was a time when if you suffered sudden cardiac arrest, there wasn't much the medical profession could do for you. Then we moved to a stage where there are some sort of dramatic interventions at the point of a heart attack. Until now we are at the situation where you stave off sudden cardiac arrest with long-term care. You take statins to lower cholesterol and vulnerability. You are more careful about what you eat. You exercise, a little bit healthier lifestyle. And you, in effect, are able to reduce the risk of the sudden cardiac arrest. What we are talking about with what the NIF can contribute is, in fact, the sort of financial market equivalent of a healthier lifestyle, to preserve the efficiencies that you get out of the financial markets.",Speech, 
"Senator Corker","Thank you very much. I know I have gone on for a long time and I am sure you have a number of questions.",Speech, 
"Senator Reed","I don't. If you have additional questions, Bob, go ahead, please.",Speech, 
"Senator Corker","I have lots of questions. We spent a great deal of time with each of you and I have gotten a chance to know you, and I am sure that Courtney and Michael and Arlene and others will be talking with you over the course of the next week or so. I would ask, Mr. Horne, you mentioned you were looking at housing in North Carolina and Tennessee. I don't know for what reason. Maybe to purchase, I hope.",Speech, 
"Senator Corker","But I wondered if you would tell me why and what you found. I wouldn't be a good Senator from Tennessee if I didn't ask.",Speech, 
