Speaker,Speech,Type,Comments
"Senator Bayh","Good afternoon, everyone. I am pleased to call to order this Subcommittee for the hearing entitled ``Equipping Financial Regulators with the Tools Necessary to Monitor Systemic Risk.'' I want to thank my Ranking Member, Senator Corker, and Senator Reed, my friend and colleague, and their hard-working staff for requesting this hearing on an issue that may seem technical to some, but will prove critical as we work to reform and modernize our regulatory structure for the future. I would also like to welcome and thank our able witnesses who are here today and thank our staff who have been instrumental with regard to technical aspects of this analysis. I am so happy to continue the dialog that we have already begun on how to equip our regulators to move beyond examining individual institutions and toward monitoring and managing systemic risk across our financial system. To our witnesses that will appear on two separate panels, welcome and thank you for appearing before the Subcommittee to give an outline on regulators' current capabilities to collect and analyze financial market data and, most importantly, what additional resources and capabilities are necessary to provide effective systemic risk regulation. I understand very well that the weather in Washington the last few days has not been ideal. As a matter of fact, some of our witnesses have been stranded here for several days. So I appreciate the dedication you have shown in making it here today, and we promise to be, accordingly, most merciful in our questioning. Before I turn to Governor Tarullo--and, Dan, thank you again for appearing before the Subcommittee; you have been here very ably on other occasions--I would like to submit a few comments for the record. I have a somewhat lengthy statement given the technical nature of the subject matter. I would like to submit that for the record, but will not read it. Is that all right with you, gentlemen? Very good. Hearing no objection, I will go ahead and do that.",Speech, 
"Senator Bayh","Before introducing Governor Tarullo, first, Senator Reed, perhaps you would have some comments you would like to share.",Speech, 
"Senator Reed","Very briefly, Mr. Chairman. I would like my statement submitted to the record also. I want to welcome Governor Tarullo also. I want to thank you for holding this hearing at the suggestion of Senator Corker, and this is a vital area and could, I think, be overlooked. But it is incredibly important. What we all witnessed over the last several years is not only great market turmoil but great market uncertainty. My impression of a lot of the problems with Lehman, with Bear Stearns, with AIG is the fact that regulators and other banking institutions had no idea where their liabilities, their risks, their counterparty exposure lay, and there was no systemic way to calculate or aggregate that information. And as a result, I think the regulators were flying blind, essentially, doing the best they could, trying to work things out, but a lot of it was just sort of flying with instruments that were not working in bad weather. It was more seat-of-the-pants than systemic regulation. So one of the things I think we have to do is create a repository of information available to regulators, available to the public with appropriate delays, so that the system is much more understandable and that, when there is a shock to the system, markets do not react out of fear, they react with some knowledge. Thank you, Mr. Chairman.",Statement,STATEMENT OF SENATOR JACK REED 
"Senator Bayh","Thank you, Senator Reed. Now, we have on this Committee become accustomed to something we call the Corker rule, where violating--or not violating, actually a breathtaking, refreshing difference from senatorial custom, Senator Corker is known for his brevity in opening statements. But since you request the hearing today and I know this is a major priority of yours, perhaps you would have some opening comments you would like to share.",Speech, 
"Senator Corker","I will be very, very brief. Number one, thank you for having this hearing. I know it is Friday afternoon. It has been snowing, and a lot of us are trying----",Statement,STATEMENT OF SENATOR BOB CORKER 
"Senator Bayh","We have been trying since Tuesday to have this hearing.",Speech, 
"Senator Corker","Right, but I thank you so much, and I want to thank Governor Tarullo for always being available and helping us think through these complex issues. Our second panel especially, Governor Tarullo, has, I know, been holed up on hotels and hanging around for several days to cause this testimony to actually occur prior to recess. I think everybody knows we are hopefully working toward a regulatory reform bill. It is important to get this testimony into the public record so we can potentially act upon it. So we thank you all for being here, for your ideas, and with that, Mr. Chairman, as you walk out the door, thank you so much for having this hearing. I appreciate it.",Speech, 
"Senator Reed","Thank you, and on behalf of Senator Bayh and Senator Corker, let me introduce our first witness, Daniel K. Tarullo, who is a Governor of the Federal Reserve Board. He is an expert in international finance. He received his education beginning at Roxbury Latin School, and then he went on to Georgetown University, Duke University, and graduated with his law degree from Michigan. Prior to assuming his responsibilities at the Federal Reserve, he was a faculty member at the Georgetown Law School and prior to that served in the Clinton administration as Assistant Secretary of State for Economic and Business Affairs and other important responsibilities. Again, Governor, thank you for your presence, and we look forward to your statement.",Speech, 
"Mr. Tarullo","Thank you, Senator Reed and Senator Corker, and thank you both for your attention to a subject whose importance to financial stability is, as Senator Reed said a moment ago, often overlooked in the broader debates about reform. Good information is crucial to the success of any form of regulation as it is to the success of any form of market activity. But many features of financial activity make the quality and timeliness of information flows even more significant for effective regulation. Most important, perhaps, is the interconnectedness of financial services firms. In few other industries do major players deal so regularly with one another, as a result of which major problems at one firm can quickly spread throughout the system. The financial crisis revealed gaps in the data available to both Government regulators and to private analysts. It also revealed the relatively undeveloped nature of systemic or macroprudential oversight of the financial system. With this experience in mind, I believe there are two goals toward which agency and congressional action to improve data collection and analysis should be directed. First, to ensure that supervisory agencies have access to high-quality and timely data that are organized and standardized so as to enhance their regulatory missions, including containment of systemic risk; And, second, to make sure such data available to other Government agencies, to private analysts, to academics, in appropriately usable form so that the Congress and the public will have the benefit of multiple perspectives on potential threats to financial stability. My written testimony details some of the initiatives at the Federal Reserve to enhance the type and quality of information available to us in support of our exercise of consolidated supervision over the Nation's largest financial holding companies. I would stress also, though, the importance of using that information to regulate more effectively. The Special Capital Assessment we conducted last year of the Nation's 19 largest financial firms demonstrated how quantitative, horizontal methodologies built on consistent data across firms could complement traditional supervision. It also showed the importance of having supervisory needs and knowledge determine data requirements. We are building on that experience and adding a more explicitly macro prudential dimension and developing a quantitative surveillance mechanism as a permanent part of large-firm oversight. While there is much that the Federal Reserve--and other agencies such as the SEC--can do and are doing under existing authority, I do believe we will need congressional action to achieve fully the two goals I stated a moment ago. There are a number of specific areas in which legislative changes would be helpful. Let me briefly mention three. First, it is very important that Government agencies have the authority to collect information from firms not subject to prudential supervision, but which may nonetheless have the potential to contribute to systemic risk. Without this ability, regulators will have a picture of the financial system that is incomplete, perhaps dangerously so. Second, it appears to me that greater standardization of important data streams will only be achieved with a congressional prod. This objective of standardization has for years proved elusive, even though most observers agree that it is critical to identifying risks in the financial system. Third, there will need to be some modifications to some of the constraints on information colleague by Government agencies, such as authority to share that information with foreign regulators or to release it in usable form to the public. Since privacy, proprietary information, intellectual property, reporting burden, and other important interests will be implicated in any such modifications, it is most appropriate that Congress provide guidance as to how these interests should be accommodated in a more effective system of financial data collection. Finally, as you consider possible legislative changes in this area, I would encourage you to consider the relationship between the authorities and responsibilities associated with data collection and the substantive regulatory authorities and responsibilities entrusted to our financial agencies. Generally speaking, regulators have the best perspective on the kind of data that will effectively advance their statutory missions. Indeed, without the authority to shape information requirements, their effectiveness in achieving these missions can be compromised. This is all the more important given the current state of knowledge of systemic risk in which there are as many questions as answers. In these circumstances in particular, the insights gained by supervisors through their ongoing examination of large firms and of markets should be the key, though not the exclusive determinant, of new data collection efforts. This does not mean that agencies should collect only the information they believe they need. The aim of providing independent perspectives on financial stability means that other data may be important to collect for the use of private analysts, academics, and the public. The agencies can certainly be asked to collect other forms of information that are important for independent assessments of financial stability risks. But I think this relationship does counsel considerable symmetry between regulatory responsibility and data collection. Thank you for your attention and, again, for having this hearing. I would be pleased to try to answer any questions you might have.",Statement,STATEMENT OF DANIEL K. TARULLO, MEMBER, BOARD OF GOVERNORS OF THE FEDERAL RESERVE SYSTEM 
"Senator Reed","Well, thank you very much, Governor Tarullo. Let me first ask the question that this need for better information is not exclusive to the United States. Could you comment on how other G-20 countries are trying to deal with this and the need for not just a national approach but an international approach?",Speech, 
"Mr. Tarullo","Certainly, Senator. A number of other regulators and overseers around the world have already begun to address the issue of information, among them the various organs of the European Union and the United Kingdom, the Bank of England. The G-20 itself has issued a couple of recommendations that are particularly salient to this question on developing a template for reporting of information of the large internationally active financial firms. Now, this is, of course, not an easy undertaking for any one nation much less for the world as a whole, but it is something which the Financial Stability Board has taken on as a task. There have been some preliminary discussions on how to organize the work of trying to see if we can come to agreement on a template for reporting of the largest, most globally active financial institutions. It is far too early to report progress there, Senator, but I can say that the effort has been launched.",Speech, 
"Senator Reed","Well, thank you, Governor. As you know, as we are proceeding down, and I think appropriately so, a legislative path which we hope will incorporate this systemic collection of information, I have got legislation in--and, in fact, I want to thank Dr. Mendelowitz and Professor Liechty for their assistance and help. But this is going to have to be an effort that goes beyond the United States to understand that, but I think it is important that we begin here. Another aspect of this international question is the issue of sovereign behavior. The Greek Government now is in a very serious crisis which is rattling the markets. There also is some indication that another one of our favorite topics, derivatives and credit default swaps, have come into it. Apparently, there are reports that investment banking firms have helped them legally avoid treaty obligations under Maastricht, et cetera. But the long and the short of it is, do we also have to include sort of sovereign entities in terms of data collection?",Speech, 
"Mr. Tarullo","Well, Senator, I think that one of the lessons that the international community drew from some of the sovereign debt crises of the late 1990s and the very early years of this century was that there needed to be more transparency associated with a lot of sovereign debt issuance. And the International Monetary Fund undertook to create special data dissemination standards which would provide more such information. Generally speaking, I would distinguish between the sovereign information and private financial system firm information since we as regulators obviously have a mandate over private firms rather than certainly over sovereigns. It is relevant, though, for us in thinking about systemic risk because, to the degree that our large institutions have significant exposures to sovereigns which may conceivably have difficulty in servicing their debt, that becomes a matter of concern for the private financial regulators as well.",Speech, 
"Senator Reed","One of the issues that repeatedly is made-- points, rather than issues--is that, you know, too big to fail is the first chapter, but the second chapter is too interconnected to fail. And that raises the issue of a focal point on large institutions might miss small institutions that could cause systemic risk. In fact, you know, there is the possibility that multiple failures in small institutions could have a systemic problem. So how do we sort of deal with that in terms of these interconnections? I mean, traditionally, it is easy for us to go to a big financial institution and say report X, Y, and Z.",Speech, 
"Mr. Tarullo","Right.",Speech, 
"Senator Reed","How do we capture everybody, not in a pejorative sense but in a data sense?",Speech, 
"Mr. Tarullo","Sure. So let me distinguish while trying to address both the data collection and the regulatory supervisory side. I think with respect to data collection, there is little question, in our minds, at least, that the data collection authorities of U.S. Government agencies need to extend beyond the universe of firms which are subject to prudential or even market regulation. For the very reasons you suggest, a large number of intermediate size firms can themselves have a substantial amount of financial activity, which, although not necessarily associated with systemic risk in any one firm, in the aggregate can define an important phenomenon or trend or development in the economy as a whole. So we do think there needs to be that kind of authority in our financial regulators to gather the necessary information to round out the picture. When it comes to supervisory or regulatory authority, the three of us, at least, have been in this room on a number of occasions talking about the choices that we have in front of us, and one of those choices is going to be how broadly to cast or to draw the perimeter of regulation. Will it be only firms that own banks? Will it be firms beyond that which are thought to be themselves systemically important? Or will it be some broader set of firms above a certain size? And I think those issues are probably going to be more difficult to resolve than the data issues, where I personally, at least, think there is little argument against the proposition that you need to gather this information.",Speech, 
"Senator Reed","Thank you.",Speech, 
"Senator Corker","",Speech, 
"Senator Corker","Thank you. And, Senator, I want to thank you for raising this up. I do not think we would have met with our next panel without you having brought this forward, and I think you are actually responsible for all of this being brought to our attention. So thank you very much.",Speech, 
"Senator Reed","Thank you, Senator.",Speech, 
"Senator Corker","I appreciate that. Governor, I think you are probably familiar with the National Institute of Finance, as it has been proposed, and they have discussed certainly it being done in an independent way. I think you maybe would allude more to that happening at the Fed itself. But I am wondering if you could talk to us a little bit about the pros and cons of what you know their proposal to be from the Fed's standpoint.",Speech, 
"Mr. Tarullo","Certainly, Senator. So this will not surprise you to hear that I think there are some advantages and disadvantages to each of the different organizational options that you would face. One such option would be the creation of a single, free-standing agency that would have overall responsibility for all the financial data collection and a good bit of the analysis. On the other end of the spectrum would be presumably just giving more authority to a single U.S. Government--existing U.S. Government agency and saying why don't you fill in the gaps? As I suggested in my written testimony, there is probably an option in between as well, particularly as you go forward with thinking about overall reg reform. To the degree that a council emerges, as I think it might, as an important center for coordinating the oversight of systemic risk in the United States among all the various U.S. Government agencies, we may want to lodge some of the data responsibilities in the council as well. The basic advantage, I think, of the single agency is what one would infer, which is you have a single group. They can take an overview. They can say let us try to prioritize, let us try to figure out where the most important unknowns are, and we will devote our activities in that direction, and we will do so in a way that we are not always stumbling over one another because we are just one agency. Some of the costs associated with the single agency--quite apart from out-of-pocket costs, which are nontrivial, but costs in the sense of non-immediate monetary costs--would include, I think, some risk that you detach data collection from the process of supervision, the process of regulation. And I do think it is important and I think our experience over the last couple of years has borne out the importance of having those with the line responsibility for supervising and regulating being able to shape the kinds of data collection that they feel are necessary in order effectively to regulate or to supervise. In the middle of the crisis, for example, it became apparent to some of the people at the Fed that getting information on the kinds of haircuts that were being applied to some securities repurchase agreements was a very important near-term piece of information in trying to assess where the system was at that moment. If that capacity had been lodged in an independent agency, with some of its own priorities perhaps and having to go through a bit more of a process, there may--and I emphasize ``may''--have been some delays in getting to that end. So I think that, as with everything, there are going to be pluses and minuses. It will not surprise you to know that from a somewhat--from the perspective of 20th and Constitution, there would be concerns about losing the capacity to shape and act quickly on informational needs. But I hasten to add that here, as with systemic risk generally, I do not think anybody at the Fed believes that the Fed should be the sole or even the principal collector and analyzer of data. This has got to be a governmentwide priority.",Speech, 
"Senator Corker","The information that you receive now, the data, how realtime is it? And I would assume during a crisis it is very important that it is daily. And then how granular is it today?",Speech, 
"Mr. Tarullo","So that varies considerably, Senator, from data stream to data stream, and I think the subject--let me be clear just that when some people say ``realtime,'' some people mean ``immediate'' by that; that as a trade happens, the data, the information about the trade is immediately available to regulators and possibly the public. For most of our supervisory purposes, that kind of literally realtime data is not critical to achieving those supervisory purposes. And, of course, as you all know, true realtime data is a very expensive thing to put together. But timely, meaning in many instances daily or end-of-the-day trading, is very important for making an assessment on a regular basis as to the stability of a firm that may be under stress. One of the things that became clear, I think, during the crisis--and for me became particularly evident during the stress tests last spring--was the substantial divergence in the capacities of firms to amass, to get a hold of their own data, to know what their own trades were, to know what their own counterparty risk exposures were. So one of the things that we have actually been doing in the wake of the Special Capital Assessment Program is placing particular emphasis on the management information systems of the firms, requiring that they themselves be able to get a hold of the data on trades or counterparty exposures or certain kinds of instrument--certain kinds of involvement with certain kinds of instruments, because if they can get a hold of it for their own internal purposes, we will be able to get a hold of it pretty quickly. So right now it is actually not so much a question of our telling them, ``Send us something you have on a daily basis.'' It is in many instances as much a matter of making sure they have the capacity to derive that information from their raw computer records and then to send it to us.",Speech, 
"Senator Corker","May I ask another question, Mr. Chairman?",Speech, 
"Senator Reed","Yes, sure.",Speech, 
"Senator Corker","You know, of course, we all tend to try to find a solution that is unique and maybe alleviates a lot of just the daily work it takes to be good regulators, right? And a lot of what happened this last time could have been prevented with the tools we had if we just maybe had been a little more effective in regulating the way that we should have and Congress overseeing the way that it should have. But there were certainly lots of issues that caused this last crisis, if you will, to unfold. So we have had this wonderful presentation that we are going to hear next, and, you know, we envision having all this, at the end of the day, realtime type of data so we know positions throughout our country, so that regulators have the ability to know if something that is putting our country in systemic risk is occurring. What should we be concerned about there from the standpoint of having this thing that sounds really neat and costs money, how do we prevent it from being something that really is not that useful but is collecting a lot of data that I imagine takes place throughout this city that is not utilized? And then, second, I would imagine that data like that collected in one place could be used for pretty nefarious purposes if it got into the wrong hands. If we actually have it and collect it, what should be our concerns in that regard?",Speech, 
