Speaker,Speech,Type,Comments
"Mr. Tarullo","OK, so with respect to your first question, I mean, I do think that the efforts of the group of academics and others who have been promoting the NIF and certainly the efforts of the National Academy of Sciences in convening that workshop have been very valuable in drawing attention to and moving the debate forward on the data needs that we really do have. And I think, Senator, just to underscore something I said earlier, the absence of data from the shadow banking system was certainly problematic in retrospect. I think that the degree to which the tightly wound, very rapid shadow banking system was channeling liquidity around the financial system and, thus, the rapidity with which it came to a screeching halt once things began to break down, is something that was at least underappreciated by even those who foresaw problems ahead. So I do think that there is--and I do not think it is a coincidence, by the way, that some of the names I saw on the list of participants in that workshop that the NAS held were the names of scholars who have written, quite insightfully, I think, on the substantive causes of the crisis and of the way in which adverse feedback loops began when things moved into reverse. So I do think we need additional data sources. Now, how to make sure that every dollar of governmental funds spent on this are spent most wisely and how to make sure that we do not demand a lot of private expenditures that are not going to useful purposes is the kind of question that I think we all confront all the time in any Government regulatory or data collection effort. And I guess I would say that that is where some of the principles that we suggested in my written testimony I hope will be of some help. Keeping the regulator and supervisory agencies closely involved and, I would hope, the prime movers of these data collection efforts I think will help because whether it is the SEC or us or the CFTC, we are going to be most concerned in the first instance with achieving our statutory missions. And so for us that would be the consolidated supervision of the largest financial holding companies and also, obviously, our monetary policy and financial stability functions. That I think is one way to do it. I think a second way would be to make sure that there is some thought about new requirements coming forward. This is why OMB has the rules they have. And as you know, we think maybe some of the Paperwork Reduction Act features need to be changed around the edges. But there is a good reason why that act exists because you do want to put the brakes on people just willy nilly saying we would like new data sources. I think actually the council, if a council of regulators were created or the President's working group could formalize such an effort, I think it would be useful to have different agencies actually thinking about what new data sources may be important and having a debate precisely to guard against any one maybe going a bit too far afield from its own regulatory mission. On the protection issue, obviously there are, as I mentioned, these important interests, proprietary interests, IP interests in some cases where vendors are involved, privacy interests where individuals are involved, a little bit less, obviously, with some of the things we are talking about. We ought to continue to have those protections. But it is also the case that our country I think wants to be protected from financial instability, and my conclusion at least is that the efforts to identify potential sources of financial stress and risk throughout the economy is not something that one or even a whole group of Government agencies should be the sole actors in. I think we do need to enable analysts, private analysts, finance professors, people who have expertise but are not in the Government, to look at what is going on in the economy to offer their views to you, to us, to the American people, and let us all filter through how much of that may be well grounded and where we might disagree. If we are going to do that, we have to figure out how to get this data into a sufficiently aggregated form so as to protect proprietary information, but to make sure that it is really useful to somebody out there who is trying to do an analysis and have some insight into what is going on in the subprime mortgage market or over-the-counter derivatives or anywhere else.",Speech, 
"Senator Reed","Well, thank you, Governor Tarullo, and you have reminded me, I have to thank also the National Academy of Sciences because we asked them to convene that meeting and I am pleased that it produced positive results in your view and other people's view, but thank you very much.",Speech, 
"Senator Corker","I thought maybe you were going to ask another round. If I could just ask one more question----",Speech, 
"Senator Reed","Yes, and I might have one, but go ahead. You go first.",Speech, 
"Senator Corker","No, go ahead. Absolutely.",Speech, 
"Senator Reed","Well, it sort of--no, why don't you go, because this is not Abbott and Costello, but you are ready.",Speech, 
"Senator Corker","So a number of us have been looking at speed bumps, ways for us not to be faced with resolution. We obviously, if we have resolution, want to ensure that this whole notion of too big to fail is not part of the American vocabulary. But we have had numbers of entities in recently-- today, yesterday, the day before--talking about contingent capital and the ability to take unsecured debt in an institution that is moving into problem areas and converting that immediately to common equity. I know that is a little bit off topic, but there is a lot happening. We are going on recess next week. I just wondered if you might have some comments regarding that. It is something that I think is gaining more and more attention.",Speech, 
"Mr. Tarullo","Sure. Actually, Senator, we have been paying a good bit of attention to that in the Federal Reserve. I got together a group of Board staff and staff from some of the Reserve Banks to try to think through some of the potential options here. So let me first begin with a little taxonomy because different people mean different things when they talk about contingent capital. There are at least a couple of concepts here. One is a concept under which a firm would issue a specific kind of instrument which would have debt-like characteristics under normal circumstances, but by the terms of the instrument would itself have a conversion to equity when some trigger event happened. The concept behind that tends to be the following. There is a period during which a firm may still be somewhat healthy, but is beginning to deteriorate, and if capital levels go down to a certain level there will be a loss of confidence within the markets and counterparties with respect to that firm. So if at that point the trigger means that all of a sudden there are X- billion dollars more of common equity in the firm, that might provide a reassurance and stop a slide downward, and I will come back to that in a moment. A second concept is really one which is as much about the potential insolvency of the firm as it is stopping the slide. So some have proposed, for example, that all subordinated debtor all forms of debt other than specified senior tranches of debt would, at some moment, which would probably be the equivalent of when you are on the verge of insolvency, convert to equity, thereby, in effect, helping to move forward what would be a resolution process under another name, because now you have way less debt on the liability side of your balance sheet and more equity. The first is, I think, the concept that has intrigued some academics, some regulators, and, I must say, some investment bankers who probably see the opportunity to create some new forms of investment. The big issue there--there are a number of technical issues, but I think probably the biggest is what is the trigger going to be. If the trigger is supervisory discretion, you probably have an issue because everybody is going to be wondering whether the supervisor is going to pull the trigger for exogenous reasons, or when the supervisor would pull the trigger. It would create a good bit of uncertainty in the markets. A second option is that you have the trigger tied to the capital levels of the firm. Now, that still involves some supervisory discretion, but it is within the context of an ongoing regulatory system. The problem there has been that, as you know, capital tends to be a lagging indicator of the health of a firm. Many firms, 2 months before their insolvency, looked like they were adequately capitalized, and so unless we get a quicker adjustment of capital levels, that probably wouldn't do the trick. A third proposal is to have a market-based trigger, a trigger that might, for example, be the relationship between common equity and assets or something of the sort, or the market price of the--a lag market price of the firm related to assets, something that gets the market in as the trigger so that nobody can manipulate it in any way. The concern that one hears from a lot of people about that approach is that it can induce a kind of death spiral in the firm, whereby people begin trading against--when they see the price go to a certain level, they begin trading against it. So my personal--and this is really personal, this is not the Board--my personal view is that all three of these approaches have significant problems. I personally just have excluded full supervisory discretion as a real option. But I think it is worth pursuing the technical challenges around both the market-based trigger and the capital trigger and that is what we have asked our staffs to do within the Reserve Banks and the Board, to see if there is something here which can be-- and this is important--which can be a less expensive form of capital for the banks. I don't want to create anything that costs more than common equity for the banks. That is kind of a feckless undertaking. But if we can figure out a way to have a capital instrument which is there in the exigent circumstances but which costs less than common equity on a normal basis for the firms, I think that is something worth pursuing. I am sorry I was long-winded, but as you can tell, we have actually been analyzing this.",Speech, 
"Senator Reed","Thank you. It did give me time to think of a question.",Speech, 
"Senator Reed","No, just a comment, because I think Senator Corker, as always, has raised a very interesting point, and this is a comment. When push came to shove, all the varieties of capital, risk-based capital, were essentially disregarded, the stress test, the tangible capital, or am I overstating or misstating?",Speech, 
"Mr. Tarullo","So our focus--so here is what happened, what I found so interesting during the crisis itself. During the crisis itself, private analysts, who are operating on the basis of less than full information, of course, and regulators both found themselves focused on common equity. Now, some of the market guys called it tangible common equity, but basically, it was common equity. And I think that what all of us, if we didn't already believe it, and some of us did, but if we didn't already believe it, what all of us concluded from this exercise was that common equity needed to be an even more important component of the equity of financial firms going forward. The stress tests, the SCAP, were conducted with the assumption that--or under a set of standards that looked to the common equity levels as well as the traditional tier one levels, and I think, Senator, that regulators around the world whom we talk to in the Financial Stability Board, market analysts, and the financial institutions themselves have all converged around the proposition that common equity really and truly is far and away the most important--not the only, but the most important component of regulatory capital. Why? Because if it is adequate, it allows the firm to continue as an ongoing institution. There are some forms of equity, tier two--excuse me, capital--tier two capital, which will be available to protect the Deposit Insurance Fund or senior creditors, but not to keep the firm going on an ongoing basis. And since I don't think any of us relish the thought of another go-around of major challenges to major financial institutions, I think we are all focused on finding the best way to maintain higher levels of common equity--when I say all of us, I don't just mean regulators. I think that is a market imperative, as well.",Speech, 
"Senator Reed","Thank you. We had a sidebar which we don't need to continue about Basel II. I think we do have to spend some time thinking hard about the rules of capital going forward. But just two quick comments about the issue at hand. I don't want to trivialize this, but essentially, this center would be on patrol for bubbles in the economy, things that could cause, you know, not in one forum but throughout the economy, real problems. Is that too simple, or is that----",Speech, 
"Mr. Tarullo","No, I don't think it is too simple, and if I-- so if I can hearken back to a sidebar we had in a different hearing where you and I were talking about--I mentioned several times in the written and oral testimony the need for independent views of things, and this is something which I have always believed, but my conversations with you have reinforced it in this context, that no matter how good a job I think the Fed can and will do, or no matter how good a job in market regulation I think the SEC can and will do, the uncertainties around financial stability are always going to be significant because stresses and problems arise in new ways. And so I think it is important for us to foster within the government but also outside of the government the ability of multiple agents to make a judgment on this. Now, I guess I think that this is something which is best-- within the government is best pursued in a collegial fashion, which is why the council occurred to me. I think if we are doing our analyses and the SEC is doing its and Treasury is doing its, bringing those together in council discussions and determining whether there needs to be a different kind of analysis or initiative seems to me to make a lot of sense. It may also make sense--again, responding to something you suggested to me a while ago--it may also make sense to have a council have at least a smallish staff of people who themselves are dedicated to looking at all of this and maybe doing some heterodox analyses. So I think I am all in favor of that, and actually not all in favor of it in the sense of we wouldn't oppose it. I personally think it is an affirmative good.",Speech, 
"Senator Reed","Thank you very much.",Speech, 
"Senator Corker","I know we need to move on with the subject at hand. I would like for you to, in writing, maybe respond, just so we can get something on the public record, regarding how--going back to the collateral or the capital we were talking about a little while ago, using maybe a quarterly stress test that was made public, thinking through how something like that might help us. But I know we don't have time for that today.",Speech, 
"Mr. Tarullo","OK.",Speech, 
"Senator Corker","We again thank you so much----",Speech, 
"Mr. Tarullo","Happy to do it.",Speech, 
"Senator Corker","If you could do that in the next few days, that would be wonderful.",Speech, 
"Mr. Tarullo","OK, Senator.",Speech, 
"Senator Corker","Thank you. Thank you very much, Mr. Chairman.",Speech, 
"Senator Reed","Thank you, and I will call the second panel forward. Thank you all, gentlemen. Let me introduce the second panel. First, Dr. Allan I. Mendelowitz. Dr. Mendelowitz is a Washington-based economist and housing finance expert. He is the co-founder of the Committee to Establish the National Institute of Finance and the former Chairman and member of the Board of Directors at the Federal Housing Finance Board, where he served two terms. Thank you for your assistance on this issue, Doctor. Thank you very much. Our next witness is Professor John C. Liechty. Professor Liechty is the Associate Professor of Marketing and Statistics at the Smeal College of Business at Pennsylvania State University. He is also the co-founder of the Committee to Establish the National Institute of Finance. Thank you very much, Professor. We are also joined by Professor Robert Engle. Professor Engle is the Michael R. Merlino Professor of Finance at the New York University's Stern School of Business. Professor Engle was awarded a Nobel Prize for Economics in 2003, along with his colleague at the time, I presume, Dr. Granger at the University of California at San Diego. Our final witness is Stephen C. Horne. Mr. Horne is currently the Vice President for Master Data Management and Integration Services for Dow Jones Business and Relationship Intelligence. He specializes in data integration and analysis of large quantities of disparate data from thousands of sources and the improvement of marketing productivity from the resulting information. Thank you very much, Steve, for returning. Dr. Mendelowitz, please.",Speech, 
"Mr. Mendelowitz","Thank you, Mr. Chairman. Thank you,",Statement,STATEMENT OF ALLAN I. MENDELOWITZ, FOUNDING MEMBER, THE COMMITTEE TO ESTABLISH THE NATIONAL INSTITUTE OF FINANCE 
"Senator Corker","I am really very pleased to be here today as a representative of the Committee to establish the National Institute of Finance and to bring the recommendations and findings of that committee. The Committee to Establish the National Institute of Finance is an extraordinarily unique group, based on my three- and-a-half decades of experience in Washington. I have actually never seen anything like it. It is a committee that has raised no money. It is a committee that represents no vested interests. It is a committee where no single member has any personal financial interest in the outcome of our recommendations. It is a committee where we have covered our expenses, what they are, out of our own pockets, and because we never organized as a 501(c)(3), we don't even get the tax benefits associated with those expenditures. What it is, is it is a group of extraordinarily talented and, in many cases, very distinguished members, all brought together by the commonly shared view that the Federal Government and the regulatory communities lack the data and lack the research capability to effectively monitor and regulate systemic risk, and for that matter, to effectively monitor and regulate financial institutions and markets. We have come together to propose a solution to that inadequacy in the Federal Government's capability and that solution is the National Institute of Finance. And we view the National Institute of Finance as addressing the weaknesses, both respect to data and research and analytical capability, and I can't stress the importance of the research and analytical capability enough. A lot of time was spent with the earlier panel discussing data and there was far less mention of the analytical capability. The reality is, we do not have a particularly good understanding of how financial markets work because we have never had the kind of sustained research effort that would yield those insights. Despite the fact that there are research departments at large financial institutions, there is a lot of good research being done by very talented people in academia, there are research departments in the regulatory agencies, but at the end of the day, the research efforts never had access to the appropriate data or to the sustained funding to do the kind of work that would provide the analytical tools needed by regulators given the challenges that we face today. And that is why in our proposal for the National Institute of Finance we would have two key components: One, the Federal Financial Data Center; and the second, a Federal Financial Research and Analysis Center. We think the structure of the institute should be set up in a way that ensures that it can, in fact, play its key role. It would be, as we indicated, an independent agency, ideally. It would be an independent voice on issues of financial risk, regulation, and policy. It would be independent for several reasons. One, it hopefully would be free from political influence. Second, it would be free from having to investigate its own decisions and actions. As long as the institute is not a regulatory agency, it is untainted by the fact that if it were investigating itself, it would be given an impossible challenge and an impossible task if you are looking for really truly independent, high-quality assessments of what is going on. Third, the institute would be self-funded, and it would be self-funded for a couple of important reasons. One, fairness. It is our understanding, based upon the research that we have seen and the discussions we have held that adapting the common data standards associated with the Federal Financial Data Center would produce a significant reduction in operating costs on the part of financial institutions. Because it would get this benefit, it is only fair that some small share of those savings would be used to fund the operations of the institute. Second, given the burdens placed on the taxpayer and the taxpayers in this most recent crisis, it is not appropriate that taxpayers should be asked to pay for the monitoring of an industry which has already imposed a tremendous burden on the taxpayers. And third, there are certain benefits in the ability to compensate staff and attract folks that go with being funded with non-appropriated funds that would make it more competitive. All of this is critical and it, of course, would yield multiple benefits. It would yield substantial benefits in terms of improving the efficiency and effectiveness of financial regulation. It would reduce the likelihood of a future systemic event. It would make U.S. markets safer and more competitive. It would reduce the operating expenses of financial institutions. And the kind of standardized data that would be required would go a long way toward addressing one of the problems that Governor Tarullo mentioned when he commented on how he was surprised to find out that financial institutions actually didn't have a good handle on what their own exposures were and they didn't have ready access to that kind of data. Last, I just want to say how pleased we are that we learned last week that Senator Reed introduced S. 3005, the National Institute of Finance Act of 2010. That Act is structured in a way that creates a National Institute of Finance along the lines that we think would be essential to making it effective and we were really very appreciative to see that legislative measure. That concludes my oral comments and I will be happy to answer any questions you or the Committee may have.",Speech, 
"Senator Reed","Thank you very much, Doctor. Professor Liechty, please.",Speech, 
