"Speaker","Speech"
"The Chairman","The hearing will come to order. I want to express my appreciation to Members on both sides for joining us today. There is a great deal of interest in the country on what we plan to do next year. The purpose of this is to focus on where we go from here. We have two panels. The first panel consists of experts, many of whom have had responsibilities in the past but who do not now have governmental authority. That was a deliberate decision on my part so that we did not have to get clearances from various entities but could get the best thinking from thoughtful and experienced people. The second panel will consist of representatives of the financial institutions themselves. I have spoken with the Minority, and we have agreed to 15 minutes on each side for opening statements to accommodate the members. With that, we will begin with the chairman of the Subcommittee on Capital Markets, the gentleman from Pennsylvania, Mr. Kanjorski."
"Mr. Kanjorski","Mr. Chairman, we have reached a crossroads. Because our current regulatory regime has failed, we now must design a robust, effective supervisory system for the future. In devising this plan, we each must accept that regulation is needed to prevent systemic collapse. Deregulation, along with the twin notions that markets solve everything while government solves nothing, should be viewed as ideological relics of a bygone era. We also need regulation to rein in the private sector's excesses. In this regard, I must rebuke the greed of some AIG executives and agents who spent freely at California spas and on English hunting trips after the company secured a $123 billion taxpayer loan. Their behavior is shocking. The Federal Reserve must police AIG spending and impose executive pay limits. If it does not, I will do so legislatively. After all, the Federal Reserve's lending money to AIG is no different from the Treasury's investing capital in a bank. Returning to our hearing's main topic, I currently believe that the oversight system of the future must adhere to seven principles: First, regulators must have the resources and flexibility needed to respond to a rapidly evolving global economy full of complexity and innovation. Second, we must recognize the interconnectedness of our global economy when revamping our regulatory system. We must assure that the failure of one company, of one regulator or of one supervisory system does not produce disastrous, ricocheting effects elsewhere. Third, we need genuine transparency in the new regulatory regime. As products, participants, and markets become more complex, we need greater clarity. In this regard, hedge funds and private equity firms must disclose more about their activities. The markets for credit default swaps and for other derivatives must also operate more openly and under regulation. Fourth, we must maintain present firewalls, eliminate current loopholes, and prevent regulatory arbitrage in the new regulatory system. Banking and commerce must continue to remain separate. Financial institutions can neither choose their holding companies' regulators nor evade better regulation with a weaker charter. All financial institutions must also properly manage their risks, rather than shift items off balance sheet to circumvent capital rules. Fifth, we need to consolidate regulation in fewer agencies but maximize the number of cops on the beat to make sure that market participants follow the rules. We must additionally ensure that these agencies cooperate with one another, rather than to engage in turf battles. Sixth, we need to prioritize consumer and investor protection. We must safeguard the savings, homes, rights, and the financial security of average Americans. When done right, strong consumer protection can result in better regulation and more effective markets. Seventh, in focusing financial firms to behave responsibly, we must still foster an entrepreneurial spirit. This innovation goal requires a delicate but achievable balancing act. In sum, we have a challenging task ahead of us. Today's esteemed witnesses will help us to refine our seven regulatory principles and ultimately construct an effective regulatory foundation for the future. I look forward to their thoughts and to this important debate. Thank you, Mr. Chairman."
"The Chairman","The gentleman from Cleveland--from Ohio--is now recognized for 2 minutes. I do not want to get too picky here."
"Mr. LaTourette","Thank you very much, Mr. Chairman. Thank you for having this hearing. I am just a little east of Cleveland, thankfully. If I were from Cleveland, I would not be successful. The witnesses' statements today have a lot of references to things like socialism, Ms. Rivlin's testimony in particular. I think that word ``socialism'' is being bandied about quite a bit today. The notion that right before we left we handed over $700 billion to the Secretary of the Treasury was disconcerting to a lot of us. Some of us voted ``no,'' not once but twice, on that piece of legislation. I think the witnesses also talk about finger pointing as being not very productive, and I agree with that. I think that this hearing needs to look forward rather than back, but I think in order to look forward you do need to look back just a tad in that there are a lot of theories as to how we find ourselves in this situation. Some are indicating that the 1999 legislation, Gramm-Leach- Bliley, is somehow in default. If that is the case, I would hope our witnesses would chat with us about the changes that need to be made to that to prevent this from happening again. Many have indicated that the failure to put a tougher regulator instead of OHFEO over Fannie Mae and Freddie Mac saw the release of up to $1 trillion in subprime mortgages by those GSEs between 2005 and 2007. I think we should see if that is the problem. Credit swaps apparently have no regulators. I wish they would talk a little bit about that. Then, lastly, I did read the Washington Post editorial this morning that talks about mark-to-markets not being a problem. That does run counter to some of the things that people back in northeastern Ohio are indicating to me. I would wish that the witnesses would talk about that as well. Just two quick unanimous consent requests: There is an article appearing in today's Cleveland Plain Dealer that talks about an area called Slavic Village. I would ask unanimous consent that it be included in the record. On October the 19th, Sunday, there was an article in the New York Times called, ``Building Flawed American Dreams.'' I would also ask unanimous consent that it be included in the record as well. I yield back."
"The Chairman","Without objection, it is so ordered. I would ask unanimous consent that we give general leave for all members to insert into the record any material they wish. Is there any objection? Hearing none, general leave is now granted, and members may insert whatever they wish into the record. They can, of course, allude to it as well if they would like to. I will now yield 1 minute to the gentleman from New York,"
"Mr. Ackerman",""
"Mr. Ackerman","A major contributing factor to the economic crisis facing the country is that our financial regulatory system is broken and needs to be fixed. Without question, at least part of the blame for the seizure of our credit markets rests with the credit rating agencies. The credit ratings that were assigned to many mortgage-backed securities over the past 3 years were not based on sound historical data and for good reason. There was none. The types of securities that were bought and sold in the secondary market contain new subprime mortgage products that had no historical data on which to base any rating. Accordingly, the AAA ratings assigned to securities that contained subprime loans had absolutely no statistical basis whatsoever, but the pension fund managers and investors who placed their trust in the ratings took the credit rating agencies at their word and purchased these exotic products. That the credit rating agencies would rate these securities without any statistical data is bad enough, but continuing to do so is absolutely bewildering. Mr. Chairman, if we are to fix the cause of this crisis, that area surely needs to be addressed. Mr. Castle and I have introduced legislation that would require nationally rated statistical rating organizations, those who are registered with the SEC, to assign two classes of ratings. One class, SRO ratings, would be reserved solely for homogenous securities whose ratings are based on historical statistical data and whose ratings pension fund managers and risk adverse investors could rely on. The other class of ratings would permit the rating agencies to continue to rate heterogeneous riskier products that may not have data."
"The Chairman","The gentleman's time is expiring."
"Mr. Ackerman","I would place the rest of my statement in the record."
"The Chairman","Thank you. We do have a large turnout. Members have asked for 1 minute, and we are going to have to ask that they stay very close to that. Next, the gentleman from Texas, Mr. Neugebauer, for 2 minutes."
"Mr. Neugebauer","Thank you, Mr. Chairman. One thing we know about Congress is that we do not necessarily do our best work in a crisis environment. We get a lot of pressure to just do something and to do something quickly. As a result, Congress can tend to overreact. Our financial markets are not functioning normally, and our Federal Government has gone to some unprecedented steps to intervene in these markets. Certainly, we need to consider some regulatory improvements. This committee started regulatory hearings this year, and the industry and the Treasury and others have put forward regulatory proposals. Before Congress rushes to overhaul regulations, we need to do a complete autopsy of the current problems so that we know exactly what went wrong and what changes could help prevent this from happening again. We also need to understand the outcomes of these problems on the structure of our financial services sector. Much focus has been on institutions that are too big or too interconnected to fail, but now it seems that more institutions fall into these categories. Expanding regulation to new entities also brings expectations of future government help. Now, this debate isn't simply about having more regulation or about having less regulation; it is about having effective regulation. Effective regulation allows market discipline to drive decisionmaking, and it minimizes moral hazard. Effective regulation keeps the U.S. capital markets competitive with others around the world. Effective regulation protects investors and consumers and rewards innovation and responsible risk-taking. We must also look at how the Federal Government plans to work its way out of these interventions. While some of these interventions are still being implemented, at some point the Federal Government will need to pull back. We need a bona fide exit strategy. This strategy needs to be a part of our discussion as we talk about regulatory changes. Moving forward, we need to work together across this committee aisle to come up with the right solution so we can leave America's financial system and economy stronger."
"The Chairman","The gentleman from Massachusetts, Mr. Lynch, is recognized for 1 minute."
"Mr. Lynch","Thank you, Mr. Chairman. I want to thank the ranking member as well and the witnesses for helping the committee with its work. I want to associate myself with the remarks of the gentleman from Ohio, who said that the time for finger pointing is long past, and we really, within this committee structure, have to figure out where we need to go in the future and how to fix this regulatory system. I would like the economists and the industry participants who are before us today to really focus on the purpose of the regulatory regime that we put in place, which is to provide information to investors, not only in external transparency but also in internal transparency. Because what we have seen is that these companies themselves do not understand truly the value of some of these complex derivatives that they hold. So, again, I thank you for your attendance here today, but I would like to see the focus on transparency, after reading your remarks, and on the value that that would have in any system that we will devise going forward. Thank you. I yield back."
"The Chairman","The gentleman from Illinois, Mr. Manzullo, is recognized for 2 minutes."
"Mr. Manzullo","Thank you, Mr. Chairman, for holding this hearing today. This committee needs to examine ways to ameliorate the impact of this crisis while examining long-term solutions to ensure that a crisis of this magnitude never happens again. As we examine the underlying causes of this crisis, it is clear to me that Fannie Mae and Freddie Mac were right in the thick of things. Some of us in Congress have been fighting the unethical, illegal, and outright stupid underwriting practices at Fannie and Freddie for many years. Our efforts are a matter of public record, at least in the last 8 years, of going so far as to publicly confront Franklin Raines, who took $90 million in 6 years from Fannie Mae, and with regard to his fraudulent, unethical lobbying campaign in 2000 and in regard to the use of unethical accounting practices to inflate the bonuses of Fannie Mae's executives in 2004. In 2005, we finally got a bill to the Floor, a vote in favor of GSE reform, including the tough Royce amendment, to make even more difficult the types of practices to continue that we see have led to this crisis. Any solution to this crisis undoubtedly needs to include a serious reexamination of the role that these GSEs will play in any future housing market. It is obvious that new regulations are necessary both to ease this crisis and to ensure that it never happens again. One thing for sure is that these two organizations need to be dissected, ripped apart, and examined thoroughly. Because once we find out what happened there as the root cause of the problem, we will make sure it never occurs again. Thank you, Mr. Chairman."
"The Chairman","The gentleman from Georgia, Mr. Scott, is recognized for 1 minute."
"Mr. Scott","Thank you, Mr. Chairman. Thank you for the hearing. I think we have to realize that the damage has been done. We have to change our mindset from one of continuing to try to find blame; and, instead, we have to work on real solutions. The number one issue we have before us is that our system is vulnerable. It has been vulnerable because a small quantity of high-risk assets undermined the confidence of investors as well as other market participants across a much broader range; and the combined effect of these factors, without the necessary regulation, caused the system to be vulnerable to self- reinforcing asset price and credit cycles. The issue before us: What are the reforms that will be necessary to reduce the vulnerabilities in our economic system in the future? We have to press hard to make sure that we stop the blame game and understand that the American people are looking to us to provide real solutions. Thank you, Mr. Chairman."
"The Chairman","Mrs. Biggert of Illinois is recognized for 2 minutes."
"Mrs. Biggert","Thank you, Mr. Chairman. Thank you for holding this hearing to overhaul our financial services regulatory system and to bring it into the 21st Century. During previous Congresses, this committee held about 100 hearings on GSE reform and led the House to pass a reform bill to rein in Fannie Mae and Freddie Mac. I worked on it and supported it in 2005 and 2007 because we saw the handwriting on the wall. These mortgage giants were too big, their accounting was irregular, and capital was too low. We also produced legislation to reform the credit rating agencies, which we worked on, and that was signed into law in 2006. The SEC was unacceptably slow in implementing any reform. Now more work needs to be done to ensure that agencies adequately evaluate credit risk. So our work to reform these regulations and many other reforms is by no means done nor will it ever be as the financial services industry is ever-evolving. Today's witnesses will touch on a litany of concerns that merit further review and serious consideration by this committee. I think that our ultimate goals should be to bolster integrity and confidence in the U.S. financial system, to invigorate U.S. competition, to enhance consumer protections, to arm consumers with financial education and information, and to never again have the taxpayers pay for Wall Street's mistakes. With that, I thank the witnesses for joining us today, and I look forward to hearing all of their ideas. I yield back."
"The Chairman","The gentleman from Missouri, Mr. Cleaver, is recognized for 1 minute."
"Mr. Cleaver","Mr. Chairman, I will reserve my comments for the question-and-answer period. Thank you."
"The Chairman","Well, then, we will go to the gentleman from Florida, Mr. Klein. I apologize. We will go next to the gentleman from Texas, Mr. Green. I was out of order here."
"Mr. Green","Thank you, Mr. Chairman. I will be brief. Mr. Chairman, I thank you for hosting this hearing, because the American people are angry. They are upset. They understand that and believe that we have within our power to change things to make a difference. They are upset about golden parachutes as companies crash. They are upset because people were allowed to have loans that they could not afford. They are upset because there are markets that are unregulated. They expect us to act. I think this is the genesis of the action that we have to take. I yield back."
"The Chairman","The gentleman from New Jersey, Mr. Garrett, for 2 minutes."
"Mr. Garrett","I thank the chairman and the ranking member, and I thank also the members of the panel for your testimony we are about to hear. As you all know, we are facing very challenging times in our Nation's financial services industry. It is important that we work in a bipartisan fashion to move forward to ensure that we put in place the proper regulatory framework to allow our economy to grow once again. But it has been said already: Before we are able to go forward with new and important changes to the overall regulatory structure for our financial services industry, I do believe that it is essential that we better understand just how we got into this problem. One of the main parts of the problem was poor regulation in the past, specifically in the area of Fannie and Freddie. Now in the past, I know that our distinguished chairman has noted that he and his party were the ones to finally get a new GSE regulator over the finish line, albeit a little bit too late. That is quite true. However, there is a distortion of the facts to allow them to claim the mantle of being a champion of reform with Fannie and Freddie. If you look back to the facts during the first committee markup of GSE regulation in 2005, it was I and some of my colleagues who have already spoken who offered a number of amendments to strengthen the regulatory controls and to reduce the overall risk that both companies posed to our Nation's economy. Each and every time, the chairman and everyone on the Democrat side of the aisle voted against these proposals, whether it was an amendment to raise the capital levels, to reduce the retained portfolios, to lower the conforming loan limits, or anything else. The other side of the aisle voted time and time again for what? Less regulation over these two companies. It was this lack of regulation that played a large part in getting us to where we are today. So I honestly think that we need to learn the lessons of the past if we are going to be successful in the future. To formulate a new regulatory scheme is a process that is going to take a lot of months, a lot of conversations, many hearings, and as much input from all parties as possible to ensure that we create really a solid system under which we can safely move forward. Creating these new regulation reforms is not a partisan project. It is really about making sure American families are protected in the future from the kind of financial crisis that we are experiencing now. Again, I thank the panel."
"The Chairman","The gentleman from Florida, Mr. Klein."
"Mr. Klein","Thank you, Mr. Chairman. I thank the ranking member as well for calling this hearing. We all understand that this financial crisis is deep. It is affecting people with their investments. It is affecting small businesses' access to capital. I think many people understand that it is due, in part, to a lack of regulation and oversight. Regulation does not have to be a burden. Smarter regulation will make our economy stronger, and I would definitely concur that we have to bring in, as we are doing today, some of the best and brightest people from all over our country to come up with some new ideas to have better regulation that will be effective in continuing to promote good ideas in the market and that will protect consumers and taxpayers. A couple of suggestions: One, when we talk about regulation, we have the SEC. We have the CFTC. There are ideas out there about a new financial product safety commission. It does not matter what we call it. I think the goals have to be the same, and that is to make sure that we are doing things to stimulate creative ideas. Again, the proper balance has to be in place. Also, I have great concern about the credit rating agencies. It seems to me that there is an inherent conflict of interest there. The way it is set up right now, huge fees are being paid. And how things could be rated AA and AAA, when people are looking at these investments, there is a problem there. Also, in encouraging competition among financial institutions, we have pretty much eliminated much of our antitrust law in the United States, and now we have more and more power consolidated with a few institutions in many different areas. This notion of ``too big to fail'' really bothers me. It is like continuing to build and build and build and being successful. When you make a number of bad decisions, I think you run out of that. So I think it is a question of we need to go back and look at all of these. Do it in a bipartisan way, but let's move. Where there is a will, there is a way. Let's get it done as quickly and as reasonably possible."
"The Chairman","The gentleman from Georgia is recognized for 2 minutes."
"Mr. Price","Thank you, Mr. Chairman. I want to join with some on both sides of the aisle who have said that the same old politics, frankly, from both sides will not get us to a solution to our current challenges. There has been lots of excellent work done on attempting to identify the cause of our current financial challenge. I will be inserting a number of items into the record. One of them is an article entitled, ``Another Deregulation Myth: A Cautionary Tale about Financial Rules that Failed.'' While the genesis of our current challenge is certainly multifactorial, what began on a microlevel with imprudent borrowers and irresponsible lenders became a full-scale financial crisis, fueled by the GSEs that were rapidly expanding their purchasing and securitization of subprime mortgages. Today, the resulting credit crunch is extended to every area of our economic system. What is taking place, though, is truly unprecedented: The direct Federal intervention in individual mortgages; a broad overreach by the Federal Reserve; an unlimited use of taxpayer dollars; and steps to nationalize banks. These actions are in their totality, I fear, an assault on American principles and on capitalism itself. It is a marked turn toward a nefarious ideal that problems can be solved by centralized decisionmaking here in Washington. To have a full understanding of the financial services' regulatory state, there must be an investigation of all facets of the sector. I look forward to working with the chairman for a more broad appreciation of that in our hearing process. Moving ahead, Congress must be sensible. The goals should be to eliminate previous destructive regulatory actions, not to eliminate all regulation but to have appropriate regulation, close the gaps in the regulatory framework, increase transparency, and enhance market integrity and innovation. The end result must promote economic growth and not stifle opportunity. I look forward to working with all who are of the same mind. Thank you."
