"Speaker","Speech"
"Mr. Bachus","What should we have done? And okay, I am agreeing with you. What should we have done as opposed to that?"
"Mr. Stiglitz","For instance, on some of these there was the possibility of a debt-for-equity swap so that if you--you know, we bailed out the debt holders, the bond holders, as well as-- even when the equity owners took a beating. There were huge amounts of increases in the value of the debt. And I was also concerned at the terms at which the money was being provided. And you can see one piece of evidence that we got--two pieces-- three pieces of evidence that we got a very bad deal in the way it was administered by our Secretary of the Treasury is the fact that most of the companies, when it was announced they were going to get an equity injection, their share price went way up. Second, you compare the terms that we got versus the terms that Warren Buffett got, there is absolutely no comparison. Third, you look at the terms that we got versus the terms that the U.K. Government got, there is no comparison. So I was concerned--"
"Mr. Bachus","Well, now, are you aware that I proposed capital injections with covered bonds or lending or, you know, backup private equity? But we did get a 5 percent rate of return that goes to 9 percent."
"Mr. Stiglitz","Yes. But Warren Buffett, on equity injection to arguably one of the better capitalized and best capitalized investment banks, got 10 percent. And his warrants were far better than the warrants that we got."
"Mr. Bachus","And I agree that, you know--I agree. But I think at least in this bill we got a better deal than what we were going to get in buying the worst of the assets."
"The Chairman","I do have to remind the gentleman the 3- minute deal was his deal."
"Mr. Bachus","So we are through."
"The Chairman","We are way over it. I thank the panel. The panel is excused. The next panel will check in. We will begin the questioning with--all right. Can we move quickly, please? Have the conversations outside. Would the witnesses and our staff please talk outside? Would the witnesses please leave? Members who want to talk to them, do it outside. I thank the members of the second panel for waiting. It is very important that we have the testimony from industry representatives going forward. We have heard and will hear in the past from consumer representatives. We will hear from people who are in the physical parts of the economy. We will hear from organized labor. The witnesses properly said, I think, and I want to say I thought the gentleman from Georgia, Mr. Price, raised very important philosophical questions that we have to deal with. We are here talking about some of the most important basic principles in government, about how in a free enterprise economy you do or don't regulate. And I look forward to a serious debate in this country, beginning when we come back, on the appropriate economic philosophical principles. I think the old discipline of political economy is going to come back as we talk about these. And we will be very careful. These are historic decisions that are being made. And you know, we have a silver lining to the cloud. The cloud, of course, is the terrible shutdown of economic activity. The silver lining is that nobody is doing any good things or bad things right now. So that the notion that we have to rush, I think, has been alleviated by the fact that not much is happening, and that gives us time to do this right. It is as important a set of economic decisions as I think this country will be making since the Depression, and I am determined, and I know the Minority is as well, that we will work together to do this. With that, we will begin with our former colleague and member of this committee. Fortunately, he wasn't around at any of the times we are fighting about, so he can stay above the battle. Our former colleague from Texas, on behalf of the Financial Services Roundtable, Mr. Bartlett."
"STATEMENT OF THE HONORABLE STEVE BARTLETT, PRESIDENT AND CHIEF EXECUTIVE OFFICER, THE FINANCIAL SERVICES ROUNDTABLE",""
"Mr. Bartlett","Thank you, Mr. Chairman, and Ranking Member Bachus. I provided in my written testimony a description of the size and scope and some examples of the problem of the regulatory system as it now stands. Suffice it to say that in summary it is a lack of coordination, a lack of uniformity, huge gaps in the system in which literally hundreds of agencies are not even authorized to talk with one another about their regulatory structure or regulatory conclusions, much less to engage in a consistent regulatory coordination. As you noted, Mr. Chairman, that will be entered into the record. The current crisis has erupted. And when the current crisis erupted, literally no coordinating body was clearly responsible, and so it was an ad hoc response that required all the agencies, and including Congress. So today we bring ourselves--and Mr. Chairman, I commend you and the members of the committee. This is an extraordinary hearing, with an extraordinary turnout. It may be the first that I can recall during this time, this season, in which this many members of the committee would come on a legislative effort such as this. The hearing is timely. It is urgent. And I think it requires some relatively rapid action. I propose today, Mr. Chairman, I would share with you five near-term regulations the Financial Services Roundtable have. These are--I call them ``no regret moves'' in that they won't stand in the way of long-term solutions. And I believe that the committee and the Congress will consider and adopt long-term solutions in short order. But on the near-term, and these near-term solutions should lead to those longer term restructuring, I would cite five. First, is market stabilization. Reduce the potential for systemic risk by giving the Federal Reserve Board overarching supervisory authority over systemically significant financial services firms that seek access to the discount window. And provide that statutory authority in advance of the crisis, not after the crisis. Second, interagency coordination. Our proposal in the short term is to expand the membership and mission of the President's Working Group by statute to make it more forward looking. The fact is the President's Working Group is the only authority at all with any coordinating authority. They have no statutory authority. And on that group is not the OCC, the OTS, the PCAOB, or any insurance regulatory agency. Third, adopt principle-based regulation. The principles should be adopted by statute by Congress. Enact those principles to serve as a common point of reference for all regulatory agencies as encompassed. Fourth, is prudential supervision. Encourage the early identification of potential risk by the application of prudential supervision by all financial regulators for all financial services forms. And fifth, is adopt financial insurance supervision. The fact is that the State-by-State system of insurance regulation is the last vestige of 19th Century regulation. It is time to move into the 20th Century. We would have you implement those recommendations--we would not--I would not contend that the implementation of those regulations would have prevented this current crisis entirely. But I do believe they would have helped regulators and the financial services industry to better and much earlier appreciate the market developments, and would have significantly reduced the scope and the severity of the crisis. We do recommend, Mr. Chairman, three additional actions to take in the near term. First, is fair value accounting. We advocate the use of a clear-minded system to determine the true value of assets in distressed and illiquid markets. The current application of fair value accounting is neither clear-minded nor fair. It is causing significant damage to individual institutions, but way more importantly, to the economy as a whole. The SEC and the Public Company Accounting Oversight Board has the authority to act. We urge them to provide auditors the flexibility in the application to apply fair value accounting. Second, credit default swaps. We think that the first step is to--the first step will lead to regulation. We think the first step is to establish a clearinghouse for credit default swaps. We do think it requires a Federal regulator. We recommend either the CFTC or the Federal Reserve. And then, third, is mortgage interest rates, Mr. Chairman. We believe that at this point this sort of mystical thing in London called the LIBOR has declined 6 days in a row--that is some kind of a record--to lead us out of the crisis, but it has not led to a reduction of mortgage interest rates. And until that happens, the economy will continue to be in jeopardy and getting worse. So if mortgage rates do not fall, then we urge Congress, the Treasury, and the Federal regulatory agencies to consider additional appropriate actions. Lastly, Mr. Chairman, we do believe that sitting here on October the 21st, it is not clear at this point whether an additional fiscal stimulus should be adopted. But Congress should consider that if in the next few weeks the measures that have already been taken do not result in the beginning of a recovery, then we think the Congress should consider a stimulus package. That stimulus package, in our view, should have 3 points: Housing; job creation; and capital investment. Mr. Chairman, we urge neither more regulation nor less regulation, but better, more effective regulation. Thank you."
"Mr. Watt","I thank the gentleman for his testimony."
"Mr. Yingling STATEMENT OF EDWARD YINGLING, PRESIDENT AND CHIEF EXECUTIVE OFFICER, AMERICAN BANKERS ASSOCIATION (ABA)",""
"Mr. Yingling","Thank you for the opportunity to present the views of the ABA on regulatory reform."
"Mr. Watt","I am not sure your microphone is on."
"Mr. Bachus","And pull your microphone a lot closer."
"Mr. Yingling","Thank you for the opportunity to present the views of the ABA on regulatory reform. Clearly, changes are needed. The recent turmoil needs to be addressed through better supervision and regulation in parts of our financial services industry. The biggest failures of the current system have not been in the regulated banking system, but in the unregulated or weakly regulated sectors. Indeed, while the system for regulating banks has been strained in recent months, it has shown resilience. In spite of the difficulties of this weak economy, I want to assure you that the vast majority of banks continue to be strongly capitalized, and are opening their doors every day to meet the credit and savings needs of their customers. As the chairman has noted many times, it has been the unregulated and less regulated firms that have created problems. Given this, there has been a logical move to begin applying more bank-like regulation to the less regulated parts of the financial system. For example, when certain securities firms were granted access to the discount window, they were subjected to bank-like leverage and capital requirements. The marketplace has also pointed toward the banking model. The biggest example, of course, is the fact that Goldman Sachs and Morgan Stanley have moved to the Federal Reserve for holding company regulation. Ironically, while both the regulatory model and the business model moved toward traditional banking, bankers themselves are extremely worried that the regulatory and accounting policies could make traditional banking unworkable. Time after time, bankers have seen regulatory changes aimed at others result in massive new regulations for banks. Now, thousands of banks of all sizes are afraid that their already crushing regulatory burdens will increase dramatically by regulations aimed at less-regulated companies. We appreciate the sensitivity of this committee and the leadership of this committee toward this issue of regulatory burden. As you contemplate changes in regulation to address critical gaps, ABA urges you to ask this simple question: How will this change impact those thousands of banks that are making the loans needed to get our economy moving again? There are gaps in the current regulatory structure. First, although the Federal Reserve generally looks over the entire economy, it does not have explicit authority to look for problems and take action to address them. A systemic oversight regulator is clearly needed. The second type of gap relates to holes in the regulatory scheme where entities escape effective regulation. It is now apparent to everyone that the lack of regulation of independent mortgage brokers was a critical gap, with costly consequences. There are also gaps with respect to credit derivatives, hedge funds, and others. Finally, I wish to emphasize the critical importance of accounting policy. It is now clear that accounting standards are not only measurements designed for accurate reporting; they also have a profound impact on the financial system. So profound that they must now be part of any systemic risk calculation. Today, accounting standards are made with little accountability to anyone outside the Financial Accounting Standards Board. No systemic regulator can do its job if it cannot have input into accounting standards, standards that have the potential to undermine any action from a systemic regulator. The Congress cannot address regulatory reform in a comprehensive fashion if it does not include accounting policymaking. ABA therefore calls on Congress to establish an accounting oversight board, chaired by the chairman of the systemic regulator. The SEC Chairman could also sit on this board. The board could still delegate basic accounting standards-making to a private sector body, but the oversight process would be more formal, transparent, and robust. I believe this approach would accomplish the goal that the chairman mentioned a few minutes ago in his comments about separating mark to market from the consequences of mark to market. And I appreciate your recent letter, Congressman Bachus, on this subject. That is a good goal. But I don't think that that goal can be accomplished if you have the current regulatory situation on accounting. Clearly, it is time to make changes in the financial regulatory structure. We look forward to working with Congress to address needed changes in a timely fashion, while maintaining the critical role of our Nation's banks. Thank you."
"Mr. Watt","Thank you, Mr. Yingling."
"Mr. Ryan STATEMENT OF T. TIMOTHY RYAN, JR., PRESIDENT AND CHIEF EXECUTIVE OFFICER, SECURITIES INDUSTRY AND FINANCIAL MARKETS ASSOCIATION (SIFMA)",""
"Mr. Ryan","Chairman Watt, Ranking Member Bachus, and members of the committee--"
"Mr. Bachus","Tim, pull that microphone a lot closer to you."
"Mr. Ryan","Thank you. My name is Tim Ryan, and I am president of the Securities Industry and Financial Markets Association. I want to thank the committee for holding this hearing. It is a good time to do this. It is an important subject. I have a few brief remarks. I would like to have my full testimony entered into the record."
"Mr. Watt","Without objection, the full text of all testimony will be put into the record."
"Mr. Ryan","I am speaking on behalf of the Securities and Financial Markets today, but from 1990 to 1993, I was the Director of OTS. I also was one of the principal managers of the savings and loan cleanup. And from 1993 until April of this year, I was a senior executive at J.P. Morgan. So I would like to have my comments here reflect that background. As you all know, the debt and equity markets across the globe have experienced serious dislocations in the last few months. Congress has aggressively responded to this by passing the Emergency Economic Stabilization Act, and granted the Treasury Department extraordinary responsibility to promote the confidence in the financial system. We fervently hope that the steps being taken will unfreeze the credit markets and restore calm to the equity markets. Serious weaknesses, however, exist in our current regulatory model for financial services. And without reform, we risk repeating today's serious dislocation. I commend this committee for beginning the process of reexamining our regulatory structure, with a view toward effective and meaningful improvements. We in the securities industry and financial markets stand ready to be a constructive voice in this critical, important public policy dialogue. I have just a few specific comments on recommendations. One, which has been really a part of the comments all morning here, the need for a financial market stability regulator. As you know, our Nation's financial regulatory structure dates back to the Depression. That regulatory structure assumed, and even mandated to some extent, a financial system where commercial banks, broker dealers, and insurance companies engaged in separate businesses, offered separate products, largely within local and domestic borders. Financial institutions no longer operate in single product or business silo or in purely domestic or local markets. Instead, they compete across many lines of business and in many markets that are largely global. The financial regulatory structure remains siloed at both the State and Federal levels. No single regulator currently has access to sufficient information or the practical and legal tools and authority necessary to protect the financial system as a whole against systemic risk. Thus, we believe Congress should consider the need for a financial markets stability regulator that has access to information about financial institutions of all kinds that may be systemically important, including banks, broker dealers, insurance companies, hedge funds, private equity funds, and others. This regulator should have the authority to use the information it gathers to determine which financial institutions actually are systemically important, meaning that would likely have serious adverse effects on economic conditions or the financial stability or other entities that were allowed to fail. We believe this is a relatively small number of financial institutions. We think it is important that a stability regulator have information gathered through coordination with other regulators to avoid duplication of oversight and unnecessary regulatory burdens and provide confidentiality. If Congress takes the approach of creating a markets stability regulator, it would be important to ensure that it not become an additional layer of regulation. Rather, Congress should consider the stability regulator in the context of the overall streamlining of financial regulatory system. Second, additional steps are necessary to improve the efficiency and effectiveness of regulation. In general, financial services regulation has not kept up withinnovation or risk. Modernizing financial regulation should be a priority for regulatory reform by Congress. In general, financial regulation should encourage institutions to behave prudently, and incentivize them to implement robust risk management programs. We also believe Congress should consider how financial regulation can be streamlined to be more effective. Duplicative Federal and State regulation is one area of review. Another is the separate regulation of securities and futures. We believe that the United States should merge the SEC and the CFTC in the interests of regulatory efficiency. Combining their jurisdiction would be consistent with the approach taken in other financial markets around the world. Congress should also consider merging the Office of Thrift Supervision into the Office of the Comptroller of the Currency in order to achieve greater efficiency in the operation of Federal bank regulatory agencies. One comment on structured products and derivatives: Innovation has generated many new financial products in recent decades that have the basic purpose of managing risk. For example, over the last 2 years alone, the credit default swap market has grown exponentially. CDSs are an important tool for managing credit risk, but they also increase systemic risk if key counterparties fail to manage their own risk exposures properly. SIFMA recognizes the risk inherent in this market and will continue to work closely with ISDA, with the Futures Industry Association and with other stakeholders in an effort to create a clearing facility for CDS that will reduce operational and counterparty risk."
"Mr. Watt","Mr. Ryan, can I encourage you to wrap up as soon as you can?"
"Mr. Ryan","Thank you, Mr. Chairman. I can wrap up right now. I am ready for your questions."
"Mr. Watt","Thank you for your testimony. I understand that Mr. Washburn is from the ranking member's congressional district, so I will recognize him for a brief introduction."
"Mr. Bachus","Thank you, Mr. Chairman. Mike Washburn, his wife Marian, and his daughter Allie, are constituents of mine. In fact, his 12-year-old daughter Allie and about 1,000 other folks have announced their intention to run against me if I do not get my act together in the next election. He is the CEO of Red Mountain Bank, which is a very progressive community bank, with three locations in Birmingham and one in Tennessee. Far more importantly, he is on several ICBA boards. His bank has received a prestigious national award for their community service, and it has also received 3 awards over the past 3 years as one of the best places to work in Alabama. So it is a good place to work. It is a successful bank. They have avoided the problems that bring us here together today. That is why I think there ought to be a representative from Main Street here, and I think he is very capable in that regard. So welcome to Washington, Mike. I look forward to some Main Street wisdom."
"Mr. Watt","Mr. Washburn, you are recognized."
"STATEMENT OF MICHAEL R. WASHBURN, PRESIDENT AND CHIEF EXECUTIVE OFFICER, RED MOUNTAIN BANK, ON BEHALF OF THE INDEPENDENT COMMUNITY BANKERS OF AMERICA (ICBA)",""
