"Speaker","Speech"
"Mr. Seligman","I think there are two different fundamental needs. First, you need some mechanism for investigating the relevant facts. And a challenge you have is because so many of the financial regulators were involved in regulation which has been called somewhat into question, how to create an independent mechanism. In 1987, after the stock market crashed then there were a number of reports. Some came from Congress. There was a particularly good one in that case that came from the Department of the Treasury. But one of the first things you should do is see if through Congress or otherwise you want to stimulate some sort of special study on a timeline which will be able to present to you a comprehensive report on what has happened. Second, and the point I stressed in my testimony, select committees, I think, are important for a different reason. Different congressional committees have different jurisdiction. To give you an illustration, this committee has a very broad ambit but it does not, for example, have within its scope the Commodities Futures Trading Commission, which reports to a separate committee. Given the urgency with which you should address financial futures and credit derivatives which have been not clearly allocated in our current regulatory scheme, a select committee would be a mechanism to a more comprehensive review. You could have everybody at the table hearing the same evidence and hopefully get to the appropriate resolution."
"Mr. Kanjorski","Very good. Dr. Stiglitz."
"Mr. Stiglitz","I agree that one needs to approach this comprehensively. I think that looking at the past and what has caused this problem is only part of what needs to be done, because there are all kinds of crises we could have had and that we will have in the future. We are looking at this in a way parochially as Americans. This has been a global crisis. Countries that didn't have our particular institutions have also had problems. And so I think we really need to think about this looking forward, taking into account the changes in the financial markets that have occurred, what are the risks, and how do we manage those risks. And I guess a final point, I think one of the real difficulties is the very large role of the special interest at play in shaping our current financial structures, regulatory structures, the failures of the current financial regulators are going to make it very difficult to go forward. That is something you just have to take into account, that they are going to try to shape the regulations to allow them to keep doing what they did in the past because it worked for them."
"The Chairman","Mr. Neugebauer."
"Mr. Neugebauer","Thank you, Mr. Chairman. Mr. Johnson, in your testimony you said regulators should develop a clear transition plan to exit from the direct government investments and credit backstops moving forward. And quite honestly, I agree that we need an exit strategy. One of the reasons that I voted against the plan, not once, but twice, was that nobody was really ever able to articulate a clear exit strategy of this major market intervention by the Federal Government. Can you elaborate a little bit more on when, in your estimation, it becomes appropriate to begin that transition where we begin to back the elephant out of the room, so to speak, and let these markets, you know, return to an environment where the government is not intervening?"
"Mr. Johnson","Yes, Congressman. Well, I agree with some of the other comments here that something like a select committee could be organized to look at this problem in a comprehensive way. I don't really have much input on the best organization to deal with this issue because there are many oversight organizations that have been set up over the years to cover almost all aspects of the regulatory sector. But I do strongly believe that once financial markets are stabilized and confidence is restored, we should have a transition plan and an exit strategy. A specific exit date is important even if that date is somewhat arbitrary. I am not a believer in central government control over the entire credit allocation process. I am a believer in strong supervision and regulation over those aspects of the financial system that are underwritten by the U.S. taxpayer such as the banking sector. But what worries me now is we have spread the U.S. Federal safety net over the entire financial system, the entire credit allocation process today. And I think we must determine an exit from that. The risk reward structure is what drives this economy and we have failed miserably to supervise the safety net and keep it more narrowly focused. We have allowed excessive risk-taking with no accountability and no transparency in the risk process. And therefore, today we are afraid to let anyone fail because we don't know what the systemic damage of this might be. Failure is a critical part of this system. Yes, there must be rewards for risk-taking. But if you can't fail when you make bad mistakes, the system is broken and you might as well just go to total control. So I would say that once a comprehensive review has been undertaken, you should rationalize the regulatory structure, in my opinion, as narrowly as possible to limit the safety net. But, I wouldn't favor doing that unless people were accountable for their risk-taking. And so--but I would favor shrinking this back to the bank holding company structure and of course having as much disclosure and transparency as possible in the securitization process so that risk takers know what risks they are taking. And I can't say the exact moment at which that should be done, but it should be done when you have rationalized in a comprehensive way and feel strongly that you understand what has happened and that the supervisory structure is adequate. But I think the sooner the better that you can get on with that I would favor."
"Mr. Neugebauer","Well, you did a great job. I had two more questions for you and you answered both of those. And so I appreciate that. Just a lightning round here. One of the concerns I have is there has been a lot of talk about systemic risk. And I think, Mr. Stiglitz, you mentioned ``too big to fail.'' Yet part of the plan here is that we are encouraging a massive consolidation of entities here, and are we, in fact, continuing to add to the systemic risk in the marketplace."
"Mr. Stiglitz","I actually remarked on that. I think it is a very serious problem, and I think part of a general failure to enforce antitrust laws in the last few years. And so one of the things I think is part of your exit strategy is that we have to think about breaking up some of the big banks and realizing that actually the economies of scale are not as big. And one of the things that I think has facilitated this growth has been the recognition that they are too big to fail and will put our money there because the government implicitly or explicitly is going to guarantee them."
"The Chairman","Thank you."
"Mr. Seligman","Let me just make a quick--"
"The Chairman","Very quickly, Mr. Seligman."
"Mr. Seligman","There is another aspect of systemic risk, and that is counterparties. That is with derivative instruments. That is regardless of the size of the institution if it is linked to other institutions through transactions where the failure of one can set in a cascading effect. That is what the real risk with Lehman Brothers turned out to be."
"The Chairman","I recognize the gentleman from New York and ask you to give me 15 seconds. It occurs to me that what we should be looking for as an offset to the doctrine of ``too big to fail,'' we should have a rule of ``too failing to be big,'' and that is the job of regulation. The gentlewoman from New York."
"Mrs. Maloney","Thank you, Mr. Chairman. I would like to welcome all the panelists and mention to Dr. Stiglitz that I have enjoyed your books, particularly the latest one, ``The $3 Trillion War.'' And I would like to reference your written comments where you said that America's financial markets have engaged in anticompetitive practices, especially in the area of credit cards. And you go further on to say, and I quote, ``the huge fees have helped absorb the losses from their bad lending practices, but the fact that the profits are so huge should be a signal that the market has not been working well.'' I do want to note that the Federal Reserve has also called credit practices and credit cards unfair deceptive and anticompetitive and this committee and this House passed in a bipartisan way reform legislation in this area, so we are acting in that area. You also mentioned that one of the problems is the lack of transparency. I would like to hear your ideas on a master super counterparty netting system. The idea of the system would be to provide a complete and transparent view of the entire financial system which would require every dealer to download all transactions every night, including all international. This would be in one place, an international area that would have a transparency so that we could track what is happening in the system. We know that derivatives are a huge part of it. But to date, the credit derivatives have been what we have focused on, yet they are only 10 percent of the global derivatives volume, so we may have an even larger problem that we have no idea how wide it is, and with such a super counterparty netting system, add more transparency, and help us move forward towards a better knowledge about our markets."
"Mr. Stiglitz","I think that would help. One of the things I commented on in my remarks was the need for standardization of these products. Because one of the problems is that if they are very complex, it is hard to know what is being netted. And so part of what needs to be done is moving towards more standardization which would allow greater transparency in the products themselves and greater competition in the market. When you have highly differentiated products it is more likely that they will be less transparent and that markets will be less competitive."
"Mrs. Maloney","Thank you. What I am hearing from my constituents is they are not getting access to credit still, even though it was reported Monday that the credit markets are easing. And these are established businesses, small and large, that are paying their loans on time, yet some banks are pulling their loans. This could be a downward spiral forcing them into bankruptcy, hurting our economy. So I would like to ask Ms. Rivlin, would one approach to help the stability in the credit markets be that at the very least, we could guarantee the loaning between the banks and have a blanket guarantee of new short-term loans to one another by the central banks? Would that be helpful in this regard? We have seen, so far, a piecemeal approach, as has been mentioned by the panelists, and not only in America, but in Europe and Asia as well. This obviously requires a high degree of international cooperation. I welcome your remarks and other panelists on this idea. Would that ease the credit? Would that help us get the credit out to the substantial businesses that are employing paying taxes part of our economy?"
"Ms. Rivlin","I am sorry, a guarantee of interbank lending? Well, that has been discussed. I think we may not need that. It does look as though interbank lending is coming back. And the international cooperation doing the same thing in different financial markets has been actually I think quite impressive that the central banks and treasuries have been working together. So I am not sure that we actually need at this point a guarantee of interbank lending. The interbank lending rates are coming down and the capital injection, it seems to me, is probably going to be enough to do that."
"Mrs. Maloney","Mr. Stiglitz."
"Mr. Stiglitz","I am not sure that the capital injection is going to be enough. But I do feel nervous about guaranteeing individual loans. I think guaranteeing interbank lending again would facilitate that market. But that itself, again, is not going to suffice. The real problem and the reason that we want to have a good financial system is that credit is the life blood of an economy. And when there is the degree of uncertainty going into an economic downturn, the fundamental problem, the hemorrhaging at the bottom, the foreclosures are going to continue because house prices are going to fall. If we aren't doing anything about either the stimulus, the stimulating economy, or about the foreclosure, banks are going to be more conservative. And so I think it was necessary to recapitalize the banks but it is not going to be sufficient to address our problems."
"The Chairman","Mr. LaTourette."
"Mr. LaTourette","Thank you, Mr. Chairman. Dr. Stiglitz, I want to thank you for your testimony. I want to thank everybody for your testimony. But Dr. Stiglitz, your testimony hit on all the points that I think I was attempting to make in my opening remarks. The first question I have for you is, I am over here,"
"Dr. Stiglitz","I am one of the few guys with a beard in the room besides you. You made the observation during your truncated opening remarks that there was a feeling at least on your part and I think it is one that is shared by a lot of people that the people who made the mess should clean up the mess. And in my part of the world in Ohio, people believe that not only includes paying in dollars, but some people think people should go to prison. I agree with that if you have broken the rules and cost people their life savings. But I think I would ask you, what do you mean, and how would you envision that the people who have made the mess pay for the mess, clean up the mess?"
"Mr. Stiglitz","In my more extended remarks, I gave the analogy that in environmental economics, we have a principle called ``pollute or pay.'' And financial markets have polluted our economy with toxic mortgages and they need, ought to pay for the clean-up. The fact is that we are providing now capital to the financial sector taking advantage of the low cost of funds that the government has. And the criteria that we have set is that we just get paid back that low cost funds. I think that what I had in mind is that if it turns out that we don't make a good return on the money that we have put into the financial system, and I mean not a zero return, but above the zero because we bore a risk, that there be some form of taxation of the financial institutions that have made use of these funds. For instance, a tax on excessive capital gains imposed on these financial institutions."
"Mr. LaTourette","I agree with you. I think that is why some of us weren't so crazy about the bailout of $700 billion, because it didn't have one that guaranteed. And it seemed that rather than finding different ways to take care of this, we just gave $700 billion to folks and said, we hope that these toxic assets have a market value some day in the future, which is a big ``if'' for a lot of money. The other observation you made was about a transfusion, the $700 billion being a transfusion given to a hemorrhaging patient, I think were your words. And that--did it have to be just from your observation a publicly financed bailout? There was a proposal for instance for repatriation of offshore funds held by American corporations to buy these toxic assets who then obviously would receive something in the form of a capital gains treatment if they bought them, created a market for them, and held them. Do you think--I mean, a lot of people, we talk about greed, we talk about lack of regulation or poor regulation, we talk about people overborrowing, buying houses they had no business buying. But doesn't it offend your sensibility, I guess, that all this bailout has to come from the public sector at this moment in time?"
"Mr. Stiglitz","It does offend my sensibilities, but I don't think there was any alternative. In earlier crises in 1997 and 1998, the global financial crisis, there was a lot of talk of what they called bailing on the private sector. But individual private investors are not going to go into the morass of our financial markets where there was so little transparency. Those who went in at the beginning got burned. And so I think there were--and the magnitudes involved required were just too large to be able to get that from the private sector. So one had to do something. But it could not have been done in a much worse way than the way it was done in terms of protecting American taxpayers."
"Mr. LaTourette","And the last observation that you made, you said the retreat from mark to market would be not a good thing. And, at least from my observation, I have been told that about $5 trillion in liquidity has been taken out of the market just by the mark to market principles. And so rather than coming up with another bad regulation on mark to market or retreating from it, since there is no market for some of these assets, and that is creating the double whammy: One, you are marking down your portfolio; and two, you have to store away more cash for safety and soundness, could we replace mark to market with something else such as intrinsic value so that we could create a level of value for an asset."
"Mr. Stiglitz","Well, I think that it is imperative to continue with mark to market. When there is no market, as is the case in some assets, obviously you can't mark to market, you have to use some other principle. The issue is what you do with mark to market. I had a very brief reference to countercyclical provisioning which takes into account what happens in these kinds of situations to market values. What I find very interesting is that those who have criticized mark to market didn't criticize it when they overestimated the prices in the bubble and haven't offered to give back the bonuses that were based on those over excessive prices when the market was excessively exuberant. They want an asymmetry where when it is too low, they will get the market up, when it is too high, they will leave it up to high. I think we have to stay with a transparent system but think very carefully about how we use that information in regulatory processes."
"Mr. LaTourette","Thank you. Mr. Chairman, Mr. Seligman is practically jumping out of his chair to comment on the mark to market."
"Mr. Seligman","I don't mean to be jumping out of my chair, Congressman."
"The Chairman","We worry about jumping out of our chairs all the time, or falling out."
"Mr. Seligman","If there is a market, not to use it runs the risk of deluding yourself. I mean, it is the essence of capitalism that we rely on markets. To suggest there is some other intrinsic value other than the markets can lead to excessive ebullience in ways that can mislead you terribly."
"The Chairman","Thank you, Mr. Seligman. I am going to recognize Ms. Velazquez and take 15 seconds to say that I think what we intend to pursue, or what I hope we will pursue, is what Mr. Stiglitz said, namely that mark to market is one thing, the automatic consequences that result from that are a separate thing, and that it is possible to leave mark to market in place, but then to make sure that all these negative consequences, as the gentleman said, put more cash aside, which have a procyclical effect. And my own view was that there is a consensus forming about a two-step process in which you have mark to market, but which you then get flexibility on the consequences. And that will be--the ranking member had asked that this be particularly part of this hearing. That will be part of our agenda next year. The gentlewoman from New York."
"Ms. Velazquez","Thank you, Mr. Chairman. If I may, Ms. Rivlin, I would like to address my first question to you. In the recent economic crisis, several of our Nation's largest financial firms received unprecedented levels of Federal resources because regulators believed that they were too big to fail. At the same time, many community banks and credit unions who did nothing to contribute to our current situation are equally affected by the crisis but have been largely left out of the Treasury's rescue plans. Given this reality, how will this affect consumers in those areas that rely upon community banks and credit unions for the credit needs, especially small businesses? Every day that we read the news, newspapers, there are different stories across the Nation where it is very difficult for small businesses to access credit."
"Ms. Rivlin","I think this is a very real problem. The hope was that at least stabilizing the major institutions first would get credit flowing and that it would help with the rest of the system. How to intervene at the community bank and credit union level is another question. Part of it, I think, goes to intervention in the mortgage markets themselves and to finding better ways and with larger amounts of money behind them to buy up the mortgages and renegotiate them so that you can keep the homeowner in the house where possible or re-sell it or re-rent it to somebody else. That strikes me, and Dr. Stiglitz mentioned this, as a really important part of this puzzle."
"Ms. Velazquez","So let me ask you, Dr. Stiglitz, should a revised regulatory framework eliminate this dichotomy where some firms are too big to fail and others are too small to save?"
"Mr. Stiglitz","As I said before, I think we do need to deal with the problem of the big banks and have effective antitrust enforcement. One of the things that I mentioned about the objectives of regulation should be access to finance, access to credit. I didn't have time to talk about that, but that is really very important. The community banks and the credit unions play a very important part in that. And I worry a little bit that in the rush to save the stability of our financial system, we are not focusing on in the long run, what is the most important, is access to finance. I think it would be very important to create a monitoring of where the finance is going, who is getting it, making sure that there is finance to small businesses. And that may necessitate giving some more help to the small--to the community banks, local banks, regional banks, and credit unions."
"Ms. Velazquez","Ms. Rivlin, even before recent mergers and takeovers, the 3 largest banks in the United States control more than 40 percent of the industry's total assets. Should working families who have watched as their retirement accounts dwindled be concerned about this increased level of consolidation and what do we as policymakers need to consider going forward in an era of increased industry consolidation?"
"Ms. Rivlin","I think we do need to worry about it. I think it is very hard to figure out exactly how to fix it. And I wouldn't want to be the antitrust judge trying this case because I don't think we know what the rules are. There was reference to Gramm-Leach-Bliley earlier; was that a mistake. I don't think so. I don't think we can go back to a world in which we separate different kinds of financial services and say these lines cannot be crossed. That wasn't working very well, nor was our older prohibition under Glass-Steagall of interstate banking. You are not old enough to remember that. But we can't go back to those days. We have to figure out how to go forward. But I think the consolidation of these huge financial behemoths is a problem."
"Ms. Velazquez","But the present days are not working either."
"The Chairman","Mrs. Biggert."
"Mrs. Biggert","Thank you, Mr. Chairman. I thank you all for your testimony. And like some of you, I want to see a Federal entity that supervises and ensures the safety and soundness of larger hybrid financial institutions like AIG. Second, that we need the FEC to regulate the credit default swaps market, revise mark to market accounting, enhance the credibility of credit rating agencies, reign in hedge funds, as well as market manipulations like the short selling. And third, it is essential, I think, that we work towards modernizing mortgage and credit product regulations like RESPA, TILA, UDAP and determining the fate of Fannie and Freddie. And I will assume that you all have read Paulson's Blueprint for a modernized financial regulatory structure. The model proposes that instead of the functional regulations that we create the three primary financial services regulations to focus on market stability across the entire financial system and then safety and soundness of financial institutions with government guarantee; and then third is the business conduct regulations that investors and consumers--that gives the investors and consumers protection. So I would like to know, in your opinion, is this a silver bullet structure that you can paint a picture for us as to what the ideal financial services regulatory structure would look like? Maybe Mr. Seligman. You talked a lot about the--"
