"Speaker","Speech"
"Mr. Scott","Thank you, Mr. Chairman. It is good to have you all here. As bankers, you are right in the catbird's seat. You represent about 95 percent of the entire financial industry's assets; that comes to about $13 trillion. That is everything, so it is critical that you stay healthy. As we go forward with this restructuring for reform and for regulatory reform, there are two types: There is the unregulated; and then there is the regulated part of your industry. We have to look at it in a way in which we come up with a delicate balance. Nowhere is the vulnerabilities. I talked earlier in my opening statement that we must zero in very quickly in the vulnerabilities, and that there is no greater vulnerability than what caused this problem, and that is bad mortgages and default. I know one thing: If we follow the scenario of what got us into this problem, and if we get the urgency quickly to resolve it, we are on our way, because the American people want some real solutions, and that is this: Home foreclosures and these bad deals that were made, first of all, we have mortgage brokers and loan originators who go in and make these loans based upon high risk because that is the way they are compensated. Somebody has to do something about that. Then they take these loans, and they securitize them. Once they are securitized, it immediately disconnects the loan servicer and the loan originator from the borrower. Then these security packages are packaged, and they are sold all around the place. So people are just in there; they make their money; they cut it up, sell it; and they are out of there. Then these mortgages are sold and packaged all around the world. That is how we got into this. So we have to move forthrightly in that respect, and I would like to get your comments on that. Secondly, I believe that we have to put an infusion of capital into helping homeowners stay in their homes. Now, Chairman Frank was kind enough when we were on the Floor with the $700 billion bailout to allow us to address that issue. One of the things that we need to do is to put in some capitalization. We tried to get 1 to 2 percent of the $700 billion or to direct the Secretary to make sure we had that available. We do not have any incentives in here for the lenders and for the loan servicers to come in and to restructure these loans on a sustainable basis. We have an economic stimulus package coming. We could not get it in there because, as the chairman said, we would have to send the bill back to the Senate. Chairman Frank and I have instructed the Treasury Secretary to move in this regard, and we realize that there has to be some money set aside. I have talked with Barack Obama about it. He certainly was for this going forward, as you will recall, as a modified, different type. At least Senator McCain also addressed this issue. We need some money. Just as surely as we got it for Wall Street, we need some money set aside here so that we will be able to have money to help homeowners stay in their homes and to restructure these loans and to put some incentives in there for lenders to go and to restructure their homes."
"The Chairman","If the gentleman wants answers to the questions, there is only about 1 minute left."
"Mr. Scott","I would. We have the economic stimulus coming up. We might be able to address it here. Please do so. Thank you."
"Mr. Ryan","May I give an answer on securitization, please?"
"Mr. Scott","Yes."
"Mr. Ryan","Thank you. Just to put this in perspective, globally, and by our estimate in 2007, about $2.5 trillion of consumer assets were securitized and distributed. This year, in 2008, we will be down very significantly at less than $1 trillion, probably at about $800 billion. This is principally mortgage, but also credit card, auto, and student loans. Without the securitization process that has developed over the last 20 years, many, many citizens would not have had access to this consumer financing. The financial system in the United States, which we all know well, does not have the capacity from a capital standpoint to support the consumer finance that I have just noted here without securitization. Now, we know we have had some issues with securitization. I am sure this committee has talked about some of the things that need to be done. We have been working very, very hard at reforming the credit rating agency process, at disclosure and transparency on underlying documentation and at valuations for securities. We are highly confident that we can roll out a process here that would make a lot of sense and that would still afford people the opportunity to pay for their homes, to buy cars, and to use credit cards."
"The Chairman","One quick answer if anybody has any other comment."
"Mr. Yingling","I just want to say your analysis of the cause of the problems was exactly right. One of the things that is not talked about much is when the unregulated side did these things--and this happens all the time--they ended up blowing up the regulated side. So this has had a very negative effect on good banks that did not do any of this. I would also say that it just seems to me that some part of the stimulus package ought to be devoted to what caused the problem. That is housing--keeping people in their houses and helping some of those homes be taken, perhaps, by entrepreneurs who would turn them into rental housing."
"The Chairman","The gentleman from Texas."
"Mr. Neugebauer","Thank you, Mr. Chairman. On one of the things I agree with Mr. Yingling and with Mr. Washburn, and it is that we need to make sure that we do not overreach and impact those financial institutions that did not do that. I kind of liken that to little Johnny misbehaved in class, and the whole class had to stay after school. What we have in our banking system today are our community banks. Some of them are small. Some of them are medium-sized. Some of them are large community banks. Then we have these very large banking financial institutions. There is going to be a lot of discussion over the next few months and years, probably in this committee, on systemic risk and on the size of an institution and on how you manage that risk. With a broad range of financial institutions, how do we develop a new regulatory pattern or institution that can regulate such a broad range? Because one of the things we hear folks say is that we need one regulator for, for example, the banking industry or that we need two regulators. Can one regulator do that? What would that new structure look like, if we were to change that structure, that could regulate such a wide variety of institutions?"
"Mr. Washburn","I cannot imagine one regulator regulating the entire banking system as we know it. That is one reason we are calling for the divestiture of those larger institutions into a more manageable size. I think that is critical. We still maintain and we still believe that we need different regulatory bodies. There are two types of charters available to us. This creates some healthy competition among the regulators. As long as they maintain contact in interagency decisions, they will all be governed consistently across the board."
"Mr. Yingling","I would agree with that. In the dual banking system, the diversity of charters has been critical. It is one area where we differ from some other countries. One of the advantages of it is that there is much more lending and capital available to small businesses and to entrepreneurs in this country because we have such a diverse system. I think another thing--and this committee has worked hard on it--is to recognize that when you pass rules designed to solve a problem, that they quite often apply most heavily to your analogy that did not cause the problem. One of the really big problems for community banks, and it may be the biggest problem in competing today, is just the huge regulatory burden. There are great economies of scale in dealing with these regulations, and the small banks just cannot deal with that."
"Mr. Bartlett","Congressman, I might add that you are not going to get down to one regulator, nor should you, but there should be fewer regulators than there are now. More importantly, the system of regulation should be coordinated between one another. There are literally hundreds of regulators for financial services, and it is the gaps that cause the problem. One other admonition: I would hope that the committee and the Congress and the industry do not sort of fall into the traditional fights of large versus small. It is not large versus small; it is a continuum of size, just like every other industry. Nor should they pit one sector against another, the traditional thrift versus bank, insurance versus bank versus securities dealers. The fact is that it is an integrated financial services system that needs to be regulated as an integrated financial services system for safety, for soundness, for systemic regulation, and for business conduct. Therein lies the answer."
"Mr. Neugebauer","One of the issues that keeps coming up is ``too big to fail.'' So the question is: When we look at the factors of systemic risk, if size is a piece of it--and we heard Mr. Washburn say that he thinks that some of these entities are too large, if you do not break up these larger entities, is there a regulatory environment where you can manage systemic risk from the safety and soundness side rather than having to worry about the size of that institution?"
"Mr. Bartlett","Well, first, I would just submit that there is no such thing as ``too big to fail'' from the perspective of the shareholders. There are shareholders all over America who have failed. The Federal Reserve and others have concluded, I think appropriately, that there is a certain size where the systemic risk to hundreds or to thousands of other companies and individuals is so great that allowing those assets to simply stop is worse for everyone, and so the assets and the liabilities go somewhere else, but the institution failed. Secondly, I think that it is not so much the size as it is the regulation, to make sure that it is regulated for the gaps so that each regulator talks to one another and coordinates with one another. I do not think it is the size overall. I think it is what the institutions do, not how large they are."
"The Chairman","Mr. Ryan, do you want to add something quickly?"
"Mr. Ryan","My only comment here is that the issue before the globe, really, right now is not really ``too big to fail.'' It is the issue of interconnectedness and, when we see an interconnected entity that has problems, what the governments need to do about it. I think that is the major issue on the table going forward."
"The Chairman","The other gentleman from Texas."
"Mr. Green","Thank you, Mr. Chairman. Mr. Chairman, there are some things that the consumers are focusing on, and they are becoming more and more sophisticated. There are some things that they just cannot understand. They do not understand why a person with five homes can go into bankruptcy, where he can save four but cannot save his principal residence. They see something inherently unfair about a system that allows me to save my vacation home, but that will not allow me to save my residence. They do not really understand why there is something called a yield spread premium that allows the broker to qualify me for a loan at 5 percent, to accord me a loan at 8 percent, to get a lawful kickback, and to not have that made known to the consumer. They really do not understand how we can have naked short selling and not do something to try to curtail it. They do not understand how hedge funds that require sophisticated investors can have pension funds with money that belongs to pensioners who are not necessarily sophisticated investors. This is in the truest sense of what a sophisticated investor is, not based upon knowledge, but based upon capital as well as some degree of intellect. So the American public is starting to focus on these things, and they are becoming very concerned about them. My question to members of the panel would be, do we need to do something about some of these things? The bankruptcy law that allows for the vacation home to be saved in bankruptcy, but for my principal place of residence or for the consumer's principal place of residence not to be saved, is that law just fine as it is? If you think that it is just fine as it is, would you kindly raise your hand? All right. Mr. Bartlett, let us start with you."
"The Chairman","For the benefit of the reporter, I assume you got who raised their hands."
"Mr. Green","Mr. Bartlett and Mr. Yingling."
"The Chairman","I would just encourage Members to remember that the system of recordation was not made for pantomime."
"Mr. Green","Thank you. I appreciate that, Mr. Chairman. You are a much better lawyer. Let us just visit briefly--I think, Mr. Bartlett, you mentioned earlier that the next stimulus package should contain something with a reference to housing. What did you have in mind for housing?"
"Mr. Bartlett","Congressman, it is very clear that it was housing that led us into the recession, and so I think the housing is going to be required to lead us out of the recession."
"Mr. Green","Because my time is going to be very short, I am going to have to interrupt. Please forgive me. I do not mean to be rude, crude, and unrefined, but I have 5 minutes, and there is much more that I need to do. So let me ask you this: With reference to bankruptcy, what do you see as the impediment to allowing persons who only have one home to save their one home when they are in bankruptcy?"
"Mr. Bartlett","We think that person should be able to save that home if you can remodify the mortgage so that they can pay it."
"Mr. Green","That is what the bankruptcy laws do not permit. They do not permit the restructuring of the loan so that you can reduce principal and so that you can reduce interest. That is what the laws do not permit. So are you saying that you would now allow this?"
"Mr. Bartlett","We do allow that. We do it all the time."
"Mr. Green","Would you allow the bankruptcy laws to be amended so that this can be done by a bankruptcy judge?"
"Mr. Bartlett","Congressman, I suppose our disagreement would be that we do not agree that people should be required to go into bankruptcy in order to modify their mortgages."
"Mr. Green","Well, it is when you go into bankruptcy. It is not because you want to, but it is because you have to, because it is your last resort, and because your home is all you have left, and you are trying to protect your last good chance to start all over again in life with a home. That is what we are talking about. Should the bankruptcy laws allow a person to keep his home?"
"Mr. Bartlett","Congressman, I suppose what I am trying to say is that we hope now the new Treasury proposal on a much faster pace is modifying mortgages and will be modifying mortgages without requiring people to go into bankruptcy."
"Mr. Green","I understand. Those who do have to go are the folks we are talking about, not the ones we would hope would never get there. Some do go into bankruptcy. Why not have that person afforded the opportunity as the person who has two homes? Senator McCain said he had seven homes, I think, or eight, I am not sure how many; he can save six of those homes. The person in bankruptcy with only one has a problem. He cannot save that one under the current law."
"Mr. Bartlett","It is hard for a Texan to disagree with another Texan. We are trying to get to the same place."
"Mr. Green","Well, we do it with a degree of love for each other. We are going to still be friends when this is all said and done, but some of us are concerned about the consumer who has to lose everything and who, maybe, should be afforded the opportunity to save his or her home."
"The Chairman","Let Mr. Yingling finish."
"Mr. Yingling","Just quickly, it is a trade-off because, right now, the interest rate on that second home is higher because of the bankruptcy rules. So, if you make the first home like the second home, it may help some people now, but it means that, marginally, interest rates are going to be higher on everybody else who gets a first mortgage going forward. That is the trade-off that Congress has dealt with."
"The Chairman","The gentleman from Missouri is yielding to the gentleman from Texas one of his minutes, I gather."
"Mr. Green","Yes, sir. My understanding is that same argument was made with reference to farm property, that the interest rates would go up on those farm loans. We find that, after a while, these things tend to find their own equilibrium in the economic order. At some point, the consumer ought to be given some preference in this process; $700 billion and we do not bail out the consumer? Something is wrong. People are not going to stand for it. I am telling you we have to focus on doing something for the consumer. With regard to the yield spread premium, really fast, what would you do about the yield spread premium?"
"Mr. Yingling","Well, I think it is something that needs to be looked at."
"Mr. Green","We have looked at a lot of things. What do we do about it?"
"Mr. Yingling","There are some ways in which it is justifiable, but it has clearly been abused. There is no doubt about it."
"Mr. Green","What about putting pension funds into hedge funds where you are required to be a sophisticated investor?"
"Mr. Yingling","Well, you would have to talk to the pension fund people. I think they would tell you that they have made some money on it. Clearly that is another issue that needs to be looked at."
"The Chairman","We will go back now. The gentleman will get his 4 minutes after the gentleman from Ohio."
"Mr. LaTourette","Thank you, Mr. Chairman. To my friend from Texas, I would just share your pain and would indicate that when you have closed rules, nobody gets to make modifications to bills. You do not get cramdown. We do not get a repatriation of funds. Mr. Chairman, I want to ask unanimous consent to enter into the record an October 15, 2008, letter from CUNA to balance out Mr. Kanjorski's NASCUS letter."
"The Chairman","Yes, we have general leave."
"Mr. LaTourette","Thank you so much. Gentlemen, at the beginning of the hearing, I referenced two articles, one appearing over the weekend in the New York Times that dealt with a development down in Texas. In this morning's paper, in the Cleveland Plain Dealer, it talks a little bit about the same thing. The author of the Plain Dealer article is a guy named Phillip Morris. You, Mr. Bartlett, and you, Mr. Yingling, at least have talked about the unregulated side dragging down the regulated side. I just want to sort of focus on that for a second. There was a fellow just indicted in Ohio for turning a place called Slavic Village, a beautiful place, into a wasteland. The fellow who has been indicted was a mortgage broker from Cleveland Heights. Basically, the article indicates--and I am paraphrasing-- that he could turn you into a real estate mogul on somebody else's dime. No credit, no problem. The guy would invent you some. No work history, no problem. He could create that, too. The example is a guy named Irvin Johnson, not the basketball player but another Irvin Johnson. He indicated that the FBI was sort of sniffing around because, between 2005 and 2006, he and his wife amassed nearly $2 million in residential property. By profession, he was a grass cutter who made no more than $10,000 a year, and his wife was a nurse's aide. So it clearly goes through that probably this guy should not have been qualified for the six mortgages that he had. I think we would all agree that the unregulated side and the unscrupulous, in some cases, had willing victims, but his walk-off line is: The bankers who financed and who once greatly profited from the foreclosure epidemic remain in the shadows. I think what he is talking about is that the unregulated side may have originated the mortgages, but that the regulated side purchased the mortgages, and then they were securitized, as Mr. Ryan talks about. Either Mr. Bartlett or Mr. Yingling, if you could respond to sort of that walk-off line. We all know of these fly-by- night groups that came in and that wrote mortgages they were not supposed to write on the basis of a commission, but then somebody bought them. Somebody bought the paper."
"Mr. Bartlett",""
"Mr. Bartlett","Congressman, you have it about right. During the crisis of subprime, 50 percent of all of the subprime mortgages were originated by a totally unregulated mortgage lender. Fifty-eight percent total were sold by mortgage brokers, but it is actually worse than that because then the other 50 percent that were originated by regulated lenders, regardless of the nature of those loans, were mostly then sold to Wall Street, to a different set of regulators, either lightly regulated or not regulated at all, that were then packaged up into another set of unregulated mortgage pools, that were then brought back to mortgage insurance, which was regulated by 50 State regulators, and that were all sort of certified by credit rating agencies that were not regulated at all. So, as to the system as a whole, you are right. Half of it originated was totally unregulated, but the rest of the system that was regulated was virtually unregulated at least with the gaps. So it is the system that needs to be reformed systemically."
"Mr. LaTourette","I would say where some of us had a disappointment or a dissatisfaction with the Treasury Department's proposal is that is where the $700 billion is going, to the other lightly regulated side, which was packaging and then moving these mortgages. It was not the traditional banks, right?"
"Mr. Bartlett","Well, Congressman, I would not concur. I think the $700 billion is going to a whole series of places to put capital back into the system, including buying these mortgages. When that happens, the first step is to put capital into the financial institutions overall, not merely into banks as the statute provides."
"Mr. LaTourette","Let me just ask: Three of you mentioned mark to market. I asked the last panel about mark to market, and one fellow from Rochester said I was trying to go back to the 13th Century, I think. Mark to market, I am told, is really having a tremendous impact on the ability of the community banks--all banks--to have the capital necessary to loan. I would just ask you each to make that observation. If mark to market is not it, what should we put in place of mark to market, or what follow-up should we have on the chairman and Mr. Bachus' idea of looking at the ancillary impact of mark to market?"
"Mr. Yingling",""
"Mr. Yingling","Well, I think what the chairman said a little while earlier in the hearing makes a lot of sense. There are a lot of straw men in this debate. Nobody is talking about not disclosing everything. When you have mark-to-market accounting in a dysfunctional market--and I will just give you an example, the Bank for International Settlements, which is the premier international regulatory body, did a study a month or so ago that said the top tier of mortgage securities, the safest part of the mortgage securities, was being undervalued by the index that was used as the base for mark to market, undervalued by 60 percent because that index is in a dysfunctional market. It is a very narrow index. It is an index that is based on dumping. It is an index that is run by bears, and that is what they said. So it may make sense to disclose that. What does not make sense is to have that drive issues relating to capital and to the ability of institutions to function. So I do think you need to have a system in which you can have disclosures, but the impact of mark to market has to be dealt with."
"The Chairman","We have to finish up here, Mr. Yingling."
"Mr. Yingling","Frankly, I think the current structure will not let you get there. I do not think the SEC's regulating FASB in the light way they have will let you get there. That is why we have put out a proposal that would have an oversight board, headed by the systemic regulator. I think that would help the chairman get to his proposal."
"The Chairman","Thank you. Now I have a request of the witnesses. Would all of you look around and see if you can find Joe Stiglitz's cell phone, which he left somewhere, and it is turned off? So, if you find his cell phone--"
"Mr. Washburn","What is his number?"
"The Chairman","Well, it is turned off. Nobody should sit at the witness table with his or her cell phone turned on. The gentleman from Missouri has 4 minutes."
"Mr. Cleaver","Thank you, Mr. Chairman. Whenever we begin this discussion of regulation, it always creates ideological differences. Mr. Yingling and Mr. Washburn, I am wondering, since someone here on our committee made a comment before the break that the CRA and minorities were responsible for the subprime mortgage debacle, I would like to find out from you, from the banking industry, do you believe that the CRA is a regulatory burden? Mr. Yingling or Mr. Washburn."
"The Chairman","I am sorry. Let us not have anybody standing in the way of the witnesses."
"Mr. Yingling","Well, I want to say that banks have no trouble with the philosophy of CRAs. Indeed, if you are going to be a good banker, you should be serving your communities."
"Mr. Cleaver","I am sorry. I hate to interrupt, because I think that is rude. Could you just answer the question, because I only have 4 minutes."
